,0,1
0,看女主演的   古相思曲   贼好看,簌花落雨
1,女主才显老气，而且自从扶摇红了后就胖了，脸圆润的无法直视，已经没有当初的灵气啦，显得很老气，特别是眼睛，原来灵气的眼睛，正是她老气的特写啊。,2003089349
2,少年游之一寸相思，就特别喜欢他们两个，现在二搭，这部剧可太期待啦！,翩然入君怀
3,男主是他的原声的？声音好雄厚哦 跟他本人长像好不配套[捂脸笑] 不好意思没别的意思 就单纯的好奇  女主也显的很成熟  ,下一页ノ回忆
4,这不就是李师傅和黄澄澄吗？？？侯明昊主演的剧里的男二和女二[捂脸笑][狗头][狗头],纳奇欧
5,居然播了，咋一点都不知道啊,臣妾只想搞钱
6,就喜欢放全集的[色][色],我妈妈说我名字太长会有傻子跟着念
7,男主是那个奶油味暗恋的男主,158****3538_m1799
8,如果男女不是剧里两位就好了，张亦诚的扮演者感觉长得过于焦急了[捂脸笑][捂脸笑]看样子起码三十以上[捂脸笑],ellachat
9,是悲剧不，想看他们甜甜的恋爱,一米幸运⭐
10,啊啊啊，我看到了什么？？？竟然上来就是全集！！！[应援][应援][应援],lawyer  liusy
11,古相思曲过来,笑容里
12,hiahiahia看我发现了什么 全集诶,佐鸣啦啦啦
13,我看到了什么 都放出来了,夏时眠
14,哇塞，直接看全集,+.数
15,鱼在水中游，是尾也是头,是刘子润呐
16,期待已久的CP二搭竟然是现实题材，迫不及待的想看后续的剧情,发型像个狮子头
17,空降吗？这是,我想与太阳相称
18,少年游太虐了，希望这部剧可以甜一点[色][色][色],一点点（QQ联系）
19,笑死，我本来就觉得陆鸢好像雪花女神龙，没想到张雅钦居然跟董璇一起拍过剧哈哈哈,红红红的红豆
20,别又 be 了 一寸相思已经难过死了,echen.🐰
21,古相思曲来的,丶南北😍
22,我发现这个男主每演一部剧都会和女主二搭一部，这对cpf很友好,困得晕呼呼🎀
23,开始是奔着一寸相思今生前世来的，但后来纯纯被这部剧的内容吸引了。真的很推荐。也很希望导演可以进步一下,莫卡贝贝
24,看了古相思曲来的,只对你任性@
25,三搭吧，张哥张姐下次来部甜甜偶像剧，这剧结局感觉还不如小相思圆满，好歹云落和左郎中还有个乖崽崽呢！求求了，三搭叭,L&绮梦
26,这么大方，直接全集[捂脸笑],wangxlntong
27,开始是奔着一寸相思今生前世来的，但后来纯纯被这部剧的内容吸引了。,莫卡贝贝
28,突然就全更了，太棒了,全世界最耀眼
29,张耀再拍个仙侠就可以剪出个三生三世啦[应援][色],LJF小芳子_1538
30,哇，这么不准时,喜相逢0830
31,总算有时间来看我们小相思二搭，虽然看起来这部剧还是很虐的样子,兵城战友
32,竟然偷偷开播了！！！,杨杨小号啊
33,欢喜冤家小甜剧，可以说是尽可能还原了,有个栗子掉了
34,十年，人生，有多少年。最美的十年，与爱的人在一起，多幸福！,火星吃火锅
35,女主演的好想和你在一起也很好看,喝点有缘人一身疙瘩4
36,画面让人很舒服，火速一起看起来 也太甜了吧,阿武睡不着
37,演员阵容强大都是妥妥的演技派，给我一直甜下去！,daisy不爱喝奶茶
38,从开头三分钟感觉就要虐死人了，难道又是一部“一寸相思”？,夹雪清风
39,从古相思曲过来的爱了爱了,笑容里
40,好本子技巧上成熟老练，这部剧就是我的心头好,三十岁的孩子A
41,拍的明明很好，男主很棒，喜欢看小甜剧的值得一刷,自作多情的霸王花
42,超级喜欢郎中和云落！！！！可不可以三搭哈哈哈哈哈哈哈[应援],攬月shmily.
43,是不是缺把斧子哦[捂脸笑][捂脸笑]，这样更有感觉[应援],情意失眠
44,女主演技自然不拖沓，剧情跌宕起伏真好看啊,全力飞奔向前的冲冲
45,真的好好看 很搞笑，真的太让人期待了，磕到上头了呀,不想上班的sleep
46,我简单看了简介，意思好像是，男女主没在一起！各子过自己的生活,晨沁、
47,"老搭档了
",尼尼爱干饭
48,俩人颜值都挺高啊，甜甜的校园剧安排起来,请叫我肖夫人A
49,感觉这部剧的风格挺大胆的，道化服太真实了,chindroid yeah
50,最近张耀都是在分别和女主二搭的路上，说真的，见不得他红眼圈和流眼泪，会跟着难过…最先喜欢的，是他的声音，然后是浅笑一下的模样。希望这部剧不是虐剧，坚持到看完。,手可摘烟火
51,我居然才知道这剧，前世今生啊！少年游之一寸相思，很好看！,木母yy
52,表白好甜啊，这个电视剧也太甜了吧,狮子座的射手座A
53,为导演爆灯，为张雅钦爆灯，很精彩的分享好喜欢,若心向阳A
54,现在越来越多的人都开始喜欢上男女主强强联手了。,白开水好好闻
55,古相思曲女主！！！好好看,千秋功名
56,张耀可以啊，体验了大悲大喜！,擎天一猪
57,林亦诚的人物形象比较有意，细节上没有瑕疵,爱自己更爱购物
58,一寸相思刚看完，呜呜呜呜呜,🍍 菠萝 蜜🍍
59,现在的电视剧怎么都这么短，无语,橘子味的软糖_
60,真的挺不错张耀电视剧非常好，严谨真实,吃货的人生不解释A
61,信任张耀的演技来看的剧，看到我也紧张刺激起来了,每天八杯奶茶A
62,别犹豫赶紧顶顶青春励志网剧《与你十年，予我半生》。,小杨喜气洋洋@
63,张雅钦又有演技又有美貌，人物设计合理,克劳帝斯大公
64,群像演技都十分精彩，少见的好剧情的恋爱剧,可爱的辛巴A
65,没啥人呢，来得还算早[应援],·亚轩豆几不ci香菜·
66,张耀电视剧很好，剧情很好看，真的很棒啊,单身狗的倔强A
67,张耀挺可爱的，这剧还挺意外的,吃名字真费劲
68,我为有钱举大旗，[应援][应援][应援]二搭超爱的,超爱吃甜品的端木奇水
69,甜爽剧日常解压看看，不拖沓的恋爱剧少见了,余梦今生浮如梦
70,小成本甜剧，感觉是双向奔赴,xddiano
71,就喜欢放全集的，都不用等两集一集的更新,偷偷爱我嘛💦
72,更喜欢副线涛和珂，背景音乐恰到好处,爷说要有光
73,像微电影一样节奏感太好了，剧情真实刺激,观一叶天下秋周
74,在·我们学校拍的欸，让我来看看好不好看,🟢罗罗诺亚·索隆
75,欢喜冤家小甜剧，现代戏我要看小甜饼啊,虽远必诛小肥龙
76,女主演技自然不拖沓，看的还挺上头的,鼻孔有点甜
77,第1集没看完，剧本粗制滥造，情节发展不流畅，配音奇怪，奇奇怪怪，本来是奔着张耀和张雅钦二搭来的，火速撤退， 一分再见[微笑],蹦颠颠
78,画面很好了，马上给我结婚,潇潇不爱笑A
79,挺不错的，剧情真实高潮迭起啊,貔古拉斯貅
80,喜欢这部剧主演阵容甚至喜欢到骨髓了。,甘心子晴
81,我的剧荒的日子终于结束了 ​​，阵容和主题太棒了,Ai酱赛赛赛赛高
82,恰到好处的纠葛观剧感一流，设定很吸引人,奥利给小咪蒙
83,听我一句，真心滴感觉男女主二搭确实是棒极了呀，确实挺好,我是一个无知的小姑娘
84,挺不错的，这部剧可真的是太圈粉了啊,元气满满小野马
85,表白台词编剧加鸡腿，双向奔赴yyds,缩龟壳的小猫咪
86,太给力啦全部可以正好无聊，没剧追[666][666][666],💖✨云💙✨
87,剧情很新颖啊，恋爱剧难得有好剧情的作品,小灰机机机机A
88,看起来很舒服，开播就觉得很上头了,挚歆A
89,好家伙一进来看到了全集,memory-_qq1311
90,小相思的二搭，女人真是人见人爱啊,小小小小饼干A
91,我也有恋爱的冲动了，这部剧已经完成得很好了,莉莉065
92,不知道就是自己OUT了，感觉男女主二搭就是比较让人喜欢，谁不喜欢呢，都稀罕,一起起🍀
93,爱媳妇就是听媳妇的话，剧情看人好紧张,刘本秀秀秀秀
94,爱媳妇就是听媳妇的话，细品的话是很有意境的,草丛伦A
95,大家赶快来关注这部剧展示成长百态吧，十分经典。,天府宏中杨建
96,虐的我中途都想放弃了，细节上没有瑕疵,毛毛的上校鸡块
97,轻松搞笑就完事儿啦，这部剧越看越香,没事想想球
98,这部剧的更新速度也算是封神了,与猫秋35
99,剧情太精彩了！张耀太帅了，转场太棒了吧,吕吕吕小萌
100,哈哈哈剧情有意思，弹幕也有意思，有救援的恋爱才甜嘛,毛毛的下午茶A
101,全集呀，一寸相思be终于有后续了,千千万万万
102,惊喜之作！，剧情人物有血有肉,万物因我一念花开
103,表白好甜啊，物理诠释半糖是蜜糖半是伤,今天我是王富有
104,看了第一集，光是参加辩论会这段，就是胡编乱造，拍的手法也好幼稚，居然还有这么多人喜欢这剧？,最可爱的小松鼠💖
105,张耀的电视剧真的很好而且越来越好，编剧的台词写的真好,我son爱吃辣条
106,编剧很用心，看男女主甜甜的恋爱就行,丛初柔小童鞋
107,太太太厉害了直接全集[应援][应援][应援][应援][应援][应援][应援][应援][应援][应援][应援][应援],乘风启航🌈🤗
108,觉得全员演技在线，追剧追剧，提上日程好嘛！,蓉儿正梳妆妹妹
109,服化道没得说，表白好甜啊,变美变强变厉害
110,我就想知道最后结局，男主女主有木有在一起,木土石开亭
111,剧情带入感太强了，每个重要的点都演的很细节,筱筱的一条鱼鱼
112,人物设计合理，全年最好剧集,惶恐*一片狼藉
113,这剧情全你们别看，还删我评论,绯色&人生
114,俩人颜值都挺高啊，这剧真上头啊,岁月_冰冻
115,我也有恋爱的冲动了，剧情方面也是拿捏住了,万籁的牢房
116,太赞了，就喜欢爱奇艺直接全放[色],逛街中的鲸鱼🐳
117,人物刻画一点也不娇气，这剧卖相太可了,阿华田不如阿华甜A
118,镜头感加剧情都挺好的，少见的好剧情的恋爱剧,落泪必有渣男
119,一起看全集简直太棒了[爱心],变成更好的小晶晶和朵儿妈
120,剧情写的太有意思了，女人真是人见人爱啊,王牌*啃啃
121,作为观众看得也很享受，剧情写的太有意思了,嘻嘻_叫我绒绒
122,我觉得他们很适合演东厂观察笔记的男女主角,喜欢跨栏の司马承恩
123,重点是服化道非常加分，越看越让人感到舒服,少爷起床吃饭啦
124,画面、运镜都很舒服，太多社死现场了,喜提新晋墙头
125,就喜欢这么直给的，一下看全集，够爽快，够霸气，疯狂点赞啊,2412656271
126,演技也很在线，太好看了,SixoneA
127,编剧很会写恋爱剧情嘛，基本和原著一样,一路上过得怎样
128,是期待了很久的剧，之前看他们路透，就很喜欢终于二搭了,莓气泄露desire
129,编剧的台词写的真好，剧中人物以及剧情走向都是很好的,常驻火星的火星君
130,信任张耀的演技来看的剧，满脸姨母笑停不下来,有_的地方就有我
131,第一次体验一次全集的，追动漫一追几年 ，这样整给我整不会了[应援][应援],Liquo⭐
132,道化服和剧情完美搭配，画面极美，赏心悦目,如此完美_宝贝
133,张耀电视剧炸裂，关键是特别甜啊！,造物者_XL
134,我在古相思曲那里哭的稀里哗啦的，女主这里悄悄更新是吧🤔,2鸸鹋2
135,剧情跌宕起伏，把角色演绎得很精彩,勇气一直在的A
136,我是来看穿大衣的张耀耀的，整部剧有种破碎的美感,控制_悲恸
137,潇洒风流的富二代李文凯让人感觉真的很不错，顶了,超爱吃大闸蟹の闻人娜兰花2916
138,想不感同身受都难，基本和原著一样,懂得人能看透
139,节奏紧凑不错喜欢，演员阵容太让我惊喜了,半世流理小野狼
140,我来的真早,一只宸皮酥
141,张耀太有观众缘了，最喜欢这样的剧情起伏大的了,爱滑雪的猫
142,观剧到目前为止无槽点。，剧情写的太有意思了,立风飒我A
143,这么阔气，又一部直接更全集的，牛🐮,Sophia语
144,张耀演的真好，又轴又萌又聪明，演员选的挺好,幼儿园最靓的障仔
145,看起来很舒服，真的太好笑了,白月光_炸
146,少年游之一寸相思续集来啦,A go ny
147,我也有恋爱的冲动了，看的我嘴角一直上扬,认真摸鱼的菲菲
148,镜头感加剧情都挺好的，细品的话是很有意境的,说有多复杂
149,这个剧名挺好的,LHTXTLYLZ
150,看的我好紧张啊这个剧情，表白好甜啊,微妙*蜉蝣
151,天啊也太甜了吧，好有质感的一部剧,天尽头苍茫
152,哎  本来想着有新剧看了  但是看到女主我就没有想看的欲望了,眼泪嘚名字
153,剧情和恋爱并行，看到我也紧张刺激起来了,春暖花会开*
154,张雅钦又有演技又有美貌，剧情真的是太精彩,花少一生推
155,哇哇哇哇 全集太牛了 之前看少年游的时候就很期待来一部现代剧 圆梦啊啊啊,一颗有影子兔子糖
156,表白好甜啊，画面极美，赏心悦目,来自火星的土豆A
157,原声设定也深得我心，非常喜欢里面的剧情,地下天鹅绒A
158,你怎么知道这部剧，有些片段在我们学校拍的啊[呲牙],夕阳•😁
159,喜欢男女主默契配合打辩论的剧情网友还真不少。,曼曼在家
160,顶一下，很赞的哦，力挺下棒棒滴男女主二搭哈，真不错哈。,用户81ec12a6奔跑的蚂蚁
161,青春励志网剧《与你十年，予我半生》好感马上来了，确实挺好,明日之后驻守
162,确实是这样的，嘴炮星人李老师嘴上说着心里有底但实际上一点底都没有,喜欢玩台球の南荣新梅
163,真的很无语，李老师嘴上说着心里有底但实际上一点底都没有,勤恳的随缘🎉💯
164,感觉男女主强强联手默契配合打辩论就是很流行。,一点都不可爱👻👻
165,看了男女主默契配合打辩论的剧情之后很是兴奋呢。,2236367786
166,开心的难以言表，帅气出场方式确实是很受人欢迎，令人喜欢。,@悠林飘雪
167,留着晚上看 希望虐可以 至少最好有个好结局。。我真的会难过,肖战老婆ㅤ
168,确实感觉男女主强强联手默契配合打辩论杠杠滴赞。,刘沐沐就是我
169,无法抗拒的视觉冲击，勤工俭学的男主事实上就是很好。,时光浅巷巷微
170,直呼过瘾，真是发现男女主强强联手默契配合打辩论确实很精妙。,大花姐姐
171,二搭二搭二搭[色],抱宝 崽崽
172,谁看完了能说一下是he吗[难过],XXS不再生气
173,还是爱奇艺给力啊，一放放全集[应援][应援][应援],我  姓   金
174,所有剧都在爱奇艺播就好了,只追不把观众当傻子的剧
175,"是谁的cp二搭了？啊啊啊啊啊啊啊啊啊原来是我！！！！！
",用户864b598438440
176,讲真这部可以，整体剧的质感和演员表现都很好,白衬衫的初恋
177,看完对张耀改观了，演员真的要有作品才行，演员选的挺好,爱看花花的草草
178,张雅钦的个人魅力实在是太明显了，道化服和剧情完美搭配,牛奶盒子浓浓
179,张耀的电视剧明显变好了挺多的，人物刻画一点也不娇气,叽叽喳喳哈哈哈A
180,我今天简直要被心动不可耻还很可爱给圈粉了，小甜剧就该这样,曾经的superstar
181,表白好甜啊，剧里服化道的整体质感也都非常不错,左腿中箭的健特
182,一定要去看啊姐妹们这剧情好多我们想象不到，简直是绝配。,一杯甜甜的蜜语奶油
183,去掉恋爱也是很好剧情作品，喜欢看小甜剧的值得一刷,专注吃喝玩乐
184,一定要去看啊姐妹们这剧情好多我们想象不到，作为原著粉对于剧情按照走还是很满意的,章鱼洋葱卷
185,直入主题一句废话都没有很舒服，不管从演员阵容还是剧情走向都很有看点,大一新生的爸爸
186,对张耀路转粉。电视剧丝毫不尬，画面让人很舒服,想要一个男朋友A
187,轻松解压，春节无脑追剧，电视剧拍出了上海别致的氛围,卖队友第一好手
188,整体剧的质感和演员表现都很好，看得我心跳加速,21世纪的chno
189,喜欢这么活力四射，阳光开朗的女主，拍摄手法很符合年轻人的口味,吃福建人的广东人A
190,剧情人物有血有肉，男主女互动的片段真的又好笑又甜,隔壁家的孩子AA
191,张耀每个角色都会解锁新的名场面，有救援的恋爱才甜嘛,狗不理的铲屎官
192,谁会拒绝甜甜的求婚呢，迫不及待想要看到下面的剧情,战斗囡囡密斯陈 
193,张雅钦真是因为颜值被低估了电视剧的演员，我的剧荒的日子终于结束了 ​​,爱吃豆芽的比格弟弟
194,张雅钦真的美，张耀有那股子灵劲，画面让人很舒服,织围脖没毛线
195,张雅钦的电视剧好得令人放心和刮目相看了，整部剧制作得也好用心,ECHO爱吃荔枝
196,看起来全员都有点东西呢，这两个人是怎么做到又甜又好笑的,隔壁家的种草小王子
197,张耀电视剧台词都有很大提升，段水流的一些金句,白云浮云火烧云
198,一对欢喜冤家 互相照亮彼此之间的路，基本和原著一样,何梦小白白白
199,女主角好漂亮，又可爱又乖的，不管从演员阵容还是剧情走向都很有看点,余温超拽
200,张雅钦的电视剧好得令人放心和刮目相看了，演员都很在线,啃桃大赛冠军兔 
201,张耀电视剧一直不错，主要也是长得帅，我是挺喜欢的，拍的特别真实,jackyloveA
202,真的是近些年很棒的电视剧。，整体剧的质感和演员表现都很好,羽言羽生
203,演员演技也都自然流畅，恋爱的气息会穿过屏幕扑面而来,等不到结局等时光
204,直入主题一句废话都没有很舒服，特别贴近生活，接地气,短腿的长劲鹿
205,演员阵容强大都是妥妥的演技派，这部的甜显得来之不易。,鱼丸粗面烤鸡翅
206,我是来看穿大衣的张耀耀的，两人感知互换还挺有意思的,余生浮华尽是你
207,张耀电视剧真挺好的，反正就是好好看！看他就完事，道化服和剧情完美搭配,狂小柴
208,细品的话是很有意境的，迫不及待想要看到下面的剧情,幕言言
209,女主演技自然不拖沓，剧里服化道的整体质感也都非常不错,小肥liu
210,心动不可耻还很可爱真的是非常的甜啊，那种羞涩的初恋感觉很对,低头思个锤子
211,张耀让人惊喜，感受到了片方、导演和演员满满的诚意，可以说是尽可能还原了,西华门女阿姨。
212,人物的台词和剧情也不错，期待后期的成长，重要情节一点都没落下,小小沙漏A
213,张耀老师电视剧也到位了，全员原声好评，特别贴近生活，接地气,一朵西兰花A
214,张耀眼神里还能闪耀着初入职场立志大干一场的兴奋，真了不起，给我一直甜下去！,黑暗中的微光A
215,这部剧太符合张雅钦的气质了呢，全员演技都在线,粉红色的天际线
216,张雅钦真的美，张耀有那股子灵劲，用轻喜烘托人生,浑浊的天空AA
217,明知道有危险还去，自己就应该做好这样的准备，这两个人是怎么做到又甜又好笑的,请你哈啤酒A
218,你可以永远相信张雅钦的穿搭，男主女互动的片段真的又好笑又甜,来自大三爷的问候
219,感情线和男女主人公的塑造实在是太太太成功了，最喜欢这样的剧情起伏大的了,是寒少鸦A
220,演员阵容强大都是妥妥的演技派，剧情写的太有意思了,万物归壳A
221,张耀演的真讨喜！节奏把控很好幽默又紧张，值得一看的好剧,自由游啊游啊游
222,张耀让人惊喜，感受到了片方、导演和演员满满的诚意，怎么那么可爱有趣呢,不安_心的迷茫
223,张雅钦超美，张耀本色出演，人物刻画一点也不娇气,云身后的昏黄A
224,你可以永远相信张雅钦的穿搭，剧情代入感拉满,麻木的那么快A
225,男女主也太甜了吧，空境和氛围感还把握得挺好的,薛定谔的猫宠物
226,电视剧拍出了上海别致的氛围，已经迫不及待等更新了,精致的不愿揭穿
227,简直是我今天的快乐源泉了，甜甜的校园剧安排起来,众生膜拜永久
228,剧情也特别真实接地气，看的我姨母笑都出来了,能够吓到你的哥斯拉
229,心动不可耻还很可爱真的是非常的甜啊，这简直就是今日份快乐源泉,笑看万物是假象
230,张耀老师电视剧也到位了，全员原声好评，好久没看到这么甜的cp了,浮夸只属于华总
231,张耀这次的表演也还挺细腻的，把人物在面对正义与现实的纠结演的很好，满脸姨母笑停不下来,壳总王者不朽
232,活泼开朗甜美可爱的小学妹谁不喜欢呀，拯救了我的剧荒,不熬夜只养生
233,这画面这质感这演员这情节太绝了，安心磕糖不用担心被虐,好景多长_暗香
234,张雅钦好几个小动作！我都觉得还挺好的，太受欢迎了吧,原味小仙女A
235,太有cp感了，没有为了衬托男主弱化女主，非常喜欢里面的剧情,五块钱的抄手
236,张雅钦演的真的太棒了，台词功底更是突飞猛进，整体剧的质感和演员表现都很好,黑土养一方人
237,细腻之处足见导演和演员的用心，本人宣布正式成为剧粉,短野原美绪A
238,最近的下饭剧看得很欢乐，这也太甜了吧，赶紧来追一下子,擅长清空的猫
239,太可了，喜欢姐姐的造型，剧情写的我都感同身受闭眼了,Seven_VA
240,看的我好紧张啊这个剧情，把角色演绎得很精彩,OmegaLeeA
241,这部剧很精彩，甜宠我最爱了，主人公表演自然到位,似风如诗的喜
242,实话实说，张耀的电视剧大幅提升了，这也太甜了吧，赶紧来追一下子,意难平也得平
243,电视剧拍出了上海别致的氛围，恰到好处的纠葛，观剧感一流,地面煎蛋的夏天
244,你可以永远相信张雅钦的穿搭，姐妹们一起追剧啊,梦梦在学习。
245,剧情也特别真实接地气，这也太甜了吧，赶紧来追一下子,家住白云区的周先生A
246,张耀电视剧不错，从一开始关注他，细致的人物刻画,儒雅的嬴乐安
247,张耀电视剧进步了，细节表现的非常好，台词功力也非常棒，哪个男人不喜欢呢,努力维持人形的香菇
248,张雅钦是什么神仙颜值啊，演员跟角色也太贴合了,晴空正好追星日
249,张耀老师电视剧也到位了，全员原声好评，生活需要补充糖分！,黑暗里的49天
250,张耀让人惊喜，感受到了片方、导演和演员满满的诚意，我不允许有人不嗑他们,怒罗为门
251,张雅钦也算是很有实力的一个新人演员了吧，剧情人物有血有肉,🌙沐呈悦
252,合着，男主女主最后都没有在一起，男二也没有跟谁在一起？这个男主演啥剧都是穷小子[捂脸笑][捂脸笑][捂脸笑],🤗️🤗️🤗️雪儿
253,2022年3月这是关于青春十年的日记十年人事几番新一回头仿佛过了半生这是十年里我眼睁地看着我爱情萌芽,川仔526
254,王燃 传媒系的系花酒神李文凯 一个每天都被自己帅醒富二代刘珂 一个永远也吃不胖的小吃货这个社会人陈涛不是在做大事就是在大事的路上这是我林亦城按照李文凯说法是一个爱写日记的三好学生,川仔526
255,小网剧真的不占优势，也没有啥宣发，看样子得悄无声息的播完了,夏沫あ♡
256,我只想知道狗不狗血虐不虐，谁看完了，告诉我一声，好人一生平安,流萤湿微光
257,看了简介没有勇气往下看，生活太苦，还看苦的就更开心不起来了,妞妞好嗨
258,什么鬼？全更了？你们买你不能有点子功利心？能不能好好宣传！！,专，，   ，，
259,这是二搭啊，之前没有看到任何信息，开播就全集[应援],酒酒酒酒酒酒酒酒🍺
260,谁能告诉我，三个性格迥异的男生是怎么玩到一块的？,幻化之翼
261,好多人都对男女主默契配合打辩论的剧情特别感兴趣。,年青人哟
262,男女主默契配合打辩论的剧情让人感觉真是超赞。,小杨喜气洋洋@
263,惬意舒畅，还是男女主强强联手默契配合打辩论比较强悍，确实不错,Ｍ＂s宝〢、馨
264,激动的小心脏要出来了，真心感觉勤工俭学的男主不错。,我们😚777
265,现在越来越多的人都开始喜欢上男女主强强联手了。,青青忆旧丛
266,怎么有种莫名的喜感！男主赚钱学习两不误还是很不错滴。,苗乡娇莲🎋
267,我hold不住了，男女主默契配合打辩论的剧情简直就是太棒了，真滴不错。,夜下月光
268,也来瞧瞧看看，好些朋友都非常支持勤工俭学的男主。,竹影情风🎊
269,感觉男女主默契配合打辩论的剧情就是很独到哈。,可爱小仙女QQ
270,赶脚赵星卉饰刘珂就是让人比较心动，真滴不错。,Jin Halove.
271,真的是引起共鸣了，男女主默契配合打辩论的剧情,玲玲好开心🥝
272,好吧，我承认已经心动了~~好喜欢男女主二搭，非常的认可。,芯芯念念🐾
273,确实是知道男女主默契配合打辩论的剧情的经典了，就是很不错,小雅诗姐姐
274,简直太喜欢啦！赚钱学习两不误的男主极大吸引了我。,刷我滴卡哇可以
275,对女主王燃的饰演者张雅钦有了更深认识，顶起。,语嫣红
