,0,1
589,实心实意滴赞一下男女主强强联手。,宿命所归也
590,风靡了，男女主二搭太精彩了,a木棉花🌸☀
591,男主勤工俭学是我滴大爱。,彬的🍭
592,喜欢这部剧主演阵容不是一会儿半会儿了，确实不错,天青色等烟雨恋
593,大家感受一下男主林亦诚的饰演者张耀。,为你而战figt
594,身边喜欢这部剧展示成长百态滴人越来越多。,萌萌星同学
595,加油啊，真心滴喜欢帅气出场方式了，真是很棒的,q黎生
596,高燃展述十年青春韶华内涵我懂了。,夜空中最亮的星⭐🏝
597,确实非常不错，司机大叔的算盘打的真响,拉朵花
598,可爱，么么哒！喜欢男主勤工俭学滴人越来越多，顶起,米多多滴🌼
599,如此地让人惊叹不已，司机大叔的算盘打的真响,糖果诱惑💝
600,我可是灰常喜欢紧凑的剧情节奏。,@悠林飘雪
601,喜欢这部充满真情实感的青春剧把持不住啊。,弯弯的月牙儿🍀
602,对袁家欢饰陈涛很中意，很可以的。,梅果🍓
603,表示喜欢，男女主默契配合打辩论的剧情,春风吹走十里雪
604,大家对阔少李哲凯都比较认可哈。,伤心落叶🌻
605,呵呵，确实男女主强强联手就是很不错，真是太赞了。,長靈……
606,太棒了，我看出来帅气出场方式很受宠，经典啊。,幸福美甜
607,确实感觉跌宕起伏的青春故事不错。,静静地姐姐
608,发现优秀的演员阵容确实得人心。,美少女的谎言🍡
609,看到高智商美女王燃就是爽，我好心动了。,若遇浅香啦啦
610,还是蛮喜欢潇洒风流的富二代李文凯。,微微的微笑🎐
611,不错的呀，司机大叔的算盘打的真响,别等时光非礼了梦🔜想🌇
612,紧凑的剧情节奏快到我碗里来，8错。,做一个小可爱呀
613,发现男女主默契配合打辩论的剧情很出彩呢。,嘉 命 难 违
614,这部剧向大众传递成长真谛真绝。,睡觉卡😄
615,高燃展述十年青春韶华酷毙了。,小小高小小💯
616,张雅钦饰演王燃牢牢把握了网友们注意力。,快乐快乐大本营🏖
617,围观赵星卉饰刘珂能不激动么。,儿子兔子的守望
618,感觉我最喜欢滴就是男主赚钱学习两不误了。,董董；888888
619,也忒喜欢男女主相互救赎了。,兰兰的天空呢
620,问一下，这个“专车”是认真的吗？,白开水好好闻
621,直接看全集多好，比那些2集2集的出好多了,隐藏你咋知道一样
622,我发现勤工俭学的男主是好评如潮。,温暖夏🍓
623,喜悦心情，最近我发现帅气出场方式很不错了。,多金悠悠
624,大力支持下男女主二搭。,烟雨蒙珑
625,看到优秀的演员阵容笑了笑。,开心快乐的野草
626,男女主强强联手大家都看在眼里了。,就这样爱着你🍡
627,这部剧多维度诠释年轻人内心纠葛吸引眼球。,Ｍ＂s宝〢、馨
628,男主赚钱学习两不误深得垂青，顶了,快乐给自己🎁
629,男女主默契配合打辩论的剧情可真行。,渃垚
630,想弄明白，这个“专车”是不是认真的？,冰冰love随缘
631,高燃展述十年青春韶华确实很靠谱。,湖边一棵柳
632,非常精彩啊！男女主强强联手很不错,电视小迷你
633,觉得天真少女刘珂不错哦。,友友rao
634,咯咯～～算是真正领悟到男女主二搭受欢迎了。,勤恳的随缘🎉💯
635,这部剧展示成长百态招人喜欢。,斯山居
636,我来给赵星卉饰刘珂大大支持，顶了,悬墨😆
637,董璇饰火锅店老板娘萱姐真是好有爱。,一样的漂亮🧀
638,男女主强强联手默契配合打辩论就是非同一般。,他为我一生守候
639,嘚吧嘚，男女主默契配合打辩论的剧情简直棒棒哒。,没有你，还不错
640,男女主相互救赎可谓一目了然。,惊声尖笑😍
641,真心不错的，女主的口条好厉害,小梓琪💖
642,特色啊，这个“专车”也太逗了吧,gao·健
643,有点抓狂，李老师实际上一点底都没有,话Tyler
644,默默支持这部充满真情实感的青春剧。,记忆不够保存3秒
645,来感受这部充满真情实感的青春剧，真心不错。,爱哭的毛毛虫1459
646,男主勤工俭学是很多人的最爱。,得过且过 ||
647,偶感觉男主勤工俭学就是很给力。,你高攀不起💖
648,额滴神呀，勤工俭学的男主好迷人,裙摆有点长
649,说的真好啊，女主的口条好厉害,好一个温柔
650,紧凑的剧情节奏倍儿有面儿。,cx·ve
651,为潇洒风流的富二代李文凯点赞。,等不等到心好累
652,哇咔咔，大家对男女主二搭都很有感觉呢。,萝卜萝卜你好啊
653,有没有知道的，这个“专车”是认真的吗？,啊霞💕🌼
654,Great!!!早就好喜欢男主赚钱学习两不误了。,俏皮眉眉
655,男主勤工俭学确实优点很多哈。,凹凸不凹凸💞
656,偶表示很欣赏，赚钱学习两不误,有点甜(*´I`*)
657,男主赚钱学习两不误真是太好啦。,Mr.Li！！
658,也发现男女主强强联手很赞。,一切都是美好的啦啦
659,张耀饰演少年林亦诚反响很强烈。,橦宝贝☀
660,跌宕起伏的青春故事确实很赞，看出来了。,栋一哥
661,偶对勤工俭学的男主确实很有感觉，非常认可,↗心ゝ爱ㄚòひ◎
662,我真的是意会了，赚钱学习两不误,我是一个无知的小姑娘
663,张耀演技值得回味，值得点赞,p少女
664,呵呵，好喜欢，没想到会这样救场,小刘和小敏
665,看了后对张耀张雅钦谱写青春成长序曲动心。,哗啦啦  
666,就是亮了，偶也来关注下男女主强强联手了。,吕神小花
667,不少朋友都对男女主二搭很感兴趣。,爱的改变😄
668,算说对了，没想到会这样救场,追星人的小黄鸭
669,确实无语了，嘴炮星人实际上一点底都没有,畅牛牛🎁
670,这部充满真情实感的青春剧好到没朋友。,苗乡娇莲🎋
671,看到了，好喜欢男主勤工俭学，速度围观了,你是我的小幸运435
672,咋回事啊，方言对富二代帅哥的影响有多大,最爱喝奶茶🎪
673,我发现帅气出场方式果然不凡。,夏与祥
674,信得过高燃展述十年青春韶华，非常认可,泽养一身伤
675,我也来问一下，这个“专车”是不是认真的？,无敌小可爱@😘
676,小心脏砰砰直跳，嘴炮星人实际上一点底都没有,白白的爱
677,跌宕起伏的青春故事就是很吸引人呢，就是好。,abc梦幻
678,力挺一下我最喜欢滴男女主强强联手。,美美的富婆
679,男主勤工俭学惊爆眼球，绝对的啊,Mr.Li！！
680,我的天呀，这个剧值得去磕起来,下一站遇见你ok
681,好奇问一句，这个“专车”是不是认真的？,素锦v流年
682,真是可以的，这个“专车”也太逗了吧,低调的炫耀123
683,看出了男女主二搭强大了。,新怡美
684,感觉真心不错的，勤工俭学的男主引人想象。,黎花带雨🏝
685,帅瞎了。。。。我是发现男主赚钱学习两不误吸引力了。,小雅诗姐姐
686,确实可以的！！男主赚钱学习两不误确实是非常不错。,谦恭有礼的纯良的哈哈哈👑
687,实在忍不住要评价下，赚钱学习两不误,姐维他命啊🌈
688,有没有打动你呢，感觉勤工俭学的男主真滴很赞。,玲玲好开心🥝
689,袁家欢饰陈涛让人眼前一亮有木有。,曼曼在家
690,紧凑的剧情节奏引发网友热情关注。,张小哥。🧁
691,对这部剧向大众传递成长真谛深度喜欢。,奶油加奶茶
692,也来晒晒赚钱学习两不误的男主。,Jin Halove.
693,呃，是啊，男女主默契配合打辩论的剧情,喜欢玩台球の南荣新梅
694,哇喔！帅呆了，喜欢男主勤工俭学。,安夏呀安夏
695,知道男女主强强联手默契配合打辩论很棒了呢。,峡fgLMuy
696,看出来了帅气出场方式的强大。,Baby小可爱👏
697,男主勤工俭学确实可以，真是不错,杨杨baby👧👧
698,想知道，这个“专车”是认真的吗？,不懂你的不懂OOOO
699,传达出的信号很强烈，男女主强强联手很不错,幻香～～
700,好好啊，勤工俭学的男主果然是超级给力。,竹影情风🎊
701,各种兴奋啊，越来越喜欢勤工俭学的男主了呢。,阿俏🏖
702,深切感受高智商美女王燃。,麻辣烫好甜💯
703,这部剧向大众传递成长真谛看样子是行，8错哈。,এ᭄ꦿ九里＇＇ ོ ོ
704,嗯...对...没错...很认同男女主强强联手，真是好极了。,施又群
705,被惊艳到了，很关注赚钱学习两不误的男主。,年青人哟
706,帅气出场方式真是火了。,海边孤星💖
707,男主林亦诚的饰演者张耀很抢眼。,得过且过 ||
708,哇呜~大家对男主勤工俭学都比较认可哈。,甘心子晴
709,很支持董璇饰火锅店老板娘萱姐，绝对可以的,zfmad1
710,很稀罕这部剧主演阵容啊。,1300六
711,不简单呀，勤工俭学的男主好迷人,嘻嘻嘻嘻哈哈啊哈🏖
712,男主林亦诚的饰演者张耀赢得众多亲们点赞。,Rem、仰望星空
713,稍做了解就喜欢上了潇洒风流的富二代李文凯。,幸福感12345😗
714,知道吗，为了准时到达辩论赛场男主换了几辆车？,我是萌妹子啊
715,我感觉赵星卉饰刘珂一定很棒。,春初意
716,紧凑的剧情节奏让人动心。,我的宝贝微微
717,真是呢，男主赚钱学习两不误绝对经典。,世俗ゼ
718,要记得关注优秀的演员阵容，绝对的好,还多不大好
719,我太喜欢赚钱学习两不误的男主啦。,妖精眼中的我
720,真是服了啊，男女主二搭太精彩了,括路者也
721,帅气出场方式的知名度很高啊，绝对的超级好。,小的羊
722,怎么一上来就是全集，这波操作属实不到,沊🍁
723,男主林亦诚的饰演者张耀果然不一般。,把光送年
724,高燃展述十年青春韶华吸睛无数，赞一个,晓晓可心
725,毫无置疑的吸引力呀，这个剧值得去磕起来,爱游泳de南荣谷梦
726,也来问一下，方言对富二代帅哥的影响有多大,泉水叮咚💝😗
727,呵呵，男女主强强联手很不错,开心yyW
728,袁家欢就是涛哥本人吧，太讨喜了,洞冰虹f
729,我会更加留意这部剧揭示校园与社会生活。,今日吃什么🍑
730,看出你们很开森，比较对男女主二搭有兴趣。,春风十里，笑声传奇
731,来追袁家欢的新剧来的，陈涛这个角色有意思,敢佟長江
732,强烈支持高智商美女王燃，确实不错,刚刚好的意义
733,速来围观，勤工俭学的男主好迷人,傻呼呼😘
734,童鞋们肯定都会很喜欢赵星卉饰刘珂。,糖果诱惑💝
735,陈涛你是上天派来的逗比吗,横刀j斧
736,男主赚钱学习两不误有眼前一亮感觉，赞一个,手工钩织坊🌼
737,这部剧向大众传递成长真谛这么多好评呢。,｡･ω･小柠檬
738,潇洒风流的富二代李文凯让人抱有强烈兴趣。,开心快乐手🐾
739,紧凑的剧情节奏亮点多多。,心慈💦
740,大开眼界！感觉到了男主勤工俭学的魅力。,无敌美少女小梅
741,帅气出场方式给我们带来了很多惊喜。,那个女孩哈哈🌟
742,感觉勤工俭学的男主就是好，就是好。,奶茶续命yyy
743,厉害啦，帅气出场方式的好处我算知道了。,春天好。🍧
744,发自内心喜欢这部剧展示成长百态。,悦悦w🧁
745,对袁家欢饰陈涛印象很深。,开始懂了明天
746,喜欢高燃展述十年青春韶华霸气范儿，经典啊。,何以心动ぃ
747,哇哇！！赚钱学习两不误的男主引人注目。,奕琳🌸
748,嘿哈哈，喜欢男主赚钱学习两不误滴童鞋们真多。,a木棉花🌸☀
749,袁家欢这“古惑仔”的样子有点搞笑,豆腐干复旦是打发27
750,给紧凑的剧情节奏大力捧场。,不眠不休💋
751,帅气出场方式果然是超棒。,连子芯
752,发现文力饰富二代李文凯绝对了不起哇。,噢哟咯👧☀
753,到点来看十年看袁家欢了，帅帅哒,恒古苟富贵72
754,男女主相互救赎称得上经典。,姐依旧
755,偶感觉男主赚钱学习两不误特点很鲜明啦。,可以的的是
756,淡定哈，这个剧值得去磕起来,涂山苏苏的书
757,好衰，李老师实际上一点底都没有,他为我一生守候
758,这部剧向大众传递成长真谛真是了得，力挺一下。,语嫣红
759,我举双手赞同感动与曲折的成长故事。,ジ Edmund ゛さ
760,顶顶顶！！！三个性格迥异的男生玩到一起让人好奇,美羊羊和野兽
761,我快被袁家欢给笑死了，这演技可以啊,好杆菌个会发光
762,知道跌宕起伏的青春故事很棒了呢，绝对的啊,黄圣伊宝贝儿
763,男主林亦诚的饰演者张耀棒棒哒。,心悦你山有木
764,真是呢，这个“专车”也太逗了吧,小小吧🍡
765,我就好喜欢勤工俭学的男主，服了,喜欢吃龙虾🦐🦐🍂
766,无法抗拒的美感啊，出场方式也太帅了,为你而战figt
767,好多人喜欢张耀演技呀，真是太赞了。,友友rao
768,实打实喜欢这部剧主演阵容，服了,哇哦~哦🌟
769,没想到陈涛还是一个隐藏喜剧人,好v不VG和挂号
770,值得一提，这个剧值得去磕起来,勤恳的随缘🎉💯
771,真是这样，这个“专车”也太逗了吧,可爱小仙女QQ
772,感觉张耀饰林亦诚叹为观止。,悬墨😆
773,优秀的演员阵容果不其然很赞。,刘沐沐就是我
774,这部充满真情实感的青春剧让人深深折服。,顺美美
775,发现了男女主二搭经典所在了呢。,冰冰love随缘
776,感觉高智商美女王燃真滴很赞。,手边的微风
777,童鞋们都已经果断喜欢这部剧主演阵容。,天府宏中杨建
778,勤工俭学的男主实在是让人心动不已。,何以心动ぃ
779,如此高智商美女王燃我喜欢，确实是这样,大小闹钟🥰
780,感觉是妙不可言呀，女主的口条好厉害,移动城堡👏
781,看着就很好，出场方式也太帅了,凹凸不凹凸💞
782,张耀张雅钦谱写青春成长序曲不是吹出来的，嘿嘿,天青色等烟雨恋
783,默默的问一下，三个性格迥异的男生是怎么玩到一块的？,没有你，还不错
784,这部剧向大众传递成长真谛注定好评多多。,q黎生
785,高燃展述十年青春韶华太吸睛了。,渃垚
786,人人都来关注高燃展述十年青春韶华。,美少女的谎言🍡
787,男女主强强联手的好我算是明白了哈。,快乐快乐大本营🏖
788,这部剧向大众传递成长真谛令人激动,陷阱a
789,始终都坚持自我，男女主二搭太精彩了,孤独的雪😁
790,这部剧展示成长百态深受宠爱。,gao·健
791,网友们对张耀饰林亦诚有共鸣。,我忍无聊
792,隔空赞一个，男女主二搭太精彩了,一起起🍀
793,给男女主默契配合打辩论的剧情跪了,好一个温柔
794,这部剧揭示校园与社会生活使人充满惊喜。,静静姐姐💘
795,我就是这样认为的，男女主二搭太精彩了,萝卜萝卜你好啊
796,大家多支持哈，都开始关注男女主二搭。,追星人的小黄鸭
797,男主勤工俭学果然是很受宠。,拉朵花
798,我也看到了，勤工俭学的男主好迷人,幸福美甜
799,一语中的，这个“专车”也太逗了吧,"爷,霸气√不侧漏"
