,0,1
276,哼哼哈嘿！男女主默契配合打辩论的剧情让人眼前一亮的感觉呢，这次是知道了。,开心快乐手🐾
277,男主林亦诚的饰演者张耀带来惊喜不少，太好了。,淅川川
278,张耀张雅钦谱写青春成长序曲可谓一目了然，真是不错,☻我以为可以不在乎
279,给力支持这部剧向大众传递成长真谛，真心不错的。,爱玩台球の南荣骞骞
280,哎哟，现在都知道男女主默契配合打辩论的剧情了呀。,189一起
281,唉，嘴炮星人李老师嘴上说着心里有底但实际上一点底都没有,唱给你听🥰
282,童鞋们肯定都会很喜欢赚钱学习两不误的男主。,金桔柠檬茶℃
283,太俗了，陈涛和刘珂两人加起来得有八百个心眼子,大仙哈哈✨
284,男女主强强联手默契配合打辩论的经典是绝对的啊。,不眠不休💋
285,彻底被雷倒了！男主勤工俭学让人倍感清爽，惊喜呀。,大仙哈哈✨
286,琢磨了一下，感觉勤工俭学的男主肯定会很震撼。,D5生产-郑平红
287,想弄清楚，三个性格迥异的男生是怎么玩到一块的？,小马儿跑的快🧀
288,强烈推荐亲们围观，赚钱学习两不误的男主真是让人大呼过瘾，喜欢极了。,顺美美
289,我看也是哈，赚钱学习两不误的男主真滴是很经典，真心不错的。,你与时光皆薄凉@✌
290,聚众围观青春群像多面展示成长百态，就是很不错,哈哈么么🏝
291,我发现董璇饰火锅店老板娘萱姐真是没的说呀。,用户81ec12a6奔跑的蚂蚁
292,不管怎么说还是喜欢女主王燃的饰演者张雅钦。,一三一生🌟
293,感觉出男女主强强联手默契配合打辩论受欢迎呀。,剩夏光年一
294,不能接受，李老师嘴上说着心里有底但实际上一点底都没有,刘沐沐就是我
295,一见定情，帅气出场方式吸引不少人目光，我好心动了。,妍妍  @，
296,看出来了呢，三个性格迥异的男生玩到一起让人好奇,静心倾听🐣
297,刚出差回来看看，发自肺腑滴好喜欢男女主默契配合打辩论的剧情。,苗乡娇莲
298,真心不错呢，赚钱学习两不误的男主引网友纷纷热议。,你不李我
299,太不一般了，三个性格迥异的男生玩到一起让人好奇,甜儿甜儿🧀
300,不知道同学们是不是跟我一样的感受，都来力挺帅气出场方式了。,云开的时候
301,大家集体感受一下这部剧展示成长百态吧，果然令人喜欢。,星光游乐园LOVE
302,额，情何以堪呀，嘴炮星人李老师嘴上说着心里有底但实际上一点底都没有,毅力扬
303,我去！！李老师嘴上说着心里有底但实际上一点底都没有,给自己加薪水
304,当然支持青春励志网剧《与你十年，予我半生》，真是很棒的,暖手宝儿🍧
305,赶脚赚钱学习两不误的男主就是让人比较心动。,幻化之翼
306,留下深刻印象，看出来男女主强强联手默契配合打辩论就是棒极了哈。,小彤彤宝
307,在我心中男女主默契配合打辩论的剧情是真不错。,楠峤🏝
308,超级好大家当然都喜欢跌宕起伏的青春故事了。,紫荫1996
309,在心里多次给张耀饰演少年林亦诚点赞，惊喜呀。,小汤圆直美丽
310,好好赞的呀，好多人都很喜欢男女主强强联手默契配合打辩论，绝对的好,我是带刺的玫瑰花
311,能够感受出来，赚钱学习两不误的男主就是好有亮点。,不懂则不痛
312,那个，我想说，男女主强强联手默契配合打辩论要火滴节奏啊，经典啊。,kongfugang💞
313,看出来男女主默契配合打辩论的剧情就是非常给力。,有你才开心☀
314,还在领悟之中，确实男主赚钱学习两不误就是很棒。,夜下月光
315,坦率地说，赚钱学习两不误的男主就是让人开心。,ARMY.⛄
316,吼吼~小伙伴们快来涨姿势吧，就是喜欢男女主默契配合打辩论的剧情。,欣冉从容
317,有知道的吗，为了准时到达辩论赛场男主换了几辆车？,娜娜livea
318,这样有意思么，李老师嘴上说着心里有底但实际上一点底都没有,仙味葵葵kun
319,好酷！好棒！倍儿爽！已经深深喜欢上了男主赚钱学习两不误。,毛毛好物
320,哎呦呦，确实身边的人都很认同男女主强强联手，好极了。,菲菲我爱你☀
321,前排站立，对李叔叔给孩子们上的成人课喜欢的不是一点半点。,傻呼呼😘
322,力挺一下给力的男女主强强联手默契配合打辩论了。,紫子姿🌟
323,笑嘻嘻的路过，男女主默契配合打辩论的剧情绝对人气超高，真心服了,静雅梅
324,男女主强强联手默契配合打辩论果然是超级碉堡。,丽迪曼
325,无力吐槽，嘴炮星人李老师嘴上说着心里有底但实际上一点底都没有,萌哥688
326,看懂了，赚钱学习两不误的男主吸引了大家，就是很可以,你我四级考试
327,不是吧，李老师嘴上说着心里有底但实际上一点底都没有,｡･ω･小柠檬😆
328,额！你刚知道阿！男女主默契配合打辩论的剧情深得大家喜爱，给力,老刘家369
329,这部充满真情实感的青春剧令人叹为观止，确实不错,用户不存在的请重新找
330,老稀饭了，哈哈~，也开始喜欢男女主默契配合打辩论的剧情了哈。,无敌美少女小梅
331,如此地让人惊叹不已~~男女主二搭真是很不错啦，真是让人hold不住了。,梅果🍓
332,确实是真心不错的，都看出来男女主强强联手默契配合打辩论很受宠啦。,一点都不可爱👻👻
333,感觉这个绝对可以的，赚钱学习两不误的男主得到广泛关注。,南希_😄
334,真是厉害得很啊，赚钱学习两不误的男主知名度很高。,东东sen
335,哇喔！帅呆了，周围朋友好多好多都喜欢男主勤工俭学。,大花姐姐
336,不围观这部剧多维度诠释年轻人内心纠葛真是做不到。,站在樱花树下的我🌸
337,亲，太多朋友都好喜欢男女主强强联手默契配合打辩论，真是极品,智慧的吃货
338,男女主强强联手默契配合打辩论实在是太吸引人。,曼曼在家
339,着实震撼了不少围观者的眼球，男女主强强联手默契配合打辩论就是给力极了哈。,人人都是灰太狼
340,看好哦，真是对男女主强强联手特别的情有独钟，果然是棒啊。,加倍卡💯
341,这部剧向大众传递成长真谛超级无敌赞，支持了,米多多滴🌼
342,网友们对这部剧揭示校园与社会生活有共鸣，真是好极了。,長靈……
343,这个谁知道，三个性格迥异的男生是怎么玩到一块的？,萌哥688
344,这还用说么，呵呵，真滴是知道男女主强强联手很棒，果然牛叉,MO阿莫🍓
345,这部充满真情实感的青春剧引发共鸣，果然牛叉,甘心子晴
346,可贵呀，三个性格迥异的男生玩到一起让人好奇,唯爱美食
347,着迷于这部剧多维度诠释年轻人内心纠葛，好极了。,澍澍呀
348,体验到了男主赚钱学习两不误不凡之处，确实是这样,烟雨蒙珑
349,张耀饰演少年林亦诚赚足了关注度，真是非常可以的,玲玲好开心🥝
350,简直就是不可思议，李老师实际上一点底都没有,一三一生🌟
351,喔喔～原来如此，喜欢帅气出场方式就是很不错滴，一看就是很不错。,春天好。🍧
352,能够感觉到跌宕起伏的青春故事就是很让人喜欢呢，这次是知道了。,哈哈小朋友😘
353,太绝了，赞一个，男女主默契配合打辩论的剧情是真正意义上的赞，真是非常可以的,泽养一身伤
354,偶一直在尖叫，已经发现大家都好喜欢男女主强强联手默契配合打辩论了，果然令人喜欢。,小雅诗姐姐
355,说下我个人一点小看法供各位参考，果然是好喜欢男主勤工俭学。,柚子柚子皮呦呦
356,加油哈！男主赚钱学习两不误真不错感觉好多人都喜欢。,同一个世
357,必须要给赚钱学习两不误的男主一个赞，那可好了。,竹影情风🎊
358,幺西，绝对滴力挺男女主默契配合打辩论的剧情一下，超级喜欢。,妍妍  @，
359,好多同事也认为跌宕起伏的青春故事确实很不错，令人喜欢。,明日之后驻守
360,淡定强力围观，童鞋们都已经果断喜欢李叔叔的话。,A0小俊🎀
361,谁能明白，为了准时到达辩论赛场男主换了几辆车？,自在的大鱼海棠
362,谁最清楚，为了准时到达辩论赛场男主换了几辆车？,啊霞💕🌼
363,又是要闹哪样呀，嘴炮星人实际上一点底都没有,白开水好好闻
364,哼哼哼，嘴炮星人李老师嘴上说着心里有底但实际上一点底都没有,永远爱你心心
365,还用看么，顶！ 真心发现男女主强强联手默契配合打辩论就是超级棒，8错。,小彤彤@_@🌼
366,瞬间高大上不是梦！发现了男主勤工俭学的诸多好处了，看出来了。,小汤圆直美丽
367,谁能明白，三个性格迥异的男生是怎么玩到一块的？,小杨喜气洋洋@
368,想想心里就高兴呢，三个性格迥异的男生玩到一起让人好奇,遇见呵护
369,哈哈，好像是这个理，男女主默契配合打辩论的剧情十分抢眼，顶起。,儿子兔子的守望
370,男主赚钱学习两不误引来大批网友围观，支持了,张小哥。🧁
371,这部剧向大众传递成长真谛就是很不错真喜欢，绝对的超级好。,施又群
372,我就讨厌这种一次性放全集的，下午又得逃班了[色],一只小胖友🍂
373,这部剧遗憾太多了！猜忌不少，就是一群人经历社会的人间险恶的故事，不属于爱情故事，只是属于友情类的电视剧,弈星亦蕴
374,姐姐我来啦[色][色],菜菜不吃鱼凹
375,剧情实在看不下去,lilimm123
376,结局是be还是he？,clair de lune⭐
377,"是谁的cp 二搭了？
是我的！[色][色][色]",蓝二哥哥´
378,好看好看[应援],蜜糖玛奇朵
379,直接全集？秀啊,聪明过人的陶小姐
380,甜一点别太虐我了,蜜糖玛奇朵
381,来了来了,蜜糖玛奇朵
382,小相思二搭了[应援],。雯肱主
383,希望不要太虐了,。雯肱主
384,来了来了,。雯肱主
385,很好看的一部剧，男女主都是我喜欢的年轻演员！！！,春棠煎茶
386,看了半天都没看懂在演啥,ꫛθꫀꪝ
387,播了？必须支持一下，当时看一寸相思走不出来～,思念于深海
388,粗一看，还以为胡一天和全智贤演的[捂脸笑][捂脸笑][捂脸笑][捂脸笑],民红
389,你从不在我本该有的未来,再清醒丶
390,"
没办法，古曲相思过来的太上头了！哭得我心痛！",上古一一
391,服化道可以，剧情和恋爱并行,弹钢琴的小女孩A
392,去掉恋爱也是很好剧情作品，真的太好笑了,睡个觉都是爱你的形状
393,看的我闭上了眼，拍摄手法很符合年轻人的口味,柯尔鸭死忠果粉
394,画面极美赏心悦目，节奏把握的好,哇啦啦小话痨
395,张耀台词功底飞一般进步，演员演技很好,真菌感染要死了
396,张雅钦的表情也太好笑了吧，挺不错的,坚持不下去就算了吧
397,搞笑又甜宠，看的我上头，真的好剧 追剧去了,肉肉肉我爱吃肉
398,特别贴近生活接地气，又可以有新的剧可以看了,小僵尸跳跳A
399,道化服和剧情完美搭配，我的少女心！,外卖被偷的小可怜
400,给我一直甜下去！，好久没看过搞笑剧情的甜宠剧了,小怪兽喜欢奥特曼A
401,节奏很紧凑画面很舒适，哈哈哈这部剧可好玩了,小仙女不怕
402,张耀电视剧炸裂，只看剧情也很刺激啊,可爱的米妮A
403,真的好好看 很搞笑，CP先磕了,蜜桃加气泡
404,讲真这部可以，入股不亏,梦里朱一龙是我男朋友
405,虽然是恋爱但是也好真实，情节上合理虚构,彬大喵~
406,张耀电视剧不错，从一开始关注他，可以再甜一点,在冬天喝啤酒
407,特别贴近生活接地气，剧情带入感太强了,trickttt-ai
408,现在已经看的停不下来，选角很不错,我超凶的AA
409,张耀演的真好，又轴又萌又聪明，蜜汁停不下来,Frida星球
410,编剧好会写代入感的剧情，这是什么神仙恋情,Woobeibei 
411,简直太甜了吧，姐妹们一起追剧啊,大雄弄丢了哆啦A梦
412,张雅钦是什么神仙颜值啊，剧情真实高潮迭起啊,wiki juice
413,谁会拒绝甜甜的求婚呢，男女主角让人特别想磕,绵绵_随机掉落
414,没想到张雅钦的身材那么好，前几集还挺上头的,Katrina9A
415,张雅钦撩头发真的好漂亮，布景什么的也还可以,landcruiseA
416,张耀真的演什么都能打动人，男角色都好帅气,Dharma_Geek
417,强调两性平等，三观正，剧情很新鲜,亥乃亚克山冬
418,我的少女心！，这个电视剧也太甜了吧,LakeOnFire
419,这部剧真是直击我的少女心，追剧好快乐,Talkaholic_L
420,张耀电视剧很好，剧情很好看，八倍速恋爱结婚可以吗,中场休息时搓澡
421,为导演爆灯，为张雅钦爆灯，值得一看的好剧,吃不起水果的嗑盐人员
422,演员跟角色也太贴合了，整部剧制作得也好用心,玛绿莲white
423,左妹有点香港温兆伦的感觉,jmalec
424,我是发现了宝藏演员么？他的剧我怎么都没看过？！,只写真实感受
425,男主声音是熊大吗？？再去看一遍一寸相思算了。。。,Jigglypuff1
426,看预告很虐，一直不敢看[捂脸笑]。想知道结尾是甜还是虐啊？,滚滚女神
427,萱姐一个藏着传奇的女人,川仔526
428,我天真的以为二搭不虐了[大哭],发财啦小赵
429,哇塞，二搭，这次能不能不虐，好好在一起！,颖伦战博
430,超喜欢张耀和张雅钦二搭！[大拇指][大拇指][大拇指],方哥破晓
431,女主真的被那老头给睡了吗？真的话我不喜看[大哭],停止妳·所谓的爱
432,终于二搭了，一寸相思，断肠意[应援],西小小柚😃
433,什么时候播的？一点宣传都没有[捂脸笑],王一博MTJJ💚💚
434,真好爱奇艺会员有好几部都是一下更新全集,sar且听风吟
435,特意来支持二搭的，买了会员，等有空的时候慢慢看,超爱吃甜橙の纳兰琨瑶
436,这不是少年游之三寸相思的男女主吗？,悠※痕💞
437,如果是不好的结局，突然就不想看了,爱玩台球de叱干盼旋
438,最后男女主在一起了吗？,So ____
439,这个都播出了我居然不知道,帅哥自会出手
440,都啥啊，终究还是张耀扛起了所有,冷色调kk
441,好好经营婚姻，好好善待婚姻，婚姻一辈子不容易，一定要学会包容，学会珍惜！婚姻要想顺利，得到一个美好的婚姻，就是好好对待婚姻，不破坏别人的婚姻，多护生，多帮助善待他人，多施，多发布一些正能量的有关婚姻方面的内容！对待婚姻忠贞不二，对待伴侣不离不弃！不宣传一些不堪色彩的内容！要有正能量，有道德修养，对人要真诚！不能伤害别人的感情，最重要的是要有慈悲心，善待身边的每一个人，每一件事，多帮助别人，把好的东西多分享给别人！这样婚姻才能慢慢幸福，好运才能慢慢降临！,安诚宁和一仁清慈
442,真行，开局两轮学生车祸[捂脸笑],大主宰很6
443,什么?竟然不声不响地播了  我冲了[色],喜欢上网の亓官欣悦
444,哇喔，他们俩有一起合作了,匿名用户
445,看了，第二集，成功让我弃剧,我的 好宝
446,这个简介不在一起，总感觉唉,炸天帮消炎
447,不亏是爱奇艺[色][色][色]爱了直接全集,小红花☺
448,这个是最后在一起。还是没有啊。求问?,用户51dab26f
449,来了流氓郎中蠢笨飞贼,匿名用户
450,到底是he还是be？he就看，be就算了，受不了[捂脸笑][捂脸笑],匿名用户
451,我白开了三个月会员，气死,匿名用户
452,假的吧？我开了三个月会员，他直接给我更新完了[捂脸笑],匿名用户
453,就喜欢这个一次看全集,考那样考嘛！
454,这不就是相爱十年翻拍吗[微笑],西瓜就是我🎁
455,这不是演古相思曲的女主角么[微笑],垃圾垃圾技能
456,就喜欢这种一次放全集的,匿名用户
457,看到最后，这部剧的男一，男二，女一心都够大的。,野桔梗🍓
458,刚好想看 一下子就更完了哇哇哇,慢慢₂
459,三搭小甜剧吧，不要再虐了,蜜糖玛奇朵
460,就喜欢大气的，一下全集出[大拇指],匿名用户
461,"爱死这种剧上来就放全集
",哈哈哈哈哈～529
462,他们两个我都喜欢，他们两个火就好了,费久兵
463,原声又全集[应援][应援]仗着（一寸相思）看他们二搭,淼旭303718
464,太期待他们了，第二次合作,灰鲸-
465,哇塞，全集!我还以为眼花了呢，酷[大拇指],取个什么名字好呢都是昵称已录用
466,我传媒拍的戏呀，真的太棒了👏播出来了[色],匿名用户
467,这才是大平台该有的格局[大拇指],陈林欣芷
468,还得是桃啊，一次性放全集[大拇指][大拇指][大拇指],匿名用户
469,"哇啊啊啊啊啊，一寸相思的男女主二搭了。
一下就放全集啦",子夜未央zj
470,哇塞，一下更新全集，厉害了,晴晚⛄
471,一寸相思和古相思曲都好看,匿名用户
472,全集啊 爱奇艺也太好了叭[应援][应援],爱赖床的青阳云凯
473,刚看完男主的另一部剧[捂脸笑],颖昊粉
474,刚看到更新全集[色]，谁的cp二搭啊[应援][应援],suk-ylt
475,哇塞，直接放全集，太绝了,匿名用户
476,厉害呀直接看全集，有剧追了[色],匿名用户
477,能拍出这种剧，编导也是人才[微笑],匿名用户
478,这么牛啊   一下子全集了[大拇指][大拇指][大拇指][呲牙],笔墨竹衣
479,请问结局be还是he啊！不敢看[大哭],匿名用户
480,牛逼 直接放全集 好啦 我追定啦 就爱这么爽快滴[色][应援],匿名用户
481,爱啦！爱啦！还在《少年游之一寸相思》里出不去呢！我来啦！,匿名用户
482,"我的天！什么！直接发全集！
",匿名用户
483,真的喜欢这种一下会员全集更新的[色][色][色][色],晚宁F😃
484,真呢没在一起吗？不是甜剧就不想看了[捂脸笑],这样也好！！
485,就喜欢这种直接的，直接放全集[应援],匿名用户
486,一次性全更完，简直不要太爽,匿名用户
487,上来就全集，我还以为是我看错了[色][色],匿名用户
488,我对张耀永远有李渔滤镜!,小宋老师滴小吴老师
489,过分了主页面都看不到,白日梦我😚🏖
490,全集厉害，爱奇艺上大分,普外科书
491,突如其来的全更，一看简介be，从开心到💔不到三秒[捂脸笑],匿名用户
492,现在的电视剧快成了短视频了，太短了,爱喝大杯奶茶🥤
493,最喜欢这种了，一下看完全集的,说我心如蛇蝎你又岂是善人
494,直接全集，给力，哈哈哈就喜欢这样的[大拇指],匿名用户
495,cp二搭了谁懂啊啊啊啊啊[爱心][爱心][爱心][爱心][色][色][色][色]还直接全集[捂脸笑][呲牙],匿名用户
496,就是终于让我感受到VIP的好处了,匿名用户
497,我觉得男主，好像刘昊然[捂脸笑],匿名用户
498,谁最清楚，新人物会带来哪些剧情？,小呆鱼。✨
499,咱就欣赏袁家欢的帅跟演技就好了,傻泡j瓜
500,袁家欢的剧也是很好看的,尊帆唯我独
501,袁家欢演出了陈涛痞帅痞帅的感觉,全是房间
502,爱奇艺太会推荐了，一寸相思,😄😄😄😄哈哈哈哈🤙
503,咱就说就喜欢这放全集的[色][色][色]爱奇艺太棒了,匿名用户
504,居然全集，还是二搭，那不得不看了[色],牛肉饭1236
505,真的想知道，这个“专车”是认真的吗？,小溪yi
506,还是爱奇艺给力，一次更新完，[应援][色],墨染zzzz
507,董璇饰火锅店老板娘萱姐的好处我算知道了。,梅果🍓
508,天真少女刘珂值得持续关注，真是不错的。,萝卜萝卜你好啊
509,真是牛叉啊，没想到会这样救场,开心yyW
510,那么好的吗？竟然一次性更了全集！[应援][应援][应援],天涯亦相逢
511,男主勤工俭学带来惊喜。[呲牙],手边的微风
512,爱奇艺总整全集的，不错不错,啊就是不说
513,都晓得这部剧多维度诠释年轻人内心纠葛啦。,与伱坚守一生
514,男女主相互救赎可真行。,云开的时候
515,在我大重庆取景的啊要疯了,匿名用户
516,这部剧展示成长百态越来越火。,遇见呵护
517,不错啊，看到勤工俭学的男主就是爽。,冰冰love随缘
518,身边朋友都很关注高智商美女王燃。,湖边一棵柳
519,一次更全集是我没想到的[应援][应援][应援],一尾鱼sss
520,说真的哈，看出来了男女主强强联手超级给力。,芯芯念念🐾
521,顶一个了，我爱勤工俭学的男主没商量。,俏皮眉眉
522,不错呀，林亦诚哭着吃饭这段很精彩,鹿港♀
523,"二搭二搭耶
（最后到底能不能在一起？[睡]）",000哈哈哈🎡
524,这么豪横的，一播就全集,诸葛问玄天
525,爱奇艺这个放全集太👍太棒了,匿名用户
526,一寸相思很不错的，希望这剧也不错,LaVie enRose
527,好看吗？看到两位主演就来看了,LaVie enRose
528,WC我看见了什么一上来就是全集[捂脸笑][捂脸笑][捂脸笑],星落✨🌸🤙
529,哈~~啦啦啦，这个剧值得去磕起来,泽养一身伤
530,给张耀演技点一百个赞，确实啊,幸福感12345😗
531,很应景哇，还是男女主二搭彪悍。,我是一个无知的小姑娘
532,哎呦喂，男女主强强联手很不错,哇哦~哦🌟
533,很稀罕跌宕起伏的青春故事啊。,不懂则不痛
534,来支持呀，好喜欢帅气出场方式呢，就是很厉害。,栋一哥
535,来问问，为了准时到达辩论赛场男主换了几辆车？,俏皮眉眉
536,男女主强强联手真不是盖的。,奕琳🌸
537,歇斯底里，李老师实际上一点底都没有,我的宝贝微微
538,无死角喜欢这部剧向大众传递成长真谛。,紫荫1996
539,现在分账里难得的好剧啊,匿名用户
540,欢乐呀，男女主默契配合打辩论的剧情,张小哥。🧁
541,不住称赞这部充满真情实感的青春剧。,一点都不可爱👻👻
542,男主勤工俭学口碑超赞。,明日之后驻守
543,男主勤工俭学真是好让人喜欢。,乖得不能再乖了
544,我就问问，这个“专车”是不是认真的？,燕子_qqbhp37
545,对袁家欢饰陈涛就是有好感，给力,陌城白夜
546,不管怎样始终支持女主王燃的饰演者张雅钦。,安夏呀安夏
547,谁知道呀，方言对富二代帅哥的影响有多大,白白的爱
548,最喜欢的就是男女主强强联手。,菲菲我爱你☀
549,比较看好赚钱学习两不误的男主，力挺一下。,连子芯
550,彻底记住这部剧向大众传递成长真谛了。,白合花开心🏖
551,男主林亦诚的饰演者张耀被啧啧称赞。,开始懂了明天
552,好啊好啊！出场方式也太帅了,小彤彤宝
553,看到紧凑的剧情节奏自然觉得喜欢。,এ᭄ꦿ九里＇＇ ོ ོ
554,萌！！很支持男女主默契配合打辩论的剧情，顶了,期待着明天的美好💫
555,勤工俭学的男主受追捧。,美羊羊和野兽
556,男主勤工俭学是真心很棒。,kongfugang💞
557,不自觉的开始关注跌宕起伏的青春故事。,不懂你的不懂OOOO
558,如此勤工俭学的男主人见人爱，真是不错的。,伊俐琳
559,发现男女主强强联手默契配合打辩论的精妙。,一丁点爱小麦
560,超级有感觉，没想到会这样救场,姐维他命啊🌈
561,抑制不住的兴奋之情，出场方式也太帅了,A0小俊🎀
562,让人心里很温暖，这个“专车”也太逗了吧,下一站遇见你ok
563,怎么可以这样！！！嘴炮星人实际上一点底都没有,夏与祥
564,很认可男女主强强联手默契配合打辩论哈。,开心yyW
565,有木有知道的呢，方言对富二代帅哥的影响有多大,花样少年🤞
566,董璇饰火锅店老板娘萱姐吸引不少人目光。,移动城堡👏
567,也来感叹赵星卉饰刘珂。,人见人爱的一朵花
568,如此男主赚钱学习两不误我喜欢，真心不错。,晨曦晨曦吖🌼
569,哈~~啦啦啦，看出来男主勤工俭学就是8错8错啊。,的模样126
570,这个必须顶起来，果断支持帅气出场方式了。,心悦你山有木
571,对高智商美女王燃很满意。,嘻嘻嘻嘻哈哈啊哈🏖
572,我发现帅气出场方式真是没的说呀。,｡･ω･小柠檬😆
573,求解释，这个“专车”是不是认真的？,有你才开心☀
574,瞅一眼，超多朋友喜欢男主勤工俭学呢。,南希_😄
575,确实这样啊，司机大叔的算盘打的真响,酒醉思红颜旧
576,最好不过了，女主的口条好厉害,那个女孩哈哈🌟
577,高智商美女王燃引来大批网友围观。,喜欢吃龙虾🦐🦐🍂
578,的确很不错，司机大叔的算盘打的真响,麻辣烫好甜💯
579,袁家欢饰陈涛获掌声无数，就是很厉害。,爱游泳de南荣谷梦
580,高智商美女王燃极大吸引了我，真是极品,mianquan
581,很甜美，强烈支持男主勤工俭学，8错哈。,阿炳嘉
582,各位，三个性格迥异的男生玩到一起让人好奇,泉水叮咚💝😗
583,这部剧展示成长百态简直就是完美。,晓晓可心
584,董璇饰火锅店老板娘萱姐确实可以。,刚刚好的意义
585,董璇饰火锅店老板娘萱姐确实是非常不错。,柳荫花下
586,都说帅气出场方式非常赞呢。,小小吧🍡
587,同学们都来为优秀的演员阵容点赞，绝对的。,紫子姿🌟
588,阔少李哲凯让人感觉真是超赞。,噢哟咯👧☀
