,0,1
0,李沁为啥怪怪的，是不是戏曲出来的都有那么一股劲儿？就那种不自然的表演你们懂吧？就好像在演戏剧演话剧那种用力过猛的感觉，我个人觉得演电视剧电影还是自然流露的比较好一点,DeanChang
1,"“人人都骂高加林，人人都是高加林”
人往高处走，有理想，有想法，追求自己的幸福有错吗？高加林的困惑，不管那个时代都雷同的存在。如果是你，你会怎么选？
",是菲林君
2,我是为路遥的这部小说《人生》而来的，原著十几年以前就看过了,lososososos
3,那年代那有画了线的柏油马路,登峰者HD
4,一个初中未毕业的村姑 ，加一个开修理铺的农民 ，就能组成一个上市公司 ，真的太无语 ，那这么想 我也能组成一个郭沫若先生的  天上的街市 ，那我就在天上上市喽 。[捂脸笑],C可欣X
5,不现实，一是车太新，二是那个年代那么浪费自行车的,fsyatt
6,为什么老演员都是方言，入戏！几个年轻主演普通话一说跳戏。还是佩服平凡世界的几个主演,巴巴得得得💦
7,[大拇指][大拇指]这剧真的好看，追这部剧的时候，真心觉得巧珍实在是真多灾多难啊！最开始的时候喜欢加林，被抛弃了，然后又嫁给了栓，丈夫还没了，不过还好，自己有较好的心理状态，否则早撑不下去了，无论是那个年代还是现在都要像刘巧珍一样，坚韧，热烈，赤诚，大爱……,Joey45🔥
8,搞不明白为什么总把结局写那么美好，那么伟大，要是我，我要告他坐牢，他毁了不是一个人的人生，而且一个家庭的全部希望，一个家庭的未来,余生爱ZJ🤟
9,喜欢李沁饰演的姑娘，金子一般的女生[大拇指][大拇指][大拇指]青涩到成熟，拥有到失去….失去到重生，从未放弃[大拇指],妞妞是我的妞妞美眉
10,为了陈晓和李沁来的有没有，男女主演技颜值都在线的剧必须追起来[应援][应援],木木木木木木木木宁
11,同样题材的电视剧，还是人世间好看，人世间这部剧真的是近10年yyda的作品，一手片尾曲人世间更是把整部剧拉满了,毛毛可爱鸭
12,这个开头就有bug了，在那个年代，自行车多珍贵，普通家庭谁会这么糟蹋车，还有拖拉机这种更是稀有，想开可是很难的,超爱吃葡萄的由由
13,我92年的，到98年村里的自行车还不是每家都有，这自行车都这么多了吗,爱吃火腿的闾丘雨燕
14,有谁我一样为了陈晓和李沁而来的举爪爪集合了。激动哇。终于等到了。[大拇指][大拇指],七宝茶
15,看过平凡的世界，再看这个，陈晓差点意思，李沁语速慢点还是不错的,发财的小貔貅
16,这导演看过原著没有？[捂脸笑],美丽而苍凉的手势
17,什么年代这地方都有柏油路了？,周宇_qq3542
18,总体挺好看的 男女主其实都挺好的 但是因为文化不同可能注定不会走到最后 巧珍跟马栓挺好的其实。高加林希望他能顺利复读考到自己的理想院校。,早川津津子
19,陈晓是新一代高加林,楠木长青🎄
20,好奇怪 就算那个时期没电脑查分。他们县好容易出大学生 肯定县里都会知道，一般都会召见撒。怎么这么容易混过,喜欢吃汉堡的太叔秋阳
21,一群群中年人演高中生[捂脸笑][捂脸笑],只要天天快乐
22,现在看剧，先看演员，看剧情，看评论，最后再决定看或不看，有一样的嘛，举个小手看看吧！,翩然入君怀
23,"为了陈晓和李沁来的有没有，男女主演技颜值都在线的剧必须追起来[666]
",不吃折耳根～💤
24,糟了，发现现在追剧没耐心了，节奏太慢😌,贝 贝🙊
25,不管别人说什么，我就觉得看不够很好看,小名子💪是个小傻子
26,高考6月份，剧中离高考还有几个月，那会已经穿短袖了吗？,有风度的Bruce
27,为了陈晓和李沁来的有没有，男女主演技颜值都在线的剧[爱心][色],🥀ꦿ꯭小迷糊💞꧔ꦿ᭄
28,黑巧珍我来看你了,"Aa
Aa呀"
29,心里如果不种满鲜花，就会长满杂草,刺麽果子
30,不错的。都看入迷了,二小_qq2598
31,仿佛看到了我的高中老师，每天都是打了鸡血的样子，甚至比我们更关心成绩[捂脸笑],瞌睡家jj
32,怎么找不到《平凡的世界》那种感觉？ 细节上差太多！,希望你在.
33,想起了父亲30多年前是县招生办主任，那个时候是人工招生录取志愿，默默的帮助过很多农村娃录取学校和调剂志愿，所以父亲去世那天，一个小小县城将近有三万多人送行。,铛铛%
34,"巧珍真漂亮
",二喵的大大
35,我是为路遥的这部小说《人生》而来的，原著十几年以前就看过了,奇瑞汽车🚗
36,怎么样好看吗,梓萱儿啊😝
37,wc 我女神会开拖拉机,喜欢跳高de子桑天成
38,第一集没看完就不想看了。不知道为什么。,城南石榴花开
39,要是全员用方言就更好。那个时代背景，方言和普通话混搭很出戏。,丽萍long
40,又有一部路遥的改编啦，还记得上次《平凡的世界》饱受好评[大拇指]我先放个屁股，这次的肯定也不会差！,八倍浓缩咖啡
41,我觉得沁沁人美戏也好，看她的戏都很舒服，她就有哪种清新脱俗的气质[爱心][爱心][爱心][爱心][爱心][爱心][爱心],Dragon-zzZ
42,双星的爹感觉要搞事啊真讨厌,嗯嗯阿～
43,陈晓演起高中生来还蛮像那回事的，眼神里充满了倔强和不服，这不纯纯男高中生嘛。,瞌睡家jj
44,一集都没看也没打算要看，可惜陈晓好演员了,OK没我在😗
45,李沁依演技绝了，演什么都这么像,小喵呜心情
46,李沁开着拖拉机来了,"Aa
Aa呀"
47,为了陈晓和李沁来的有没有，男女主演技颜值都在线的剧必须追起来[应援][应援],爱吃锅巴の拓跋范明
48,二八大杠能这么骑？一次就废了，那时候农村人家真有钱，一辆🚲无所谓啦[捂脸笑],张和华ach
49,谁懂啊？看人生之路第一集就震惊感觉一股子黄土味朝自己吹过来，下一秒我就可以直接开唱“我家住在黄土高坡”（不是）,帅哥让我看看
50,#人生之路剧评征集#高双星随波逐流却对待婚姻负责，高加林努力向上却曾经抛弃巧珍，巧珍没有文化却独自创业，每一个角色都有着自己鲜明的特征。他们是在时代大趋势下，不断成长的是真的在努力奋进。人无完人，有优点，也有缺点。,天使护眼
51,周里京电影版《人生》很好看,A人生之旅
52,路遥先生的成名作《人生》改编的电视剧剧，之前有非常捧的《平凡的世界》引发收视热潮，相信这部剧肯定也不错。还有男主陈晓女主李沁这对组合也是我非常喜欢的。期待！！,巴山雨婷
53,太好看啦，里面的人物形象都很丰富多彩，性格都很分明，好喜欢马栓这么有责任和担当的男人，巧珍真的好有灵气，高加林从一开始遇到事情的怨天怨地到后来勇敢面对一切一路上真的成长了好多，秀礼人好好，黄亚萍也很努力一直为了自己的梦想而坚持着，她们都很好，村子没有我刚看的时候想的那么坏，后面一直在弥补，但是还是不可原谅的，总之这个电视剧真不错，追完了还意犹未尽呢，过一段时间两刷[大拇指][爱心][应援][应援],小艾米(人 •͈ᴗ•͈)♡☆
54,不喜歡張嘉倪，要不是李沁我才不會看,Sophia-Lu
55,喜欢我沁，大吉大利，今晚看沁[色][色],MR.阿义🎀
56,这部作品太好啊，多励志啊，为了梦想，为了那份不甘心努力，历经苦难终于有了自己想要的生活。看完后内心久久不能平静。我是从那个年代过来的，真的是那么苦，我同学为了能上高中上大学，在家养两头猪，为得给弟弟和自己是凑学费，不至于辍学。一边上学，一边干活。最后弟弟考上，她没考上。她这半生过得很苦，我是亲眼看着的。不经历那样的苦难，怎么能品评出这部作品的真谛。,嘎嘎鱼💪
57,这部剧里李沁的妆造不行，脸弄得太黑，好像永远麼洗干净一样，农村人也不都是脸那么黑的,WQC9319果果
58,看了一下花絮，李沁学拖拉机自己设计下车动作这一处细节做了很好的处理，就那个下车的动作看得出来是老练的，而不是像刚学会的[应援]很棒，李沁饰演的刘巧珍我也觉得很生动[色]，全员演技都在线[应援]希望人生之路开播收视长虹[打call],⛈空白格🌊
59,父母总是拿自己的孩子和别人家的孩子做比较。只会有两种结果，一种是孩子为了超过别人会更努力，还有一种情况是孩子觉得压力太大，受不了，只会自暴自弃了，有的甚至心里都有可能产生变化了。,朱宝贝乖
60,我是为路遥的这部小说《人生》而来的，原著几年以前就看过了,心里有鬼V
61,才知道那个时候要通过预选才能参加高考。我和我婆婆一边看一边聊，她是85年参加的高考，那年一个班都有十几个预选过不了参加不了高考的,乔巴的小帽子
62,胡拍  以前家里自行车很珍贵  谁家舍得这样骑自行车,好听的名字🎉🍒🔥473
63,发现漏洞，细节决定成败，那个年代想喝汽水那有那么随便啊？大城市三个直辖市和个各省会城市差不多，小县城？根本不可能！即使有汽水厂，也是计划供应的，不是满大街随便卖的,看井渴
64,以前大学生好像是包分配工作的吧？在信息不发达的陕北农村，考上就是天子骄子，考不上回家种田。太极端了,梦念8次
65,"为了陈晓和李沁来的有没有，男女主演技颜值都在线的剧必须追起来[666]
",azmat719
66,有谁我一样为了陈晓和李沁而来的举爪爪集合了。激动哇。终于等到了。[大拇指][大拇指],爱吃橘子de澹大姐姐
67,刘巧珍我来了，李沁在什么年代都那么美,看夏初的7喵
68,千万不要再飙陕西话了，《平凡的世界》因为这个没有办法看,哈多阿德
69,为什么老演员都是方言，入戏！几个年轻主演普通话一说跳戏。还是佩服平凡世界的几个主演,浓舒
70,俺来看陈晓啦[呲牙]他的电视剧演技我放心[应援]很庆幸经典人物高加林给他来演,云襄公子
71,这歌是西北锤王唱的吧？,苟哥。🎪
72,我是为路遥的这部小说《人生》而来的，原著十几年以前就看过了,crickers
73,"男主，女主应该是用陕北话。普通话太跳脱了。
代入感差",西西🌙🎁6448
74,"开头直接看不下去了 别说那年代自行车是稀罕物 就现在有几个舍得这样糟蹋自行车的？ 还是推荐去看原著 路遥先生的文笔真的很棒
",ジ 梦里「有座城
75,看了第一集开头就放弃了，这太夸张了吧？,一路向北7978
76,女神开拖拉机[捂脸笑],Fairy♡..
77,一个初中未毕业的村姑 ，很贴近生活，一个农民通过自己的努力，信手拈来，完全不尊重原著，这样的电视剧看了让我感觉我无所不能 ，我好歹也是大学毕业 ，我是不是也能组成一个跨国公司 ，思考中。[捂脸笑],情青💝
78,太扯了吧，全县五年就考出去这一个，学校会不知道是谁？还能回去重读,135****1886_m2457
79,84年，我大绍兴地区的发达村子才有一台黑白电视机，属于村资产，家里有自行车的，那就更是凤毛麟角了，这剧里学生就骑自行车？除非是九十年代,用户49a9daf1
80,为啥家里人都是陕北话，而年轻人土生土长的却是普通话，那年代的农村孩子是这腔调吗,你怎么知道我有对象٩(๑^o^๑)۶
81,我怎么不知道还有预考,志存高远015
82,"改得太烂了
",喜欢吃牛排の南门以晴
83,追完人生之路 慌剧了 求第二部,蟠桃会 小妮子
84,最近看了几部陈晓主演的电视剧，演的真好[大拇指],维妮(王馨葶）
85,陈晓李沁！冲着这个男女主都要追下去有没有！就是为了她两来的,飘到了彼岸去
86,拜托 别再让我遇到没结果又很喜欢的人了,酸菜可乐ɞ
87,最近追了好几部陈晓的作品了，刚追完尘封十三载,木头头🉐️
88,预告看哭，我来了，沁沁很有乡村味,Jenny0777
89,不管别人说什么，我就觉得看不够很好看[大拇指][大拇指][大拇指],听海诉说心事🍧
90,女一女二都超好看呀[应援][应援][应援][应援][应援]好喜欢,十三1313🌟
91,刘巧珍 ，珍行，还会开拖拉机呢,峥嵘岁月/
92,看过原著过来了[大拇指][大拇指][大拇指][大拇指],糖果儿🍬安利
93,人生之路该怎么走，才算对的,龟虽寿⭐
94,说一下看完首集的感受，演员各方面都好，演技在线！剧情紧凑，制作精良，细节处理的也好很多感人的画面，代入感很强很共情，仿佛一下子把你带回到你的那个时候。很真实的一部良心剧！一开始为演员而来[爱心]却发现这剧值得一追[大拇指],我喜欢你眼里的星星✨
95,亲亲们，好看吗，接下来追它,用户536ec852
96,这个电视我之前看过几集，不错！,ヅ回眸ヅ一笑百媚生🌈
97,同样是路遥的作品，这部剧我感觉和平凡的世界还是有很大的差距，尤其开局一段狂飙自行车秀车技，已经加大了和平凡的世界的质量差路[捂脸笑],虎虎Taylor
98,84年路修的那么好，让农村的80后情何以堪[捂脸笑][捂脸笑][捂脸笑],灰灰麻雀
99,看了原著来的，可以的,超爱吃橘子de公孙宛秋
100,这个开头太让人失望了，原著的开头用雨天和雷声烘托高加林沮丧的心情，雷声由远及近，情绪由低潮到爆发，天气，心情，家里条件，教师工作重要性互相呼应，也为日后的感情线埋下伏笔，堪称最精彩的开篇，这个可好，来个山路飙车，意义在哪呢啊，有点失望了,一诺MM0205
101,刚看隔壁梦中的那片海太好看了，这部也有李沁啊,龙霸天下jun
102,高加林家里穷的都揭不开锅了上学都有自行车骑了，改编也别太离谱好不好,秋霖🍓
103,刘巧珍开着拖拉机来了,刘巧珍的珍珠
104,因为平凡，所以不凡[大拇指][大拇指][大拇指][大拇指],一生只宠一只猫
105,预考就庆祝是不是早了点？,龚喜发财😘Sarah
106,这剧一开场就拍的有问题的，高佳林飙车那么快，自行车就那么一扔，那个年代条件不好，一个自行车就舍得这么祸祸吗？,迪迪520😗
107,前面几集还挺好看，到后面感觉缺点东西。,往事随风倒🍑
108,还在为人生迷茫吗？来看看吧,娟籽🎋
109,我喜欢的两个高颜值[大拇指],JKYC☀
110,人生之路很漫长，看自己怎么走,你是祖宗啊🥝
111,84 年我都毕业一年了,yashili
112,[应援][应援][应援]李沁VS陈晓，两个都是我喜欢的演员，喜欢再来个现代剧二搭，霸道总裁 傲娇妻那种,丶没有神的过往Olivia
113,第一集就跳戏了，感觉就是一堆小鲜肉花骨朵攒到一起拍部神剧，经济条件也太好了，没意思。,醉_聽雨
114,这老演是真不行呀，那个年代谁家有辆自行车不是爱惜的跟命似的，谁会舍得那么折腾！,丘秋丘秋
115,高加林巧珍终于来了太好了,云襄脑师
116,结局没看懂……这男主有外遇还是没有啊？[捂脸笑][捂脸笑],凌凌46466
117,这个电视拍的跟坨奥利给一样,开朗的网友6545
118,这部剧还没怎么看，跳着浏览了下，个人的感受是画面质量不错，但如果剧里有当时的那种口音即不太标准的普通话，代入感会更强。剧里目前主要是老一辈的演员会有这种语气，像年轻人就讲的是正儿八经的普通话（李沁唯一说了有这种感觉的就是“嘞”），口齿很清晰，但同时也少了年代感与那个味道。,Zoter
119,李沁演什么像什么，导演也非常细腻真好。[大拇指],安娜妈妈1314
120,拍的很好，剧情也很吸晴，追追追[666][666],你最珍贵go on
121,人生之路，艰难困苦，玉汝于成！刘巧珍，自强不息，止于至善! 期待@李沁 饰演的刘巧珍 ! [大拇指],云文∞
122,"这拖拉机是李沁开的吗
",匿名用户
123,第一次看这样的剧[大拇指][大拇指][大拇指][大拇指]，很不错[666][666][666][666],虽然我人很好v
124,刘巧珍这拖拉机开出了跑车的气势[大拇指],擦擦擦啊啊啊1122
125,年代代入感好好，演员好真实的演技[大拇指],微风拂面春意荡漾
126,这部电影我太喜欢了，演绎的是我们农村人的真实,小全|全友家居|商务
127,高加林来了,云襄脑师
128,什么剧，越看越没劲，完全没有让人继续往下追的冲动,亮和晶晶
129,请问这是年代剧吗，太浮夸了不真实,超爱吃饼干de东门睿慈
130,果断弃剧，平凡的世界看了好几遍。这个拍的太敷衍了，请多少水军也改变不了拍的不好。年代剧，要认真的。八四年，大部分农村地区还没有电，大部分农村人衣服都是打补丁的，吃的是黑面馍馍，高粱饭，洋芋擦擦,南市北城
131,每个人要走好人生之路[爱心],༄྄ེིོུ清ཉི࿐
132,就喜欢看这个电视剧！不错不错很好看！[应援],ly19990804
133,陈晓高加林要有前程可奔赴，亦有青春可回顾，志存高远，奋斗不息！,只只椰星
134,看着到无聊但是看了一会儿也到挺好的,血色姐姐
135,最成功的小说改[应援][应援],!(心之所向)!
136,老戏骨飙陕西话，主演普通话，一下子就出戏[捂脸笑][捂脸笑][捂脸笑],爱你一一一一一
137,会英语很高大上吗,的往事1
138,太夸张了骑的飞快车都乱丢，不用骑回去了吗，学校还这么新哈哈哈，不符合年代呀,135****5405_m1519
139,好喜欢李沁，喜欢看她演的电视剧，很有感染力[大拇指],牵牛花姑娘🎡
140,我邻居80年的，初中毕业后学了两年电脑，前年公司上市了，一切皆有可能,嗨礼
141,服道化与年代不符呀，主演演员应该说方言，哎，有点失望,松鼠喜糖
142,那个年代这自行车都当个宝。谁会这样骑[大拇指][大拇指][大拇指]，导演屌[捂脸笑][捂脸笑][捂脸笑],马哥万岁万万岁
143,喜欢李沁饰演的姑娘，金子一般的女生[大拇指][大拇指][大拇指]青涩到成熟，拥有到失去….失去到重生，从未放弃[大拇指]喜欢李沁饰演的姑娘，金子一般的女生[大拇指][大拇指][大拇指]青涩到成熟，拥有到失去….失去到重生，从未放弃[大拇指],樱🌺花🌺雨✨
144,狂飙过来的,甜甜317🤔
145,李沁这一面真的豪迈。拖拉机女士,Rock•J
146,开剧几分钟就觉得很失望。那个年代有辆自行车都宝贝得不得了。哪舍得这样跟当摩托车一样地耍酷么？[捂脸笑],茉瞐
147,巧珍的脸蛋黑油油，小娥的脸蛋赛白绸,daimule
148,终于等到李沁的新作品[大拇指][大拇指][大拇指][大拇指][大拇指][大拇指][大拇指][大拇指][大拇指],美沁❄
149,终于追完了 好剧 这样的好剧必须好评👍,蟠桃会 小妮子
150,看了原著再来追的剧，希望不要有惊吓[呲牙],霜_qq3003
151,开拖拉机的刘巧珍好俏,妙手XING
152,天啊，我竟然看到路遥的人生拍出了电视剧！真的顿时热泪盈眶！想起多年前捧读此书的情景。路遥，你真的太伟大了！,安心雪花❄️
153,哎哎，为啥七八十年代农村的公路都铺上了水泥路嘛，拖拉机挂上黄牌的，主人公为啥说的普通话，而配角说的陕北话，好突兀[捂脸笑][捂脸笑][捂脸笑],不愿人长久
154,1984年陕西农村这么富裕吗？我们山东菏泽农村是穷的掉渣,喜欢吃烤馒头的慕容之玉
155,李沁太美了，巧珍质朴善良还会开拖拉机[应援][应援],六颗小城星
156,"看了路遥老师的原著小说，现在为了沁沁看剧，喜欢[爱心]
",等风来1192
157,先看演员表 在来看剧[呲牙],金JJJJJJ金
158,李沁这个造型真的可以，没一点偶像包袱[大拇指],昆哥
159,终于等到陈晓了[爱心][色][色],Mo.1022
160,"一点农村人的样子也没有[疑问]拍不出农村孩子的样,李沁就很不错👍",海滩上的足迹
161,李沁开拖拉机，是自己开的吗？,oyh811126
162,刘巧珍 眼里有光，坦坦荡荡。人生之路，温暖善良。,MHX记忆
163,弱弱这个是那个年代的，居然有拖拉机，自行车，大富人家才有的东西,就怕猪队友
164,都是实力派演员，好看[大拇指],爱欣1206
165,给李沁打10分,小腿笨哦玉
166,那个年代真的是老思想，不让女孩子读书，想女娃在家里干活[大哭],草木♚
167,没有农村的感觉，和平凡的世界差太远，,人间悲苦啊
168,这明显雪藏了好几年的剧了,怪物汽车。
169,为了我们如金子般的巧珍来,沁的老朋友
170,好喜欢，第一次看李沁演这种电视。,小英姐姐xy
171,李沁演戏还是挺有层次感的，少女时期的稚嫩，任性，不懂事，有点女汉子的感觉；慢慢变得成熟温婉坚强。,欢歌笑语只为你
172,哈哈，陈晓新剧来了,luochenyu
173,核心演员说不了陕北话，到是配角比主角说的好。高加林起步就二八大杠加持，巧珍也开起了拖拉机；说实话；开篇那几个镜头拍的让人如芒刺背。,夫子可夫
174,实话实说，不如大江大河1，不像高中生，没有少年感！40年前农村人衣服连个补钉都没有！,格格_qq3092
175,李沁骑摩托车下来哪个腿转一圈是不是有点夸张[捂脸笑],热ay♧
176,刘巧珍真的是个很勤劳淳朴的农村姑娘呢,草木♚
177,刘巧珍呐[色] 好喜欢刘巧珍！看小说就很爱了，还是喜欢的李沁演的[色][色][色],荡荡233
178,冲着 陈晓 李沁  这部剧 就没啥问题！ 都是用心演戏 没绯闻的好演员,爱的春天华尔兹
179,毕竟不是完全照小说改编的，只是选了部分情节，就当一部新作品看就好了，挺好看的,唐琳玲🎉
180,终于等到刘巧珍了！！！,-MZX
181,沁宝开着拖拉机来了,"Aa
Aa呀"
182,这电视剧拍成荒诞喜剧了,fire－man
183,开播了[大拇指][应援][应援]刘巧珍,凝柔欣紫
184,陈晓会骑自行车了啊,Plum小李
185,为了男女主而来，有一样的举手啦[应援],咹静o00
186,李沁演的刘巧珍很生动,NN阿-
187,男女主演有点出戏，别人都是方言，主角一口的普通话。假，跟平凡的世界差太远了。,想遮风挡雨，却带了狂风暴雨
188,刘巧珍漂亮善良性格好，干活哈哈麻利，就是没读书,悠悠*🎀
189,李沁的好几部剧都挺喜欢的，她人美也有灵气，但是这剧里感觉她表情和说话都用力过猛，比如下拖拉机那个腿画的圈，说话那个速度，跟其他人比起来有点不自然，你们觉得呢？,亲爱的热爱的好好地
190,"#李沁刘巧珍# lq#李沁人生之路# 美丽是刘巧珍@李沁 不值得一提的东西，虽然没上过学，她也有着极为丰富的内心世界，同样完美继承了父亲的经商头脑，还拥有绚丽的精神光彩。
","岚沐


huihui"
191,#李沁刘巧珍# lq#李沁人生之路＃华丽转身，不拖泥带水，眼泪留给自己，体面留给别人，清醒又独立的倔强姑娘刘巧珍@李沁  ,"岚沐


huihui"
192,李沁演的用力过猛，不好,焱焱焰🎊
193,为李沁而来。人物形象、画面都很有年代感,139****6587_m1569
194,不会男主中间和好多人在一起，女主一直等吧，最后才在一起,Aug♛420
195,看原著的时候真的被当时刘巧珍的真诚打动了，那个时候的人就是那么淳朴，爱情也那么纯真！,敏敏王子🐣
196,就 名字和时间好像是，其他跟原著没一毛钱关系，黄亚萍成高家林的高中同学了，高家林没落榜。唉，看不下去了。,139****1263_m2798
197,陕北那时候普通话这么标准，主演的装扮与说话没有那年代代入感，老戏骨与主演对话无法融合，老戏骨还是老戏骨。,爱你一一一一一
198,李沁拖拉机好开吗？下次带带我[色][色][色],餧じòぴé★☆蓶羙
199,有些人不要对80年代刻板印象那么重。本80后不发表意见，但是我说个细节，98年泰坦尼克上映时是一刀未剪的,赵九号
200,刘巧珍竟然会开拖拉机[捂脸笑],草木♚
201,李沁，年代剧，我要开会员[色][色],AAA何威
202,情结极其离谱，多年不出一个大学的县城，能出一个大学生，校长和班主任能不知道吗？所以怎么可能被顶替,133****3628_m1847
203,李沁我女神，演技杠杠的，这妆容颜值也在线,屠夫第一
204,金子般的巧珍人美心善,姑苏一揽风月🤙
205,亲亲们，好看吗，接下来追它,哲哲妈1990
206,那个年代的大学生比现在博士还珍贵,美丽心情_qq2775
207,西北不都是吃面吗？怎么吃粉？,渝软软
208,陈晓很棒，高加林演的好，我没看过原著，但我看了头三集，挺吸引我的，演员们和老戏骨都很在线，继续追下去呀[应援][大拇指][大拇指],永不低头灬
209,这拖拉机不要开太溜，不然我会爱上的[大拇指],餧じòぴé★☆蓶羙
210,为了李沁来，希望她多演正剧,椒椒椒椒椒椒
211,李沁终于有新剧了，必追[大拇指][大拇指][大拇指],如烟♡♡
212,"陈晓高加林骑车这一段演得不错
",陈晓跟班
213,来了，来了，李沁美女，男主也喜欢,光光¥😝
