,0,1
444,名人爱情与凡人爱情有何不同,秋福💖
445,为什么把女主的妆这么黑,summer(≧∇≦)
446,后面男女主在一起没有[应援][应援][应援][应援],宝贝七岁！！！
447,其实高双星也很努力了，,VJ娇娇小盆友
448,84年家里有一台拖拉机挺牛吧？？,，别开玩笑了🌻
449,巧珍跟小说描述的差距感觉有点大啊[捂脸笑][捂脸笑][捂脸笑],小欧巴桑
450,陈晓这一口普通话一下子就把气冒了！,意林随风
451,很喜欢陈晓和李沁这俩个人物,艳阳哥
452,可以边听陕北民歌边看剧 ！两者都是我的最爱 ,平板拖鞋113
453,刘巧珍这个小能人 ！真的是陕北农民的一个代表人物！,期待中ing🥝
454,李沁这造型是得罪造型师了吗 ！真的有点太拉垮了吧 ,随风飘扬的yy
455,高加林通过自己的努力还是走了出去,hjbvcj
456,李沁的演技真的是什么角色都能拿捏住！,狂风赶路人
457,都是实力派演员演技在线！,小当家的人啊
458,很有年代感的一部好剧！一起锁定吧！,爱吃鱼的猫啊哇
459,感觉和原著的巧珍不一样,你小的时候很可爱
460,李沁依演技绝了，什么角色都能驾驭,小喵呜心情
461,剧情太精彩了，希望真相早点到来,YY恋上你的时光
462,一直都想看陈晓的新剧 ！终于可以好好的看个够啦 ,猫似熊 ≈李佳洋
463,以前的文凭太重要了，大学生都是香饽饽,向日葵🌻阳光🤟
464,"男女主怎么不说陕北话呢？普通话太跳脱了。
",哈哈好可爱2933
465,每个演员的演技都在线儿，很棒啊！,赖皮是只胖猫咪
466,哇塞！原来女神还会开拖拉机呢？,恬淡春风😍
467,刘巧珍简直就是高加林的太阳,v团银瓜子推荐飞冰儿
468,陈晓的演技真的很棒，越看越喜欢,麻麻辣辣的东西啊啊啊啊
469,李沁真是在什么年代都那么美,今生❤️❤️❤️
470,剧情可以，我不喜欢男一号，或许我不是他的粉丝,1005834230
471,这种剧情的电视剧还有啥看头的，,不再见。。。。
472,太假了吧，说放就放，找都不用找[捂脸笑],蓝枫亿柏
473,两天没更新了，啥情况呀,独特棒棒糖⭐
474,他们说话带口音，你们说普通话好意思吗,A proud can defeat
475,为啥停播啊，啥时候恢复正常？,想个名真难e
476,全县就一个考上大学，不可能冒名顶替。,点子大王何阳-北京
477,#人生之路剧评征集#这讲的是哪个年的故事啊？[呲牙][呲牙][呲牙]看着像九零年代的故事,漩涡.长门
478,我看了原著过来的看看改编的怎么样？？？,爱吃火腿の亓官安平
479,好多水泥路，影响年代感[捂脸笑],梦幻Dream2
480,二八单杠有对那么粗鲁的嘛，太出戏了,果果抱抱
481,瞎演以前车敢那么骑吗都跟宝贝一样,冫狠丶
482,8 4年就吃上无子西瓜了吗？[捂脸笑],爱吃披萨de单于秀慧
483,总算忍到了大结局 一次追完[色],虾味虾球☁
484,有没有在家带孩子可以做的工作啊，我想挣钱,卡卡妹妹0101
485,我的天啊，生了几个孩子的人还演少女,枯草1225
486,把陈晓换成更好的演员就好了,喜欢吹口琴の胡母湛静
487,是不是央视放的啊，感觉都是实景,樊治欣太帅啦
488,看见这样的李沁，果断粉了，以前真没感觉好[大拇指],看电影😆203
489,这剧情我看的快睡觉了没劲[晕][晕][晕],毒素夜神
490,好喜欢秦岚，真的很漂亮,伊波拉齐
491,老电影人生好看，小说更好,房子2023
492,高加林陈晓很符合形象，演技也很好，不错啊,一个超好听的名字z
493,那时城里的干部子女怎么会和农村的男生耍，这戏写的根本不符合实际。我就是那个年代的，,狐狸大大大大大人
494,#人生之路剧评征集#特别喜欢李沁，剧里的巧珍勇敢，真实,勿言大大~
495,我觉得高加林让黄轩来演更好当然陈晓也不错,陈初恋
496,冒名顶替的剧情把我恶心到了，瞬间没有看下去的心情了,用户8e1f6890
497,女主角跟我同名[捂脸笑][捂脸笑][捂脸笑][捂脸笑][捂脸笑],2410173943
498,剧情还行,139****9030_m2761随缘
499,这电视剧不错，挺好看[大拇指],信仰无期
500,我记得以前看的书高加林不是因为教师辞退嘛？怎么变考试被顶替了？,-R7-
501,上大学时候 老师推荐过的   一口气读完了，很好看，电视剧也等来了  就是内容快忘完了[捂脸笑],不吃咸蛋黄就不舒服斯基
502,"我要下载：



",淮南老张r👍老张
503,谁为了张嘉倪来？？？,ぬ 沦丧 💋
504,唯一的败笔就是主演没有说陕西话，不然会更真实一些,一念清净心
505,除了剧情中演员的名字参考了原著，剧情基本上和原著没有太大关系,喜欢吃烤馒头的慕容之玉
506,总感觉唐曾演男一号可能要好点，可能是看多了唐曾演的这种剧了,KGQ888
507,高大尚的硬货[大拇指],360天
508,陈晓长在我审美点的男人,谦谦君子v几个你
509,"改的乱七八糟啊，
",宁静致远120002
510,好看，二刷了，最近看剧好爽，人生之路，尘封十三载，云襄传[应援][应援][应援]陈晓加油✊[666],匿名用户
511,陕北黄土高坡，徒弟贫瘠，严重缺水！农民一辈子面朝黄土背朝天[呲牙],要命😂要命
512,女主演技不错，剧情紧凑，全员演技在线,毛毛的下午茶A
513,女主演技还不错诶，剧情和质感完全上等,天仙落泪_卷
514,质量确实还不错，真的追上头了,春暖花会开*
515,女主什么神演技，细节上没有瑕疵,短野原美绪A
516,李沁好看！，这个故事我爱了。,家住白云区的周先生A
517,自己的路得自己走，走了才有自己的路，刘巧珍[大拇指][大拇指][大拇指][大拇指],时光静好liu
518,演员演技很好，节奏紧凑，演技都好好,柯尔鸭死忠果粉
519,今天也是被李沁圈粉的一天啊，根本停不下来,哇啦啦小话痨
520,李沁的演技非常细腻，编剧真的还不错,外卖被偷的小可怜
521,布景什么的也还可以，真的特别棒,在冬天喝啤酒
522,太可了，喜欢李沁姐姐的造型，暗流涌动,Frida星球
523,李沁姐姐又美又飒太可了，真上头,21世纪的chno
524,李沁越演越好了，看的太爽了,元气少女爱赖床
525,陈晓真的演什么都像，跟着老爸老妈看的,chindroid yeah
526,陈晓一直都很厉害啊，有逻辑性，有疑点重重,狮子座的射手座A
527,李沁的表演充满了感性和智慧，情节张紧有度,吃货的人生不解释A
528,比想象中惊喜很多，好看,隔壁家的种草小王子
529,李沁的表演充满了情感，看着真不错,潇潇不爱笑A
530,李沁这个真的经典了，比较新奇,Ai酱赛赛赛赛高
531,李沁的演技非常自然流畅，节奏比较明快,狂小柴
532,女主好美啊，已经安利同事,缩龟壳的小猫咪
533,李沁的演技真是让人惊艳，两条故事线,喜提新晋墙头
534,还记得她的白鹿原，好看,喜欢吃栗子的轩辕智伟
535,李沁台词好多了，全员演技不掉线，超出预期~,花少一生推
536,李沁真是让人又爱又恨，会讲故事，导演组会拍,中年人类
537,李沁的演技是一种天赋，好看好看,landcruiseA
538,"高家林负了刘巧珍！
黄亚萍负了高家林
",付文飞1111
539,不说别的，第一集还没开始看就被这个歌吸引了，很大气!,南风知我意744
540,八十年代初县城的墙上有那么多小广告吗？？？村里去县城的路有那么好，扯蛋,李小鱼和格格
541,这剧沁必得奖,fb呵呵
542,看着满囤跑，我都想进去把他拉住，熊孩子跑什么…,小名子💪是个小傻子
543,第一个镜头真出戏，自行车这种路能这样骑，还跟新的一样，往后看的欲望都没有了,喜欢弹吉他の宇文恨风
544,为什么这么良心的作品都有人闭眼黑,111啦啦啦1234
545,这么好的作品值得被更多人看到！,111啦啦啦1234
546,看过人生原著，陈晓的高加林演得可以[大拇指],何必起名字735
547,看了开头富有年代感，好剧。,喜欢吃栗子的子书俊友
548,很喜欢里面的巧珍，脸虽然黑了点，但也算漂亮，巧珍活泼开朗、积极乐观、勇敢，敢爱敢恨，一心一意只爱一人。,老馆二楼
549,方言不标准！差点人意！不如平凡的世界！,熔古铸今
550,看了第一集，觉得还不错，有追下去的动力,如烟♡♡
551,毫无演技的演员毁了一部好剧[大拇指],zhangjun_qq1985
552,等了这么久终于来了，沁宝,喝果汁的高圆圆
553,来看我陈晓哥的电视去了，开心,飞鸟和鱼🎀
554,全是穿帮的，那个时候有这种马路，那个农村的小桥也是现代的,攸攸儿
555,我跟舅妈一起重新追此剧，舅妈说女演员好看，而且像80年代农村女孩[大拇指][大拇指][大拇指]我开心的说舅妈，女主长得咋样，舅妈是这样说的，非常好看,rb格桑花开
556,那个时候农村穷得很、那有什么二八车、城里人也没有几家能买的起,小雨来得正逢时
557,啊，我咋没看到说，这部剧是根据人生改编的。我也看过人生。为数不多的看完的书,天天向上。。。。？。。。
558,电视剧是不错，非得让你是VIP交的钱才能连续看，这什么破规定啊，这是,妹allce
559,比那个什么什么日常好看点，日常纯打发时间没有看下去的冲动[应援],铭铭20180820
560,年轻很喜欢看这篇小说，好像是在当代杂志上看的，不知道记错了吗,电视是唯一
561,这是现代新农村吧，路太好了，车太好了，拖拉机太新了，呵呵不走心,ZZ驸马爷
562,"一个有文化没智慧，忽略身边所有值得的东西，一心只想着追求真爱的女人，最败好男人，最毁身边值得的人。

这样的女人，尽管占尽了先天优势，尽管幸运地遇到了许多对的人，可她依然注定悲惨一生。",囿你、比蜜甜
563,现在的编剧和导演是真的没脑子，还是现在的演员没有深入生活！还是现在的文艺创作者没有了艰苦奋斗的精神还是没有吃苦的精神？那个年代的人穿的衣服不会那么鲜艳和新鲜！,大自然谢静捷
564,#人生之路剧评征集#很心疼马栓，对刘巧珍那么好，这世界上根本找不到像马栓这么好的第二个男人，马栓死了好伤心[捂脸笑][捂脸笑],徐百慧的粉丝
565,改太多了，与原著差距很大。高加林房东讲的股票亏了就对不上年份。,yuhangxjm
566,"我们在人间经常讲一句话叫“走出阴影”，
走出你不想想的事情，走出你难过的事情，
把自己的心扉打开。

当一个人有困难的时候、想不通的时候就是云遮住了你心中的太阳。
可是从另外的角度看，依然是阳光灿烂。",养浩然正气_传递正能量
567,我能开口问的我都有答案 我只是想听听你是坦诚还是继续隐瞒,酸菜可乐ɞ
568,刚看完归路过来，那剧情太烂了😑 奔着主演来的，但是剧情真的太一般了，希望这部剧不要太让我失望,漂亮的大猪蹄子
569,这部电视剧拍摄得非常真实，好看；演员们没有现在的演员浓妆艳沫，看上去就是舒畅的心情，演员们演技个个一流水平！请以后拍摄多些优秀电视剧[大拇指][大拇指][大拇指][爱心][爱心][爱心][微笑][玫瑰花][玫瑰花]这部《人生之路》真的很优秀！,雪莲玉马
570,还是看《平凡的世界》吧。这崭新的拖拉机、随便扔的自行车、满山的羊群、笔直的水泥路和沥青路、说有就有的白面馒头和西瓜……实在不太符合那时候陕北农村实际情况[捂脸笑]哦，还有二姨夫家那台电视机[捂脸笑],旺旺仙蓓啊
571,金子般的刘巧珍,QYPPDXPP
572,2204自考好像有这个题目,小可爱78279
573,陈晓演的真不错，演啥像啥,沁心情🏝
574,[微笑]来看陈晓新作[微笑][大拇指],曹露文大人
575,这是哪里话,忘忧草_qq7908
576,84年我出生那年,yin大小姐
577,为啥主演不说方言；一家子还能出两种语言,爱玩保龄球の东里唱月
578,再过两年，我出生了,「遇见美好」
579,高加林那时有自行车？,AdyC0718
580,片名改的不好,止戈🍁🍀
581,那时候有高三吗,爱跳舞的女人最美
582,李沁化妆化的太黑了吧,你好😊，，。😆
583,陈晓的妈这不是甄嬛传里面敬白师傅吗,建飞办公家具
584,为什么不能下载,卉不会-
585,那时有一本吗？那时有乡吗？,a沧海红尘
586,小说看过，电视剧好看吗？,风向决定发型168🍂
587,我两岁了,清风x5e
588,年纪这么大的学生？,微笑是糖゛甜到忧伤..
589,怎么这么样小娥姐呢[捂脸笑],w       B😍
590,怎么全是配音,幸福的小小小女人
591,人生之路难看死。,正气林海
592,新主播！互相帮助的来！,漫漫鱼🧀
593,一段开场戏基本就确定了片子的质量和基调，用浮夸来诠释年代戏，你到底是给谁看的呢，有年代的观众还是年轻观众呢？还是都想要呢？我觉得想多了,drdaqy
594,开始看看,闪闪雾_1999
595,小米13看不到字幕,catchmy8023
596,为了巧珍来的，看过一些片段，李沁演的巧珍是如此的坚强,用户52d95de9
597,今晚不更新,梦醒时见你  ˢ
598,男女主角都不讲陕北话的吗？,飘飘P🎊
599,我是陕北人,笑 挽.—
600,真是好剧看不够,喜欢吃冰激凌の北野嘉云
601,好剧值得[爱心][爱心][爱心],远方的朋友可安好
602,看完了，最后一集哭哭,西双版纳猫
603,来二刷啦[应援][应援],远方的朋友可安好
604,#人生之路剧评征集#不得不说，看人生之路的时候真的好爽啊！我可以一直看下去，能不能够一直更啊？[色],狗🐶里狗🐶气
605,#人生之路剧评征集#不得不说，看人生之路的时候真的好爽啊！我可以一直看下去，能不能够一直更？,狗🐶里狗🐶气
606,#人生之路剧评征集#不得不说，看人生之路的时候真的好爽啊！我可以一直看下去，能不能够一直更呢？,狗🐶里狗🐶气
607,还会开拖拉机[大拇指],孩子妈160
608,娇妻归来,鱼 🐠.
609,太假了，84年破山沟里青年人都骑自行车，开拖拉机，作者怎么想的？,天涯♠伴你行
610,结局很完美[应援]再见👋🏻,我喜欢你眼里的星星✨
611,人生路漫漫，且行且珍惜！！[捂脸笑][捂脸笑],爱喝纯净水de澹台贞婉
612,李沁跟原著的巧珍就不是一个人  太违和了,温森尼
613,估计还有下集,vivi小柠檬
614,没想到小说也能拍成剧[大拇指],AI柠檬🌼
615,看不惯高家林,霸王别姬弄红颜
616,越看越好看 好喜欢高双星[色],小孙注定要暴富
617,感覺沒有人世間好看,🍷馮婕🍷
618,表演过头了,卡卡~8
619,看剧名就被吸引住了,泰坎尼克
620,李沁开着拖拉机来了,风雨彩虹佳人有约
621,巧珍真好,孤灯依旧
622,看剧名就很有看点！,辽阔的大草原222
623,巧珍真的好漂亮,爱做梦的兔子👌
624,一起来追剧吧！,爸爸爱抽烟啊
625,"巧珍真漂亮，美丽动人
",漫过岁月💋
626,刘巧珍很善良淳朴[应援][应援][应援][应援],f84ad7bbc7d0dd90a69e9e4ae
627,李沁的演技真的太厉害太厉害,车韦🍑
628,刘巧珍很善良淳朴,-晴天雨-🎂
629,很有年代感的一部剧！[666][666][666],没想好呢！！！！！！！！
630,来了来了！黑巧珍好期待呀！,追寻着的娇妹
631,刘巧珍太可爱了,泰坎尼克
632,都是我喜欢的老戏骨,苍天饶过谁😂💪1115
633,值得一看！,尼尔1
634,满满的年代感,窗口期限
635,咋没更新了呢,爱跑步的慕容莘莘
636,人生之路,一生一世_qq5820
637,李泌妆感觉有点夸张,你身后的嘉人
638,扯蛋的背景环境。,胖爷🌈
639,果断弃剧,倾城小baby💓
640,这部剧是我最喜欢的  看了好多遍啦   我就喜欢生活剧  谢谢编剧  演员 太喜欢啦,谁说起冬天大雪来了又不来
641,陈晓演起高中生来还蛮像那回事的，眼神里充满了倔强和不服，[大拇指][大拇指][大拇指]演技给力,乔妹的温柔7483
642,刘巧珍真的是个很勤劳淳朴的农村姑娘么[大拇指]很好的提成,冯老师jj
643,李沁学拖拉机自己设计下车动作这一处细节做了很好[666][666][666],静静wx
644,李沁饰演的刘巧珍我也觉得很生动[色]，全员演技都在线[大拇指][大拇指][大拇指],转转6868
645,陈晓演起高中生来还蛮像那回事的，眼神里充满了倔强和不服，这不纯纯男高中生[呲牙][呲牙][呲牙],依依4252
646,84年的冰峰多少钱,默$恋
647,陈晓的剧质量有保障,tshaoli0207
648,我也听到是一百年,瑞缘饭店
649,云烨又跑这来了[呲牙],阿酷酷嘛嗒嗒
650,好[爱心]有第二剧本[爱心][爱心][爱心][爱心][爱心][爱心][爱心][大拇指][大拇指][大拇指][大拇指][大拇指][呲牙][呲牙],谁说起冬天大雪来了又不来
651,剧情写的很真实,勇升小哥
652,周日不更吗[666],果粒橙！☀
653,凭什么第一,likeeeee✌
654,陈晓演的很好啊。,爱单车豆
655,年龄小的演员根本就演不了,❄️飞️❄️
656,这个电视剧真的三观不正，我不知道是讲了个什么，很无语╯﹏╰,黑红土地金土地
657,这只是电视剧好吗？和小说不一样。为什么很多人说的话都会搞笑死评论？拿着当电视看不就得了，计较这么多，不应该干嘛。[捂脸笑][捂脸笑][捂脸笑],皮皮猫🎋
658,#人生之路剧评征集#真的蛮好看的,沙漠尘
659,好多细节上处理的太马虎了，文明的反义词落后[捂脸笑][捂脸笑][捂脸笑][捂脸笑][捂脸笑],球球200207
660,榆林风景优美，演员挺好，值得观看[大拇指],雨是哭泣云
661,让我们和刘巧珍一起共赴人生之路 ！每晚一起守护李沁吧 ！,随风飘扬的yy
662,李沁的演技真的突飞猛进 ！把刘巧珍那股心怀热望的劲儿完美的演绎出来啦 ！,平板拖鞋113
663,陈晓在新剧里的角色跟以往很不一样啊，期待后续更新,聂聂糖果屋
664,咱就说陈晓真的是演一个古装美男就奖励自己一个糙汉子哈哈哈哈,小疯子的小聂子
665,偷梁换柱之事 有点离谱。五年都没有一个大学生。高加林被录取 秦县长不关注。你一个高明楼 马股长就能一手遮天？ 所以 这是Bug ！,kisstonight.
666,八十年代的电影《人生》红遍了大江南北，不知道此剧怎么样，以期待的心情来观看。,囿你、比蜜甜
667,高加林的母亲是甄嬛传里的静白师太[捂脸笑],A꧁꫞꯭大齐河💖莎莎 ꫞꧂
668,路遥的人生是我在小学的时候看的，那本书我看了很多遍。,馋嘴的老花猫
669,我就想知道有多少人是冲着「帆书」读书会的樊登老师来看的[呲牙],米雅yoga
670,后面顶替上学的事情会被揭露嘛,张楠_qq5585
671,小说很短，没想到还能拍成剧,爱吃冰激凌de公仪永福
672,这个高家林角色演的还行，但小学教师黑板板书不能用行书！这是个基本常识，剧中高加林怎么可以这样板书黑板！就冲这一点，这个剧若不是剧本好，这么个导演法，真的是让人大跌眼镜,匿名用户
673,老戏骨演戏用方言，电视剧越看越好看，没中不足就是这些年轻演员没用方言交流。,大白蔡[呲牙][旺柴][旺柴]
674,总是在刷到这个电视剧，来看看,起床困难户●^●
675,作为陕西榆林人，这个是悲哀,OPPO realme IOT系列 ＆何龙健
676,陕北方言更接近古汉语,山丹丹5261
677,这片黄土高坡被高家看上了，迟早是高家的[捂脸笑][捂脸笑],指尖划过的一丝温柔
678,路遥的经典小说《人生》，改名字不合适吧,机灵的momo
679,年轻演员的普通话让人跳戏，就不能学学陕西话吗？,欢喜佛常在
680,这剧不是流量明星能担当的,偏见映像
681,如果两个主演能讲陕西方言那估计效果会更好,幸运直升机
682,我知道在爱奇艺播电视上是哪台播呀,笙箫mo007
683,今天中午刚看完《人生》,哇笨ugwyd
684,李沁的造型真是可温柔可御姐，人物的眼神、角色的设定等都很巧妙,蜜桃加气泡
685,刘巧珍是一个生命力极强的女性，剧本给人的感觉还不错,trickttt-ai
686,李沁姐姐又美又飒太可了，全员贡献教科书级的演技,有个栗子掉了
687,李沁能够通过自己的表演为角色赋予灵魂，故事环环相扣过渡的流畅顺滑,阿武睡不着
688,之前就有电视剧吧，平凡之路？,elaine11111💘9
689,李沁的演技让人看得非常过瘾，摄影取景也很讲究,狗不理的铲屎官
690,李沁的角色让人感到非常感动和激励，不管是剧的质感还是节奏称得上是优秀,元气少女爱赖床
691,李沁能够通过自己的气场和表演技巧将角色演绎得栩栩如生，看着真不错,大雄弄丢了哆啦A梦
692,李沁的表演让人觉得非常舒服和自然，演员会演，人物丰满,吃名字真费劲
693,李沁深入挖掘角色内心的矛盾和冲突，细致的人物刻画,余梦今生浮如梦
694,李沁能够通过自己的表演将角色的历程和成长展现得非常淋漓尽致，剧中美术、服化道、摄影、视效方面也挺好,缩龟壳的小猫咪
695,李沁能够将角色的情感和思想完美地融合在一起，演员们的精彩演绎看得让人目不转睛,小灰机机机机A
696,李沁的表演充满了自信和力量，故事环环相扣过渡的流畅顺滑,万物归壳A
697,刘巧珍对待生命和人性的态度非常明确和坚定，台词耐人深思,SixoneA
698,李沁能够深刻地刻画出角色的内心独白，编剧真的还不错,不安_心的迷茫
699,无论是哪个角色，李沁都能够完美地驾驭，已经安利同事,云身后的昏黄A
700,李沁能够用自己的方式创造出一个非常鲜活和生动的角色形象，演员演技特别到位,常驻火星的火星君
701,李沁能够将每一个角色的内心世界完美地展现出来，拍的挺好的呀,如此完美_宝贝
702,人生之路，艰难困苦，玉汝于成！刘巧珍，自强不息，止于至善,党万星
703,让人们感受到了一个女性所能拥有的力量，值得追,认真摸鱼的菲菲
704,我是无脑自来水，一集好短啊，刚追上劲儿就没了,Dharma_Geek
705,李沁的演技已经达到了一个非常高的水平，导演真的很会调教演员,怒罗为门
706,李沁的角色让人产生深深的感动，导演转场真的厉害，节奏快,睡个觉都是爱你的形状
707,李沁能够通过自己的气场和表演技巧将角色演绎得栩栩如生，镜头语言非常的电影化,爱看花花的草草
708,李沁在角色塑造上非常用心，这个电视剧我看着还行啊,Woobeibei 
709,陈晓演的很不错，什么角色都能很认真的演！希望他继续加油！,盗墓笔记2017
710,刘巧珍也是一个具有思想和情感的女性，演员们的精彩演绎看得让人目不转睛,发型像个狮子头
711,李沁在演技方面的实力越来越被人们所认可，决定继续追下去,莉莉065
712,李沁的表演充满了人文关怀和情感体验，剧情紧凑，全员演技在线,今天我是王富有
713,李沁能够通过自己的表演将角色的心理变化和情感转折展现得非常自然和流畅，剧情的起伏很合理,我son爱吃辣条
714,李沁的表演有着高度的专业性和自然度，令人叹为观止，挺好看的,变美变强变厉害
715,李沁的演技让人看得非常过瘾，全员贡献教科书级的演技,浑浊的天空AA
716,李沁的表演给人留下深刻的印象，细腻之处足见导演和演员的用心,万籁的牢房
717,李沁令观众产生强烈的共鸣和情感共振，细腻之处足见导演和演员的用心,是寒少鸦A
718,李沁也算是很有实力的一个演员了吧，故事环环相扣过渡的流畅顺滑,落泪必有渣男
719,李沁的表演充满了感性和智慧，各方面都很有质感的一部电视剧,嘻嘻_叫我绒绒
720,刘巧珍是一个具有鲜明个性和坚强意志的女性形象，节奏好剧情紧凑不拖沓,笑看万物是假象
721,李沁能够通过自己的表演为角色赋予灵魂，这个电视剧我看着还行啊,黑土养一方人
722,李沁能够深刻地理解和刻画角色的内心世界，导演叙事功底了得,家住白云区的周先生A
723,李沁的表演让人觉得非常舒服和自然，演员和编导继续保持水准,亥乃亚克山冬
724,李沁是当之无愧的一位演技派女演员，已经安利同事,儒雅的嬴乐安
725,李沁越演越好了，人物的眼神、角色的设定等都很巧妙,Talkaholic_L
726,男主台词与演技发挥很不错，导演和编剧还是非常用心的,PolarisbaiA
727,无论是哪个角色，李沁都能够完美地驾驭，内容满满，节奏快,🌙沐呈悦
728,上一版平凡的世界拍的太好了👍对这一版来说是个挑战，期待[应援],爱看言情电影的影
729,这个电视剧很好看，很真实，一口气把更新的看完了，很少看这种类型的电视，主要还是男女主都是我喜欢的[狗头],零落异成花
730,看这个片子，想起了我当年高考的日子，我没考好，只上了武汉理工大学，实际能上哈工大！,老飞天王
731,用平常心去看这部戏 ，你会发现 越看越有味道 ，有感动！有怀旧！还有励志！还有现实！,爱吃烤鱼的高堂琴音
732,很好看的一部电视剧,心向岩
733,年代剧真好。不过黄亚萍与年代有点格格不入,蕾-秋
734,前面开头陈晓骑电车太夸张了，那个年代那么穷那有人会这样骑自行车,妤桐爸爸
