,0,1
735,英语最高专8，10级是哪个系列,心怡心恋
736,看到后面在县长面前表现的样子，其实也铺垫了马股长这个人就是个喜欢装模作样、搞表面功夫的人，演的挺好的,麥ラ嘜
737,就这刚开始一段戏，已经不想看了，距离平凡的世界差太远,笑语欢声☺
738,值得耐看的电视剧，很受启发，不错不错[大拇指][大拇指][大拇指],rb格桑花开
739,李沁这几年咋啦，发生啥事了，怎么演的都这么不自然，用力太过猛,雪中漫步love
740,为了剧情年代地区需要，他们每个人的肤色估计几乎都抹了小麦色深色的粉底液。上次看李沁是请君，演技肯定好。,艾格尼李享瘦瘦
741,一部发生在二十一世纪二十年代的二十世纪八十年代故事,风中的AQY
742,人生之路真的很好看[应援][应援][应援],朦胧的lucky😝☁
743,只有三大爷说的陕西话正宗，其他都不知道说的啥话,我咧哇刚大木哒
744,乡村那个年代，这么好的拖拉机，什么家庭,xiang 6077
745,陈晓，男女主都很喜欢😍[拍手][拍手][拍手],爱吃西餐de东宫柔雅
746,原著里那个年代山区都是土路，那有柏油路,A人生之旅
747,剧名没有原版《人生》符合小说，也没内涵,A人生之旅
748,喜欢我沁，大吉大利，[色],依琳姐姐你好
749,男女主实力派，选的好[应援],芳霏随心❤
750,不管别人怎么说 特别的好看,Vincentttt1
751,那个年代确实有机会啊，多读读历史[捂脸笑],D哒滴
752,八四年没有重点学校，上高中的学校都在镇或县城。,喜欢吃豆包de独孤飞语
753,李沁演技绝对的好，就是有时候用力过猛。,余佳缦 LED灯
754,只是取材于《人生》的一部分？,138****8862_m2605
755,因为看了这个剧，然后报了考研- -,harryyyyyyyyyyyyy
756,好看吗？不好看就直接弃坑了,不要不要的好吗
757,开头把原著改了，已经没有想象的空间了,春qqqqqq
758,小四轮太先进了，不是那年代的,爱涮火锅の公孟俊明
759,70末拖拉机少但是有，我舅舅就有,碧云天淇
760,一看背景又是黄土高坡就马上弃剧，,vost119
761,张克南才是最土的一个,사랑해요宝贝
762,都是托，特么才看了5分钟，觉得这剧真好太假了,隔壁王叔叔
763,宁愿骗你说我要睡觉了 也不愿告诉你我有多伤心,酸菜可乐ɞ
764,不合理 只有认真学习 不可能这成绩,旺旺123⊙∀⊙！
765,他只不过用他无聊的时间陪你，结果你就沦陷了,酸菜可乐ɞ
766,为了不毁掉我心中的经典，不看也罢！,月色清寒.畦
767,只是披了个《人生》的外壳罢了,Ye1111110
768,讨厌这种不主动找他，他就不会找我的关系,酸菜可乐ɞ
769,为啥主演都用普通话，不协调,心晴心晴心晴123123
770,讲真的 喜欢了他那么久 差点以为他是我的了,酸菜可乐ɞ
771,陈晓和李沁的肤色画的太不真实了。,超爱吃牛排的士孙晨风
772,都穿太干净整齐了 差点儿味儿,啥屁昵称
773,太喜欢路遥了，很期待影视化，特地赶过来了,缘定翠山
774,有没有让我哭的电视剧，比如～人世间,ヾ宿命い
775,学校都不知道谁考上了吗？,ylcasino
776,农村人的爱意应该是含蓄的，委婉的,就你二大爷
777,原本沉重的一部剧硬拍成了现在炫酷剧,就你二大爷
778,承诺再好又有什么用 想走的人从不缺理由,酸菜可乐ɞ
779,男主没兄妹？那年代最少兄妹都三五个，尤其农村,消逝的青春_wx1149
780,实在看不下去老扮嫩。告辞。,133****0485_m1370
781,陈晓一把年纪还演高考生,S、nn
782,道具组有点不用心感觉,zky921590087
783,道具太新，不符合80年代的实际。,H0LD住
784,那个年代有自行车，拖拉机的都是富人,and辉辉
785,李光复老师用的配音，这剧挺讲究啊,Daniel.Xiao
786,那以往的同窗生活，是一串糖葫芦，那迷人的甜和酸，将永远回味不完。,ほ頾骺䙸€肄嘧ほ
787,很棒的电视剧，好看，演员演的也好，场景也很真实,中庸herry
788,《人生之路》的硬伤就是男一号，怎么选的？,我也是很想知道🎐
789,我是先看了原著的书，再看了84年版的电影，再来看这个，但…完全没法比。,DuoDuo就是DD
790,这部剧的装造我是不敢恭维，但是超级喜欢陈晓，追追看，希望剧情不拉胯,追剧小箱子
791,支持支持支持,宁燕娜
792,这电视剧拍的太毁原著了，看看平凡的世界吧,口天楠0423
793,这剧情一点也不贴近实际，不是素颜化个丑妆就演得好,139****4630_m1931
794,高加林，渣男,無關痛癢
795,听说高加林是渣男，[捂脸笑],追剧老仙女下凡
796,这么多夸李沁的，真奇怪。,浅浅喜，静静爱， 淡淡释怀
797,不是为了那个演员而来，而是好看才来,周宝宝宝👍
798,真的太好看了   好喜欢高加林,明目✌
799,感觉陈晓好忙啊，电视剧一大推,追求_qq1069
