,0,1
319,我天，一次性更完，别看还没看，我太爱了[应援][应援],拥抱lucky的月亮
320,我眼花了么，怎么看到电灯了,暖光黎明
321,必须得夸一下这个更新速度[色][色],小鱼永远快乐
322,看到封面好尴尬进来的，尬死了[撇嘴],曲奇：
323,就喜欢这种一更更全集的这种[色][色][色],ゆ、 红颊 Entice。_qq1307
324,这个床头灯，这个绒拖鞋。我也是醉了！,匿名用户
325,爱奇艺怎么了  太强了剧情全集放送大爱,😁大圣哦哦哦
326,太好看了，就喜欢这种一次性更新完的[色][色][应援][应援][呲牙][呲牙],蜜橘.瑶
327,哈哈哈 就喜欢这种开心的剧,顾氏姑娘
328,李成蹊武力值好高，帅哥打架都这么好看,l葫芦l
329,公子贵姓，看了就停不下来了,连子芯
330,编剧有点东西，坐等公子贵姓更新！,若遇浅香啦啦
331,我只想说，每个细节都处理得到,刷我滴卡哇可以
332,把持不住的喜欢，剧情跳脱有趣。,明日之后驻守
333,看着很好笑的样子，公子贵姓这部剧很耐看,小美妞89
334,今年年底最佳解压电子榨菜 没有之一,语嫣红
335,无厘头中带着甜宠，谁会不喜欢呢？,少爷的梦🤗
336,现在都流行女主活泼，男主高冷，倒追的电视剧吗？,昧光★
337,感觉这剧组蛮用心的 人设饱满演技在线,陈得才
338,沙雕又搞笑，这编剧有点东西,重遇ni
339,爱死了，笑点满满，干搜到了剧组的用心,甘心子晴
340,真是一秒都不敢错过，笑点好密集,就这样爱着你🍡
341,公子贵姓，任何人不看我都会伤心的ok？,叶子被风的爱
342,强推！！公子贵姓宝藏剧认证，很好看的。,hin小楼又东风🔥🌻
343,女霸王gai溜子的人设我的真的很喜欢,海参在哪里
344,剧情沙雕有趣，人设饱满可爱，好看,超级无敌小熊熊☀
345,哈哈，的确如此！！亲测这剧可追,凹凸不凹凸💞
346,狠狠为公子贵姓的剧情点赞了，笑到停不下来,思雨妹妹🍀
347,完全看不够，是谁说只看一集的？,一样的漂亮🧀
348,沙雕剧都来看看，这才是喜剧改有的样子,gao·健
349,片头音乐都很有趣，这部剧是我喜欢的,abc梦幻
350,突然high了，主题曲很好听的,悦悦w🧁
351,似乎很不错啊，环环相扣剧情我喜欢,剩夏光年一
352,哈哈，精彩呀！！！公子贵姓里面的主题曲好好听,爱玩台球の南荣骞骞
353,高明啊，这部剧各方面细节满分,玲玲好开心🥝
354,对称轴强迫症掌门李成蹊有点可爱,移动城堡👏
355,别说，公子贵姓还挺有质感,晓雨哈哈💦
356,还很不错哎，我很喜欢剧情,嘉 命 难 违
357,别管我们小红了，他的眼里只有美食,裙摆有点长
358,这种搞笑有解压的剧多来点吧 喜欢,乖得不能再乖了
359,看剧就是为了快乐，这部剧非常达标,噢哟咯👧☀
360,禁欲又有强迫症的男主有点意思,泉水叮咚💝😗
361,这部剧含泪痣含量好高，很有特点,曼曼在家
362,不止主演人设有趣，配角也好有戏,匿名用户
363,火！瞬间爆满，公子贵姓让人越看越爱,裙摆有点长
364,细节搞笑中带甜，甜中又带点沙雕,幸福美甜
365,唐氏寻找命定之人人气撑到爆棚。,一切都是美好的啦啦
366,沙雕甜虐喜剧，已经在看了,一起起🍀
367,女霸王当街抢男人，这剧情就很带感,春风吹走十里雪
368,感受到大家的喜欢了，同道中人,小小高小小💯
369,深夜emo？打开公子贵姓马上不emo了,白白的爱
370,命定之人送上门，少主表示很开心,甜儿甜儿🧀
371,我觉得成不成超有cp感，身高差就很萌,美少女的谎言🍡
372,看第一眼好喜欢 越看越喜欢 这剧有点东西,熏破马蹄
373,作为一名资深的腐族，剧情精彩满级,妖精眼中的我
374,开心快乐比啥都强，细节处理的很好,白开水好好闻
375,这就真的好快乐，没看的千万别错过,陌城白夜
376,第一次知道，沙雕轻喜剧原本这么快乐,没有？！☺
377,已经在期待成不成的吻戏了 看预告很甜,珊珊来迟Y🍁
378,我就喜欢唐不言gai溜子这个设定，就很可爱,2003055037
379,给唐氏寻找命定之人解决家族困境手动点赞。,哇哦~哦🌟
380,寻找命定之人爆笑之旅招人稀罕。,湖边一棵柳
381,关注唐氏寻找命定之人了哈。,小吖，，✌
382,两个人黑暗中交流这一段真的很有喜感,你不李我
383,李成蹊云盖雪也在找唐门，这不巧了,爱是需相互
384,人气飙升呀，主题曲我要反复听,等不等到心好累
385,姐妹们，公子贵姓看起来,🌹   @过去式
386,唐不言追逐泪痣男引人侧目。,星光游乐园LOVE
387,呵呵，太搞了吧！想要一追到底,素锦v流年
388,太有意思了奥！！！这么剧值得去追,苗乡娇莲
389,大批网友支持唐氏寻找命定之人。,小可爱的花花香
390,都来哈，我瞄了几眼就爱上了,chuangwei888
391,看片头就感觉不简单，现在已经出不去了,毅力扬
392,呦!这部剧主题曲也太棒了,弯弯的月牙儿🍀
393,第一次看沙雕戏剧，格局打开,美美的富婆
394,精灵古怪的唐不言深得我心。,有才华的板鼓
395,突然High了，主题曲很好听的,桂丫头
396,周围人对口嫌体正直清冷少主赞叹不已。,旧时明月旧时光
397,有个性，我喜欢....追剧公子贵姓真的太爽了,开心快乐手🐾
398,不仅主线剧情带感，动画也超可爱,金桔柠檬茶℃
399,古装“砂糖”喜剧《公子贵姓》戳中心窝，剧情很不错。,柳荫花下
400,室友们最近都在追公子贵姓,燕子_qqbhp37
401,实在的太好看了，一口气炫八集,哗啦啦  
402,女霸王没落稳，当街劈叉，喜剧效果拉满,小雅诗姐姐
403,李成蹊要不从了吧，唐不言也挺可爱的,泽养一身伤
404,已经陷入成不成cp了，他们必须成,军少爱你哦
405,好喜欢唐不言，gai溜子气质狠狠拿捏。,畅牛牛🎁
406,笑吧笑吧，我被公子贵姓惊喜到,萌哥688
407,两个人蒙面无障碍交流，完全不在一个频道哈哈哈,小呆鱼。✨
408,这部剧cp可乱炖，哥哥太爱我了怎么办。,无敌美少女小梅
409,跳脱的故事情节让人好感递增,幻化之翼
410,不要被女主看似酷炫的出场欺骗,开心yyW
411,唐不言和李成蹊上演暧昧搞笑让人好感递增。,梦想还未实现123
412,真彪悍，公子贵姓太好看了,阿俏🏖
413,绝杀啊，剧组是良心制作,Luckyjjl芳芳
414,唐不言这段跑酷，狠狠的帅到我了,小叶子美美妞
415,李辰蹊不仅禁欲还有点强迫症，必须对称,温暖夏🍓
416,蒙恩挺适合这种禁欲系忠犬,春天好。🍧
417,矮油嘿，这个有创意，公子贵姓真的是良心剧,无敌小可爱@😘
418,好喜欢鬼灵精怪唐不言,阳光明媚a💦
419,可以啊，无意间打开公子贵姓就爱上了,ღ᭄_萱轩ル
420,云盖雪那是个大魔头，就是个“哥管严”,夜下月光
421,女主看似街头女霸王，其实武功一般般,妞丶好安静
422,看了还想看，第一次追剧停不下来,龙女yy
423,还想要多看一些，希望能够赶紧更新呀,p少女
424,这才是沙雕轻喜剧该有的样子,一三一生🌟
425,感觉剧情很精彩，很期待后面的故事,小马儿跑的快🧀
426,无厘头神操作很好很强大。,chen 依依
427,唐不言被李成蹊倒挂在树上hhh真的又社死又好笑,長靈……
428,我只想~~~哈哈哈~~~不是我一个人觉得公子贵姓画面舒适,海边孤星💖
429,强推！女霸王当街验身泪痣男，剧情超刺激,静雅梅
430,我一个笑点贼高的人，看公子贵姓笑到停不下来,kongfugang💞
431,佩服佩服，扶我起来继续追剧,就個標點👱
432,已经安利朋友在追了，好剧要和朋友一起共享！,开始懂了明天
433,快乐源泉！！追剧就是开心,***锦艳
434,已经停不下来了了，这部剧真的很不错,冰冰love随缘
435,笑点过于密集根本停不下来,D5生产-郑平红
436,看了很喜欢呢，支持一下，公子贵姓真的太好看了一点,爱奇艺蕙蕙3073
437,共享，乐一下！现在天天心心念念盼更新,买她说啥🌸
438,"这种好剧,就是要一口气追剧到天亮",唯爱美食
439,喜欢的童鞋来举个手！良心剧组,嘉 命 难 违
440,女霸王当街抢人回去当压寨夫人，我喜欢,兰兰的天空呢
441,唐不言追泪痣男太带感了。,甘心子晴
442,考研休息区，公子贵姓勾起了我好奇心,橘味的藕
443,笑到停不下来，做到了真实的搞笑,勤恳的随缘🎉💯
444,气不过的唐不言要报复李成蹊和云盖雪二人,北雁心雨3
445,我要稀罕死了！公子贵姓全员演技在线,乖得不能再乖了
446,每天的快乐！一起来追剧,天青色等烟雨恋
447,这剧没有一个重复的笑点，非常有想法,海参在哪里
448,唐不言验身不成被李成蹊倒挂在树上笑死我了。,他是她🐾
449,金美辰演的唐门少主唐不言古灵精怪，还是个lsp,紫罗芳心
450,不错哎，这部剧格局很大气,云开的时候
451,今年冬天的快乐就是它了，真的很上头。,阿炳嘉
452,公子贵姓满满细节，笑点超密,abc梦幻
453,唐不言因为强制验了很多人因此臭名远扬,紫子姿🌟
454,举双手支持唐不言在蜀地抓泪痣男验身。,少爷的梦🤗
455,唐不言要验身李成蹊和云盖雪这叫一个赞啊。,我真的漂亮💞
456,女主唐不言炫技酷跑出场，帅到了。,万里晴空🌼
457,唐氏因血脉问题，族人皆活不过25岁，这也太惨了。,ⓧⓘⓐⓞ튠ⓙⓘⓝⓖ
458,光看开头就感觉很好玩。,我的宝贝微微
459,剧情很解压，我越看越上头。,刷我滴卡哇可以
460,爽大发了，爱奇艺就是帅,睡莲莫奈
461,喜欢看这种 不啰嗦，搞笑[应援],唉你不变心
462,就喜欢这样一下就 更新完的小甜剧🌸,meng坠落
463,太棒了，一次性看完[色]支持小金的新剧[应援][应援][应援][应援][应援],噗噗大人🍗
464,太爽了吧一次性更新完,Moonlight   Z
465,剧情紧凑、轻松诙谐，男主、女主的表演自然，颜值耐看。期待男主、女主的更多作品！[大拇指],psxfxxm
466,看了前半集，差点把我尴尬癌看翻了，古代的屋子，现代的床，关键是还有电灯，无语了,梦想成真的希望
467,泪痣呀……李宏毅貌美如花,鬼堂棗
468,这床可以，有情调的那种,喜欢爬山de公广智阳
469,超级糖啊,匿名用户
470,那时代有现代台灯？,匿名用户
471,这是现代剧还是古代剧,2263019632
472,有点雷到我,，，无敌是多么，🍓
473,好讨厌这个喷东西的桥段，完全是故意的,人生若只如初见^_^愿初心不改
474,这剧60年后能看吗,酸木瓜蘸小米辣
475,这俩人是被屁喯了？🌚,是洛洛子呀.
476,有没有同类型的剧推荐啊[色],云眠ZZ
477,喜欢古装小甜剧，有没有推荐哇,Rêverie-
478,有没有类似的古装剧推荐好好看啊[色][色],zhenli🍑
479,《公子贵姓》，名字吸引过来的,＃&*＃￥$${{&*}
480,男主长得像张耀,前晨似景
481,我擦，台灯，就算是网剧能不能也削削认真点,着迷💕呀
482,一次性看完，那也熬了好几夜呀，不过真的是好看呀,红星大闪
483,这剧好看不？,家有儿女Gabriel
484,要不要这么好看[色]！快点更新,杨子nn💫
485,金沫汐好几个小动作！我都觉得还挺好的，细腻之处足见导演和演员的用心,十秒萌定你23_
486,蒙恩演愣子演的真挺好。 这部剧怎么这么可爱啊，剧情和恋爱并行,帅且酷
487,金沫汐不仅身材好而且还这么有气质，场景真实高度还原,洛丽塔_233
488,整体剧的质感和演员表现都很好，讲真，这部可以,嘟嘟熊we
489,感情线和男女主人公的塑造实在是太太太成功了， 天啊，也太甜了吧,少年手里挥舞着年华
490,这部剧太符合金沫汐的气质了呢，好久没看到这么甜的cp了,少年还不懂梦与实
491,节奏紧凑没有一点拖沓，那种羞涩的初恋感觉很对,天要逆吾_
492,部分剧情映照现实值得人们反思，开播就觉得很上头了,心跳造反_
493,金沫汐电视剧很好，期待下一期，偶尔带点趣味感的镜头调节节奏,羞恥出沒_
494,蒙恩作为演员的魅力要溢出屏幕了，细致的人物刻画,想吃月亮了_
495,这部剧太符合金沫汐的气质了呢，电视剧还是挺好看的,梅干菜煮汤_
496,金沫汐太鲨我了，怎么会这么御，特别期待后面的剧情,oser的生活方式
497,金沫汐真是因为颜值被低估了电视剧的演员，破镜重圆的梗多久都不会腻,我可乖了_
498,非常欣赏蒙恩对唐不言的演绎，姐妹们一起追剧啊,丢了魂吗333
499,蒙恩的电视剧在线，特别眼神，我也有恋爱的冲动了,你抱我一下_3
500,人物刻画一点也不娇气，太喜欢看这样甜甜的剧了,简译的
501,百看不腻，男女主感情发展速度也很快，请保持这个进度，太上头了，看的我好紧张啊这个剧情,用户@3b0429c5
502,金沫汐简直是人间蛊物辣死了，女主不傻白甜，男主也有勇有谋,懊恼王子_w_
503,金沫汐很美啊，喜欢喜欢，这也太甜了吧，赶紧来追一下子,动漫迷i_小说控i
504,蒙恩从偶像转变成演员了。有些慢镜头的拍摄我很喜欢，看的还挺上头的,小野寺律_高野政宗
505,选角很不错，剧中美术、服化道、摄影、视效方面也挺好,喂 请还我棒棒糖vv
506,恰到好处的纠葛观剧感一流，这部剧可真的是太圈粉了啊,我对时光很过敏vv
507,男主又帅演技又好，作为原著粉对于剧情按照走还是很满意的,坠入二次元的海e
508,感情线和男女主人公的塑造实在是太太太成功了，段水流的一些金句,笨小孩的幸福饼e
509,道化服十分在线，剧中人物以及剧情走向都是很好的,没眉毛红发的冷酷小男孩
510,好多实力派，我已经大概能够想象到后面的剧情发展能够有多甜了,卖萌嘟嘴萌妹纸_e
511,编剧很会写恋爱剧情嘛，拍摄手法很符合年轻人的口味,连起WIfI聊死你e
512,感情线和男女主人公的塑造实在是太太太成功了，太解压了,嘚瑟的小孩cvd
513,唐不言这个人物原著描写得非常饱满，物理诠释半糖是蜜糖半是伤,请叫我小祸害e
514,蒙恩电视剧进步不少，这几年很少看到他的消息，原来是在磨炼电视剧啊，一些高远景镜头也很大气,此昵称就如此好吧
515,哈哈果然人类的本质还是喜欢无脑爽剧啊，演员跟角色也太贴合了,Yes_my lord
516,蒙恩性格真招人喜欢，看的我好紧张啊这个剧情,栎森其
517,布景什么的也还可以，作为原著粉开播就立马看了,此昵称不存在21
518,原声设定也深得我心，这两个人是怎么做到又甜又好笑的,墨城烟柳うc
519,这部剧太符合金沫汐的气质了呢，继续散发魅力吧,宝宝找盆友
520,蒙恩眼神里还能闪耀着初入职场立志大干一场的兴奋，真了不起，物理诠释半糖是蜜糖半是伤,祭岛黎梦
521,蒙恩电视剧不错，从一开始关注他，满脸姨母笑停不下来,爵介迹
522,金沫汐的戏有明显的爆发 有点期待下一部，姐妹们一起追剧啊,执笔写浮生32e
523,蒙恩真的演什么都能打动人，女主不傻白甜，男主也有勇有谋,听风灵羽
524,麻了麻了，好爱金沫汐，谁会不喜欢姐姐呢，男女主角让人特别想磕,乖ヽ娶定你啦
525,蒙恩电视剧台词都有很大提升，能量补充时间到！,卡尔27连击
526,金沫汐的电视剧也有了很大的进步，太好看了，恋爱丝毫不拖沓剧情,科比永远在心中2020
527,你可以永远相信金沫汐的穿搭，画面让人很舒服,一别汲汲年
528,金沫汐脱胎换骨的表演都让影片的完成度极高，故事情节令人感动,伍晚晴w2
529,蒙恩的电视剧明显变好了挺多的，本年度最搞笑的一部电视剧了,捂热这段关系
530,蒙恩的电视剧确实蛮让我惊喜的，剧情跌宕起伏真好看啊,狮吻鹿
531,太甜了我的嘴角已经笑到达太阳穴了，男主女互动的片段真的又好笑又甜,空空姬w2
532,蒙恩太有观众缘了，空境和氛围感还把握得挺好的,你是我的大白兔_23
533,蒙恩太可爱啦，恋爱进度条直接拉满的节奏真的有点看爽了,叮当猫_恋猪
534,麻了麻了，好爱金沫汐，谁会不喜欢姐姐呢，这个电视剧也太甜了吧,少年如你
535,俩人颜值都挺高啊，偶尔带点趣味感的镜头调节节奏,井里的呆萌少年
536,感情线和男女主人公的塑造实在是太太太成功了，空境和氛围感还把握得挺好的,十秒萌定你23_
537,演员阵容强大都是妥妥的演技派，物理诠释半糖是蜜糖半是伤,最萌罪名_
538,金沫汐还有上升空间，但努力肉眼可见，可以再甜一点,走失的可爱妹纸6号
539,剧的三观也挺好，节奏也好，剧版大多数原著剧情都有保留,斩魂庭师2w
540,淡淡的渐进式的恋爱很让人上头，那种羞涩的初恋感觉很对,每逢夜晚倍想念
541,唐不言这个人物原著描写得非常饱满，都很温馨美好,洛丽塔_233
542,金沫汐的电视剧也有了很大的进步，太好看了，太让人圈粉了,希羽岚梦_
543,插曲真好听啊，不管从演员阵容还是剧情走向都很有看点,我在你的怀里吃炸鸡
544,每个重要的点都演的很细节，恋爱的气息会穿过屏幕扑面而来,打小我就淘w3w
545,金沫汐不仅身材好而且还这么有气质，少见的好剧情的恋爱剧,风璃殇_
546,蒙恩气质就是清冷禁欲，拍摄手法很符合年轻人的口味,偶长得帅也有错吗？
547,部分剧情映照现实值得人们反思，把角色演绎得很精彩,说你爱偶_
548,一定要去看啊姐妹们这剧情好多我们想象不到，调情油归油，但那是奶油,把村长装到篮子里去w3
549,金沫汐的偶像光环找到了最好的表达方式，太受欢迎了吧,幼姬_
550,金沫汐真的美，蒙恩有那股子灵劲，感谢拯救了我的剧荒！,幽幻紫银233
551,真的是近些年很棒的电视剧。，空境和氛围感还把握得挺好的,叼个奶嘴闯天下32
552,狠狠的被这剧里金沫汐的服化美到了，淡的渐进式的恋爱很让人上头,那时年少懵懂无知
553,我万万没想到田曦薇带给了我们很多的惊喜，还原度很高,孤城深巷少年梦
554,感觉是双向奔赴，这个剧完全满足了我小时候的幻想的呀,嘟嘟熊we
555,这部剧很精彩，甜宠我最爱了，这也太甜了吧，赶紧来追一下子,萌得挡不住_
556,金沫汐的长发造型和角色真的好搭，CP成功的立起来了,心如海深藏少年
557,一直就很喜欢金沫汐，好期待新的作品，好笑挺下饭的,少年手里挥舞着年华
558,蒙恩老师电视剧也到位了，全员原声好评，插曲真好听啊,我已萌出天际33
559,从主演到小配角演技都很不错，好久没看到这么甜的cp了,巴拉拉能量作业消失_232
560,女主的颜值太养眼了吧，这小心翼翼的试探真的磕死我了,_萌呆有点小腹黑233
561,金沫汐的电视剧好得令人放心和刮目相看了，演员演技在线,枸杞红枣水_
562,你可以永远相信金沫汐的穿搭，剧情看人好紧张,少年还不懂梦与实
563,哈哈哈剧情有意思，弹幕也有意思，破镜重圆的梗多久都不会腻,羞恥出沒_
564,整体剧的质感和演员表现都很好，哪个男人不喜欢呢,蘑菇不是花_
565,搞笑又甜宠，看的我上头，整部剧制作得也好用心,月亮奶油面包_
566,蒙恩这次的表演也还挺细腻的，把人物在面对正义与现实的纠结演的很好，舍不得快进,oser的生活方式
567,细腻之处足见导演和演员的用心，这部剧太上头了,我在点火_
568,太有cp感了，没有为了衬托男主弱化女主，看得我嘴角上扬,丢了魂吗333
569,狠狠的被这剧里金沫汐的服化美到了，这两部剧简直了太完美了,大白白32
570,蒙恩的肉体和电视剧都属于巅峰，安心磕糖不用担心被虐,问题先生6r
571,场景造型什么的都能感觉到用心，细节上没有瑕疵,寂寞先生32
572,这么给力，上全集喔[应援],Smile～～～～✨
573,你别说嘿 这男主男二一出来还真感觉这cp和女主没什么关系 他俩一黑一白 还死木头的[狗头],诸葛嗒嗒抡铁锤
574,你说这少主没功夫吧 她下来之后摔了个一字马 你说她有点子功夫在身上的吧 她摔了个一字马[捂脸笑],诸葛嗒嗒抡铁锤
575,这种剧真的又土又上头，而且全集更新简直是本土狗福音哈哈哈,飘到了彼岸去
576,剧情好看吗,颖火虫 1314
577,隔壁对《我而言危险的他》《狂飙》《卿卿日常》……来的，强烈推荐大家去看，绝对好看,宁二姑娘♡﻿
578,这剧好看吗[疑问],匿名用户
579,这剧好看吗,匿名用户
580,就喜欢这种一次完结的剧，好不好看是其次，一次性完结反手就是一个赞[大拇指],虞闪闪☘️
581,哈哈哈！！我可真是太喜欢爱奇艺啦～又一部全集放送！！[色][色]太爽了！！,比个啵最赞💚哟
582,这俩男的有事🌚？,是洛洛子呀.
583,这命差的和美国貂似的，到年龄找不到对象就得嗝屁，呵呵哈哈哈啊哈哈,喜欢吃海鲜の壤驷问玉
584,搞笑剧无疑了,待花开🍀
585,心动的信号,Try One＇s Best
586,这剧好看[色],可爱可爱可爱的可爱的小可爱
587,现代的席梦思床[捂脸笑][捂脸笑][捂脸笑],清醒梦境
588,看着他喷糖粉真的很难受,扑空了温柔.♡
589,又甜又土真的很上头,青尔er
590,女主，但有点搞笑啊[呲牙],2276336279
591,古代有台灯,爱吹笛子的纳兰布欣
592,喜剧吧笑死我了,ᝰꫛꫀꪝ听众
593,太小儿戏了[捂脸笑],匿名用户
594,全程又甜又有趣哈哈哈,匿名用户
595,"居然有四件套，牛逼哦

",匿名用户
596,笑死我了,qqckxl1
597,里面怎么还有沙发[大拇指],匿名用户
598,好看吗？好看吗？,我是追剧党
599,第521条评论，就给我了,匿名用户
600,用积分也能兑换会员,紫色的玫瑰D
601,喜欢上架就全集的[应援][应援],涩落🏖
602,下饭小甜剧我喜欢[呲牙][呲牙],匿名用户
603,虽然但是 就很上头[捂脸笑][捂脸笑],匿名用户
604,那个年代有电灯？？？？？晕,十分之一（思）
605,这个主题曲好好听[色],娱乐大泡
606,不喜欢男主,勿扰😙️😙️😙️😙️😙️
607,别说，挺上头啊,匿名用户
608,更全集的剧太爽了,匿名用户
609,非常非常期待,匿名用户
610,追起来超级好看,匿名用户
611,哇哇哇全集太爽了吧[666][色][色],匿名用户
612,好看好看好看[应援][应援][应援],匿名用户
613,哇哇哇！好喜欢小甜剧啊,千钟栗子
614,有点意思,希望之星_qq1613
615,做梦素材🈶️ [色][色][色],匿名用户
616,这么烂的剧,匿名用户
617,一次更新了太可以了,小女枪飘
618,抖音路过,Aza的酷萨（皇家毛线）
619,全集[色][色][色][色][色][色]爱了,帅到掉渣🌈
620,厉害了，全集，爱辽爱辽,匿名用户
621,真好看啊真好看,匿名用户
622,卧槽  直接更了全集呀[色][色],魚餅ᵇ²
623,年底解压神剧，强推,小汤圆直美丽
624,宝藏喜剧，笑点超密集,匿名用户
625,全员有梗，笑点一个接一个,伤心落叶🌻
626,我懂得，求加更想看,萝卜萝卜你好啊
627,沙雕甜宠故事够有趣。,chen 茉一😘
628,哥哥狠狠拿捏弟弟,明日之后驻守
629,桃李不言，下自成蹊[悠闲],山月与风尘
630,全员喜剧人，超会玩,♡.小柳
631,前排呼呼[爱心],匿名用户
632,来看小金啦[色][色],士多啤梨熊🐻
633,一下全更新完,饭團~
634,绝对，一次性更完的,XZ🤓666
635,可以一次性看完666,匿名用户
636,一次更全集，太棒了,匿名用户
637,大结局有没有在一起,小小😃James🎁763
638,喜欢一次性更新完的[色],༄༊࿆瑶瑶崽ོྂཾ࿆࿐
639,看电视剧先看女主,听晚风的过往🍄
640,楚楚 宝玲也在啊,鞠保汐 （蜜橘）
641,一次性更完，太好了,鞠保汐 （蜜橘）
642,男主是侠探简不知里面的男主，那部也很好看,匿名用户
643,哈哈有床头灯，还是现代的大圆床,爱吃螃蟹的颛孙小瑜
644,生活每天都苦哈哈，看点小甜剧安慰安慰自己[捂脸笑],我是东山啊😉🌙Mia
645,剧组已经穷成这个样子吗？那个床是咋回事儿啊？,匿名用户
646,这个剧，就是现代和古代柔和的剧，诶无语啊[捂脸笑][捂脸笑][捂脸笑],迷雾围城市里
647,连床头上放的台灯很时髦啊,迷雾围城市里
648,看剧照古装片，看开头那灯那床我疑惑了，在转古装片啊[捂脸笑][捂脸笑][捂脸笑][捂脸笑],柠檬精妹子
649,这是简不知那个男演员[色][大拇指],清浅1119
650,这剧是古装剧，怎么屋内装饰都好现代爱[捂脸笑],善良随缘就好
651,俺没眼花吧，既然穿着毛拖?[捂脸笑],养了一只老倩
652,帅哥美女呢，还是翻翻以前的老片，看看帅哥美女洗洗眼睛去,空月123456
653,新的一周开始了，金美辰早,强哥197309🧀
654,激管铧铁[应援][捂脸笑][大拇指][666],评知颖纹饿
655,竟然有电灯，太不走心了,zhang洁521
656,期待现在的小弟弟小妹妹多出新品就好,惜缘天使2019
657,古代还可以穿拖鞋[呲牙][呲牙],🌞爱上月亮🌙✨
