,0,1
658,追完狂飙，都剧荒了，不知道看啥剧了，不知道这部咋样[捂脸笑],家有儿女Gabriel
659,大圆床 还有床头灯真是无敌呀 古装现代剧,匿名用户
660,多拍戏吧，真的演的自然有亲和力,强哥197309🧀
661,我喜欢看蓝歌的造型，那蓝色的翅膀，很特别的,小美妞89
662,为什么不能下载,༺凉⃠兮⃠༻
663,古代拿走什么台灯穿帮了不好看,匿名用户
664,怎么感觉刚开始有点请君的味道,黄和81
665,和传闻中的陈芊芊差不多的套路[微笑][微笑][微笑][微笑][微笑][微笑],匿名用户
666,刚看完保护车主大人，一样的演员啊[捂脸笑][捂脸笑][捂脸笑],匿名用户
667,挺好的剧啊，热度咋那么低,匿名用户
668,这个床上用品是认真的么[捂脸笑],匿名用户
669,满满的现代风，（四件套，拖鞋[捂脸笑]）,G🇨🇳🇨🇳
670,金美辰符合我的审美，太好看了,冰冰124576
671,看完大结局，男主很帅演技不错，真的，哭绝一流[捂脸笑][捂脸笑][捂脸笑],圣诞树开心🎄
672,wc把我吓一跳，直接跳出来第10秒女主的脸把我吓着了[捂脸笑],向日葵女孩ay
673,真的挺搞笑的，金美辰喜剧演的不错,强哥197309🧀
674,金美辰演的挺好的，多拍戏吧,强哥197309🧀
675,它里面的场景跟少年歌行一样的,匿名用户
676,古代片里有台灯，太违和了,沐夏Eva
677,看封面男主缩小看了以为是张耀,前晨似景
678,台灯都有了，离手机出现也不远了,匿名用户
679,催熟乌珊让我大开眼界！！,Fei060588
680,这个剧很值得下饭，太搞笑了！[捂脸笑],喔喔小花园
681,东西都是现代的，一开始看到以为是现代片,闫月盼盼
682,"男主和我妈同名同姓哈哈哈，叫男主名字好怪啊
",讲义气的橙子熟了
683,蒙恩演的不错，又帅气，好看,我是一只蘑菇妹
684,有灯？  这不是古装剧,nsjxbcjs。
685,国子监来了个女弟子卓文远的侍从是男主,justinnaw
686,我觉得，这片头音乐好《瓦舍江湖》啊,nines Jasmine
687,发现宝藏，少年歌行的赤王！！,匿名用户
688,那个床和大门帘我以为是现代剧啊[捂脸笑],小姑娘是我🌻
689,我的剧荒的日子终于结束了 ​​，这部剧就是我的心头好,叮当猫_恋猪
690,就喜欢蒙恩这样的角色，选角很不错,不是逗比我不爱_233
691,画面滤镜都很真实，哈哈哈这部剧可好玩了,少年如你
692,蒙恩真的演的好棒！！路转粉，基本和原著一样,痴情少年_葬空城
693,剧情写的太有意思了，剧情真的好看呢,吃货自然萌i_
694,画面极美赏心悦目，人物都有血有肉,智商都来卖萌了_
695,男主的颜我磕到了，这部剧有趣极了,_放开那萌比_
696,剧情看人好紧张，虽然是恋爱但是也好真实,少年你闯进了我的心
697,追剧追剧提上日程好嘛！， 终于不用剧荒了,走失的可爱妹纸6号
698,全员演技都在线，越看越让人感到舒服,斩魂庭师2w
699,重要情节一点都没落下，要幸福哦。,君焰w
700,剧情很新鲜，全员演技都在线,伊文思_33
701,情话土归土但那是甜蜜乐土，剧情节奏很好,颜户鸢
702,金沫汐真好看，演员跟角色也太贴合了,每逢夜晚倍想念
703,道化服太真实了，这剧太可了,一生所爱赫萝v
704,拯救了我的剧荒，看得我心跳加速,恋离飞柜
705,我的少女心！，演技也很在线,上杉夏香23
706,金沫汐演得不错，场景真实高度还原,啗一荔
707,蒙恩太帅了 演的真好，基本和原著一样,打小我就淘w3w
708,拍的特别真实，空境和氛围感还把握得挺好的,李白被我炸成二百五
709,人物都有血有肉，绝了绝了，这个真的可！,说你爱偶_
710,又甜又刺激，哈哈哈这部剧可好玩了,江户川柯北233
711,细品的话是很有意境的，道化服十分在线,把村长装到篮子里去w3
712,演员都很在线，越看越上头,幽幻紫银233
713,重要情节一点都没落下，真的很棒啊,叼个奶嘴闯天下32
714,音效视效都很棒，那些年我写的人物成精了,筱残233
715,对蒙恩路转粉了，有剧情的恋爱剧少有啊,羽灵233
716,道化服十分在线，给我一直甜下去！,那时年少懵懂无知
717,服化道可以，良心制作，渐入佳境,樱语冰凌233
718,导演和编剧还是非常用心的，值得看起来,血叶洛莉兰233
719,表白台词编剧加鸡腿，阵容和主题太棒了,阳光少年范
720,节奏紧凑不错喜欢，都很温馨美好,孤城深巷少年梦
721,女主演技自然不拖沓，背景音乐恰到好处,萌得挡不住_
722,女主的颜值太养眼了吧，稍有的不无脑的恋爱剧,软萌音马尾萝莉_
723,双向奔赴yyds，编剧真的还不错,心如海深藏少年
724,金沫汐姐姐又美又飒太可了，女人真是人见人爱啊,虎了吧唧_w
725,想不感同身受都难，一些高远景镜头也很大气,可爱型号_
726,我真的非常喜欢这种甜甜的剧，好笑挺下饭的,时光゛乱了流年老了少年
727,想不感同身受都难，演员阵容太让我惊喜了,喜欢骑自行车的褚师高格
728,演技放心制作放心真心高品质好剧，画面我很喜欢,少年还分不清左岸与彼岸
729,女主的颜值太养眼了吧，好有质感的一部剧,少年゛流浪于时光
730,群像演技都十分精彩，恋爱的同时不忘励志,巴拉拉能量作业消失_232
731,认可度还是很高，强烈推荐给大家,_萌呆有点小腹黑233
732,表白台词编剧加鸡腿，演员演技很好,枸杞红枣水_
733,调情油归油但那是奶油，剧情也太甜了吧,背叛太乱
734,非常喜欢里面的剧情，还原度很高,韭菜酱果233
735,男主这个颜我真太可以了，真的好剧 追剧去了,少年还是懵懂的恋
736,哈哈哈剧情有意思，弹幕也有意思，我发誓没人能躲过这对cp,库特莉亚_
737,哈哈哈剧情有意思，弹幕也有意思，内容也不拖拉,叫主人_
738,这剧真的太好看了吧都去追啊！，惊喜之作！,推倒餐具6
739,节奏特别好演技和台词都在线，太期待剧情了,蘑菇不是花_
740,这画面这质感这演员这情节太绝了，良心剧,月亮奶油面包_
741,金沫汐大大不要再散发魅力了，太太太好看了,兔兔呢_
742,少有的不无脑的恋爱剧，越看越上头,可不可以假装爱我232
743,看的我好紧张啊这个剧情，画面很好了,大白白32
744,就喜欢这样乱拍的剧哈哈，真的很棒啊,不会骑马的王子354
745,演技放心制作放心真心高品质好剧，这部剧细节取胜,寂寞先生32
746,惊喜之作！，火速一起看起来 也太甜了吧,摘熊熊_
747,有剧情的恋爱剧少有啊，特别贴近生活，接地气,任空虚沸腾2e
748,感觉这部剧的风格挺大胆的，严谨真实,灰太狼_红太郎
749,这部剧真是直击我的少女心，服化道没得说,赫莱恩
750,蒙恩太有观众缘了，编剧的恋爱剧情写的太好了吧,桃子_你很可爱__阿狸_你很可2_
751,想不感同身受都难，真的太好笑了,青梅一朵看小兰_竹马一棵望新一
752,这部剧细节取胜，甜甜的校园剧安排起来,数学这货太傲娇e
753,蒙恩电视剧大爆发了耶，值得一看的好剧,橘真琴大天使_
754,蒙恩太帅了，追电视剧，看了6集很爽，超级还原,我v我VB啊八杯水
755,对蒙恩路转粉了，好笑挺下饭的,嫼乂波_谙舲航
756,追剧好快乐，剧中美术、服化道、摄影、视效方面也挺好,神啊_赐个妞吧e
757,画面、运镜都很舒服，剧情挺流畅的,vVB编剧
758,人物刻画很棒，认可度还是很高,感情泛濫的小孩_e
759,编剧好会写代入感的剧情，阵容和主题太棒了,全宇宙少年萌主
760,现在已经看的停不下来，开始期待后面的剧情了,暮然回首_全是基友_
761,这部剧已经完成得很好了，越看越上头,小女人小魅力e
762,故事节奏、细节处理和配乐都不错，剧情跌宕起伏,所罗门的第七十二根柱子
763,金沫汐又有演技又有美貌，开始期待后面的剧情了,不卖萌の纯笑容
764,想不感同身受都难，已经被剧情带入了,番茄炒蛋好吃吗158
765,淡淡的渐进式的恋爱很让人上头，全员演技都在线,小海豹男孩
766,已经被剧情带入了，拍的特别真实,流氓兔耍流氓e
767,女主角好漂亮，又可爱又乖的，演员选的挺好,软哞哞的稚女e
768,我也有恋爱的冲动了，编剧真的还不错,你好啊2020万岁
769,挺不错的，太受欢迎了吧,黑羊_卵
770,蒙恩挺可爱的，拍摄手法很符合年轻人的口味,我对作业唱征服_e
771,真的挺不错蒙恩电视剧非常好，太受欢迎了吧,拉克丝·库莱茵
772,给我一直甜下去！，值得一看,画个逗号给明天ve
773,演技放心制作放心真心高品质好剧，叙事风格新颖,我愿陪你一起犯二e
774,就喜欢一次更全集的剧[色][应援][应援],月亮之下💘
775,表白也太浪漫了吧，真的超级有意思,朕要回幼儿园深造e
776,最近的下饭剧看得很欢乐，太多社死现场了,妖尾是光_
777,金沫汐真的太美啦！，这部剧已经完成得很好了,加长小黄瓜
778,拯救了我的剧荒，这部剧可真的是太圈粉了啊,人心凉薄cd
779,少有的不无脑的恋爱剧，我的少女心！,相見不如懷念vd
780,恋爱丝毫不拖沓剧情，好有质感的一部剧,冰蓝阔乐
781,观剧到目前为止无槽点。，演员演技很好,心无城府aq
782,蒙恩太帅了 演的真好，细品的话是很有意境的,番茄小绿
783,人物刻画一点也不娇气，段水流的一些金句,良人末归ac
784,人物设计合理，甜甜的励志剧情太好了吧,你是我穷极一生的梦魇
785,看得很开心，特别贴近生活，接地气,买老婆去②
786,剧情真实高潮迭起啊，剧情非常清晰明了,ㄡ冇誰會吢疼涐_w
787,挺好看的小甜剧，道化服太真实了,充电五分钟_装逼两小时w
788,蒙恩演技太炸了，马上给我结婚,梦想拼不过现实_w
789,强调两性平等，三观正，值得一看的好剧,西瓜头好看
790,一个字：太好看了吧！，这部剧真的蛮不错的,四季映姬w3
791,金沫汐姐姐又美又飒太可了，CP成功的立起来了,西行寺幽优子
792,就喜欢蒙恩这样的角色，剧情带入感太强了,基劳成疾
793,可以说是尽可能还原了，这剧还挺意外的,七曜贤者w2
794,节奏紧凑没有一点拖沓，场景真实高度还原,白井_泪子w
795,节奏很紧凑画面很舒适，严谨真实,安塔利亚w2
796,蒙恩挺可爱的，编剧好会写代入感的剧情,希洛梦w
797,俩人颜值都挺高啊，姐妹们赶紧安排起来冲冲冲,拾晨雨_w
798,讲真这部可以，这部剧太上头了,水果糖eve
799,看起来很舒服，体验了大悲大喜！,不是逗比我不爱_233
