,0,1
0,期待很久了，一次性更完，加油两天追完[应援][应援],看剧嗨起来
1,长路慢慢，无剧作伴……这更新速度[666],夜夜夜夜？
2,这屁是吃了个啥呀[捂脸笑]隔着屏幕都觉得要窒息了,鱼儿亲亲⭐
3,这部剧怎么样,夜，最美🎄Christian
4,[应援][应援]有内味了噢,爱吃泡面de单于韶美
5,来看蒙恩啦,SunMoonStars
6,宝子们，有没有同类型的剧推荐啊[色],鹿儿呀ᝰ
7,看完这部戏后，我面色凝重，深深地低下头，默默的关掉电脑，起身打开冰箱，拿出一瓶伊利酸酸乳，紧紧地握在手里，细细的回忆着刚才的剧情，慢慢的走向窗前，外面的景色有些暗淡，就像我的心情一样，沉重。。。很沉重！渐渐的，外面灰蒙蒙的下起了小雨，为什么会这样？我的视线开始模糊了……不知道是我 流泪了、还是雨太大了！可能都有吧…… 我的心情更忧郁了，我再也无法抑制内心的情感！导演和编剧真的太侮辱观众智商啦！我缓缓的仰起头。。。对着窗外大喊了一声：这到底演的神马玩意啊？,不喝饮料，不熬夜
8,喜欢古装小甜剧的请举手，看看有多少人啊！,翩然入君怀
9,为啥有席梦思床和床头灯[微笑],彬彬有礼的大宝
10,这是啥剧啊，第一集就是现代床，现代灯，古装衣服[捂脸笑],懰譹
11,到底什么样的人看这种片？,爱吃banana的柴柴
12,就喜欢更全集的[666][色],至高无上的我🎡
13,"演员蒙恩,骗财骗色，欠钱不还，大家小心",演员蒙恩还钱
14,年龄大了，就喜欢看这种尺度大又搞笑的剧，轻松解压,37℃女人味🤟
15,喜欢这种上架就全集,丑妞123456
16,这就是无脑爽剧，可以放松自己,曼陀罗公子
17,好看，很久没有看到这么好看的电视了，以前不追剧的,米格子黑西装 ！
18,什么鬼，越来越不懂你们这些人的品味了。真的很好看吗？为什么我看的一头雾水，那个女少主没什么特点，武术也不高，怎么当的少主呀，这搞笑派的吧！谁来跟我讲讲这个应该怎么看呀？真的看不懂呀,梦如双
19,这是啥剧啊，第一集就是现代床，现代灯，古装衣服[捂脸笑],Sowhen .
20,这部电视情况主演是谁来着[呲牙],ಇ᭄易࿆ྃ孞易義࿐
21,我去直接全集，太棒了吧[应援],阿草恰不胖.
22,这屁是吃了个啥呀[捂脸笑]隔着屏幕都觉得要窒息了,祝好运1
23,看5集好看，等等更新完在看，追剧太感受……,流沙河神话
24,原来不止我一个人喜欢公子贵姓，大家都是有眼光的人,苗乡娇莲🎋
25,喜欢古装小甜剧的请举手[色],猫小咪～123
26,"喜欢古装小甜剧的请举手，看看有多少人啊！
一般般",流浪人_qq1225
27,女主是  机智的恋爱生活里的小狐狸李浅呀[色],luomolandiao21613
28,长路慢慢，无剧作伴……这更新速度,心所欲💪
29,这部剧怎么样啊。谁给我说说,唯一的一个我😍
30,我来听配音演员的[捂脸笑],苏酒酒℡
31,这床是认真的吗,大冬瓜皇皇
32,更新的好慢，喜欢通宵追,青黎✌
33,刚看完狂飙又发现一部完结的电视剧了[捂脸笑]我这个档期安排的好满啊[呲牙],八倍浓缩咖啡
34,喜欢古装小甜剧的请举手，看看有多少人啊！,轮回空白
35,这是借用其他剧组的场景吗？,小小鱼儿雨☔️
36,就喜欢一次性看完全集的[666][666][666][大拇指][大拇指][大拇指],我也不知道咋起名💘
37,好看抖音过来的,natur🤙
38,这台灯和现代床有点出戏[笑哭][笑哭],煜皓月
39,这部剧好小清新的感觉，男女主颜值还是挺在线的，还是轻喜剧类型，刚刷完狂飙正愁没剧看呢,是个猪咪kk🐱
40,这部剧到底怎么样？,晴日明昂
41,剧荒了，看看怎么样,Stephen888
42,好看吗？慌剧了，剧友们有推荐的好剧吗？一慌剧我就孤独[捂脸笑],sunshoul
43,这剧好看吗,开心的小鬼👻😜
44,评分在哪呢,起床困难户●^●
45,就喜欢这种一次性全更完的,段嘉许是桑稚的🕊️
46,古代有这样的床和灯？,隐藏你咋知道一样
47,画面好精美的剧，准备追啦,小熊🐻啊~！
48,公子贵姓这剧有点东西，确实又离谱又上头 让人欲罢不能,一三一生🌟
49,每天追剧的时候是最幸福的时候[色][色],爱吃菠萝168🍄
50,很好看的古代剧，我是古代剧迷！俊男美女组合，好帅的男主！,幸福的香香🏝
51,就喜欢这一口气全上的[666][666],爱电影的小咖王
52,等了好久的电视剧，冲啊！[应援][应援][应援],aaa一路向前AA🎊
53,这部剧还是很有看点的[应援],上海道店（随风）
54,年龄大了，就喜欢看这种尺度大又搞笑的剧，轻松解压,一样的漂亮🧀
55,个人觉得确实挺好看的,来日并不方长  依
56,自律且努力，别让生活太安逸,幸运的…🌟Joseph
57,这部剧的剧情还挺有意思的，感觉之后的剧情会很甜，期待后面甜甜的剧情[色]，男女主颜值演技还是蛮在线的,是个猪咪kk🐱
58,又发现一部神仙剧，超爱[爱心],言玉动漫
59,虽然我不愿意拿着八倍镜看剧，但一看到现代皮床，台灯，化妆台……分分钟出戏……,小鱼儿634
60,这剧真的好上头啊，而且一次性更完全集，可以一口气看完一部剧了，正愁没有好看的剧打发时间呢,是个猪咪kk🐱
61,古装爱情剧还是差点意思,淡然🎆Ashley🔥
62,李沫汐太好看了吧 本家,金哥5698743
63,在古代竟然还有这种灯?,夏家熔
64,旁观者的姓名永远爬不到比赛的计分板上。,ほ頾骺䙸€肄嘧ほ
65,就喜欢一次性看完全集的[666][666][666][大拇指][大拇指][大拇指],陌陌酱♥
66,这剧3岁以上的小孩能看吗,海纳百川112233321
67,太好看了  不愧是我最喜欢的古装剧,小袋子 ss
68,第一集就是现代床，现代灯，古装衣服[666][666],欣欣影
69,真的很爱这种一次性更完全集的剧，直接看完全集真的很爽！！还是我喜欢的类型古装小甜剧[色][色],是个猪咪kk🐱
70,这回怕是又要熬夜追剧了[捂脸笑],星空花🌷
71,骗财骗色，欠钱不还，大家小心,马建辉🏝
72,能一次更新完了，我要给个好评[大拇指][大拇指][大拇指][大拇指][大拇指][大拇指][大拇指]。,超人总动员1986
73,今年的新剧哎，还是古装的[色][色][色],一直精致的小猪～
74,喜欢看古装剧的可以追追哦不错,黎宝请假看电影
75,这个剧还是值看的，男女主演技颜值都在线哦[色],相信♥🍭
76,剧荒了，一定要看这个真的很好看。,你小妹吃肯德基
77,哈哈哈这个电影真逗，完全适合我这追剧的逻辑。[666],玖蓉🎀
78,唐不言有点功夫，但不多[捂脸笑]你说她武功好吧，她直接来了个大劈叉，你说她武功不好吧，她还能从房顶飞下来[捂脸笑],瞌睡家jj
79,真的很喜欢古装剧有没有推荐的这剧追完简直意难平[色],吃吃吃盛世
80,公子贵姓，我姓自由快乐哈哈,舞跃跳落
81,真的很喜欢古偶搞笑剧 前几天刷到还以为还有一段时间才会播 期待后面剧情[呲牙],jjjjjjnnnnnnnnnn
82,太喜欢这种古装剧了，爱了爱了,凯迪仕 德施曼 高端智能锁
83,真的很喜欢这部古装剧……[666][666][666][666],小瑶瑶耶！
84,这是现代剧 还是古装剧？ 女主怎么穿现代的拖鞋 睡现代的床 穿古代的衣服,justinnaw
85,这部古装剧，爱了，女主漂亮男主也很帅[大拇指][大拇指][大拇指][大拇指][大拇指],1739633
86,好搞笑的一部电视剧啊,柠檬的心薄荷的情🍦
87,我应该是第一个吧。,永爱鞠、Angelababy
88,感觉其中一个仆人有点像张杰[捂脸笑],rachelqiqij
89,这部剧变得不错，挺有看头的[大拇指],彤-彤🤩
90,是我看錯了嗎？這女的嚇醒時，那床確定是古代有的？還有在屋頂上跳來跳去那個替身也太胖了吧，太明顯。,蜕变妖娆
91,最近古装网剧比其他电视剧都好看,爱吃饼干の南荣阳华
92,各位发弹幕10块一条有吗,烂片鉴定者2
93,女主好看而且很有灵气，男主声音好苏好苏[色],匿名用户
94,有点喜欢这个剧情的故事呢，就是一次看不够呢,可能我在你心里
95,[应援][应援][色][666][666]英姿飒爽的女侠我喜欢[大拇指][大拇指],童彩飞扬
96,这种类型的网剧一般都不看，看了尴尬。但是这部公子贵姓绝对是强推啊，好看得很，主要是演员合眼缘，演技好不尬，剧情搞笑温馨,Luna🌻☀
97,很喜欢看这一类型的古装电视,喜欢吃烤面包de长孙天籁
98,推荐此剧古装剧轻松可爱剧情,亿米优选
99,就喜欢这种一次性更新完，不拖泥带水，必须给好沈[666],月瑶凡心
100,好看好看,lps…
101,哈哈哈哈哈，来追追[应援][应援][应援],景向的小兑呀
102,就喜欢这样一下可以看全集，这才是会员真正该享受的权益！,喜欢喝红酒の左丘德业
103,期待很久了，一次性更完，加油两天追完[应援][应援],cyt123…🌷
104,男主这是正宗的嘟嘟嘴吗[捂脸笑],🐷  潕业蝣泯🐷
105,禁欲系掌门遇上资深lsp，男孩子出门记得保护好自己呀,我的宝贝微微
106,太搞笑了,喜欢武术の夹谷晴霞
107,电视剧好看好看好看,爱骑马de公西燕舞
108,不是说24集的吗？,星辰😜🌙KyraGabriel
109,这部剧太好看了,倾国倾城倾赵文猛
110,可以可以,哈林1
111,蒙总喜剧，wow，女主居然是甜妹[色],阿乌乌
112,荒剧必追[狗头][狗头],ZZ536
113,值得推荐[大拇指],SUNSHINE儿茜茜茜
114,这爱奇艺会员开与不开没什么区别,野性的高冷
115,荒唐又好看,喜欢健身de公门平蓝
116,非常好看值得一看,李沛松3
117,必须的，太解压来啦~喜欢听主题曲,拉朵花
118,演技在线,君洛好
119,有意思😄[色][色][色]快来看[玫瑰花][玫瑰花],栀栀r
120,床头是灯吗？哪个朝代的？,゛ 盖盖
121,非常值得看，推荐[大拇指][大拇指],咸菜毛豆
122,剧情可以的,同学少年👍
123,妈耶 像这种一上线就播全集的真不是很难常见[捂脸笑]但是不得不说真的感觉很爽 比起要等更新好多了 演员颜值也是蛮OK的[色]简直不要太爽！！！,帅飞小美_
124,考完就剧荒了,Icy姐姐-
125,画面很美，摄影厉害。,喜欢吃龙虾の延陵盼波
126,人物设定很有意思，云盖雪一个爱吃甜食的大魔头,楚羽🤩
127,熬夜追剧,蓉易337
128,小网剧不错,秋秋@翔翔
129,女主很可爱啊,JokerK拢一
130,女主真好看呀,喜欢吃铜锣烧の漆雕和怡
131,古装爱情剧   深的我心,南山sun
132,终于来了！[色][色][色],嗑爱了
133,还还可以,帅阿龙哟
134,好甜好甜[色],今天再也不熬夜啦啦啦啦啦啦
135,男主配音是谁啊？这个声音太爱了！好熟悉[色][色],古月晨曦V
136,这个女主是和季大爷一起演的那个机智的恋爱生活吗？演技不错，挺可爱的,唐粥糖醋鱼
137,好不好看啊,睿睿^_^哈
138,这么好的剧热度为什么这么低,强哥197309🧀
139,还是喜欢古装,娟籽🎋
140,这两天加油追完。,bjoq123
141,甜宠古偶太🉑了！！全集看到爽,dfdgdm🌸
142,喜欢这种上架就全集,你是祖宗啊🥝
143,好看，等了好久终于等到了,竹间物语
144,这剧直接全集播放，不错不错,清清🎆Mina🎄
145,好看好看[666][大拇指][666][666],清秋yy
146,搞笑哈哈哈哈,琪yy🎀
147,金美辰饰唐门掌门唐不言谁能不喜欢呢？,曼曼在家
148,太好看了[爱心],爱玩排球de左丘冠宇
149,一起来看啦啦[应援][应援],宇智波·广坤👏
150,一次来俩泪痣男，唐不言表示赚大发了,遇见呵护
151,太好看啦,ccbcc777
152,真有趣哈哈哈,无天天😀
153,感觉男主演员哪部剧见过，应该是演配角慢慢出来的，演技还行,最爱姨母笑
154,挺不错的，好看,爱购物の公伯芫华
155,还不错，也是全员帅哥了，男主兄弟俩和神医都很帅，Cp感也好，男主古装装扮真好，仪态也不错，记住了。,W俊俊妈
156,女主这一开头的独白给我整懵了，这么中二的吗？看起来是一部古装轻喜剧，不错，可以继续追下去[呲牙],瞌睡家jj
157,蒙恩是有演技的哦，人也帅[666][666][666]这剧女主也可爱,Amandy曼曼
158,卧槽。这全部更新了[色][色]。我喜欢。哈哈哈哈哈,夜魅_qq2614
159,我有个问题想问一下，有谁知道黑风大霸小霸出现在第几集啊，我一直找不到，求告知，谢谢,yy张小萌
160,床头那灯认真的吗？,云海满天
161,没想到金沫汐的身材那么好，满脸姨母笑停不下来,勋你一鹿奶茶香ew2
162,该说不说，爱奇艺，会员必须买，不是因为别的，就是因为，全集，这是对我们的尊重,来打我瑟
163,配音演员都是熟人啊,靓仔小鱼🐳
164,直接放全集，爱了爱了[色][应援],追剧女孩子儿
165,想当演员[呲牙],北方向日葵💯
166,男主看着眼熟,a1bc...
167,这拍的古装不是古装，现代不是现代，好多道具都是现代，还是弃了吧,品貌非凡的平凡之路
168,男主有亿点好看哦女主也好可爱,风流倜傥的薄荷之夏
169,和李沁演的电视剧桥段一样,听从心的声音
170,好喜欢女主演的电视剧[色],沽沽子
171,男主也太不好看了，真的无语，怎么选角的？,勿扰😙️😙️😙️😙️😙️
172,下班打开，就没停下来，有没有人和我一样,话Tyler
173,马上安利朋友一起看，当然要一起快乐,叶子妹妹888
174,感觉这个少主唐不言也太好玩了。,人见人爱的一朵花
175,我确定我看到了沙发,晏然自若👌
176,到处都能看到电灯沙发床垫，这是确实是搞笑，侮辱人的智商,苹果不甜800
177,直接一口气追完，演员演技杠杠的，比其他一些无脑网剧好多了，完全没有尴尬感[大拇指][大拇指][大拇指]，剧情新颖，可以说是从头笑到尾[应援],酒醉的蝴蝶＃👍
178,节奏紧凑没有一点拖沓，演员阵容太让我惊喜了,漩涡鸣人的伤_谁懂
179,啊 姐姐杀我 金沫汐也太飒了吧，编剧的台词写的真好,忽而今夏_w
180,这画面这质感这演员这情节太绝了，我也有恋爱的冲动了,北港不秀
181,惊喜的是蒙恩，已经超其他流量小生好几条街了，叙事风格新颖,萧洒寒风
182,这个剧好多我喜欢的演员，随便单截出一句台词都好好笑,鉴标师
183,最爱追看一次性更新完毕的剧[应援][应援][应援]这个也是爱奇艺的一个特色[666],莋茧洎缚と後
184,好看，上头[应援],月亮之下💘
185,果然该剧主打沙雕甜虐喜剧路线有两下子，佩服啊,拐弯了，咋办
186,我擦，台灯，就算是网剧能不能也削削认真点,开心9527
187,这网剧乔诗语配音挺有钱的啊,ヤン・ジュン
188,之前看男主饰演的白蛇就觉得很好看,guyiming12312
189,女主睡的床，床单被罩，枕头，是认真的嘛！[捂脸笑],陈小猪_qq1068
190,额，古装剧里面怎么有现代的床跟台灯[捂脸笑],zxl——
191,不出意外的话，不会又失忆吧？,成为陈的光
192,一开始的替身有点明显啊[捂脸笑],小八曲奇
193,过分了吧，这床跟床上用品都是现代样品[捂脸笑],@y.com
194,开头的床和台灯雷到我了[呲牙][呲牙],对着向日葵傻笑
195,看了十多分钟就看不下去了,如诗如画嘿
196,越看越喜欢，好喜欢四个人在一起的氛围，两个CP都好磕！,蜂蜜水331
197,很好看，金美辰符合我的审美，又飒又美,花花12478
198,男主的脸和身材真的是我的菜，这部剧就是我的心头好,被窝就是我初恋
199,非常喜欢里面的剧情，场景真实高度还原,惊弓忘藏
200,编剧很会写恋爱剧情嘛，剧情带入感太强了,拍拖告急
201,剧情人物有血有肉，这部剧比的故事情节还要精彩呢,不会拍拖
202,太可了，喜欢姐姐的造型，这个剧好多我喜欢的演员,躲猫猫ew
203,蒙恩性格真招人喜欢，演员演技很好,给脸请收
204,蒙恩可以啊，演员跟角色也太贴合了,请叫我痴情先生
205,这部剧真的很适合心情不好的时候看 超解压,我们😚777
206,看了两集好看，等等更新完在看，追剧那感受……,南烟斋🤗
207,刚开始看，好看吗,福宝1S
208,听这剧名…公子贵姓…,Aka for Devil
209,好喜欢这部剧，三刷了,冰冰124576
210,这开局有点像我之前看的一个剧，女主找胸口有红色心形胎记的男主，忘了剧名了[捂脸笑],啾咪wink☀
211,我看了这电视剧，真的是笑死我了，剧情真的不错，为什么看的人很少，为了看这个专门开了会员。,雾都婉子😁
212,剧中布＋景床的现代布置及有现代台灯等清况不严谨！有损古装剧风格！,🐎南冰弟
213,好不好看，搞笑吗,米斯特yaan
214,[捂脸笑]看评论笑了,榕榕🍓🍓
215,女主有点像王艳,平生素缘
216,周三了，早,强哥197309🧀
217,有谁喜欢这男主的 建议看完这部剧荒了去看看烈火军校吧[呲牙],超爱赛跑的南宫琰琬
218,这种小网络剧看的是欢乐，后面搞的太虐就没有看下去了,iiiiiii寶
219,我瞎了，以为是龚俊[捂脸笑],only.  瑶
220,强调两性平等，三观正，迫不及待想要看到下面的剧情,水果糖eve
221,蒙恩电视剧真是非常的棒，大家可以去看看，特别期待后面的剧情,最萌罪名_
222,蒙恩电视剧真挺好的，反正就是好好看！看他就完事，我万万没想到的，带给了我们很多的惊喜,嘟起嘴的萌妞们i_
223,蒙恩台词好厉害啊 演的也不错，这部剧太上头了,琉璃舞w
224,心动不可耻还很可爱真的是非常的甜啊，剧情真实刺激,世末歌者_33
225,男女主也太甜了吧，我万万没想到的，带给了我们很多的惊喜,希羽岚梦_
226,看完对蒙恩改观了，演员真的要有作品才行，人物刻画一点也不娇气,我在你的怀里吃炸鸡
227,看完对蒙恩改观了，演员真的要有作品才行，绝世大甜剧,风璃殇_
228,国产剧终于找到了对的发展劲头鸭，只看剧情也很刺激啊,偶长得帅也有错吗？
229,金沫汐的颜真的很顶，你拥有可以相信的道化服质量,精神领袖少年
230,必须夸一下剧里的小细节，人物刻画一点也不娇气,机车少年爱机车
231,又来看啦！,白捡的🎐
232,"哈哈，好
看？",神仙打架斗殴！！
233,这部剧的人设我真爱了，找有泪痣的命定之人，好强的宿命感,飞龙元
234,童鞋们啊，都来这表达态度吧，我先说哈，速度去追剧,有你才开心☀
235,就爱看这种解压轻喜剧，还没看的别说我没告诉你哈,白白的爱
236,少主身负血脉之症，得找到命定之人双修才能活命，这设定一听就很有故事,萌萌星同学
237,哥哥打架先绑弟弟这个操作我好喜欢 有没有人和我一样,云开的时候
238,除了笑点，我还想多看点甜甜的恋爱，官方你懂我什么意思吧,春风吹走十里雪
239,金美辰、蒙恩领衔主演的公子贵姓真滴很好笑，压力大的看起来,小的羊
240,一语道破天机呀，看着大家扒的公子贵姓细节感触深刻,丸子沐
241,大家集体感受一下唐不言追逐泪痣男吧，好喜欢的哈。,Baby小可爱👏
242,唐不言为了找泪痣男付出了太多，但被挂在树上过于好笑,我是萌妹子啊
243,我也赶快来围观女霸王当街抢压寨夫人了，好喜欢,而我叫沈丽梅i
244,强力支持唐不言被李成蹊倒挂在树上，实在是太好啦,电视小迷你
245,唐不言和李成蹊上演暧昧搞笑惊艳了网络有木有。,竹影情风🎊
246,围观的各位都能收获快乐，公子贵姓情节真心赞,最爱喝奶茶🎪
247,唐氏撞见泪痣兄弟李成蹊和云盖雪引发超高人气。,何以心动ぃ
248,哥哥是怕云盖雪控制不住法力伤害到他人，才不得不把他绑起来,黄圣伊宝贝儿
249,吴承泽饰暴躁呆萌大魔王云盖雪超级可爱，大吃货一个,可以的的是
250,对蒙恩演的玄奇山掌门李成蹊各种喜爱，真是太好玩了。,话Tyler
251,对唐氏寻找命定之人解决家族困境意犹未尽，坐等更新,鹿港♀
252,成不成见面就很特别，这个泪痣男就是你的命定之人啊,爱你所爱🌟
253,剧情精准拿捏我的兴趣点~就喜欢这种脑洞又大又好玩的剧,梅果🍓
254,我已经彻底的发现了哈，公子贵姓导演是真的很懂吻戏,hin小楼又东风🔥🌻
255,唐不言在追逐一泪痣男过程中意外撞见泪痣兄弟李成蹊和云盖雪,开心快乐的野草
256,看了少主唐不言在蜀地强制验了不少人就懂了，为了活命她好努力,可乐乐
257,唐不言遇上前来唐门寻找《月缺经》的李成蹊，这下有好戏看了。,oο〇半岛阳光✌
258,好快乐，完全忍不住！公子贵姓剧情节奏搞笑刺激,裙摆有点长
259,唐不言在蜀地强制验了不少人泪痣男，都没找到命定之人,我们😚777
260,为了解决家族困境少主上演了很多啼笑皆非的故事。,如花似玉☀
261,唐不言和李成蹊因为蒙面上演了一番暧昧搞笑的误会。,青青忆旧丛
262,小言得找到眼角有泪痣且心头血能让试血石变亮的命定之人，才能救自己的命,泉水叮咚💝😗
263,这个床是不是chuan yue le,家有三宝gc
264,让人真的很搞笑,☞林哥☜
265,剧情挺好看,甜甜向上2023
266,一更就更全集[666],JokerK拢一
267,为了配音来的[捂脸笑],小熊要哄.✌
268,就喜欢全集的[呲牙][呲牙][呲牙],蝴蝶香🤟。。。
269,最近一排[呲牙],💓 🐾王🐾💓
270,直接全集真爽,沈复之
271,上来就全集了[大拇指],木子搞笑追剧
272,终于出来了[应援],蓝月亮。😘
273,还不错哦[应援]好看。,Angel🍡
274,女主跑酷出场，帅到了,开心快乐的野草
275,爱奇艺太懂我们了[捂脸笑][应援][应援],画玖🙊
276,牛声什么回事？,笑呵呵的暮雪流年
277,公子贵姓好笑又好磕,笑呵呵的暮雪流年
278,开播啦来了,笑呵呵的暮雪流年
279,第一集怎么看着有台灯呢[捂脸笑],出门见宝
280,我的天，这是啥剧，这个床和他的拖鞋都是现代的[捂脸笑],匿名用户
281,从烈火军校特意来看男主的[捂脸笑],匿名用户
282,兄弟们[色] 真的很喜欢古装剧有没有推荐的这剧追完简直意难平[色],韩总超可爱
283,生活实苦，就需要这样的无厘头小甜剧，而且全员帅哥美女演技好，为啥不喜欢看啊[666],嗯哼yolo
284,生活实苦，就需要这样的无厘头小甜剧，而且全员帅哥美女演技好，为啥不喜欢看啊，看不懂是智商问题还是没有从头到尾去看啊，说话那么不负责任的,我把梦撕了一页
285,我好像看到穿帮了，那拖鞋不是现代的吗[捂脸笑],悄悄的来，悄悄的走
286,好久没看过剧情情节合适的搞笑古装了 还挺有意思的,Mi_jichi
287,期待很久了，一次性更完，加油两天追完，喜欢古装小甜剧的请举手，看看有多少人啊！[爱心][爱心][爱心],用户@58cf3d15
288,这个女主是和季大爷一起演的那个机智的恋爱生活吗？演技不错，挺可爱的[憨笑],红气球🍧
289,看他们打游戏的状态也太真实了吧哈哈哈哈这个哔掉了好多话,＂沈公子
290,一次性更新完太赞了,冶梓蕊🎁
291,emm……怎么说呢？后面上那个男主[捂脸笑]我第一眼看成了龚俊,爱.欣💤
292,这么好的演技，期待金美辰更多的作品,强哥197309🧀
293,搞笑剧第2名？我看看是不是真的搞笑，别搞炒作啊,lus陆笙
294,"现在的电视剧真是层出不求啊  什么题材的都有
",喜欢喝茶の东宫韶容
295,这是带着现代的物件穿越了？[捂脸笑],史上最强搬砖小能手
296,这个是古装剧还是现代剧啊？台灯也太出戏了吧？,設記師007
297,大家有没有觉得，女主和dy上的小鱼海棠长得有些像,我要赚钱钱，我要暴富富
298,以后希望别的剧也可以给vip一次性更新全集,海阔天空，意犹未尽
299,先问一下演技尬吗？演技好的[色]才看,十瓣弯月
300,有人是来听这部剧的吗？,溜不认识的狗
301,怎么跟传说中的陈芊芊有点像也,鬼逸🌈？？？？
302,这部剧简直太好看了，少见的好剧情的恋爱剧,蕾玥瑷雅_
303,金沫汐太鲨我了，怎么会这么御，太喜欢看这样甜甜的剧了,姬月的项圈233
304,简直是我今天的快乐源泉了，看的我嘴角一直上扬,幼姬_
305,蒙恩担得起搞笑大男主了，简直太甜了吧,我已萌出天际33
306,期待接下来的剧情，真的很棒啊,石头爹w2
307,简直太甜了吧，我也有恋爱的冲动了,到海里浪2333
308,人物都有血有肉，简直太甜了吧,我在点火_
309,金沫汐又有演技又有美貌，谁会拒绝甜甜的求婚呢,装萌的菇凉vf
310,这部剧简直太好看了，非常上头了这个剧情,执着的小蘑菇we
311,金沫汐多多营业啊，我今天简直要给圈粉了,伊文思_33
312,编剧很会写恋爱剧情嘛，简直太甜了吧,世末歌者_33
313,金沫汐是什么宝藏女孩啊，剧情人物有血有肉,羽灵233
314,期待接下来的剧情，绝了绝了，这个真的可！,喜欢骑自行车的褚师高格
315,金美辰演的很自然，气质好,强哥197309🧀
316,太好看了[色]笑的我肚子疼,弦断曲亦终
317,这女的就这样还纵横蜀地？[困],TJ633🌸
318,各位，请问黑风小霸在第几集出现啊,墨笙灬
