,0,1
334,哎呀121枪杀大案主犯,MVP♪糖豆糖
335,值得一看。,爱打篮球的南门凝蕊
336,看完评论直接不想看了,匿名用户
337,吃泡面追剧,匿名用户
338,[呲牙]怎么没有看见嗄子哥.....,^ω^歡笑背後啲訫酸☆
339,真实案例一点多不真实,⭐ 紫气东来⭐
340,看到评论，还是弃了,品貌非凡的平凡之路
341,这部剧得压了多少年,匿名用户
342,来喽！来喽,匿名用户
343,喜欢鲁诺 表演自然[大拇指],雪玛丽
344,好看吗，家人们？,爱热巴宝宝~
345,我也追剧，我来啦,明远有道
346,没热度吗,哈哈哈喝哈啊哈哈哈
347,先尝试看一集[捂脸笑],匿名用户
348,来了来了,༺༒ 寂寞愛上了眼淚༒༻
349,请叫我追剧小能手[应援][应援][应援][应援][应援],燕子会回来吗？
350,这女主不但演的差劲剧情也是稀烂！,匿名用户
351,就第一集有点草率，后面的还可以[大拇指] 情节性很可以,Zeyoe
352,喜欢看这类型剧，但是女主演的不好,探~白
353,看你这个比样刚才精神来四比。,爱玩爱喝爱吃
354,看着这女的就不想看这电视了,匿名用户
355,看完这部戏后，我面色凝重，深深地低下头，默默的关掉电脑，起身打开冰箱，拿出一瓶伊利酸酸乳，紧紧地握在手里，细细的回忆着刚才的剧情，慢慢的走向窗前，外面的景色有些暗淡，就像我的心情一样，沉重。。。很沉重！渐渐的，外面灰蒙蒙的下起了小雨，为什么会这样？我的视线开始模糊了……不知道是我 流泪了、还是雨太大了！可能都有吧…… 我的心情更忧郁了，我再也无法抑制内心的情感！导演和编剧真的太侮辱观众智商啦！我缓缓的仰起头。。。对着窗外大喊了一声：这到底演的神马玩意啊？,用户@c6c09e4419300
356,看到那个女的，立马就不想继续看了,喵喵何
357,召唤第一集弃剧的，真心看不下去这剧情,1234😌88🎄
358,刚开始看得热血沸腾，看到后面这点，彻底没法看了,匿名用户
359,还是在我们大吊州拍的吗[呲牙][呲牙][呲牙],淡定（波波）
360,身为纪律部队，竟然不听从上级指令，我也是醉了，现实里怕就开除了,飞翔_qq5513
361,交警没有抢的吧，那个女交警是人才，给子弹给吃吧，小命都要没了,top  student🎉
362,对，不鸣会死，在路上鸣理解畅通，这在偏地也要鸣真的理解不了,什么手势
363,真的看不下去，无语,匿名用户
364,夏海荣让我弃剧了,"ूाीूू
ꦽ"
365,这么多老演员加持，为了这么一个女主角，警察队伍就算你是烈士的子女也是要守纪律的，怎么可能无视纪律这样胡闹！拿出来的的钱还放近镜头，假的不能加！这个剧还说是真实事件改编，真是有失水准！估计要么导演有背景，要么就是这个女的有背景,一叶障目 不见泰山！
366,那个电视台播放,匿名用户
367,这女警也是服了[捂脸笑],匿名用户
368,别侮辱花了,vVBv吃个
369,看封面都不想进去看了,135****5991_m1033
370,仞雪霞光满天,山秀芙蓉Kylie
371,没有一条能看都要毛,欧阳铁如意
372,这剧竟然在常州拍的[色][色],徐小妞麻麻
373,很感兴趣，很好看,杨金诚🧁
374,视频很好看啊,杨金诚🧁
375,好长广告[发怒],匿名用户
376,抖音来的，第一次看到冒着生命危险破坏抓捕行动的,qq15710
377,*从现在开始起，能否及时更新集数和内容，并在新片预告栏中出现，谢谢，拜托了！,"王兄
王兄"
378,看到第17分钟，看不下去了，里面所有演员都很好，但是女主的设定真的看不下去了,匿名用户
379,我要举报，举报河神2的魔道童 太恐怖了，细恐,hlukon
380,这种情况这个女交警如果死了算什么,suiyuan3hgx
381,换掉女主的话此剧可行,王兰fa秀丽
382,很好看呢，剧情和演员都挺不错的,看世界的北斗星
383,没毛病，没有这个女主，我相信这电视剧应该不错。,左半邊の翅膀😘
384,还卧底警花，长成那个样子,匿名用户
385,本来想看的，看了一下评论就不看了[捂脸笑],匿名用户
386,看到女主角都想放弃追剧,◆天灬空╂！
387,这个女主角看着有点二,◆天灬空╂！
388,我就是为了来打个差评的,匿名用户
389,是不是都没看完第一集？！哈哈哈，可惜了,核桃娜
390,"没颜值没演技还出来丢人现眼
",用户8b0b91bc
391,这个女交警演的，一言难尽,钢铁迷彩
392,21集看的我都服了。气炸 白白牺牲了即将退伍的队员,沈婷_qq1278
393,"高亚麟让闫妮贿赂了吧    整这么个女主
",用户8abc17aa
394,这女主的情节和开玩笑一样,Yanairui
395,不管好不好看，最起码是在常州拍的，支持一下[应援],匿名用户
396,看到夏海荣 马上不想看了,匿名用户
397,多大势力干任性抗命并没什么事就拉到了,yeshero
398,这还是一名警察吗，何无组织纪律,天马乀行空
399,这部电视剧侮辱了警察也侮辱了女性,匿名用户
400,天呐，敢再烂一点吗？强烈要求下架这部剧，我感觉智商受到了侮辱。[大拇指][大拇指][大拇指],匿名用户
401,有没有看过的，剧透一下,余欢妖
402,"这女主，一没颜值，演不了偶像剧，但有关系，于是来演警剧，但又没演技，就因为她有关系，可怜了一班老戏骨了。这女主关系真不一般啊
",匿名用户
403,看着像无锡,Thegirlyl
404,人丑多作怪,喜欢懒床010
405,女主人设问题严重,大连微友圈
406,有点看不下去,小姐姐☞☜😗
407,一个人毁了一部剧,小姐姐☞☜😗
408,可惜了搭戏的老演员,王兰fa秀丽
409,可惜了很多老演员,王兰fa秀丽
410,常州拍的,娟¥¥@o
411,卧底警花,奋斗吧，青春💞
412,只想给个差评,匿名用户
413,出生女主,coccoo
414,戏二代，实力差,江西老蒋
415,一个女主角毁了一部电视剧，选角色很重要。剧情不错,用户884cf1a401b40
416,剿匪英雄,匿名用户
417,这样女警也能活过第二集,用户51c1cb36
418,第一集都没看完，拉黑,匿名用户
419,看到男主女主就不想看了,匿名用户
420,三年居然长这么大[大拇指],罗罗555UK
421,一看评论果断不看了,AAA🍎 九月茉莉
422,女主毁了这部剧 [大拇指][大拇指][大拇指],匿名用户
423,不是可以另边绕吗[捂脸笑],什么手势
424,里面还有天哥呀[呲牙],冰雪腊梅🏝
425,水标签都揭扔了[捂脸笑],莅响
426,21集真的很气人,沈婷_qq1278
427,太讨厌这女的了,卜少讷讷
428,实在看不下去了 ,谁爱吃小糯米了
429,女主扛不起这个角色，,沉浸  无奈  死去
430,自以为是 害人害己,匿名用户
431,"真是找不到女主了？狙击手都比女主强太多了
",匿名用户
432,挺好的一部剧让这个女主整个演砸[捂脸笑],用户1b4417c4002b8
433,感觉这部剧的女主是换了，后加上去的,匿名用户
434,本来过来看是给岳胜一个面子,匿名用户
435,浪费我时间不说，什么玩意,匿名用户
436,这不是扯蛋吗？就这一小袋钱，最多也就30来万，省有史以来最大的毒品交易。,用户79e0e68402280
437,太喜欢鲁诺了,ss915doris
438,看不下去了，走了走了,匿名用户
439,这剧我放弃了…,用户51c1cb36
440,女主角的背景很牛逼,匿名用户
441,往后看了几集，女主演技还是挺松弛的，还有一些老戏骨,用户691e672d
442,这情节也是没谁了，拍这样严重不切合实际的电视剧，,匿名用户
443,非常非常好看,匿名用户
444,看了你们的评论，直接弃剧了,匿名用户
445,剧情本来挺好的，这女的一出现这片就没了味道,匿名用户
446,电视剧情很好，可惜演员不行,匿名用户
447,因为一个女主不想在看下去的剧[捂脸笑],匿名用户
448,女主是有关系吧，哪都有她，换剧了,匿名用户
449,看了这个女交警果断弃剧,用户3aea7c440073e
450,一集都没看完，直接关闭。,匿名用户
451,真不知道怎么好意思播出的,匿名用户
452,看到她搅局了还那个态度我就弃剧了，拜拜,用户a37429e41fe40
453,女交警的行为直接弃剧,匿名用户
454,因为这个女主，我决定不看了,匿名用户
455,女主是来搞笑的，真的看不下去了，半分都多,匿名用户
456,破案缉毒的电视剧都要拍成神剧,匿名用户
457,怎么说呢，部分剧情很扯，哎,匿名用户
458,没意思，看女主角交警不爽,匿名用户
459,这个是搞笑话的片子吧,匿名用户
460,第一集就看不下去了。收队。休息,匿名用户
461,闫妮很给力[大拇指]女儿怎么长成这样....？？？[呲牙],匿名用户
462,这两位一男一女主角看的人感觉很累[捂脸笑],匿名用户
463,是留个悬疑吗简介没有女主,用户11bac3c400569
464,毒品交易选在闹市边上[捂脸笑][捂脸笑][捂脸笑],匿名用户
465,能打负分吗[捂脸笑]这剧情这 女主,匿名用户
466,一个女主就拉跨了一部剧！88看不下去了,用户@c0a7950418a00
467,一个小交警不服从命令，公安局拿她没办法,匿名用户
468,这么傻的剧情，脑袋被馿踢了吧，,匿名用户
469,这些老戏骨不配有演员表吗？挺好看的看演员表空荡荡,匿名用户
470,不明白这个剧除了要讲禁毒的危险 为什么女主角要这样演[冷汗][冷汗]任性又自大[捂脸笑]真的没明白 第一集就看得我想弃剧[衰],匿名用户
471,"一部好剧被一个女主毁了，换个女主，这剧就神了，看了一集看不下去了，散了
",匿名用户
472,别看了，太烂了,匿名用户
473,确定不是拿来搞笑？,用户66f2cf31
474,没有演员了吗？,匿名用户
475,三年前，什么情况？,用户b0e8fc0413940
476,鲁诺优秀,舵道舵道
477,换个女演员吧,用户8585ea1a
478,白瞎了这一群老戏骨,匿名用户
479,这女一号演技不行！！,匿名用户
480,在哪评分，最多一分,匿名用户
481,闫妮的闺女,未来金牛座
482,"
楼奴作业",匿名用户
483,新相亲大会,匿名用户
484,女主犹如路人甲,匿名用户
485,果断弃剧,匿名用户
486,常州拍的[色][应援],匿名用户
487,这样也能拍[捂脸笑][捂脸笑][捂脸笑],匿名用户
488,夏东海这次栽了,匿名用户
489,江苏省南京市,手机用户186****5636
490,女主主要演技不行。,匿名用户
491,冲鲁诺，被邹元清吓走,天南海北88
492,辣警狂花电视剧版,用户51ffc0e4029c
493,确实没法看，剧情拉垮女主不行,⭐ 紫气东来⭐
494,女主是哪里的关系户[捂脸笑],浅蓝先生
495,这么搅合还预料不到后果。这女警傻吧,用户b38e88041ff40
496,这是实力派捧流量丑八怪[呲牙],匿名用户
497,广告太多,匿名用户
498,女警是老大啊。厉害👍,用户b38e88041ff40
499,"17分钟弃剧
",匿名用户
500,有谁知道好看不？[捂脸笑],匿名用户
501,"车牌苏
D是江苏我们大常州吗[色]",用户32e8760402813
502,第一集看到背景就看不下去了,用户440b034402918
503,害人精，关键时刻缩在哪里都不敢动，连累别人,用户6b6aacff
504,这个电视的收视率，就是因为这个女的,匿名用户
505,夏海蓉这个演员我弃剧！挺好的剧让她演的稀㴰！,用户6b6927ad
506,会员一年好多钱,匿名用户
507,评分竟然7+[捂脸笑],匿名用户
508,好看不,几口蜜桃
509,This流裸，宰相刘罗锅,匿名用户
510,丁生火,张文🎈壹面湖水董事经销商
511,这破剧,Wen　一一一一
512,哈哈哈,匿名用户
513,警花,兢兢业业的祝老婆
514,"好看
",adadgfgf
515,反面派,匿名用户
516,内鬼,爱喝白酒の青阳雅唱
517,小耳朵,BANK  OF  JIAOPENG
518,不想看,匿名用户
519,就是的,林丽伟🎊
520,[666][666][666][666]挺好看,匿名用户
521,不懂,孙建云黑牡丹
522,先看看,孙建云黑牡丹
523,练功卷,ⁿ 和尚洗头用飘柔
524,太假了,钱女友z l
525,不好,匿名用户
526,吉姆尼,匿名用户
527,这…警花？[捂脸笑],土豆公主的妈妈
528,报看,匿名用户
529,考研,夏水稻生长
530,"懂雷啊
",匿名用户
531,太假了,毛毛大人在上
532,弃剧,匿名用户
533,太假了,匿名用户
534,这女警悔了这么多好演员,小谢㇏
535,怎么才有35集啊,り*蝶恋椛
536,挺好的一个剧，给这个女人搞得一点兴致都没了,匿名用户
537,这女的凭什么当女主啊,formerのpledgě✘
538,这演技……,桐～桐～
539,不咋地,꧁༺坚果๑๑呆呆༻꧂
540,好看,开欣怡
541,好看[大拇指],木木哒258963
542,好看吗？[呲牙],小清儿宝宝啊
543,：广告多,匿名用户
544,田小杰,用户8656f616
545,无厘头,钢铁迷彩
546,老A是谁,匿名用户
547,无语呀,默默锅盖焖
548,差劲,故友  べ
549,喜欢这种题材的局,天天快乐的😄
550,一个女主毀了整部剧，第一集就弃了,看看停停🍧
551,剧是好剧，就是主角让人失望,喜欢吃零食de西门朗宁
552,看见有人骂这女警就放心了,诚实的铁牛
553,我觉得这部电视剧蛮好的，天天晚上追,一人一狗走世界
554,因为农夫没赞助所以商标拿下去了😂,真实的我
555,老卧底，新世界，会禁播的,匿名用户
556,完全仗着父亲的荣誉，没大没小的,永不言弃的爱你
557,这要是现实生活中早就给他撤了,ＴＥＲＥＳＡ
558,感觉又要被女主搅合了,你的无线网卡
559,如果是普通交警呢？肯定会给处分的,看看停停🍧
560,还挺好看的,华晨雨的粉丝
561,太假了,匿名用户
562,什么叫仅存的记忆中。他爸又不事失踪了二十年了。,爱喝汽水的公祖谷枫
563,卧底想出来进了厢式货车，警察局竟然不知道？这漏洞不应该呀，唬我呢,136****1129_m1405
564,不符合逻辑这种箱车后尾不光是有液压尾门里面还有两扇门谁开的,我就是我润鑫源
565,什么时候能看到卓牧闲的〈老兵新警〉改编的电视呢？,忠武将军上轻车都尉
566,女交警又来搞破坏了,爱爬山の梨落
567,只要看到这些主演，我就不想看这部剧了，难怪火不起来,匿名用户
568,常州高架,纵横四海－SKY
569,常州拍的,纵横四海－SKY
570,哪里是张一山啊,用户936d1e64
571,如果没点尿性，全都是循规蹈矩的，那不是战狼中队想要的人,喜欢吃烤鱼的濮阳逸雅
572,求你们给她一枪吧,182****7137_m1179
573,主角光环太严重,182****7137_m1179
574,都是我喜欢的演员,幸福快乐多多1
575,不合逻辑，这么胡闹？,喜欢看书の轩辕圣杰
576,什么破窝底，人命重要还是线索重要，线索没了可以在找，人没了什么都没了,吉祥龙🙏
577,我们云南,匿名用户
578,咋不把这女人开除,匿名用户
579,[吃瓜]这女的漂亮不漂亮不重要，就这说话语气太不像交警了吧！演幼儿园老师合适,吃瓜群众爱追影视剧
580,己收藏，准备下载看，看到大多数的评论后失去看的兴趣，直接取消收藏了,星语0420
581,看到这女的直接弃剧,匿名用户
582,小海蓉这是长残了,喜欢唱歌de东里凯凯
583,三年就变成大人了吗,183****0990_m2160
584,这个剧不好的一点就是，有时候有解说员，导演是怕我们看不懂吗。,英子妹🍒
585,这个死女人哎，你脑子,糖加三勺长弓
586,一条臭鱼坏了一锅好汤,换房
587,看着这女警很不舒服,看看停停🍧
588,来了来了，报,海边踏浪。
589,就几个人咋变成五十多人了,男人本（色）小伟
590,这种智商怎么当上交警的？,匿名用户
591,好了 弃剧了 好讨厌这样的人设,休闲小站
592,老头子该不会是到警察当卧底的吧,爱爬山の梨落
593,也不知道女交警领盒饭了没,爱爬山の梨落
594,因为一个片段来看这部剧,爱爬山の梨落
595,知否看了3遍，实在没有看的了,超爱喝纯净水DE美铝
596,一开🔫就是子弹演的好。  是不是傻,吴超凡_qq1286
597,看到女警第一眼就果断放弃,看看停停🍧
598,肯定要开除，还要记大过处分的。,山高水长路远
599,这女交警演的什么玩意儿啊！,山高水长路远
600,为何都是透明的塑料袋装面粉,超爱购物的秃发婉淑
601,演员表连女主名字都没有😂,爱吃菠萝的奥利奥
602,不是说没有老戏骨吗？刚才那个是谁？,周丽娜81
603,看了女主放弃，啥玩意，好好的题材，被玷污了,诚实的铁牛
604,女交警怎么不厉害了，差点害了警察,媛媛🍒James
605,逻辑混乱，毒贩为什么停车找事,匿名用户
606,你一个卧底还这么NB，太离谱了吧,人生百态 世事难料
607,电视剧 怎么会有这样的女人出演神圣的警察,匿名用户
608,玩游戏似的，就拍不出一部好看的片子,负债开始
609,编剧籍贯是火星人，鉴定完毕！,XGJ_qq1384
610,这是猪，在不要亏你先人了,1卡了吗好卡啊啦
611,周小生他们都在这里拍的,钻石$眼泪
612,这个地方都有很多电视剧在这里拍得哦,钻石$眼泪
613,这个怎么和抖音上推荐的不一样呢,*胜天半子*
614,这剧是女主自己花钱拍的吧,波一👍
615,随便在哪里交易就好呀，非得到废弃大楼来[捂脸笑],水——
616,挺好一个电视剧让她演废了 演滴啥呀,爱旅游的小豌豆
617,听说评分有点差 来看看女主长啥样[捂脸笑] 拜拜👋,156****0851_m1975
618,找到厢车也没用，车早开出去了,绿叶轻舟🐣
619,导演要让她死，一集她都活不了,潇洒哥424Grace
620,这女交警应該开出，我她有关係，所以牛,坦蕩
621,还有追的必要吗？弃剧吧，三年长的比风吹大的还快,匿名用户
622,他们不行不然何要卧底？还是个女子。,沉默暴风6
623,开头一个下头女真不想往下看直接大结局,棣球🌍上的欣🌟
624,真对夏海蓉无语真丢她爸人,棣球🌍上的欣🌟
625,能不能来个漂亮的女主角,请叫我良哥0
626,女主演技和长相拉分了,昆嵛秋叶（点点）
627,这是什么破片  ，走了  ，傻了吧唧的,123老付123
628,这些不是都辅警在做吗？,爱查尼比
629,和一代匠师差远了，这演技[狗头],吉祥如意0809
630,主角差强人意！每集篇尾讲解人都比演员演的活！,吉祥如意0809
631,唉，女主的演技实在是没办法恭维。[骷髅][鄙视][鄙视][骷髅][骷髅][骷髅][骷髅],匿名用户
632,回忆太多故事情节太复杂不好看,环保黄超福
633,感觉要一个人毁了一个剧的感觉,当时光非礼了梦想
634,我来看一下有多少人看，那个女的降低收视率,匿名用户
635,这个女主演技真是无语了,匿名用户
636,这个女主生生的把一部好剧给拉下来了,匿名用户
637,不知道为什么追不下去了[捂脸笑],枯叶蝶1010
638,不但不惩罚，估计还要嘉奖,奥力给😇(ง •̀_•́)ง
639,这剧情，交警把炸弹的事解决了,135****9726_m1213
640,这拍的什么电视穿透了。,喜欢吃蛋糕de独孤彦灵
641,这要在纪律单位，不判刑也得开除！,爱探险的令狐霏霏
642,要是没靠山的，早都被辞退了,蒙娜丽莎liu
643,三年前就仅存的记忆啦？三年前多大,匿名用户
644,应该吓尿了吧，刚才那股劲呢？,太乙散仙
645,母女俩一个模子刻出来的,太乙散仙
646,美女请节哀小狗带亲了,136****3104_m1537
647,这回知道躲了，成事不足败事有余,顺风顺利～好心情
648,这演员这剧情直接不能入眼,洁齐清明
649,听说是部烂剧，我不信，进来刷一下,超速的蜗牛😀
650,看不到一集除了女主好像都挺好的,招财进宝_wx1626
651,刚不是扎了头发吗？怎么又批着,我是蓝色的Blue
652,他爸要是卧底也得被她害死,匿名用户
653,又是他失踪了，罚罪里面也是他。,喜欢玩排球de夹谷雅柔
654,看到“你怎么看”就不想追了,喜欢玩排球de夹谷雅柔
655,有这样的女主不想看了,喜欢吃火腿の南宫曜栋
656,这姑娘要是女主不想看了,喜欢吃火腿の南宫曜栋
657,不应该把这女的打死吗？不用她演了,匿名用户
658,我听说这里有个小娘子挺气人的～  我来瞅瞅,Mm 丶C arey
659,这个女的作女一我真的不行,joryang_qq1197
660,看到这个女主角就不想再往下看了,匿名用户
661,子弹超出了光速，引发了时间倒流,tianxim
662,不是重案六组的丁箭嚒,不要你觉得我要我觉得嘿嘿
663,紧急情况一般都听不到,不要你觉得我要我觉得嘿嘿
664,只有看禁毒电视剧开弹幕,ᥫᩣ洁妹儿.
665,老戏骨们演的真好不错,灞暹ξ乛
666,闫妮的女儿还是先当群演吧多历练吧,起个名字太难嗯嗯
667,大队长站岗执勤逗玩呢,起个名字太难嗯嗯
668,谁告诉你回忆就是三年前,沈拉拉妈妈
669,这小妮子后台可以呀，敢这样。,一生只爱你😅DD
670,演员表的人就俩，想多看看都没有。难过😔,能否钟爱一生
671,这还不得停止反省，造的,匿名用户
672,家里有矿才可以这么干,匿名用户
673,这女主角是找关系来的[捂脸笑],陈可儿123456789
674,明明是设定的角色，你们为啥非要这么认为,六y s y y wu w
675,怪不得演员表里没有女主的信息,爱吃锅巴de万俟安宜
676,这么多名配角，这女的不简单,爱吃锅巴de万俟安宜
677,拍电影的家里没人永远拍不了,多……鱼
678,这个女孩是不是闫妮的女儿呀？,@小女子不才＆
679,我一看这个女的就不想看了,匿名用户
680,现在才上线就证明作品不太好 积压太久,心中天地 方是至极
681,有这女主这剧坚决不能看了,换房
682,这个女主只能靠闫妮出名,吉祥如意0809
683,女主人设不是选的太好,吉祥如意0809
684,哪里找的这么多烂尾楼？,一杯红茶
685,这女交警不好看，还是放弃这剧吧,匿名用户
686,因为一个女交警，直接弃剧,💰宝宝💰~
687,夏海蓉一去卧底 就看到他父亲了,墘灵修
688,比缉毒警都厉害？太放大她的作用了,看看停停🍧
689,没有组织纪律性，太自以为是,看看停停🍧
690,在武进西太湖影视城拍的,黄昏er
691,听说女主角是闫妮的闺女，不知道演技咋样,用户8ad05c97
692,嗯，怎么没有人呢？就我自己吗,海边踏浪。
693,这女的看也不像聪明人啊，导演选人越来越物质化了,137****6085_m1902
694,哇塞，真实事迹改编，更有看头，最喜欢看人民军队警察故事之类的剧,会飞的美人YU
695,这部视频，真的太好看了，谢谢，官方，这一场正能量，把我说的话听不懂吗？推展，感觉很稀奇的句子吗？,八少.天涯歌手
696,纪律部队开出这么一朵奇葩花朵，还赋予是有个性，会带来多大影响？警服脱了！,品茗清谈1964
697,3年，小孩变大嫂了？,郭执业毒师
698,后剧也没有看下去的必要了，连军人最基本的操守服从命令都做不到。,@٩(๑^o^๑)۶开心@٩(๑^o^๑)۶
699,这片子是降智的,好玩不过大团子
700,有点个性,爱吃铜锣烧的南宫访文
701,不是我说你们都有病吧  人家怎么样怎么演都是导演和编剧安排的 你们狗叫什么,匿名用户
702,烂尾号楼,匿名用户
703,胖子是不是小兵张嘎啊,匿名用户
704,矿泉水怎么是这样的,爱爬山の梨落
705,女交警有主角光环,爱爬山の梨落
706,女交警不听从指挥,爱爬山の梨落
707,女交警不听指挥,爱爬山の梨落
708,女交警出来了,爱爬山の梨落
709,女交警来了,爱爬山の梨落
710,看到讲解来看这部剧,爱爬山の梨落
711,这个是二十三岁吗？,zjdbsuakkana
712,还是狂飙好看,匿名用户
713,今年的新片啊,用户913b7e5f
714,电视剧漏洞百出啊！,山高水长路远
715,太没有纪律行了,匿名用户
716,也不封个烟,匿名用户
717,这啥情况,北区西城
718,云襄外婆看完了,小王爷爷爷🌻
719,还必须看，操,匿名用户
720,监控都随便调了,匿名用户
721,看的来气,喜欢吃烤馒头de闻人攸然
722,颜值有点欠,喜欢吃烤馒头de闻人攸然
723,三年前[捂脸笑]，怕是13年前哦[捂脸笑],随缘2020tp
724,那里聪明了,随缘2020tp
725,干掉她后面怎么演？,幸福快乐多多1
726,莫名煽情,匿名用户
727,江苏省南通市,海湾1号
728,这女主啥也不是[擦汗],丫丫😍Luke⛄
729,活了半集,喜欢喝饮料の公良俏美
730,女主该换一个,喜欢看书の轩辕圣杰
731,三年长这么大？,超爱吃豆包的褚师永嘉
732,苏南是哪里,偶然Victoria
733,人不狠站不稳,岁月静好6339
734,[爱心],匿名用户
735,这个瓜婆娘又闯祸了,钻石$眼泪
736,没劲了。撤,择善而行🙊
737,拜拜啦，你们慢慢欣赏,爱吃水煮鱼の柳絮纷飞
738,常征他爸吗？,康娜子OP
739,考研二人组,一巴掌☀
740,感觉像是个烂剧,波一👍
741,这是喜剧片吗,波一👍
742,好看不，这部剧，,爱看电视de濮阳又蓝
743,看了她我也有点不想看了,傻妞liuxia
744,有什么好的剧,匿名用户
745,米叔是苏大强吗,手机用户189****9863
746,安长林局长专业户,手机用户189****9863
747,老六呢？跑了吗？？？？？？？？？？？？？？？？？？？？,匿名用户
748,用不了这女警,匿名用户
749,我笑死了,匿名用户
750,邹元清演的不错,我心在笑4
751,警察了不起,枫叶飘零☁
752,女的干嘛！死了好,可爱笨男人11
753,她爹是领导所以这样,匿名用户
754,致敬禁毒警察[大拇指][大拇指][大拇指],匿名用户
755,应该是故意快抢的,◆枕月入眠💯
756,假的不能再假了,大侠🍇0405
757,我也是从外婆过来的,匿名用户
758,这女的二,匿名用户
759,没人看吗,匿名用户
