,0,1
0,这女的谁呀，长的也太随意了吧，也能当演员，这后台不得了吧,策马扬鞭5168
1,第一集就看不下去,L.哦哦哦哦
2,这主角不捣乱是不可以吗？上级让他撤退，她死活不撤，她是一名交警，就要该做交警应该做的事情。,我又何尝不想心动了
3,第一集退，主角都是从不服从命令，坏事才能成长？？,凝枫霜颖
4,高亚麟是怎么啦？不是很有才华一人吗？怎么显得这么低能了呢？,预应力A
5,三年前小孩，三年后就交警了？,182****3621_m1116
6,夏海荣让我弃剧,关注1562
7,真服了，怎么什么电视剧都得有个搞破坏的角色呢，着人恨哎, 叶子
8,太哈咯，这个女主。第一集就告诉大众，有关系就是牛，任何纪律都是白搭，警察局她家开的。拜拜呢。这评分怎么拉上去的哦,喜欢玩乒乓球de公良丝娜
9,"改编没毛病，就是希望改的稍微真实一点点就有人看了
",美好未来阿文
10,最近追了好几部刑侦剧，最差的一部，你看都看不进去怎么让人往下追，真是醉了,陌路人 GXY
11,第二遍了,小猪佳白
12,三年前小女孩5岁，，，三年后小女孩当交警了[捂脸笑][捂脸笑][捂脸笑]能不能再假一点,HUANGLIANGDI
13,这算不算越权行为？拍戏也要有个度 行政处分应该还是需要吧？还不反醒！己通知她撤 还不撤退 这是不是违抗命令？难道这些就不追究责任了？拍的什么？没法看下去……！别为了标题去符合这个不成章的内容。,ZXYZXY_qq1232
14,看了预告片段，感觉演员阵容和剧情应该很不错，但看了第一集一小段，这部剧可以定义扯淡剧，一个交警可以跨警种去参与执法行动，就因为他父亲和其他警察熟悉，他就有特权，拍戏可以扯淡，但别过分，观众不傻，剧情合不合理难道看不出来。,心随之所欲
15,微博来的，不听命令，闫妮女儿，服了,小明DE时代
16,看呢就好好看，不然就别看，后面很精彩的  ,小野猫喵喵喵Sydney
17,这部剧最大的问题就是女主拉低了档次,ღ᭄追風ꦿ꯭蹤夢꧔ꦿ᭄࿐
18,这什么东西 女主真的一言难尽,张麟，
19,女交警让我弃剧,谁爱吃小糯米了
20,看了第一集，搅和了这么大的事情居然连个处分都没有，而且是后来明知是嫌疑人车辆，正在报案，她居然追着处理违章。现实中怕也就只有一集了，女主第一集就被开除了,每天看灰机
21,支撑我看这几分钟的动力是为了给它评个一星[捂脸笑],雷恩🇨🇳😆
22,作为警察，不是最主要的是服从命令吗？这女主拿生命开玩笑，这编剧真的是编的太离谱了,黎花😘
23,看了10分钟，看不下去了,桃桃大仙🍡
24,在他爸是英雄，作为交警缉毒警在执行那么重要的任务…我靠，没法看啦！,曹世进是猪
25,这样冲动，不听上级多次命令，破坏了部署两年的计划，她还可以这么轻松不受任何处罚？太不严谨了,幸运@A位之人生
26,闫妮的闺女主演啊,循环太阳VS
27,把警察那种威严演成了儿戏，哪找的女主,坚守一份执着🌟
28,浪费我流量一个夏海榕，毁了一部电视剧，一集都没看完，果断弃剧,玩命王子殿下
29,再好的电视剧总有人说不行…也是醉了,炜大爷🌈
30,女主要是不是这样的性格就好了[捂脸笑],养糖富婆
31,看了评论一片到啊，按理说应该排名很靠后啊为什么居然排在狂飙的后面尘封十三载的前面，这就很让人深思啊，就这剧名直接劝退,皇庭彡骑士
32,一句信号不好听不清，这电视剧看到这为止了。,lì－國
33,真的弃剧了，不好意思，本来很想看，女主我真得看不下去，不是漂不漂亮的问题，就是跳戏,123好运连连A🧀
34,没有想到导演竟然是家有儿女里的夏爸爸哎[应援],刘子涵0914
35,女主不适合演戏可以做别的，不要为了当明星去演戏！演员也要有天赋，不是阿猫阿狗都可以去演戏,奇思妙想一路长红
36,看了第一集，这女的主角光环，只能在电视剧演吧，现实中有这种不听指挥的吗[大拇指][大拇指][大拇指],向日倾葵
37,这样早就开除了,孙悟空和猪八戒🎐
38,这个女交警，如果受到惩罚，我就看所有的片集，可惜他没有受到惩罚，一点惩罚都没有，,冰的人
39,女主还是不要再拍电影了。真是一个人耽误一部戏。拉低了那么多老戏骨的演技,☞吳先生☜🎫
40,一个女主毁一部剧‘果断放弃,爱喝茶的百里凡阳_1077
41,海容拉底了整部电视剧的评分，第一集看完直接不看了[捂脸笑][捂脸笑][捂脸笑]差评,匿名用户
42,很好看呢，剧情和演员都挺不错的，虽然没有大牌但是故事很好👍,肖步活了的
43,一看到骑行服套扣式肩章就不想再看一秒，这些基本的常识都不懂就别出来丢人现眼。,凯迪要拉客
44,这剧编剧好，不得不偑服。我只能束起中指[捂脸笑],哈啰士
45,"有好评这剧？
",严娟869
46,就想问一下评论区的大佬，有钱大家一起挣啊，别忘了小弟[吐],梦中摸鱼
47,这女1[捂脸笑]中国没有女演员了哈,沈阳迷迭香1981
48,现在的电视拍的真的没有啥看点。一点挣扎激烈的举动都没有，,玄门梓龙🏖
49,就这居然第二名，太离谱了吧,皇庭彡骑士
50,这女主拉低了这部电视剧,68Gor
51,犯了这么大的错，居然不开除,182****3621_m1116
52,太不真实 瞎演 不符合要求,mc果果mc
53,为什么要出现这个女的．好讨厌,andejiancai
54,女交警破坏缉毒行动，不需要写报告?不需要停职处分？编剧是为了让她继续破坏行动吧，女主光环,Ｍīｙūｋī
55,什么电视剧导演美有脑筋吧,爱吃苹果の延陵米琪
56,这剧应该叫.《实习卧底警花》[捂脸笑],雪玛丽
57,我本来挺喜欢这部电视剧的，但是女主实在是一言难尽[捂脸笑][捂脸笑][捂脸笑][捂脸笑],喜欢健身の南门乐语
58,奔着鲁诺来的·但这女主，我放弃了,肉酸托腮!-^
59,这是有真实案例的,林丽伟🎊
60,作为合格的交警 就可以骑自行车不戴头盔啦？[呲牙][呲牙][呲牙],狂人DJ
61,秦琼的傻儿子吗，又来现代变黑帮了,狼族🌼
62,光头局长换成丁勇岱，女一号换成景甜。,尼鲁豆
63,我没看  准备看  一看评论  我也不咋想看了,一点点光捧在手里像太阳
64,这部剧刘华强和高启强来演会是什么样子呢？[呲牙][呲牙][呲牙],A锋利的👠鞋摇晃的红酒🍷
65,闫妮的女儿演技太差了，根本进入不了角色里！这剧第一集就止步了，可惜了那么多实力派老演员了！,浪里个浪兔兔🍑
66,我怎么感觉华叔有可能与海蓉爸爸有联系啊！,6699米多
67,确实没见过这么没有城府的卧底，编剧太低了,宇哥1121
68,冲着高亚麟导演去的。,尼鲁豆
69,犯了这么严重的错误，一点处罚都没有。假的不行,M辣辣💘
70,干嘛还拍后面第一集都没看完,新移动号码😗
71,看了第一集女警花追匪徒，我过来看看评论区都是咋骂她的[捂脸笑][捂脸笑][捂脸笑][捂脸笑],Veilahill
72,太假了，这么远离现实生活，果断弃剧,燕子k k
73,我想说，不是我对星二代有啥意见，我是觉得这个女主真的太张扬了，完全不听命令，这样的事情，在现实生活中，恐怕压根不行吧，还是我格局太小了！,榴莲卷妈
74,如果是你们啊多少老戏骨都挑不起来的，别在那里说风凉话了啊！不想看可以退出！[闭嘴][闭嘴][闭嘴][惊恐][惊恐][惊恐]闭嘴,林丽伟🎊
75,支持宣传缉毒影视作品,养糖富婆
76,看得两集就不想看了，一个女交警哪里那么多事，上级的命令老是不听。他爸是市委书记吗？好多次都不够死。,风(*^ω^*)不再温柔
77,夏海容让我不想追了…什么玩意…这要是现实不给处分吗,爱吃红豆沙的侍其琼音
78,因为女主的演技，成功的让我弃剧了，白浪费了那么多老演员的演出,_木凉心
79,请问一下这是不是抖音刷到的那个女交警[666][666],迷茫
80,这是在我们常州拍摄啊！,熙儿🐾🤙
81,哟，高亚麟老师当导演了？,尉迟浩澜
82,：夏东海，你不找个像刘星的，不会拍电视，是吧？[捂脸笑],风为衣丶🤙
83,这女主是我一个人觉得难看吗？还是我审美出问题了[捂脸笑],yycyjjwq
84,电视真是啥都敢演，真扯淡,一江春水1991
85,想来想去还是编剧让女主背了个大锅，第一集看完实在看不下去了,布丁的二舅
86,根据真实事件改编的，大家要理智，这是真实事件,爱吃甜品de羊舌白竹
87,女主居然没有名字，此剧就是她也扑街啦,悦悦悦悦悦。
88,这女主啥意思？导演是看不起追剧的[微笑],郭什么睿i
89,听说被吐槽的很厉害，所以来看看,菲份护眼0212
90,什么玩意儿，女主傻了吧唧的,助梦时代
91,除女警察，都是俺喜欢好几位男主角,国甜田
92,女交警这颜值如果不是闫妮的女儿，估计很难当女一号吧[呲牙],JOYJOY狮子座
93,什么玩意儿？,🍦糯米糍🌈🎨❤
94,剧情还是不错的，女主演的还可以，给她成长锻炼的机会，她会成为一个好演员演的。,Abby颖颖
95,群众的眼睛是雪亮的，这么多人不喜欢女主夏海荣说明大家不喜欢看她，很捣胃口，有些电视剧大家一看就会喜欢上了演员，难怪介绍里没她名字,袁依然
96,导演是刘星他爸吗,谢美云😃
97,这也太烂了吧？第一次搅局没处分，第二次搅局咋滴没咋滴，看完第一集都是我的极限,赫巍巍
98,一个女交警添乱，跑去捣乱了，都在那里低着头躲着干什么，写的什么剧本,玲玲萌萌的！
99,男女主有点眼熟啊，这个剧好看么,DR.GGGT
100,别看，会被气死[微笑],旺仔小赵º
101,父亲就死了，还仗着父亲是官儿啊，这个女自己从小那么冲动，把自己父亲害死了，现在又来害别人,达哥燕妹
102,特意过来给大家推荐的！支持新人[大拇指]。本人从来没评论过电视剧，这部局属实不错[大拇指],孙晓珊98
103,会员已经追到25集了，海蓉越演越精彩[大拇指]超级喜欢了！强烈推荐这部电视剧,孙晓珊98
104,女主就不能换换？,氟西酊Nathan
105,看到这女的不想继续看了,药给😚
106,这比样的交警还不开除？,爱玩爱喝爱吃
107,让宋轶主演该有多好看啊,🕊꧔ꦿ归᭄ꦿ꯭零꧔ꦿ℘⸙
108,几年前？打激素了吗？,玄 奘
109,这种神级剧情是一般网红剧的惯用搭配，接着看着一本正经的胡说八道，下饭挺不错，我一评论就晓得资本方的目的就达到了,穿过时间看你
110,这么多老戏骨衬一个夏海荣，夏海荣骨子里有星二代的影子。编剧不错，换个女主会更好,清晨的一缕阳光🌞🌞🌞🌞🌞🌞
111,女主是个铅笔？？,不烦宝宝
112,感觉还不错，先看看[爱心][爱心][爱心],养糖富婆
113,第一集就看不下去了！女主无论颜值还是演技都不太行啊！可惜这么多老演员出场！,JOYJOY狮子座
114,感觉还不错,养糖富婆
115,好喜欢这个男主呀！好像跟王志文合作那个电视《风雨送春归》里面的那个反派！[色],啦啦，1234
116,"这导演编剧怎么会找这样一女来·演技颜值太差了    一部好剧就坏在这女人身上
",爱吹笛子de呼延寻琴
117,怎么会叫这女的来演,搞笑吧……滚开我的生活
118,这怎么看 不够生气的,很能吃的小小
119,这什么shab剧情 ,随意club_qq1869
120,剧情所致，导演安排的，她也没办法[呲牙],凯撒和王子
121,只有我觉得这女主的嘴有点出戏  总是嘟嘴,哭、囿谁心疼🍀
122,好好的剧本，给女主演砸了,寒烟灵境
123,这编剧[呲牙]，三年前？,卫丹城
124,能不能让这女的死啊,阿辉爱上了阿蒋
125,主角光环太严重，看两分钟都觉得浪费时间,¹⁹₀₄   ¹⁴₂₄
126,"其实并不会，还是认识到很多。如果是真实改的话确实也就是这样，不拘一格降人才也正常，我是跟着追完了。
",爸妈万福1314
127,怎么找个这么难看的女主呢？[捂脸笑][捂脸笑][捂脸笑],上帝D左手
128,想好好看，结果这女的演技，毁了一部剧,被烤的鱿鱼
129,什么乱七八糟的,摩卡小文世界
130,鲁诺演什么片为什么都刻意拖慢说话速度呢？？？,阿里噜呀😆
131,夏海荣让我不想看这部剧了，这女主拉低了这剧档次，不喜欢女主长相，,袁依然
132,整个中国找不到女演员了？,喜欢骑自行车de谷梁刚洁
133,女交警捣乱竟然没有责任还一顿好几个菜，这这是神剧,大魔魔魔魔魔王王
134,江苏省常州市的车牌,高大上_wx182265
135,毒品交易用练功卷，导演走点心吧,太阳雨141009
136,看了十分钟，果断弃了，三年小女孩妙变交警,超爱吃沙拉的仲长诗双
137,看呢就好好看，不然就别看，后面很精彩的,林丽伟🎊
138,这片本来挺好的，这女的一出现这片就没了味道[捂脸笑],Sybiao
139,看了第一集就不想在往下看了[捂脸笑],过去是用来回忆
140,这导演也不知道咋个想的，这女演员有可能是他家亲戚！直接拉低了这部电视剧的GTP,爱拉小提琴的哥舒飞翰
141,啊啊啊啊，题材我是喜欢的，但是看了吐槽，就不想看了,lucky.three.y
142,剧名叫卧底女警不得了，还精华呢,师夷长技以制夷^
143,缉毒警很危险，所以让她去做交警吗？没用且比缉毒警安全多了。其他例如刑警很苦也很危险。,汉堡店89564
144,第一集的剧情就失败了,徐卿9401
145,评论都说女主太xx，我还应该进去看第一集嘛,风光灿烂傅
146,好久没有这种类型的电视剧了，之前拍的有一些不太一样，这种类型的我特别喜欢看 ,做个吃不胖的瘦子呀
147,那桥不就是宜宾长江大桥啊,💞LᴍɪᴇxW⁹🥰
148,这是缉毒啊 弄的跟开玩笑一样,我有乛壶酒
149,剧情确实有一部分不合，但是我看了22分钟，就看见剧情被黑成这样，有点不合理,奉先 何是我
150,杜志国都已经70岁了还不退休还当交警没有演员了,闈徕哥哥
151,本来想看看，一看演员鲁诺，果断放弃,相遇相知不相逢
152,人民币出现练功券，打枪把额头打了，倒下去然后额头一切正常，这也导演太不职业了吧,宫长霆叶
153,"二O二三年五月十？日，我只能以时间为划痕记录着界址。
孙建云",孙建云黑牡丹
154,脑子有泡，上级再三下命令撤退还不撤退，作为一个警察不服从命令还没有被处分[微笑],XXXX- 尔玉
155,演员阵容强大，都是久经沙场的老兵。看了一会，感觉镜头转换有点快也有点飘了，看得头昏眼花，整体还可以的。,人在旅途～
156,电视剧榜第一和这个评论不搭啊，幸亏没浪费时间这么多差评,风停雨住_qq1235
157,这女的真不行，还当警察，如果说演技没问题，那就是剧本有问题，差评,曹毅大哥哥
158,这是怎么评上热榜第一的，看到那个封面都没有看的欲望,鸽纸🍓
159,第一集就让我没得看下去的欲望了，写的什么玩意,玲玲萌萌的！
160,刷视频来看一下，还以为是电影呢，这样的拦车还能活那么久,楼上给我占
161,说好用警花呢[捂脸笑],诛七七77
162,女主真无语,匿名用户
163,*从现在开始起，能否及时更新集数和内容，并在新片的排片榜中及时出现，谢谢，拜托了！,"王兄
王兄"
164,这水平凉凉吧❗,哈啰士
165,找个这样的女主角，瞬间不想看,v他刚刚人际沟通让他一天又一天
166,选演员很重要，看这个女演员就弃剧了看不下去,🇨🇳金姐🤗สู้ สู้
167,这女的长相跟鲶鱼绝了     哈哈,南宫扑燕
168,女主没选好，毁了一部剧,香虫虫
169,"感情用事，实际行动中怕不是这样的
",乌溪湾
170,"看到18分钟  果断弃剧啦
女主这人设  [尴尬]",沫一莫
171,夏海荣肯定是夏东海的女儿，不然不可能让她拍,抬举我了🍀
172,这女主的做法在现实不处分才怪,青山绿树🤩😁😂😂
173,因为这位“美女”，不想看了,秦南浪子💦
174,这部电视剧我也参加的,杨忠军（GH00212）男39岁
175,这电视剧傻子拍的，敢不听上头安排,范后君6米8
176,这个剧情不喜欢，不符合实际,无食桑葚于嗟女兮
177,法外有情！但这样的开头确实很失望，正能量！,非礼勿视😉❤
178,兴致勃勃来看，第一集就被女交警劝退了，不看了。,I am a beauty.
179,剧情可以，主演不想，逻辑辣鸡,一条人2000
180,没法看，看到女主直接弃剧,策马扬鞭5168
181,蠢女人，看了第一集就不想看了,策马扬鞭5168
182,没看一点就准备弃剧了，理由是女主演技太差，,inuitboyxxxxx
183,第一集耐着性子往下看,匿名用户
184,但凡有点脑子都不一样,很能吃的小小
185,剧情太拉胯了，一个交警，哎~不说了！浪费流量,CKLogic
186,片名卧底女警，简介的演职员表都没有女演员[捂脸笑],L.哦哦哦哦
187,真他妈是假货啊，拿练功券当钱,匿名用户
188,糟蹋这些老戏骨的演技和参与，果断弃剧,小李子就是内昂纳多
189,这女的演的不咋滴，白瞎这剧了,匿名用户
190,有谁知道女击狙手真名叫啥？好漂亮好酷！,匿名用户
191,我觉得还不错，女警察需要很漂亮吗！,祯祥🐣
192,这就看不下去了，根本不可能的事,嘿嘿，美女
193,外婆新世界看完了 来追这个剧,默默 888
194,靠，这女警什么情况，逆天啦,夜路王子
195,真的是，让停都不停，有点过了啊[捂脸笑],夜路王子
196,这个剧名太俗了……什么年代了还警花[捂脸笑][捂脸笑][捂脸笑],三镜头反光
197,看了这个女警瞬间就不想了,匿名用户
198,女主开始的人设有问题！,匿名用户
199,因为女主毁了一部电视剧，弃了不看了,匿名用户
200,我咋这么不喜欢女傻子,匿名用户
201,刚开始看到这女主就放弃了追剧,匿名用户
202,看这个女主看着情节真的是看不下去。,灵贞云
203,这女的这样在警队早被开除了,钱女友z l
204,看见这女主，果断弃剧！可惜了这些老戏骨了,幸运正式开始
205,在我们大常州拍的啊。看见钟楼大桥和苏D牌照了[大拇指],喜欢打高尔夫球の淳于嘉致
206,不看了，一个交警这么牛,真的是要起个名字真难啊
207,直接跳过，一点不想看这女的,老人与老人
208,这么多的差评～～我到底是看还是不看呀[呲牙],喜欢看电视电影的刘恋
209,这个男主的面相不太适合演正面人物[捂脸笑],木子帥🍂
210,这女主是啥来路？这也能演女主？还警花，笑死了,ztzb741028
211,"不是有老戏骨在我觉得是没有人看的
",爱吹笛子de呼延寻琴
212,"这女的一定是带钱进组   
",爱吹笛子de呼延寻琴
213,看剧名进来的，接着磕，估计会有惊喜,喜欢吃火锅の漆雕半梅
214,很讨厌女主的样子，她是靠什么上位的,袁依然
215,没有看下去的动力，剧情太挫，,1503804
216,这女主演的，看不下去了 ，弃剧 ,匿名用户
217,这第一集就看的窝火，这女的无组织无纪律,Lyqbla
218,奔着高亚麟导演来追这剧的，结果就这么个玩意,阿宇@💤
219,信号不好听不清，这完全是没脑子,阿宇@💤
220,挺喜欢那两个男演员，这个女的。不认识,还没想好叫个啥🤟
221,不服从命令，这样的不配当交警,幸运星闪闪发亮
222,因为这个女主拜拜吧，这个剧不看了,Veilahill
223,"三年 女儿就可以长这么大
",AA国际机场集团有限公司陈姐
224,特意过来评论一下，这个女交警投资拍的吧？,王正直♀
225,这跟狂飙简直天差地别,TDX丶雷神
226,这拍的演的看了5分钟就不想看了,匿名用户
227,苏南省这明明是成都的嘛,匿名用户
228,排行榜第一怎么来的，拍的水平太低了，最多5分,Gbo🎋
229,这个女主角是毒贩的卧底吧[捂脸笑],匿名用户
230,确实，这个女的这样一演，拉低了这部电视剧的档次,达哥燕妹
231,颜值不行啊，这种短发不是谁都合适,cqyanyan
232,剧情不合理 女主演技太差,抓兔子
233,"现实中不可能这么轻拿轻放，真当观众是傻子？
",匿名用户
234,010警号开头是电视剧里这个省的警号吗？？？,小小盾盾
235,这个女的竟然可以活过第一集，,东方雪狼99
236,第一集这女交警真为警察长脸了[大拇指][呲牙][呲牙][呲牙][呲牙][呲牙][呲牙][呲牙][呲牙][呲牙][呲牙],小小盾盾
237,啥意思，就是有关系咋样都行呗？,爱核桃
238,这剧本写得太烂了，还是几年前的套路,匿名用户
239,第一集就看起来没意思了,小丿五1225
240,明明是很好看的一部电视剧．切出现了一个这人😤😤😤😤,andejiancai
241,这么高调的女警能去卧底,wangyouqiang_qq1523
242,没有明白，卧底警花，都没有卧底什么事，起名卧底警花不理解[捂脸笑],爱吃火腿de小小达奚思莹
243,直接让她去缉毒警就行了嘛，真绕弯。,匿名用户
244,这么严重的违规，居然没受处分，咋想的,2315936941
245,什么东西，乱七八糟，不看了，,用户48ef83f7
246,非专业导演的作品较差，段和夏二个角色的演员演技差。,gzztx一笑而过
247,看到四个小伙伴同时打入贩毒集团之后的剧情，我都怀疑每集后面说道的缉毒警的真实性了,古惑兔仔
248,大家好好看，越往后越精彩，这个夏海荣演江瑞太对角了,จุ๊บ 蒹葭 😘
249,我觉得很好看，越后面越好看,匿名用户
250,给他胳膊一枪,小喜哥，
251,看到女主，果断弃剧,下一站，，？！
252,没看出来是警花,师夷长技以制夷^
253,不好意思 实在看不下去,匿名用户
254,硬凹的女主[微笑],匿名用户
255,吐了 吐了,匿名用户
256,女主绝对是减肥利器。,狄子🌈123
257,因为女主，直接散了,匿名用户
258,女主角就活了一集,波兰仔周琦
259,在常州拍的,岳封_qq1695
260,看了10分钟果断放弃[捂脸笑],匿名用户
261,草真搞笑没信号[色],想你的人是我：怎么样
262,"看不下去了
",百岁安生💚
263,有一部神剧,匿名用户
264,一分，不能再多了,伯傲玉
265,搞这个还不如看深渊,匿名用户
266,一分钟都看不下去[捂脸笑],匿名用户
267,"感觉还可以看
",adadgfgf
268,女主太冲动,◎ ⊙★ 『晓』★◎♀
269,太喽了，这部剧[衰][衰][衰][衰][衰],匿名用户
270,实在看不下去了,〃仓促
271,[666]十分钟不到劝退了。,爱吃豆包de百里韫玉
272,这剧……除了女主都挺好,匿名用户
273,这是在常州拍的,峻毅妈妈
274,还带快退的呀,用户5aef9269
275,整体还不错,亮凉了
276,来吧，这剧烂透了,Hi 静梦
277,[捂脸笑]影片质量是真差啊,匿名用户
278,看的脑壳疼[捂脸笑],匿名用户
279,一个老鼠坏了一锅粥,喜欢喝红酒的玫瑰不慌张
280,可惜了一帮老戏骨,匿名用户
281,确实父亲最爱孩子[大拇指],国甜田
282,夏海蓉让我弃剧,匿名用户
283,燕妮的晚节,爱唱歌de第五高邈
284,这女主真6啊[大拇指][大拇指][大拇指],只爱大波浪
285,确实不行  不是观众不买账  ,用户9422b817
286,md这女主 关系户吧,Dennis、shen
287,"
夏女警直接让我弃剧[捂脸笑]",匿名用户
288,导演把自己搞砸了,寒烟灵境
289,我在一大队油坊头,孙建云黑牡丹
290,反正我是觉得不好,4～3 . 2、丨
291,看着不舒服，撤了！,匿名用户
292,看这女的确实弃剧了[捂脸笑],匿名用户
293,女主好拉胯，弃剧。,豌豆米👍
294,成功被女交警劝退,182****3621_m1116
295,能不能换一个女主角,用户9241162d
296,看不下去了,用户9241162d
297,不喜欢女主，弃剧。,匿名用户
298,真难看这剧,Dilemma？
299,太难看了,匿名用户
300,女主干爹投资的,匿名用户
301,不能评分吗？,录先生的梁小姐
302,离现实差太远，不好看,钱女友z l
303,女主不行，弃剧,匿名用户
304,果断弃剧了,小小小小年呀👑
305,女主劝退了,匿名用户
306,编剧牛逼 走了,匿名用户
307,太难看了,匿名用户
308,看了半集，拜拜了您那,书香好香
309,女主把我劝退了，再见[捂脸笑],匿名用户
310,一只苍蝇坏了一锅饭,匿名用户
311,挺好看的啊[666],匿名用户
312,弃剧，大差了,江西老蒋
313,一点不现实，,匿名用户
314,什么情况？,榜一大表哥
315,好多演技派演员,爱拉小提琴的猫(^･ｪ･^)
316,这是电视剧？,○оo。//ka  Jacky
317,这剧情，第一集就这么烂,海岸边城
318,看个剧把你们忙够呛[捂脸笑][捂脸笑][捂脸笑],匿名用户
319,看了看了20分钟果断弃剧,TDX丶雷神
320,白百合比较合适,Catherine2015
321,看了评论弃剧了不看了拜拜[捂脸笑][捂脸笑][捂脸笑][捂脸笑],hanyu20190424
322,女主角真无语,匿名用户
323,哪个台演！,匿名用户
324,这个女的 真的无语   ,匿名用户
325,女交警的演技是…,🌈🌈🌈七彩阳光
326,真心看不下去了[捂脸笑],🌈🌈🌈七彩阳光
327,不符合逻辑,匿名用户
328,弃剧，这夏海容有点2,我不是hǎo 男人
329,果断弃剧,匿名用户
330,肯定没看头,885558😁
331,江苏常州拍的,MVP♪糖豆糖
332,这编剧编的什么玩意,匿名用户
333,这导演，呵呵,王小屁.
