,0,1
283,宗元圆的表演有着高度的专业性和自然度，令人叹为观止，一个多小时下来没有任何多余片段,能够吓到你的哥斯拉
284,宗元圆真的是一个很有自己想法和追求的一个演员！，我吹爆啊!!!,控制_悲恸
285,宗元圆成为了一位备受关注的演员，期待好久终于上线了,懂得人能看透
286,居然是女主护崽子姿势保护男主，拍摄手法也比较细腻,半世流理小野狼
287,宗元圆能够通过微妙的眼神和动作展现出角色的情感变化，任何层面来讲都是最好的剧,不熬夜只养生
288,最后担着女主的那一剑，彻底破防了，这会员开的不亏,认真摸鱼的菲菲
289,敖瑞鹏真的演的好 很有共情 台词是是原声吧，专业的制作团队精心制作的完美作品,五块钱的抄手
290,作为小成本网剧，诚意满满，还是挺有意思的，涨知识了感觉,说有多复杂
291,战损妆的感觉真的是好适合他，这个剧太好看了，一定要好好宣传,古今天地_任我主宰
292,宗元圆的演技已经达到了一个非常高的水平，real过瘾,天尽头苍茫
293,宗元圆是当之无愧的一位演技派女演员，有逻辑性，有疑点重重,绵绵_随机掉落
294,宗元圆简直是在演我们呀，这个开头就比其他几部多了,花少一生推
295,宗元圆是当之无愧的一位演技派女演员，主创团队真的辛苦了，谢谢你们,黑土养一方人
296,什么样的喜欢，才会让阿宝奋不顾身的去放那一剑，比较新奇,擅长清空的猫
297,宗元圆的演技已经达到了一个非常高的水平，这部电视剧确实厉害，不狗血,Seven_VA
298,宗元圆能够通过自己的表演将角色完美地融入到故事情节中，看电视剧走起来,Katrina9A
299,邓超元作为演员的魅力要溢出屏幕了，决定继续追下去,似风如诗的喜
300,敖瑞鹏台词功底飞一般进步，预感这部剧要火要爆,意难平也得平
301,布景什么的也还可以，细节要素众多，希望能继续保持,地面煎蛋的夏天
302,宗元圆演技精湛，情感细腻，整部剧现在看着还挺期待后续剧情的,landcruiseA
303,宗元圆真的有进步 眼神以及内容都很到位 期待他的继续发展，为了看这个充了会员,梦梦在学习。
304,敖瑞鹏可以啊，希望以后内娱多一点这样的电视剧,Dharma_Geek
305,整体剧的质感和演员表现都很好，剪辑没有让我云里雾里,努力维持人形的香菇
306,战损修狗和前面憨厚耿直的慕容宝真的是判若两人啊，这部电视剧确实厉害，不狗血,吃不起水果的嗑盐人员
307,宗元圆的表演充满了魅力和张力，质感属实是做旧了,黑暗里的49天
308,宗元圆能够通过微妙的表情和动作展现出角色的情感起伏，好看,玛绿莲white
309,敖瑞鹏演的真好，又轴又萌又聪明，在节奏感快，演技都很好,PolarisbaiA
310,宗元圆的表演让人感到非常震撼和美妙，剪辑没有让我云里雾里,🌙沐呈悦
311,嗷嗷～又是鹏鹏的剧[色][色]，先评论再接着追剧[应援][应援][应援]，真棒👏🏻给我们的🥝三十二[大拇指][大拇指][大拇指]就应该多多来几部这样全集放送的剧[666][666][666],の懒懒の
312,第一集确实看不懂，看到第六集真香，但是17集就开始虐人了，结局有点奇怪，整体还行,vivi113
313,古装、武侠剧，虽然有点现代台词，导演风格吧，不过还可以，别再哪个演员精日或者舔美，或者偷税漏税影响我心情了,爱喝矿泉水之管闲居士
314,重温第二次少年江湖电视剧，真的非常好看，演得特别好,绿叶之魔
315,就喜欢这种放全集的 之前的一闪一闪亮星星 卢洋洋那个剧 还有刘怡潼那部剧都挺好看的,SamourYU🍀
316,胡歌为啥不拍电视剧了，琅琊榜看了3变，伪装者看了2变，在没好看的了,没有钱真难受
317,真的好看，敖瑞鹏你就焊在武侠剧上，再出两部必火,水笙苼木
318,我觉得敖瑞鹏真的好帅，国子监来了个女弟子就感觉他一定会红，好感动的[色][色][色][色][色][色],灿烂的大牛哥
319,唉，没有VIP的痛苦 ，只能等周五六的时候 更新两集了 ，呜呜呜 [大哭][大哭][大哭][大哭],息山神女❀息芸
320,我终于又可以从大结局倒着看到第一集了[应援][应援][应援]爱看哪儿就看哪儿[应援][应援][应援],狐狸尾巴猫🎐
321,好看不 ？咋有dcy呢，一看到他就想到他遇到粉丝丢下女友跑路哈哈哈哈哈哈哈哈哈哈哈[呲牙] 影响我看雷无桀‘不好看我就不看了[捂脸笑],真是太可可了呢
322,隔壁一个多小时的剧情，分成20多集短剧发，还不是天天更新，有些是真的好看，但是有些是看着就烦[捂脸笑],炸天帮消炎
323,2007-2008年那时充会员看电视剧都是全集！那时候才是感觉会员的意义，现在感觉很不喜欢，好多剧看完6集就要等待,经济开发区888
324,过去的，别再遗憾；未来的，无须忧虑；现在的，加倍珍惜那些看似不起波澜的日复一日，一定会在某一天让你看见坚持的意义。,梦儿美梦
325,世间事，人生情，看开随意，看淡无虑。心若不在，何必强求；人若不爱，何必强留。学会拿起，学会放下，万般自在。学会让一切随心，随意，随缘。,梦儿美梦
326,无缘的真，是人生的欢喜，无缘的散，只是人生的离别，偶然的思念，憔悴一世的繁华，再见的缘，只是彼此的情，分手的梦，撒落一滴忧伤，一滴爱情，失落的卑微，继续无奈。,梦儿美梦
327,[捂脸笑]不知道是不是看多穿越剧了，刚看第一集听女主说话就知道不是这时代的人[捂脸笑],～梦幻仙境～
328,放全集可以的，就隔壁那个看见缘分的少女，一开始很感兴趣，结果就是等更新，到最后懒得看了,小小的天地间
329,烂剧无疑，这是老早拍的剧了，看雷无桀演员小火了一把就放出来了，这里他好像也不是男主，你们还是期待他以后的剧吧，希望他多接打戏，少年歌行好看主要还是得益于周木楠描写少年气的笔力，只要剧本好片方态度好基本不会拉的，不得不说小说改编还是得让原著作者来写剧本,冰菓ツ
330,就喜欢爱奇艺，这就是vip的特权啊，在库那实在太憋屈，直接撤,小鲁喂
331,啊啊啊啊啊~为什么要折磨我？我还要准备中考呢？你怎么一下更了？我害怕我控制不住我自己呜呜呜呜呜[大哭][大哭][大哭][大哭][大哭],【囍】🍂
332,"我有点不敢相信,特地来讨论区求证一下,全集啊[色]",红雨vs蓝雨
333,这剧情看了没有往下看的欲望，这剧情考验现代人的智商吗？唉！,审判者灬绯
334,[666][捂脸笑][微笑][666][666][666]肚子好饿，我只能握住拳头，打向自己的肚子，帮自己出口饿气,夏沫浅-雨
335,好家伙直接是全集 太开心了 前天才知道这部剧预约了 今天就能看到全剧 好幸福 谁懂[应援][应援][应援],一路漂向北方
336,宗元圆是不是模仿虞书欣？但演得怎么这么讨厌，问题出在哪,Mr_KHK
337,如今电视剧都是请新人便宜吧，便宜就算了关键得适合演武侠剧呀！女主角让戚砚笛来演绝对[大拇指][大拇指][大拇指],跳 跳 虎
338,放全集多好，降低风险，不然以目前的影视形式。下架的剧太多了,十二号玩家M
339,江湖之大，也逃脱不了一个情字！总是有几对cp有感情纠结，搞得死去活来的[色][色][色],琉璃风殇
340,爱奇艺一直都是我信赖的平台，比某些平台不知道好了多少倍，只有这个平台才会让我舍得开一年的VIP，爱奇艺加油！,轩齐颜
341,如果有一部直接更新的剧，别的会员不买了就买爱奇艺了，否则别怪我移情别恋哦，多多做些好的作品,Mist金伟
342,本来我是不想看的，奈何人家诚意满满。一下放全集,你妈，怎么不更新？
343,很良心的剧一来就放全集，希望以后别的电视多多学习,若爱 ， 莫离……
344,台词不给力。不够古代,夕瑶累了
345,"有来二刷的吗
",铭小霜💫
346,想看宁安如梦,wzwlenen
347,放全集真好[爱心],芝是你
348,一次性更完 爽快,٩💤hz💤۶
349,演员咖位不够,二胖兔🐰
350,就喜欢这样的,蓝莓干什么
351,终于开播了,🐑🐑YYZ
352,全放完啊[666],张茹玉
353,我去，直接放全集！！！,暗影殿的萱卿
354,男主角还演了一个少年歌行，这女主角完全没有听说过演过啥呀[捂脸笑],用户4d0c6c18
355,古装武侠和仙侠剧越来越倒退啊！,星辰loveuuaaaa
356,女主好像虞书欣，男二好像王鹤棣！有人同感不？,sunshinezhiyan
357,这个雷吴杰竟然当男主了啊,A—う请叫我小韦俶俶
358,无冷却闪现 ，就问你们怕不怕[狗头][狗头],明興
359,听到粉丝就不想看了！古装不是古装现代不是现代不伦不类！,旭阳映月—
360,我看封面是以为是虞书欣和王鹤棣,4.8j
361,啊，这这我CPU烧了这电视剧还能这样拍？[捂脸笑],我要一个西柚
362,现在的古装电视剧，太假了，,流年似水0323
363,为什么那么像虞书欣，还有王鹤蒂,Zw·☀️
364,美女拍的剧，功夫好，爱江湖剧[微笑],耀玥dxj
365,这个夫人就是陈芊芊里的 花园城主！！！！！！,哈哈哈喵喵猫猫
366,只是为了看敖瑞鹏来的 😂😂😂 同感举手 😂,哈哈哈喵喵猫猫
367,这不意林的《清河公主》吗？,DuHai🎊
368,这剧前8集还好，情结动人、剧情紧凑。后面的就好像突然换了导演和编剧，剧情改的就像是更年期，让人看了易怒、烦操、想打人。感觉跟有翡手法很像，武指发挥不稳定，侠客们功力忽高忽低，智商也是。我特么本来是下载来看的，看完气的我不得不来这里评论。导演啊！编剧啊！不行就退休吧，别特么霍霍大家眼睛和人民币了。,秋🌸2021
369,女主睫毛妆化得可有问题,lucy_huangna
370,全集女主为主，为何排名男主后面？,黄凤群_qq1055
371,开局放到现在，女主要判几年啊？[捂脸笑][捂脸笑][捂脸笑],请给我一支神笔马良的笔
372,所以女主到底什么身世,欣光1
373,啊啊啊好看[色]，两天追完了[应援]希望有第二季,Aeson
374,男主在这里面的妆伴还是很好看的,涵涵岚岚🌸
375,看起来全员都有点东西呢，期待着哦,睡个觉都是爱你的形状
376,像微电影一样节奏感太好了，都是实力派演员,爱看花花的草草
377,美女帅哥好般配，很有味道,牛奶盒子浓浓
378,从主演到小配角演技都很不错，又回来了,肉肉肉我爱吃肉
379,好看！好看！剧情精彩，预感这部剧要火要爆,彬大喵~
380,宗元圆成为了一位备受关注的演员，挺好看的,章鱼洋葱卷
381,宗元圆的演技真是让人惊艳，这部剧情特别好,在冬天喝啤酒
382,弟弟的演技真的是很不错哦，前排加入观剧大队,trickttt-ai
383,拍的特别真实，迫切地想看后面剧情,想要一个男朋友A
384,宗元圆的演技不仅仅是技巧，期待着哦,21世纪的chno
385,像微电影一样节奏感太好了，80%以上的精品度，爱了爱了！,有个栗子掉了
386,当时看原书的时候想象过男主样子，期待后续,小时候脑袋被门夹了
387,宗元圆的演技让人看得非常过瘾，追得津津有味,Woobeibei 
388,Get到了敖瑞鹏的颜值和电视剧，剧情也很抓人,阿武睡不着
389,宗元圆太鲨我了，怎么会这么御，更新再快儿吧,三十岁的孩子A
390,敖瑞鹏的电视剧在线，特别眼神，看电视剧走起来,狗不理的铲屎官
391,这个剧好多我喜欢的演员，看的太爽了,战斗囡囡密斯陈 
392,宗元圆的演技非常独特，给我大晚上看精神了,爱吃豆芽的比格弟弟
393,演员演技很好，希望多一些这样的片子,元气少女爱赖床
394,被宗元圆惊艳到了是真的好帅啊！，比较新奇,chindroid yeah
395,演员演技很好，马上就拉朋友一起追剧,吃货的人生不解释A
396,细品的话是很有意境的，可以追,隔壁家的种草小王子
397,场景造型什么的都能感觉到用心，追追看,每天八杯奶茶A
398,敖瑞鹏可以啊，专业的制作团队精心制作的完美作品,无渣型渣男
399,宗元圆好漂亮好灵动呀，挺好看的,克劳帝斯大公
400,又美又帅，又御又可爱的，简直绝了，这个剧情爱了爱了,吃名字真费劲
401,恋爱剧难得有好剧情的作品，剧情真的特别棒,余梦今生浮如梦
402,敖瑞鹏可以啊，继续追剧,何梦小白白白
403,宗元圆的演技极具感染力，越追越上头,观一叶天下秋周
404,这玩意和少歌有啥联系,我欲乘风向北行🌻
405,少年江湖我快笑死了， 爱奇艺也是好眼光,虽远必诛小肥龙
406,人物设计合理，给我锁死啊,潇潇不爱笑A
407,这部剧细节取胜，真是咋看也看不够,巧克力不加糖A
408,少年江湖好下饭，这个阵容期待了好久,jackyloveA
409,故事情节曲折紧凑，80%以上的精品度，爱了爱了！,貔古拉斯貅
410,导演和编剧还是非常用心的，看完之后还想看,等不到结局等时光
411,少年江湖好下饭，心中本年度最佳,短腿的长劲鹿
412,冲就完事了，为了看这个充了会员,Ai酱赛赛赛赛高
413,特别贴近生活接地气，马上就拉朋友一起追剧,元气满满小野马
414,敖瑞鹏电视剧炸裂，剧情很精彩,狂小柴
415,这个剧好多我喜欢的演员，有逻辑性，有疑点重重,缩龟壳的小猫咪
416,战损妆的感觉真的是好适合他，这种好剧真的是越来越少了,小灰机机机机A
417,甜份过高要小心，比大片电影好看多了,挚歆A
418,冲就完事了，预感这部剧要火要爆,刘本秀秀秀秀
419,宗元圆的表演非常自然，都是实力派演员,低头思个锤子
420,太好看了，敖瑞鹏演的太棒了，真上头,西华门女阿姨。
421,拍摄手法很符合年轻人的口味，演员可！画面可！,小小沙漏A
422,人物和情节都比预告饱满很多，是难得的好剧,万物因我一念花开
423,像微电影一样节奏感太好了，这个真不错,今天我是王富有
424,作为观众看得也很享受，这剧已经被我锁定了,丛初柔小童鞋
425,打工人精神状态be like，觉得节奏滤镜都很好,粉红色的天际线
426,甜份过高要小心，继续追剧,变美变强变厉害
427,觉得全员演技在线，追定了,惶恐*一片狼藉
428,少年江湖是不是耽改改的加女主啊，非常喜欢,浑浊的天空AA
429,宗元圆大大不要再散发魅力了，期待后续啊,万籁的牢房
430,主人公表演自然到位，目前五星极力推荐,阿华田不如阿华甜A
431,这部剧太符合宗元圆的气质了呢，真的追上头了,是寒少鸦A
432,编剧写的剧情人物有血有肉，太有内个味道了,嘻嘻_叫我绒绒
433,演员都很在线，都是实力派演员,喜提新晋墙头
434,啊哈哈哈好盛师父真让人羡慕啊，真的可以,SixoneA
435,宗元圆演技精湛，情感细腻，好看,一路上过得怎样
436,重点是服化道非常加分，要认真看剧了,麻木的那么快A
437,期待接下来的剧情，比大片电影好看多了,常驻火星的火星君
438,剧情很能让人共情，我看完了，家人们，我好危险，我害怕,如此完美_宝贝
439,少年江湖是不是耽改改的加女主啊，追定了,造物者_XL
440,弟弟的演技真的是很不错哦，节奏明晰，值得一看。,爱滑雪的猫
441,宗元圆的表演有着非常高的艺术价值，值得一看,浮夸只属于华总
442,画面极美赏心悦目，在我心中这就是年度最佳,立风飒我A
443,宗元圆的演技非常出色，这剧已经被我锁定了,幼儿园最靓的障仔
444,邓超元的眼神戏很有层次，都是实力派演员,白月光_炸
445,宗元圆的表演充满了内敛和细节，这个剧情爱了爱了,天仙落泪_卷
446,喜欢这种一次性看全集的感觉，都好赞！,壳总王者不朽
447,敖瑞鹏可以啊，很有诚意！,好景多长_暗香
448,画面让人很舒服，应激反应也看得人一颤,原味小仙女A
449,演绎精当故事精彩，演员演技特别到位,微妙*蜉蝣
450,感觉这部剧的风格挺大胆的，看着真不错,春暖花会开*
451,宗元圆的演技非常出色，觉得节奏滤镜都很好,来自火星的土豆A
452,人物设计合理，目前五星极力推荐,短野原美绪A
453,认可度还是很高，内容满满，节奏快,OmegaLeeA
454,好本子技巧上成熟老练，布景，配乐，转场厉害,中年人类
455,恋爱剧难得有好剧情的作品，演员可！画面可！,家住白云区的周先生A
456,人物设计合理，这是一个关于信仰的故事,亥乃亚克山冬
457,敖瑞鹏电视剧不错，从一开始关注他，追追看,儒雅的嬴乐安
458,每个重要的点都演的很细节，导演转场真的厉害，节奏快,LakeOnFire
459,开播就全集 很难不爱 要是都这样就好了,深海中的月光💤
460,特别贴近生活接地气，主演神仙阵容加持,晴空正好追星日
461,导演真的很会调教演员，希望多一些这样的片子,Talkaholic_L
462,宗元圆的演技真是让人惊艳，real过瘾,中场休息时搓澡
463,感觉这部剧的风格挺大胆的，剧情不拖垮，精品好剧,怒罗为门
464,一集都没能看的下来，直接太出戏啦,用户56ddcdba
465,脸型像邓伦眼睛像罗志祥黑眼圈好重啊好虚的感觉,A雪暮
466,就喜欢这种一次性更完的,小莫洗手
467,什么意思？不能说“三观不正”吗？说了就是不友好？,小小鱼儿雨☔️
468,现在的电视剧，拍的也无语了，没看头,長島的雪
469,没一个认识的，看的人都没有,🥸🥸🥸🥳🤩😎🤓🧐🤨张三
470,这个字体也太大了吧，哈哈哈,匿名用户
471,"迷上敖了

@柠檬糖🍬: 我捡不起破碎的你，也好好看







[应援][爱心]",.不是西
472,爱奇艺真是追剧最爽的平台,奶茶223
473,女主长的真心不好看颜值演技不好说[捂脸笑],法国回家结婚vv好
474,女主要是换个，会更火[捂脸笑][捂脸笑][捂脸笑]感觉挺好就是看不下去,匿名用户
475,这么一卡一卡的！~好累眼睛啊!~,时/pz光
476,好看吗。好看的话我续个会员,温柔且傲娇😃
477,放的什么乱七八糟的东西啊？,混沌之初的天空
478,看第一眼以为是王鹤润,会哭泣的小仙女
479,为什么说现代话台词，穿越剧？,💕张先生的憨憨🌙
480,但愿中途不要下架 一下子能看全集也是挺爽的 ,💎👑💐生命奇迹💝💛🍧
481,我去，一下全集真好，要是所有电视都这样就好了,匿名用户
482,这剧还可以[应援]轻轻松松主要是不费脑[捂脸笑],我喜欢你眼里的星星✨
483,想问一下，这部剧好看吗？最近剧荒了，有推荐吗？,匿名用户
484,不一定好吧，很多好看的放全集,Ice莎莎🐇🐇
485,这种东西也好意思拿出来放,烂片时代
486,看完这部戏后，我面色凝重，深深地低下头，默默的关掉电脑，起身打开冰箱，拿出一瓶伊利酸酸乳，紧紧地握在手里，细细的回忆着刚才的剧情，慢慢的走向窗前，外面的景色有些暗淡，就像我的心情一样，沉重。。。很沉重！渐渐的，外面灰蒙蒙的下起了小雨，为什么会这样？我的视线开始模糊了……不知道是我 流泪了、还是雨太大了！可能都有吧…… 我的心情更忧郁了，我再也无法抑制内心的情感！缓缓的打开窗子，对着窗外大喊了一声：这到底演的神马玩意啊？,浮生…若梦🤙
487,前面有很多细节没看到，来二刷啦🥰,月饼糖
488,[666]我喜欢先看颜值，爱情甜不甜，帅不帅[捂脸笑]有一样的吗？集合集合,天使之名
489,这女主怕是化妆师要黑她吧,覃果果
490,喜欢男一男二，可惜女主越看越不想看,此号已废！？
491,"开局就满还看的，咋都没有人推荐啊
",匿名用户
492,那么好看的电视剧，不知道为什么没有火起来,文艺青年哦婆佛你
493,女主也是姓慕容，男主也是姓慕容？他两谈恋爱？[捂脸笑][捂脸笑]不是兄妹,🤗️🤗️🤗️雪儿
494,结尾显示有第二部，所以第二部什么时候[呲牙],匿名用户
495,女主不是很OK啊，想李宏毅来,匿名用户
496,我也来看敖瑞鹏的，演得太好了,匿名用户
497,喜欢这样播放，就应该这样痛快嘛！[应援][应援],三亚一年
498,谁已经看完了或者看几集了，能不能告诉好看不[捂脸笑],匿名用户
499,女主这人设有点无语 坑蒙拐骗[微笑],匿名用户
500,好几年前看过原著小说，都忘了内容了,我的盖世英雄520
501,我的老天，这是多大的福利，必须追了，好爱[色][色][色][色][色][色],灿烂的大牛哥
502,带资进组演戏的人越来越多，女主啊,方名祭
503,奔着男主也没让我看下去的欲望,方名祭
504,我去，全集都有了我靠我喜欢,匿名用户
505,现在这电视剧拍的越来越拉胯,匿名用户
506,还[大拇指]有比这个更牛逼的嘛 全更,匿名用户
507,优秀，不要等更新。好多剧等更新，等着等着不想着了 月升沧海等,大庆庆Q
508,主角的名字总让我联想到慕容冲和符坚[捂脸笑][捂脸笑],俏皮猫小五
509,一次性就更新全部的电视剧真好，直接看完,星球文化
510,热度冲冲5000看慕容宝吃10个鸡蛋,荨湖mm
511,离5000没多少了，先让宝吃个鸡腿先～～,saideruike
512,看这类剧的是不是都是小屁孩！20后的人！,婲✨岆
513,有哪个姐妹和我一样看过意林小小姐！公主系类，这本是小淑女系列里的清河公主传！我小时候就觉得这些书拍成电视剧肯定很好看，但估计肯定改了很多！讲实话，我一直觉得作者第四册写的很水，厚度直接是前面每部的二分之一，还是个开放结局，就非常失落。,匿名用户
514,就喜欢这种更新就很会员看全集，啦啦啦[应援][应援][应援][应援],NAZ.啦啦啦
515,我的清河公主[微笑][微笑][微笑]改得只剩主演名字了[微笑][微笑],☆荼小柒~๑.
516,好家伙，演员表只有三个人,怡儿👍Brandon🌼
517,这样，我觉得都会买会员放,谦笑
518,这个播放速度，简直霸气。,烟雨茹画
519,这才是VIP该有的样子，一次全集,薛薛谦最棒
520,卧槽 我是来看武侠剧的 不是来看穿越剧,亦解忧唯有杜康
521,这个不就是我小时候看的小说吗《清河公主》,yuzuru❄️⛸
522,不愧是爱奇艺，一下子全集，爱了爱了,理智的…～
523,后期色调 黑场有点死啊，咋不调调 ！感观不好呀 ,喜欢喝饮料の稀邮
524,看第一集就看不下去，剧情太拉夸，哗众取宠,slalffff
525,喜欢这一下子全发出来[应援][应援][应援],憨咪
526,还可以，冲哥晕倒那里笑死我了[捂脸笑],赵喜喜
527,就喜欢这速度，正愁着剧荒了呢[色],用户4da2d9c6
528,昨天看了剧组直播 破5000让一分钟吃鸡腿🍗,吃土豆片的红红公主
529,一下子更新完，太厉害了,落衡LH🌟
530,这不是陈芊芊里面的城主吗,Jane  Elizabeth
531,这是改编自小说《清河公主洙宛传》,流年不语殇浅夏l☀
532,我在别的平台搜这个剧显示是 2021年的剧[捂脸笑],苗苗苗禾
533,一个古风虐文改成网络梗甜宠了我真的会恨,香蕉苹果牛奶西瓜
534,我看封面以为是王鹤棣和虞书欣 勿喷[捂脸笑],你叫不可能
535,真爽快，一下看全集，必须[大拇指][大拇指][大拇指][大拇指][大拇指][大拇指][大拇指][大拇指][大拇指][大拇指],哈喽王大大🌟
536,说都是现代的司[冷汗][擦汗]哪点像古代,欠你的今世💑
537,我看播放量第一，想着这是新剧还是以往的剧[捂脸笑],昵称已被占用 ！✨
538,给你大大的赞[应援]全更新了不知道好不好看,墨一波
539,评论少，看来不怎么好看啊,会飞的猪Katherine
540,学网飞却没有它的质量,@枫焰
541,一下全集，属实有点惊喜,贰叁｀
542,会员观看全剧，开启追剧新模式,风中的面条
543,女主不够漂亮，上嘴唇不好看,喜欢吃橘子的公上丽玉
544,突然发现全集来了 快乐就是如此简单,CC_freedom🐰
545,我太爱这种一下更完的感觉了，爱奇艺我爱你[爱心][色][应援],往事随风飘散开来k
546,说实话女主这颜值不抗打呀,a249881158
547,[捂脸笑][捂脸笑][捂脸笑]古装剧拍成这样我也是无语了,很乖的大憨包
548,今天放假正好一次性看完他～～[666][666][666],saideruike
549,熬瑞瑞瑞加油期待上错花轿嫁对郎[色],晃晃的小可爱💓
550,要是每部剧都这样，我能省很多钱。[捂脸笑],蓝TL0327
551,看了简介，没有想看的欲望,我是练习2年半的蔡机
552,一次性更新全集 泰裤辣！！,玖Fossette
553,像这种剧，还是爱奇艺就给力了，好爱啊[应援],幻夜之下
554,太激动了 全集啊 可以一直追到爽了[应援],吴LOVE王
555,完了看这剧脑海里一直浮现护心的天曜,懒儿^ _ ^￼
556,感情戏少点的剧就好看[应援],猫咪的运运
