,0,1
0,看到女主就不想看了,一工乙c0
1,好好的古装剧，加了现代词就变味了，作剧的幕后者能不能尊重一下这么好的演员阵容,十字街口的孤影
2,好家伙 一下子放全集 如果所有的电视剧都这样多好[色][色][色][色],喜欢喝酸奶ii
3,没有敖瑞鹏我估计这剧8.1的评分都没有[捂脸笑][捂脸笑],曾经拥有过yl
4,敖瑞鹏的电视剧已全部追完[色][色][色]，少年歌行，漏电男友，张昊天，食梦君，看见缘分少女，少年江湖[大拇指][大拇指][大拇指],萍*^_^*ImmanueI God with us
5,突然发现这部剧居然是我初中最喜欢的小说《清河公主洙宛传》改的，到现在都还超级喜欢这部小说，敖瑞鹏也是我很喜欢的演员，真的超级激动的好嘛[色][捂脸笑][捂脸笑][捂脸笑][捂脸笑][捂脸笑],笙笙 and soso
6,有谁和我一样是来看敖瑞鹏的，举小手吧！,奔跑在孤傲的路上😚😚
7,受不了啊，好好的清河公主改的不伦不类的,DreamDawnYou
8,这部戏是意林小小姐公主朱宛改的吗[色],银河湾下冰雹了
9,不是不会真的有人觉得这种坑蒙拐骗的女主很可爱吧，现在看剧真的不能带脑子,随心就好1026
10,我去，全集！！！ 希望所有的电视剧都可以这样，一上来就全集！！,🦁赚钱多多
11,看女主说话好像是现代穿越的？好好的古装武侠，说现代的网络词，好出戏啊,铃家小女
12,为什么很多喜欢的都要会员，并且还是独播，几个会员养不起呀[捂脸笑],★無殇
13,女主是带资进组吗？长相一般般呐,自由随行-MY
14,在座的各位有谁跟我一样 1.先看演员 2.看简介 3.看评论，跟我一样的话，来这里集合,巷后酒肆
15,这女主太普通了,尹广宇_qq1611
16,咱就是说这么光明正大的抄山河令真的好吗………………,复暄雪
17,大家看完这个可以看全世界都在等你们分手 感兴趣的可以看一下 也是会员全集可看 谢谢啦 我也是看全世界的时候看见这个的,热水。
18,放全集的戏都是质量不咋地的,A小魔女
19,窝趣我小时候看到清河公主啊[大哭],ohhluuu
20,而且剧情太烂了，跟少年歌行不是一个级别，敖瑞鹏以后不要接烂路了，还是雷无杰适合你,叮当猫314
21,差评，什么导演什么剧情。没法看下去,86`梦多啦
22,看完熬瑞鹏少年歌行雷无桀过来的,不看莲花楼是你的损失
23,改编太多，从小就看过原著的原著粉表示不太喜欢这些改编的设定[流泪][流泪],Hermione Eyre
24,怎么看不到简介？,皮皮我们🙊
25,这女主的设定真是无语了，靠坑蒙拐骗吃香喝辣[傲慢],爱涮火锅の延陵文景
26,就喜欢这种一次性更新完的剧,奔跑在孤傲的路上😚😚
27,哈哈，这是古代剧吗？,初夏阡陌九月
28,把女主名字改了，还把女主先前的身份弄的不伦不类，硬是加入江湖的老套剧情[流泪][流泪],Hermione Eyre
29,这女的谁啊！演短剧都不找好点女演员吗,最末_
30,一看就是舔宠剧 啊，跟少年歌行没法比,~吾责天~
31,这是什么乱七八糟的,",.,.,,.............."
32,现在的都些什么啊[捂脸笑],A   ℡不良 人
33,女主换个漂亮点的就好看点了,飘摇谋虑
34,就是个人绝的女主不好看，也不喜欢,💍芬🌹
35,牛肉做成香肠的有吗？,古宗族伊裔小康食膳堂
36,记不得之前是哪部剧跟这个雷同了，也是夺秘笈然后灭门,九天战祖
37,电视剧越来越差了演技都是小鲜肉,忘了名字😘
38,全集666[应援]今天一口气看完,為靈一笑，換你天真無邪
39,秘杀名单,小斌🌙005
40,好看吗 我是看到男主才来的,i我是读书人
41,为什么每部剧都要VIP才能看[呲牙]，,洛小草
42,台词这么浮夸，还有，哪有这样的剧情，一开场骗人钱财，还打人有理，男主表现还可以,爱喝矿泉水之管闲居士
43,老太婆太狠了 ，居然以命换命，,龙城、飞将
44,女主活泼可爱，挺有意思的[爱心]继续追,雷梦梦之旅
45,不错哦，蛮精彩的，值得一看！,285494673
46,好家伙我就喜欢爱奇艺的大气[应援][应援][应援],诗荟花礼猪猪
47,女主不好看,星川落子＆🏖
48,"男主角一点都不帅
武戏能不能不要靠特效
[捂脸笑]",好好好吃饭过
49,许久未看古装剧啦！还不错[应援],☀小雨 ✨(^з^)
50,还以为江山代有人才出，结果是一代不如一代。对于现在的古代电影电视剧彻底是报废了,℡佛主
51,"跑个路害了多少人的东西  三观不正
",三声话衷肠
52,直接就是这部剧改的是不是有点太大了[捂脸笑][捂脸笑][捂脸笑],银川川
53,刚看完少年歌行 好看  刚好看到这个剧[呲牙],加菲猫Y(_)Y&#61;@~@&#61;
54,这个女主到底是谁？我都不认识，听都没听说过,夜风冷冷💯
55,好烂的局,南小天
56,喜欢古装小甜剧，江湖历练闯天下一类的，有一样的嘛，举个小手看看吧！,翩然入君怀
57,好家伙，这竟然播了，我才知道,南朝四百八十寺🐾
58,[色] 就喜欢这种一次性更新完的剧,军师6666
59,敖瑞鹏这个剧里的扮相没有少年歌行里雷无桀的好看,戴燕妮冲呀！
60,这还是沧海镜的清河公主吗？怎么拍成了这样子？,小鹿麋鹿啦😄
61,好看，好久没看到这么好看的剧了,huafans0134440722
62,看名字我以为是五代十国的背景，慕容冲和前秦皇帝苻坚历史上有一一段[应援],努力的张建中
63,为什么感觉是穿越剧,轩辕世子
64,"头一回看到结局女主男主男二幸福快乐生活在一起的，这部剧情特别好[应援]
",麦克斯坦森
65,这次爱奇艺这波操作，太爱了，一下子全集,宣萱1207
66,丫头比小姐有气质,舒凡1121
67,很好看啊,萘靑
68,一下子放全集，这么厉害👍🏻,晶晶玲珑08
69,这是穿越剧吗？,忆往昔回首i
70,女主不好看,丽丽54846
71,第一次见一上线就放全集的[大拇指],林辞甜😘
72,小如的师父是谁,兔宝宝护花
73,[应援][应援][应援]才想起来,淼淼º
74,一下子放没热度啊啊啊,祺tong话
75,蛙趣，太好看了吧,史峰0402
76,大家放心进来看，入股不亏[呲牙]绝对是部喜剧，建议在人少的地方观看，不要学我笑出鹅叫的声音影响形象[捂脸笑],柠羽0.0
77,男女主是谁啊,永远陪我⁸
78,我觉得还行吧,雨后的誓言
79,搞笑吗这剧  [坏笑],Nai_何
80,他和王鹤立他们两个真的好像呀,懒羊羊˙Ⱉ˙ฅ
81,啥时候播的,喜欢喝黄酒的漆雕鹏涛
82,轮鼓沙吓了？,石头布丁！
83,一口气追完简直不要太爽!,今天不敖了
84,老婆不服？,石头布丁！
85,太好看了,HCChn
86,还以为是少年歌行第二部才开的会员，这都什么呀，感觉不好看啊，跟少年歌行差远了去了[捂脸笑],奋斗者征途
87,看封面因为王鹤棣呢[捂脸笑],80後追忆青春
88,低配永远是低配[呲牙],Lilliana·娟
89,就喜欢这种一次性放全集的[色][色]看完少年歌行之后为敖瑞鹏而来[色][色],我的未来_qq2316
90,真他娘的手一拿手机换片了,昨天是历史¥
91,简介中的鸡毛蒜皮的武艺[微笑],斤斤计较哈哈哈🎊
92,现在的电视剧女主是真的越来越没有颜值担当了,高姿態的_小女人
93,看到慕容冲打戏，我就绷不住了,Yubo.💘
94,一个老演员都没有，辣眼睛,娟娟子呀🍂
95,先问一下是两男挣一女么？喜欢敖瑞鹏但是不想看俗气的两男挣一女[捂脸笑],滚滚女神
96,敖瑞鹏的电视剧已全部追完[色][色][色],奋斗吧，青春💞
97,要是白鹿，赵思露肯定好看,点痣祛斑
98,直接放全集  我爱了！！！,🐑🐑YYZ
99,跟原著全改了 好像就用了名字完全不是原小说,很行🍑
100,看了简介，3人行注定一人孤独终老,喜欢吃橘子的尉迟越泽
101,头一回看到结局女主男主男二幸福快乐生活在一起的，这部剧情特别好,曾经的superstar
102,开头感觉女主人品不大行啊,🦅二月天
103,打开简介导演照片泰酷辣[捂脸笑][捂脸笑],熬夜追剧到天亮😍
104,额……看了几集，还行，就是男一男二的关系演得有点过，基情四射[捂脸笑],一路向前1117
105,我还以为是虞书欣跟王鹤隶,抱走千玺ฅ
106,还是去看看90年代的武侠剧算了,恋爱中的前任攻略
107,是放弃热度吗哈哈一次全集,嘻嘻哈哈呵呵嚯嚯呵呵哈哈
108,一听台词，就不想看了，放弃,A~上了贼船就跟贼走
109,想念李宏毅的少年歌行,江南七夏
110,好家伙，裤子你该学学爱奇艺这波操作[捂脸笑][捂脸笑][捂脸笑][捂脸笑]不要太感动好不,狐狸尾巴猫🎐
111,这也叫古装电视剧，多看一下以前的古装电视剧吧,ღ᭄💞黄盖打周瑜໑ຼ₀₂₃💕
112,别管！熬瑞鹏拉爆你们所有人！！！[色][色][色],Cat☝☝
113,一次性放全集[应援][应援]来看敖瑞鹏啦[色][色][应援],一束阳光sunshine
114,明明可以抢，偏要搭上一本书[捂脸笑][捂脸笑][捂脸笑],余仕青
115,前面还可以，后面那剧情混乱的都跳着看,林林子子芊芊
116,现代的营销手段都穿越波及到古代了。不要998，不要668！好熟悉的超市味道。！[捂脸笑],(๑•́ ₃ •̀๑)。。。。
117,就喜欢这种一下子放全集的[色],黎艳萍🌟
118,女主瘦点可能会好看些，看脸觉得整个人都好壮。,好运年年888
119,"我想知道女主的身份啊[应援][应援][应援]
有不有知道的",盛世繁花🍁
120,又是武侠亲嘴儿睡觉的剧，辣眼睛,奋发图强 迎难而上
121,女主好看的啊只是放在娱乐圈普了点,金渣.
122,今天才开播的么？,古月乔花坊
123,男主的 恋爱吧，食梦君 可好看了 大家可以看看[色],Fami.✌
124,纯骗子，这海报做的以为是王鹤棣和虞书欣,小爷就是阿福
125,宁安如梦放全集，立刻充会员,墨洋洋😍
126,古代化，说话现在化，看不下去,A_荳腐牺施💋MG
127,看封面我还以为是虞书欣跟邓伦演的了,xflovexy1314
128,其他都好，就女主太喜哭无常了，一会笑的像个傻子，一会哭得眼红泪流的，实在不正常[捂脸笑][捂脸笑],说只会说祖安话
129,服化道有点像九零年代港风古装剧,斥巨资磕剧
130,果然主演颜值很重要，实在看不下去了[捂脸笑],Eric-俊
131,还是爱奇艺大气，一次性全集,我也不知道咋起名💘
132,敖瑞鹏的看见缘分的少女也好看！强烈安利,Doki心冻
133,现在拍的鬼,夏未F
134,真的没剧看了就看看这个吧,Y.昊翰
135,嗯爬坡哦哦多拍点,cn00lq
136,成本核算的精细[微笑],殷小毅
137,什么情况刚上映就更新完了？？,韩夜雪
138,这个是小说改的 小小姐的小说,小洁洁洁洁🏖
139,好像余墨耶,木铃兰
140,感觉女的是现代人，是不是穿,大庙村李
141,感觉还可以，继续追,米糖$$$
142,有点搞笑的古装剧,139****5100🎋
143,结局了？是不是还有第二季,用户47705c4c
144,来了来了来了来了,爱吃橘子的淳
145,当喜剧看,能言善辩的云飞💯🎊
146,这部剧很好不是很腻歪，好看的很,张茹玉
147,不错的电视剧[大拇指][大拇指][大拇指][大拇指],闫永🍓
148,挺好看的[大拇指],若雨清风丶
149,只有爱奇艺是最给力的,瑶瑶琰琰813
150,我是先看评论,小唬大哥
151,少年江湖,名字是很难取的都被占用了
152,一下子全部发出来你小子真不错[色],桐敷千鹤🦋
153,这剧有雷，大家小心,一个口袋子
154,让观众沉浸在宗元圆角色的情感中，演员演技特别到位,专注吃喝玩乐
155,甜宠剧的话女主能不能找个好看点的  隔壁在下李佑里全是新面孔美女,搬书先生。
156,很好看，但见意从第二集开始看！！会有发现新大陆的感觉！！导演第一集拍的真是一言难尽，三观问题、人设问题、各种情节硬凑问题，败好感呀！第一集删了吧！,雨雪霏霏呢
157,女主，长相不是很重要，但演技真的很重要，这演技看着就像在台上演戏一样，无语,方名祭
158,路过卖菜的就拿人家菜往出丢，我要是卖菜的上去就是一巴掌打晕过去,五阿哥吉祥🌼
159,"居然看全集。这个惊喜回想起：10多年前的操作了。[大拇指]点个赞。
我会接着买你的会员的。放心哈！
所有的剧全给我来全集。就一直买一直买。[666][666]",(๑•́ ₃ •̀๑)。。。。
160,就喜欢全集播放的，新演员也很棒[大拇指]有名的演员不也是从无名开始，他们就喜欢吊人胃口,泊头鼎兴模具～罗晓阳
161,提早上了开播了。,仍是之名
162,无语，女主不咋样啊，剧情有点一言难尽的感觉[捂脸笑][捂脸笑][捂脸笑],北冥唯恋
163,山寨版的吧，找个武术指导不行吗。全程慢镜头,木头人木头脑
164,我居然挺喜欢听这音乐的,💞瑾辞💞💤
165,这都拍得啥呀，漏洞这么大，午夜居然和大白天不相上下，会武的人都有夜视眼！,刘杨傲雪
166,宗元圆是当之无愧的一位演技派女演员，为了看这个充了会员,左腿中箭的健特
167,宗元圆的电视剧好得令人放心和刮目相看了，爱了爱了,小仙女不怕
168,宗元圆能够通过自己的表演将角色完美地融入到故事情节中，很少能看到这么引人入胜的电视剧了,可爱的米妮A
169,宗元圆能够将每一个角色的内心世界完美地展现出来，这剧已经被我锁定了,小肥liu
170,喜欢这种兄弟不反目，从始到终共同对敌，质感属实是做旧了,地下天鹅绒A
171,现在看剧，先看演员，看剧情，看评论，最后再决定看或不看，有一样的嘛，举个小手看看吧！,A—Joe、
172,所有的电视剧都应该这样。天天挤牙膏似的！太烦人了,Elaine_小予
173,一天就出全集，希望以后的电视剧也不要等一个多月才更新完了,随-风☀
174,一下子出全集，让我感受到了会员应有的待遇，继续保持，我的会员也会一直保持[应援],过过过！火火火🔥
175,看起来太爽了！！！一下子播出这么多集！爱死了，爱死了！！！特地为此充会员好吧！,不記你.
176,我喜欢看敖瑞鹏演霸道总裁，食梦君很好看还有新人类男友会漏电,大鱼88☁
177,我以为眼睛出了问题，一下子全集[色]，冲着全集怎么也要看，大气[应援][应援],茉沏茉沏
178,真牛皮 一次放完 能这么干的剧  扳着手指头都数的过来,马丁·霍华德
179,还以为自己搜错了，谁想到全播了，上一个这样看的还是一闪一闪亮星星，冲冲冲。,滟滟☘️
180,不会看着看着就撤了吧[捂脸笑],用户8883a268
181,大气全集,匿名用户
182,真爽，出全集，可以追了。[大拇指][大拇指][大拇指],王小歪7
183,这个片最好看了多排点,《阿宝》🙊
184,许愿宁安如梦一样的播法,匿名用户
185,剧情太精彩了！敖瑞鹏太帅了，感觉越到后面越好看,外卖被偷的小可怜
186,每个重要的点都演的很细节，剧情很精彩,一杯甜甜的蜜语奶油
187,看完了，不错啊至少不墨迹。演员也挺好！男主不错哦[应援],我喜欢你眼里的星星✨
188,还有慕容宝，死的太可惜了,vivi113
189,男主和女主最后在一起了吗？,木子秋蝉
190,我就喜欢爱奇艺这样，全集[666][666][666][666][666][666],紅太阳.
191,女主挺可爱的，期待她演多些电视剧,闲逸致
192,本人今天又来抽空看了[大哭]最近好忙啊 ,吃土豆片的红红公主
193,只有爱奇艺会一次性放全集,唐宫羽
194,"奔着放全集来看的，就喜欢这样的
",紫欣ing
195,喜欢你这种任性，一次性放完[大拇指][大拇指],纯洁的天空11
196,敖瑞鹏的眼光绝了，每一个角色都很有意思,vivi113
197,各位，这不就是意林小小姐《清河公主·珠宛传》吗,金洲勇士🍭
198,好家伙，一下全集播放。真的是太开心了。,好运你我他💫
199,这部网剧女主不是赵露思和白梦妍，是新人演员[捂脸笑][捂脸笑],超人总动员1986
200,最喜欢看一次性放全集的，爱了爱了[应援][色][爱心],莫名😋🍑7890
201,这剧的原著我上小学的时候看的[捂脸笑]，虽然改的连亲妈都不认识了吧……但你还别说，电视剧比小说要有看头，真没想到这书能被翻拍，看到主角名时确实惊了一下[大拇指],耘耘呀
202,这是因为一场婚礼结束前我们要在现场进行直播、不用我自己来不嘛,莫霞家居潘海强
203,不懂就问，为什么称之为网剧呢？这跟正剧有什么区别吗？难道就因为导演跟演员不出名吗？,芈根烟
204,现在这些古装剧先别说剧怎么样，这个歌主题歌一个比一个好听,婠婠2048
205,这封面，不是碰瓷苍兰诀吗，明明不像的人，偏偏能让人看错[微笑],IG人的各类科技还有人
206,简介有点东西的，鸡毛蒜皮的武艺[大拇指]6第一次看到这么形容的,蟹堡皇接线员派大星
207,这结局，也真够潦草，导演没有想好结局，可以延迟播放，何必呢！！！,独自品味夜的美
208,女主还可以有几份像杨蓉男的也有几份像陈龙像王鹤隶啥眼光明明不像,加油！小菲
209,什么时候发布的还一口气全集！我第一次看到好稀奇哦,金渣.
210,大家从第二集看吧，还不错的剧！第一集简直是劝人别看,弥、戒
211,宗元圆的表演充满了热情和能量，希望以后内娱多一点这样的电视剧,白衬衫的初恋
212,战损妆的感觉真的是好适合他，这部电视剧确实厉害，不狗血,橘子柒柒love
213,宗元圆好几个小动作！我都觉得还挺好的，强烈推荐,弹钢琴的小女孩A
214,宗元圆能够通过自己的气场和表演技巧将角色演绎得栩栩如生，期待后续,柯尔鸭死忠果粉
215,宗元圆能够通过微妙的表情和动作展现出角色的情感起伏，每一个演员都是演技棒棒的，包括每一个配角,哇啦啦小话痨
216,宗元圆能够将角色的情感和内心状态表现得非常深刻和细腻，值得慢慢品味,真菌感染要死了
217,主演们的互动方式也太有意思了，还是挺有意思的，涨知识了感觉,坚持不下去就算了吧
218,看起来全员都有点东西呢，希望多一些这样的片子,小僵尸跳跳A
219,宗元圆的表演让人感受到角色的内心情感和复杂性，希望继续追下去不要让我失望,叽叽喳喳哈哈哈A
220,剧情越来越上头，开头就好甜啊，主创团队真的辛苦了，谢谢你们,小怪兽喜欢奥特曼A
221,宗元圆能够将角色的情感和内心状态表现得非常深刻和细腻，非常喜欢,蜜桃加气泡
222,敖瑞鹏的电视剧在线，特别眼神，不愧是我最喜欢的剧,梦里朱一龙是我男朋友
223,宗元圆是什么宝藏女孩啊，这部电视剧确实厉害，不狗血,大一新生的爸爸
224,宗元圆撩头发真的好漂亮，任何层面来讲都是最好的剧,有人偷面条啦
225,宗元圆能够通过自己的表演将角色的历程和成长展现得非常淋漓尽致，值得一看,我超凶的AA
226,少年江湖好下饭，还是挺有意思的，涨知识了感觉,卖队友第一好手
227,宗元圆成为了一位备受关注的演员，又有了追剧的动力,Frida星球
228,主人公表演自然到位，谢谢你们所有人给我们一部好剧,吃福建人的广东人A
229,邓超元作为演员的魅力要溢出屏幕了，拍摄手法也比较细腻,daisy不爱喝奶茶
230,没想到宗元圆的身材那么好，主演演技全在线，故事也很引人入胜,隔壁家的孩子AA
231,宗元圆的表演让人感到非常震撼和美妙，迫切地想看后面剧情,自作多情的霸王花
232,感觉邓超元的洛轩也算贴合，欲罢不能，明天继续,全力飞奔向前的冲冲
233,宗元圆的演技让人感到非常温暖和理解，这种好剧真的是越来越少了,不想上班的sleep
234,部分剧情映照现实值得人们反思，看了一集之后根本停不下来,黑寡妇不喝水
235,宗元圆能够将角色的情感细腻地表达出来，心中本年度最佳,请叫我肖夫人A
236,宗元圆能够通过自己的表演展现出角色的多面性和复杂性，real过瘾,狮子座的射手座A
237,宗元圆的表演让人感受到角色的内心情感和复杂性，这个剧我看着还行啊,若心向阳A
238,每一个细节都能够完美地表现角色的情感状态，专业的制作团队精心制作的完美作品,大雄弄丢了哆啦A梦
239,宗元圆真是因为颜值被低估了电视剧的演员，看完之后还想看,ECHO爱吃荔枝
240,宗元圆深入挖掘角色内心的矛盾和冲突，这无疑是今年最好的剧,擎天一猪
241,宗元圆能够将角色的激情和冲动展现得非常饱满和真实，这个剧我看着还行啊,爱自己更爱购物
242,宗元圆的表演让人感到非常震撼，每一个演员都是演技棒棒的，包括每一个配角,可爱的辛巴A
243,无论是哪个角色，宗元圆都能够完美地驾驭，希望后面剧本更多,单身狗的倔强A
244,宗元圆的演技让人感到非常真实，我看完了，家人们，我好危险，我害怕,发型像个狮子头
245,宗元圆能够将角色的情感和内心状态表现得非常深刻和细腻，很少能看到这么引人入胜的电视剧了,xddiano
246,宗元圆能够通过微妙的表情和动作展现出角色的情感起伏，这是一个关于信仰的故事,爷说要有光
247,宗元圆的表演让人觉得非常舒服和自然，演员和编导继续保持水准,鼻孔有点甜
248,啊哈哈哈好盛师父真让人羡慕啊，在我心中这就是年度最佳,余温超拽
249,场景真实高度还原，这个剧太好看了，一定要好好宣传,啃桃大赛冠军兔 
250,宗元圆太鲨我了，怎么会这么御，整部剧现在看着还挺期待后续剧情的,wiki juice
251,宗元圆能够将角色的激情和冲动展现得非常饱满和真实，总之，好剧就应该要力荐,羽言羽生
252,邓超元作为演员的魅力要溢出屏幕了，期待着哦,鱼丸粗面烤鸡翅
253,喜欢这种兄弟不反目，从始到终共同对敌，剧情发展完全猜不透了,奥利给小咪蒙
254,宗元圆大大不要再散发魅力了，我看完了，家人们，我好危险，我害怕,余生浮华尽是你
255,宗元圆能够通过自己的气场和表演技巧将角色演绎得栩栩如生，总之，好剧就应该要力荐,幕言言
256,宗元圆表演让人真正地感同身受，这个剧情爱了爱了,小小小小饼干A
257,宗元圆对角色和剧情的深入理解和把握，难得一见的好剧,莉莉065
258,从主演到小配角演技都很不错，希望继续追下去不要让我失望,草丛伦A
259,宗元圆能够将角色的人性和情感呈现得非常复杂和多维，节奏明晰，值得一看。,毛毛的上校鸡块
260,宗元圆的表演令人难以忘怀，每一个演员都是演技棒棒的，包括每一个配角,没事想想球
261,宗元圆的表演让人感到非常震撼和美妙，这是一个关于信仰的故事,吕吕吕小萌
262,宗元圆成为了一位备受关注的演员，我觉得还是很不错的,毛毛的下午茶A
263,宗元圆真的是一个很有自己想法和追求的一个演员！，心中本年度最佳,你才小可爱A
264,敖瑞鹏做得很好。敖瑞鹏优秀啊，各方面都很有质感的一部剧,我son爱吃辣条
265,能够让观众深刻地感受到角色的内心情感，拍的挺好的呀,一朵西兰花A
266,宗元圆的演技非常自然流畅，布景，配乐，转场厉害,黑暗中的微光A
267,敖瑞鹏台词功底飞一般进步，剧情还OK，就是觉得好像还没高潮就结束了,蓉儿正梳妆妹妹
268,让人十分钦佩宗元圆的演技，演员和编导继续保持水准,筱筱的一条鱼鱼
269,这剧真的太好看了吧都去追啊！，在节奏感快，演技都很好,岁月_冰冻
270,让人对宗元圆的角色有更深入的理解和认识，心中本年度最佳,请你哈啤酒A
271,宗元圆的表演具有强烈的感染力，，主演神仙阵容加持,来自大三爷的问候
272,宗元圆真的是一个很有自己想法和追求的一个演员！，都好赞！,落泪必有渣男
273,宗元圆好美，宗元圆的每个造型都好绝，布景，配乐，转场厉害,王牌*啃啃
274,看起来全员都有点东西呢，这是一个关于信仰的故事,自由游啊游啊游
275,宗元圆真好看，演员们的精彩演绎看得让人目不转睛,少爷起床吃饭啦
276,宗元圆是当之无愧的一位演技派女演员，一个多小时下来没有任何多余片段,不安_心的迷茫
277,敖瑞鹏这次真的给大家带来了惊喜！演的很好，演员可！画面可！,云身后的昏黄A
278,慕容宝的演绎简直纯纯打工人精神状态，已经安利同事,有_的地方就有我
279,宗元圆能够引起观众共鸣和情感共振，剪辑没有让我云里雾里,薛定谔的猫宠物
280,宗元圆的表演充满了灵性和艺术感，这部确实有实力了,精致的不愿揭穿
281,有没有姐妹和我一样想要超前点播的，欲罢不能，明天继续,众生膜拜永久
282,敖瑞鹏眼神里还能闪耀着初入职场立志大干一场的兴奋，真了不起，小伙伴们来看看这部剧吧,勇气一直在的A
