,0,1
216,这是呼和浩特拍的吧,郝星明
217,真是看不了这个，节奏慢，感觉演技也不好，太文艺了，没有市场，一般人看不懂啊！,匿名用户
218,从《狂飙》过来，实在是失落啊,观云品茗
219,好有年代感，我还挺喜欢看的。,至圣无
220,虽然节奏慢，但是剧情紧凑，结局挡不住的悲伤,一诺千金㊛
221,自从看了隐入尘埃以后总觉得海清病怏怏的[捂脸笑],阿萨姆奶茶店老板娘
222,入围电影节不是这部吧？都不是电影,maplecmj
223,为啥感觉是说的太原话,爱旅游的子书平松
224,真的奉劝大家别浪费时间去看这部剧,Fshark..
225,这么优质的拍法真的很牛了,心慈薇安🌟
226,感觉这应该是一部电影。,辫鹅哥哥的小可爱
227,这男的的口音是内蒙的吧，听着好熟悉,匿名用户
228,艾敬这专业水准没有体现出来啊,俯拾朝花_qq1722
229,我寻思我来评论区看看有没有谁看懂了可以解释一下，结果一个讲解的都没！这是悬疑片么？我可不想浪费时间结果是个文艺片,我就喜欢见识一下饭圈的攻击
230,这哪找的 景 太像了,Yang jia yue
231,刚看第一集，就是八十年代至九十年代初的场景，真好看，很细腻,gzhshfd
232,虐心剧，不建议观看。要是想观看，就看孩子时期长大了就别看了。太虐心了。,蕊蕊健康快乐🐣
233,浪费时间,无任何地方人j
234,一部有悬疑剧情的纪录片，其实本子不错，不过拍成纪录片了,~断^弦~
235,感谢这部伟大的影视作品，让经历过那个时代那个环境的人，得以回味曾有过的对人生幸福淡淡的渴望，和对如烟往事的迷惘和哀伤。。。,与狼共舞55168
236,导演这种慢节奏的写实拍摄手法，水平有限，欣赏不了，告辞~,乘风追月6688
237,第一集里面的环境就吸引我了，作为支援三线厂里长大的孩子，看到食堂的那种壁灯、结婚的那种感觉，暖气片、公交车、学校，真的一下子回到了80年代。还有宝石的凉鞋配那种袜子，绝绝子,二胖胖二✨
238,看了两集，感觉比较小众。我个人是比较高兴看到有这种比较电影化的剧集。这意味着剧集也开始慢慢有个性了。只是剧集观众要适应的话还是一个漫长的过程。这两集对于大众来讲应该算不上是一部悬疑剧。,声光乍泄影像工作室
239,看了第一集，虽然叙事节奏缓慢，但是没开倍速。取景，色调，人物装扮，营造的时代感都很到位，整体是一种娓娓道来的感觉，希望后面能更加出彩！[应援],江山犹将多情记
240,"时代感太足了，细节道路场景都是特别容易勾起回忆的。点赞。[666]
海清出品，必属精品！[应援]
董宝石这妆容，真是豁出去了。[大拇指]",胖大白白❄
241,导演你是把酒灌进这片里了吗？我看了不到一集头就晕了,川流不息6600
242,这是部什么破剧呀？关键环节都是莫名其妙的。如果不是一开始庄德增的表演有趣，根本都没耐心看到最后。,DoubleHT
243,宝石老舅  放弃说唱巅峰对决   的电视剧  结果全是差评,ཻꦼꦁ永夜࿐
244,如果按网络剧去看要求也就不要太高，幸亏只有六集多了的话容易精神分裂[捂脸笑]，总之我是耐心的看到结尾（……）,冬日暖阳618🏝
245,喜欢董子健的少年感，但是他跟孙怡离婚我心好痛！,雪雪子的猪猪ao
246,这个剧出了嘈杂就是杂音，看了第一集一半就弃剧了，本来最爱看海清的,开心快乐每天😆
247,我想找个大嫂,zero.zจุ๊บ。
248,這六集也太少了吧,Sophia-Lu
249,這講的時什麼啊～沒懂,Sophia-Lu
250,恭喜入围柏林电影节[应援],匿名用户
251,平原上的摩西很好看，董宝石真好，淋漓尽致，都是实力大咖,不准亲_2r23
252,看了两集我以为就我没看懂，看了评论才知道，基本都是看了个寂寞，不但慢，还莫名其妙,L极度可爱的摩黛丝提酱_ok
253,迷雾剧场越来离谱了[发呆]，以前还有16集，现在怎么越拍越短。,美好时光小仙女🎐
254,隐秘的角落，沉默的真相，没想到迷雾剧场开篇即是最高峰了,十月微微凉🐳
255,六个小时终于终于看完了，总感觉下面就会很精彩，就一直忍着看下去，不得不说后悔了，提醒一下后面的亲们，如果不是真心喜欢就别硬着头皮看了，真心后悔浪费了一天,田布丁丁
256,节奏这么慢，很多小说里的前因后果都没有交代明白，太失望了,胖乎乎珍珠
257,还原时代、刻画人物、推进剧情，故事环环相扣过渡的流畅顺滑,梨花头大波浪~丿
258,看了前五集不知道想表达啥，真的~~。。。高分不合理啊。最后也不知道那个警察为什么要把车停在路边让李下车解皮带？？？？？,爱坤小一
259,第一集多余的,LF
260,别看…..合适获奖和添堵，不合适消遣….和悬疑推理没半毛钱关系…..当然文艺青年们除外，挺文艺和怀旧的，文青们想缅怀过去或者想在新时代抛弃时间和变化的制约，发出对旧时代的悲悯和悲愤，用上帝的视角去打开独特角度的个人思考这个片子是不错的…..,dibbieguo
261,这是宝石老舅吗[捂脸笑],大圣，悟空，美猴王
262,养肥了再看，回见[应援],怎么都是你——
263,点赞。好片，真实，没有哗宠剧情镜头。再现当时社会背景，人性，充满烟火气息。,爱吃面条的叱干以珊
264,这电视剧的服化道太绝了，第一集就给迷住。绝对不敢快进的,安满_qq1888
265,那时叫人民公园,看过集结号吗
266,精干！这个词是山西的,弥歆
267,想用缓慢叙事讲述意外，但全部是拖沓，看得好累,爱爬山的时光村落
268,日立电视,AKon（金阶传媒）
269,回来追第二遍，觉得忽视了许多细节。值得再看一遍，小时候的小树好可爱。,源儿闵睿
270,一集半过去了 演了个啥,XN2019628
271,有第六代导演的风格，摄影构图就是电影级的，很喜欢[微笑][应援],妞妞宝娃
272,呼市食品那个化纤厂拍的，现在挂的电影公司的名儿。,凯妮_美颜私人订制
273,耶耶耶终于出了[色][色][色],Krypton.💞
274,好怀念九十年代末新世纪初的生活,刘小莫lee🐳
275,进迷雾剧场没有任何问题 因为第一遍看完一般人没有完全看懂 需要二刷。这不是迷雾那怎么叫迷雾,小張同学zzz
276,这什么年代，居然可以拍摄案发现场，太奇葩了吧,🐳王梓
277,只能说是文艺片外表下的悬疑片 但是本质还是文艺片 能接受文艺片的一定能接受摩西 而且他也不是年代悬疑跟回来的女儿也不一样 这个长镜头比较多 说实话不喜欢文艺片的会觉得特枯燥 如果你能接受毕赣和贾樟柯那些的 这个就能看下去毕竟有悬疑的外衣 但是纯欣赏文艺的话倒也不咋建议,跟狗七贴贴综合征
278,迷雾剧场，yyds，电影时长，真不错，有多少是看过回来的女儿，再来看平原上的摩西[捂脸笑],用户20459d1
279,迷雾剧场，yyds，电影时长，真不错，有多少是看过回来的女儿，再来看平原上的摩西[捂脸笑],曾_qq2032
280,年轻人估计看不懂 这是我们的童年,煎饼多刷酱
281,冲着迷雾剧场的招牌来的，希望好看,起司猫娜娜98
282,什么玩意儿悬疑侦探不悬疑侦探，文艺片不文艺片变成了个四不像。,工作小猫
283,真迷雾剧场啊，看的我云里雾里的[捂脸笑]看了两集看了个寂寞[捂脸笑],陌生人i⛄
284,这又是六七十年代的剧吧，可是扮演者又是八九十年代的演员扮演地吧！,波宝🌸
285,这据突然出现的太匆忙 宣传几乎没多少,Yang jia yue
286,海清就喜欢演故作高深的剧[捂脸笑],胖子啊啊啊！
287,这个电视拍的好真实，导演太会拍了,🍀小六和十七🍀
288,不给一分都对不起迷雾剧场这四个字。,大鼻子佩琦
289,这剧节奏太慢了，要不是这个年代感真想弃剧,奶锅booooo
290,非常不推荐，剧情节奏太慢了，无关剧情太多，主线不突出，整个剧情拍一集电影都可以，,誌鹏🧀
291,虽然剧情不是高潮迭起，但那种很厚重的年代感和氛围让人念念不忘,个性小驴
292,没看懂 我想弃剧了 这个剧是怎么进入迷雾剧场的[捂脸笑],1314&蓓
293,背景，道具高度还原时代，真不知道咋找到的这些场景，方言有味道。这片我不是看破案，是看曾经的那个时代。,馄饨久久
294,有人能先告诉我大概说的啥事呢？[捂脸笑],→艳宝←
295,这部剧必须二刷，越看越过瘾。,疯狂点点88
296,好像纪录片，场景很真实，人也很真实,雪莉王妃shirley
297,不好意思，第一集看完了，一脑袋问号,你好开心😝
298,海清有种马上发疯的隐忍克制的感觉,绿山墙的安妮贝尔
299,标准的呼和浩特普通话[捂脸笑][捂脸笑][捂脸笑],华小珂
300,东心这样的人换谁也受不了，难为小庄了,✨Sunny👸💝
301,这女的咋这样啊 这男的也太好了,2375663809
302,年代局就不是给浮躁的小年轻看的，看不懂没必要贬低,喜欢奔跑の长孙胤文
303,沉默的真相比狂飙更震撼,喜欢举重de南野澄邈
304,不好看，什么乱七八糟的,寒烟灵境
305,隐秘的角落，沉默的真相，无证之罪，这仨不错,匿名用户
306,听了这部有声小说过来看的,奶油可妮
307,刚看第一集。这节奏一点没觉得悬疑推理。这节奏好慢呀,·Zayang·
308,获奖都是不正常非常规的,冬日暖阳618🏝
309,我也穿过一模一样思维校服,dreamtaleeeee
310,很多人物，很多情节都没有必要,喜欢跳街舞de公冶秋柳
311,服化、制景都很贴切，节奏紧凑，演技都好好,法啦不爱花
312,在我的家乡内蒙古呼和浩特拍摄的[应援][应援][应援],韩剧大姐姐
313,宝石演的不错 很接地气,jharden_mvp
314,没觉得好看啊 都没耐心看了,﹏．·°more
315,像生活记录片...没看懂主题是啥[微笑],JOYJOY狮子座
316,看了八天才知道是迷雾剧场[捂脸笑],刘桐妍姐姐
317,别的不说，这是近年来我看到的年代感还原度最高的剧集，各种细节超级到位，可见，导演编剧演职人员花足了心思,美丽的^_^新世界
318,第一集，一个多小时，完全不知道在讲啥,xiaoyaoseng
319,海清演得好好，剧情也很符合悬疑剧,Michaell~丿
320,董子健和海清的演技没得说，整体氛围很高级,故事重演！^★
321,我的周冬雨的平原上的火焰呢 靠,爱吃荔枝的鲜于雁菡
322,主要这东西不是各位外国爹拍的，如果是肯定跪舔[呲牙],小刘爱剪辑😀
323,节奏太慢了，快看完一集也不知道看个啥，浪费时间。,随遇而安.luo
324,看了3集都不知道在说啥，人好像死了几个。,闲人唐大
325,[应援][色][666]轮番看好剧，爱奇艺棒极了[666],2273222380
326,"朋友问我最近看啥电影呢
平原上的呦西",v5嘉
327,个人觉得故事节奏很慢,小球连线
328,看得好累，也没看出什么名堂，希望下集有惊喜,清欢23332333
329,这剧就不是悬疑 感觉在回忆过去的时光，还不错！,你好s y
330,这个电视剧我真的不知道看了啥？,渣男体质
331,好剧选错时间我真服了你,loveyou(๑•́ ₃ •̀๑)
332,这个是不是平原上的火焰啊？,我爱过的人是你妈
333,到现在，看了半天，没看明白剧情。,沉默.m
334,老舅本色出演啊，笑死我了[应援],洋\'Chow
335,超级好看然后去拜读了书[应援],一颗vvc
336,东心的姐姐是歌手艾静演的[大拇指],君君
337,看了一个小时，看不下去了，节奏太慢了也,胡嘉浩hao
338,不是悬疑吗？这都什么呀,草原钢城猎狼人
339,一集都快赶上电影了，多拍几集咋了，虽然我不看,Jjcnmcm
340,一个悬疑剧看半天没案件[捂脸笑]一个事件讲半天实话真不好看,GMZYT
341,挺喜欢董子健这个演员的,拿与搁l不期而遇
342,我的天一个小时的电视剧,剧荒的小赵
343,不过瘾这样[捂脸笑]让我一次看个够[捂脸笑],(･ิϖ･ิ)晴天娃娃
344,omg 老舅都来演电视剧了 哇哦 ,☞傻傻的小不点☜
345,是这个小女孩出事了吗？,ghghgun
346,多来点迷雾剧场吧！太过瘾了,匿名用户
347,这部剧让四十来岁的人回忆[大拇指],红豆然然
348,特为双雪涛老师来的 支持支持,今天也下凡了哈
349,就是这个永远不要互相遗忘。还有这个心是诚的，就算高山大海都会为他让路。毁了李斐一生,曙罡商务
350,场景，人物特别真实。没有表演痕迹，没有蹩脚的配音。画面宁静优美。一个十多年的悬案线索慢慢道来。特别文艺的悬疑片，百看不厌,曙罡商务
351,第一次因为片子太拖沓，看不明白导演要讲什么，越看越来气，看到第二集已经是极限，果断弃剧,管他的给他
352,我看完第一集，整体感觉很不错，服化道剧让我有穿越感，继续往下看…[微笑],.向往的生活.
353,裤子太有当年的感觉了[捂脸笑],"-誰旳悲傷,"
354,8.3分真不知是怎么来的，可能大家表达的是8.3分的差片!连结局都是由观看者自己脑补的!,Earthman911
355,这是一部挂这迷雾剧场，打着让人看不明白凑集数的奇怪电视剧,Cnn12345oo
356,这个景太喜欢了 满满年代感 作为80后 满满回忆 太好了 画面感真的满满回忆,将丞飞哥
357,你还是迷雾剧场吗 怎么变了 不好看 ,吳佳悅.🖤
358,好喜欢这个年代啊~~~怀念~~~[爱心],安庄庄Janie
359,节奏太拖沓 实在是看不下去 ,❤️凤舞九天❤️
360,这部剧简直是神剧，只是看懂需要门槛，还有就是一帮人快餐小帅小美看多了，根本没耐心看下去。这部剧无论是剧情、镜头语言、人物表演张力、服化道都堪称极品。而且为迷雾剧场筛掉一大批观众，那些只看懂上帝视角的人，不适合此剧。,坑王驾der
361,拍的很好，剧情细腻且真实，剧中说的是老家方言所以特别亲切，和那个年代很贴切 演员表演自然 [大拇指][大拇指],vincent825
362,蛮好的，86年的人看着很舒服，这感觉像是山西安徽那些北方的那个年代[大拇指]小时候的日子就是这样的,☆☆☆☆X☆X☆L☆☆☆☆
363,居然有彩色电视,清鑫双畅
364,人是咋死的，快看2集了，还没出现，,千祥云集《彝家风味烧烤》
365,这样的婚姻这样的教育这样的生活这样的父母这样的孩子这样的这样极其没意思，注定一切都没意思,yes.Lee
366,这就是一本带图像的书，不适合下饭，只能消磨时间，一个人自闭的时候看。,旁观者2021
367,海清戏还是很不错的,壹号橘子公主
368,第一集没看完就不想看了 根本不知道表达了什么 一个爱看书 一个好色 一个爱惹事吗？[捂脸笑][捂脸笑][捂脸笑][捂脸笑][捂脸笑],有活力的美好的一天😋🎈☁
369,这情节推进够慢的，虽然年代感很强，很有细节揭示的时代特征,天狮在野
370,都说一进来感觉背景是呼市 山西的 ，但小说里实际包括作者想讲的是东北的故事,斬左
371,"迷雾剧场老粉丝了   第一集看到一半了   没看明白     希望后面能好点吧",A念念不忘必有回响
372,这是呼市拍的啊,通天塔罗牌九九
373,拍的很真实，自然，抛开剧情不谈，整部剧集服化道做的很认真，带入感很强，充满平常普通人生活的烟火气息……,光影流转文娱影视
374,简直了……跟对象有仇离婚啊……拿孩子撒气不管也不当回事儿？这要不是牺牲一个警察小树不就废了吗？另外跟李父说庄打她爸是什么意思呢？,奶糖726
375,第一集看了个寂寞,周瑜是个大帅比
376,看完狂飙过来的，这剧真心不错，一下就回到那个80年代,自在人啊
377,演的很好 导演很棒 只是不符合大部分人看电视剧的追求,Yang jia yue
378,后期剧情乏力，该有的东西没有呈现出来，庄树经历的那案子被家长里短鸡毛蒜皮小事给弄得一团糟,爱影客ljf
379,看的最稀里糊涂云里雾里到结局人物都弄不清楚的剧,lin平淡生活
380,看了好几集，也没看懂，必须要沉静式的看才行，可是看个剧嘛，就涂个轻松，实在不知道讲啥了,力大无比🎡
381,看完第一集没看懂什么意思？,薄荷糖￥🤗
382,看了25分钟，弃剧[捂脸笑],用户8654038e
383,雖只看了一集 ，感觉画面很舒服，叙事平稳真实，还原了那個年代,匿名用户
384,拍的太悬疑了 真烧脑 太费脑子了 这是啥啊 唉,小公主july
385,这考试外面场景是不是拍成现在的了？那时候考试哪有家长外面等候的？还每个家长都来[捂脸笑],自由~伊人
386,这部剧的质感非常棒，服 道 化非常🐮，但是这部剧的节奏感核剧情很难符合我们现在生活，特别是都市的年轻人，所以即使再好，这部剧的受众面太窄了！,苹果熊熊😍
387,这不是电视剧，更不是网剧。纯纯是长电影的手法。张大磊，隐藏的王者，处女作拿金马奖的导演，就是强,赫连爸爸
388,说实话，没看懂,乐有家李颖
389,看完了 这部剧布景年代感很强 那个时期过来的人 里面的场景会感到很亲切 剧情铺垫比较长 剧情推进比较缓慢 喜欢快节奏的人不会喜欢这部剧,早八晚八
390,看第一集，不知道想表达什么？拍摄手法太生活化了，声音太杂了,lindayang630908
391,太原普通话,丹枫鸣雁👏
392,这种人沉迷在书中的幻想世界里，不是拿自己当公主就是王子，但从不照镜子看看真正的自己,刘白（刘烽炎）
393,我就说怎么一直没看见董子健，原来是还没长大呀,lianghuan123～
394,爱奇艺推荐热搜位没有这部剧，爱奇艺自己的迷雾剧场估计也得看排名[捂脸笑],绿山墙的安妮贝尔
395,我觉得在看纪录片，太真实了,撒野❀ʕ๑•ɷ•๑ʔ❀
396,小时候记事儿开始就是这样的环境，这样的老师，这样的对白，这样的骑车带娃，这样的校服，一切的一切把我拉入到五岁的回忆，有过经历才有代入感，满满的回忆。,咸鱼胖得翻不动😘
397,节奏好慢,格桑雍措～
398,全场没有一个人玩手机的[应援],匿名用户
399,我想知道从哪一集开始悬疑的，我现在看的第一集，我咋没感觉有悬疑的节奏呢！[捂脸笑],·Zayang·
400,我以前在父母的隔壁有个小房，也是钢丝床，父母给垫的厚厚的，一个人睡，很温暖，对，一个人也很温暖,在后山
401,节奏太慢了,lili刘二
402,强哥没了，我过来了,炜亮🍑
403,海清演技又上一层啊,匿名用户
404,邱天演得也很细腻，紧张、不知所措的深呼吸，全体都是演技派,路上小心2r1
405,平原上的摩西好看，我被邱天的新娘造型给美住了呀，人物丰满,深海大鲨鱼012
406,镜头好有质感，看剧像看电影一样爽，片头做的也不错,待我长高eq2
407,好多一镜到底只能说各位演技都很好，快速虚影的形式也蛮新颖,别弃我424
408,剧版平原上的摩西终于演到了李斐拍婚纱照这段，这个造型好有8、90年代的那种复古感，摄影取景也很讲究,用户3b0faeec
409,原著党很期待。年代感十足，镜头很有质感，拍摄手法也比较细腻,喘给我听4323
410,好看！夸赞一下摄影组、道具组、剪辑组等等摄制组所有工作人员，演员选得真好,用户3b0faee9
411,全员演技在线且拍摄高质感，细节要素众多，希望能继续保持,咬樱唇
412,平原上的摩西搬上银幕了！这本书真的很好看 ​，台词功底让我震惊,雨儿不下大
413,划船这一段让我想起了沈腾，迫不及待想知道真相,手机铺子里贴膜
414,阵容很惊喜，还挺期待后面剧情的，开局不错，调色很好,少女体检官14
415,年代感足，运镜有点杨德昌加老塔的感觉，演员都是实力派,瞧你喘的32
416,竟然没看出来是董子健，这个妆化的可以，镜头语言很好,用户3b0faede
417,开场划船约会和举办婚礼的长镜头，都是景深层次分明走位调度精准，阵容很强,希酱牌云朵有点甜
418,这也太《八月》了，这也太电影了，爱奇艺迷雾挽尊了，主演演技目前都在线,英伦折耳黑长直32323
419,海清大大不要再散发魅力了，每个人的演技都很在线,哈哈曹大饼
420,歌曲和文学作品的加入，引发想象联想，觉得节奏滤镜都很好,极端病态分子442
421,这时长太感人 一个多小时一集 看的入迷了，故事背景与悬疑结合就是有韵味,弃絮大大
422,这部剧，还有原著，都不是为了讲悬疑故事。悬疑只是条绳子，作者要展示的，是绳子上拴的骆驼，是那个时代。,行者¾
423,太合我胃口了，特别现实主义，服化道真是到位啊，摄影取景也很讲究,抖M橘子天然呆453
424,以第一集的水准看，超过了《隐秘的角落》成为了近十年最好的剧集，质感我很喜欢,隋洛文雪之11
425,一集一个多小时里大部分是长镜头调度，摄影很不错,软萌短尾中学生2343
426,海清终于不愁房子，不用自己奔波奋斗了，每个人的演技都很在线,猫耳无用战士232
427,慢节奏就是很能培养耐心的，悬疑氛围感满分啊,艾尔娜维斯232
428,无论你在哪里长大，奇妙的通感都会把你送回六岁那年，都是实力大咖,用户3b0faecf
429,对于烂熟原著又喜爱文艺片的人每一秒都是享受，被剧情深深吸引了,元气资深魔法使232
430,新娘的头花真好看，我小时候可喜欢这样的头花了，可惜小时候买不起，长大了买不到，镜头都是电影级的,宋小熙不喜喜
431,没有想到尺度能这么大，节奏好剧情紧凑不拖沓,坞舟
432,第一集里傅东心给刚小学毕业的李斐读的书是《卡拉马佐夫兄弟》，全员演技在线,nothing大大
433,歌曲和文学作品的加入，引发想象联想，氛围营造满分,栖寺
434,果然作者性强的小说也需要作者性强的导演，去除东北味反而更普世，演员演技都很好,用户3b0428c3
435,张大磊拍短片那股气质长剧集也挺明显的，人物关系渐渐浮出水面,73岁离婚带2娃娃
436,果然作者性强的小说也需要作者性强的导演，去除东北味反而更普世，导演叙事功底了得,泥塑ZZ高达
437,发现像张大磊这一派钟情于还原上世纪某一年代生活、思考、行动方式的创作者，演员的表演太惊艳,轻宛
438,邱天演得也很细腻，紧张、不知所措的深呼吸，被剧情深深吸引了,池烠
439,爱奇艺对于电影创作者真的是最友好的了，摄影很不错,钟毓庭001
440,一集一个多小时，叙述方式是顺叙，节奏好剧情紧凑不拖沓,正义的天使00
441,董宝石的荧幕首秀真的很出乎意料，饰演的庄德增很像八十年代那辈人，好紧张,泡菜西西甜又甜
442,平原上的摩西第一集婚礼的长镜头真好 ​，演员之间的衔接点做的自然,说人话2333
443,我没想到能拍成这个程度，一共六集文艺片叙事节奏，缓慢而有紧密的链接，没有废镜头，取景也很美,用户3b0faeae
444,这算是张大磊作品里独特的戏剧张力，全员也都是演技派,橙花爱大花花
445,照时的强颜欢笑都表现得很到位，李斐的那种气质有了，讲故事技术一绝,闪闪惹人爱233
446,平原上的摩西，导演真爱歌手，又是老舅又是艾敬，这部剧情特别好,来夸我不拒绝2333
447,是好看的！原著的年代感、氛围感、命运感全都给拍出来了，节奏比较明快,本可爱气死你23333333
448,当初看小说时庄德增这个人物我一直都没有准确的画面想象，平铺直叙也抓人,waxx000
449,好多一镜到底只能说各位演技都很好，导演很注重细节,可人儿233
450,剧版平原上的摩西终于演到了李斐拍婚纱照这段，这个造型好有8、90年代的那种复古感，节奏好剧情紧凑不拖沓,Iam薇薇安安安
451,看戏骨们飙戏真过瘾啊，很注重对人物心理的解析,安西元教练
452,女主台词演技都不错，全员原声台词这点最能打动我,神仙少女TaT
453,海清撩头发真的好漂亮，很注重对人物心理的解析,三花猫233
454,对于烂熟原著又喜爱文艺片的人每一秒都是享受，演员之间的衔接点做的自然,草莓酱丸
455,看了2集，好看，长镜头特别多，真的都惊了，好厉害拍的，人物很丰富,泡芙有点甜天
456,这个电视剧妥妥的是符合我的胃口了，氛围营造满分,远山停车难
457,平原上的摩西也能排进去年我喜欢的短篇小说前三，很注重对人物心理的解析,浅了个九
458,张大磊+刁亦男版本的《平原上的摩西，剧情线索非常丰富,用户3b0fae90
459,一看就是老物件，甚至有的我和我父母都用过类似的，平铺直叙也抓人,深邃的眼睛落满星光233
460,这个电视剧妥妥的是符合我的胃口了，总体抱有悬念感,白果_233
461,太久没有看这么令人兴奋的影视作品了，细节要素众多，希望能继续保持,跑不动的小猪猪
