,0,1
0,这部剧真的好看吗？之前看过两次都弃剧了，现在实在没悬疑剧看了，有打算再看一下～,我是～小玥儿
1,"观感很不好，很装的一部电视剧，不推荐。
1.剧情推进非常慢，节奏拖沓。
2.很多长时间定格的镜头，故作高深，感觉很装。
3.演员各种口音，容易跳戏。
4.主线和主题都不突出，不知道想表达什么。",运动中的LJ1987
2,迷雾剧场，yyds，电影时长，真不错，有多少是看过回来的女儿，再来看平原上的摩西[捂脸笑],天若有情天易老TT
3,有老舅的表演为啥演员表没有他的介绍啊,🎈   2amor 。
4,从尘封十三载过来。,爱吃菠萝的太叔春冬
5,"结合小说补充电视里没有体现的剧情：
1、庄德增（装得真）文革时期把傅东心老爹打聋了，傅家两个女儿的事业前途也因此（家庭背景）受到影响，出身书香门第的傅东心放不下高傲心气，不甘蜗居于烟厂当个工人但又没法改变现实，只有埋头读书画画以解内心苦闷。
2、傅东心曾因落水被老李救了（据她讲的故事推测）爱上老李，也为爱情争取过（闹过）但没能如愿，于是心灰意冷接受相亲。
3、小树三岁时傅东心知道庄德增就是打聋她爸的仇人，为了小树她选择忍下去，可对于和仇人生的儿子，她也没有更多的感情给予。
4、庄德增一开始就知道老傅是他打聋的，一直有愧于心，所以他接受大三岁也不算很漂亮的傅东心，接受她对他的冷漠，坚持热脸贴冷屁股以此安抚自己的良心。他娶她就是赎罪，这就是为啥他能不找外遇的原因，很多不知道原著的看客只看到了他的表面。但无疑老庄也是时代背景之下的受害者。",C虎妞I趣叭C
6,最近真的好剧频出啊 刚看完《回来的女儿》接着《狂飙》就出来了 《三体》也紧接着播出 现在又来《平原上的摩西》 看不过来啦[应援][应援],LAYONE
7,[大拇指][大拇指]喜欢这种不急不躁的调调，很舒坦，最喜欢庄先生，性格真好，爱家爱孩子爱老婆[大拇指],杜甫不忙
8,来看老舅,发芽土豆～
9,看完回来评论。首先，这剧不应该进迷雾剧场，不是悬疑刑侦剧，悬疑剧迷可以撤退。其次，剧的节奏非常慢，都是具体生活场景，找人能从楼上拍到楼下这种，没有耐心的劝退。好的是：一集将近一小时，排成了连续电影，质感也很像电影。8090年代的生活场景历历在目，非常细腻，还原度高。导演的拍摄手法也很细腻，更像文艺片，喜欢文艺片，想回忆8090年代生活的可以看看。,你说啥就是啥1
10,迷雾太绝了，尤其《沉默的真相》,芸生匀升.
11,非常值得欣赏的一部电视剧。所有的情节和线索都在细节里隐藏。电影的质感，很生活，很细腻，很人性。每一个演员都非常到位，像这样高质量的国产片不多。[大拇指][大拇指][大拇指],小小腾🎡
12,不知道怎么回事就是看不下去，这也能进迷雾？奇了怪了,夜雨梧桐8935
13,为什么老舅的名字没有在简介上面？,ꦿ᭄雪ོ
14,看完第一集没看懂什么意思？,电视剧。迷
15,剧情精彩，值得关注,梦游娃娃1
16,看两集就一个感受，，这个剧好吵啊。  太多环境音了 ！！！ 烘托时代感的手法就这么单一吗？  搞得像埋彩蛋一样 反而让我有点出戏。,丶炽焱丶
17,这片就拍成个文艺电影就行了  非得拍成电视剧 是想把观众全部整抑郁吗？,爱唱歌の南门德元
18,虽然是迷雾剧场，但上的太不是时候了，狂飙和三体神仙打架，他收视高不了[捂脸笑],Way Back*
19,感觉还不错，一镜到底的。拍摄手法蛮新颖的，里面的宝石也是一个亮点,！！4419
20,时长1分半，这叫电视剧吗？商人,^大女人^
21,"看这部剧就像看书一样，节奏缓慢而真实，得自己去发现去思索。
      所有的事情平淡无奇的发生着，就像我们生活，没有刻意告知，没有强调戏剧冲突，一切都是淡然的发生",周烨_qq2561
22,沉默的真相yyds 不接受反驳,『零.2℃』
23,这个就是文艺片，有很多长镜头，可以说整部剧是文艺悬疑，喜欢自然喜欢，不喜欢的无所谓了,用户@e8eccc4413880
24,这是什么类型的剧啊，快看完一集了，不知道说啥的,常冰是个好人
25,这片就拍成个文艺电影就行了  非得拍成电视剧 是想把观众全部整抑郁吗？,爱喝茶的公冶芳馥
26,和《狂飙》谁好看？,吉祥的爱奇艺
27,我都不知道在放什么,X i a o จุ๊บ
28,不得不说迷雾剧场拍得是越来越差了,晴间多云有时阴
29,真没想到，老舅还有这一面呢[捂脸笑],生活充满阳光🍑
30,看了50分钟了 感觉看了个寂寞,不行街+组揍
31,像二一九公园,爱喝红酒de闾丘菁英
32,不是周冬雨演的吗？,嘿嘿哈哈哈吼吼
33,要文艺就好好文艺，要悬疑就正经悬疑，有文艺又悬疑的拖沓剧情，起个名字都这么文艺加悬疑,喜欢打台球de端木金鑫
34,喜欢悬疑、推理或有些烧脑的剧情，有一样的嘛，举个小手看看吧！,翩然入君怀
35,很好的电影，大家快来看看,石鑫杰爸爸
36,剧情很好看！,二小_qq2598
37,这么难看吗[捂脸笑]，刚追完十三载和回响过来的[捂脸笑][捂脸笑],愉快的幸运从你开始😜
38,这部剧和隐入尘烟太像了，更多镜头给了时代中普通人的日常和孩子成长的故事。而不是专门为了悬疑刑侦。最后在湖里小斐撩起自己假腿的裤脚时，她居然带着一种炫耀。因为她遇到了最爱在她面前调皮捣蛋求关注的小树。但内心极度渴望小树的悲悯和疼爱之心。当然这对父母算不算太惨？父亲深夜保护自己的女儿居然能干死不知身份的警察。当然警察错以为女儿怀里的汽油就是前面作案人使用的工具。这样双方误会导致的悲剧。执法者错误执法也会酿成悲剧，就如烈火灼心里四个青年误认为自己是杀人犯，追凶的人也认为这四个人是杀人犯。最终的真凶另有其人，那这一场追捕发生的悲剧谁来买单？这算不算寻找真相和真凶的成本！小斐一次断腿，一次被击毙都是为了这个真相付出的成本~~生命的代价！,享受中庸
39,最近真的好剧频出啊 刚看完《回来的女儿》接着《狂飙》就出来了 《三体》也紧接着播出 现在又来《平原上的摩西》 看不过来啦[应援][应援],城南以南不会蓝
40,海清这张脸看着40多 怎么演这个角色,么么哒哒嘛嘛呢
41,首先我很尊重这部剧的演员和导演老师们 但是我一看到划船 不知道怎么的 这脑袋瓜子里净是沈腾吃毛豆的画面[捂脸笑],诸葛嗒嗒抡铁锤
42,傅东心这个人物存在的目的是什么？我觉得导演是个傅东心式的人。,54刘帮主
43,观感太差了，第二集难受到最后一集，要不是挂迷雾剧场，第二集就看不下去了。说什么文艺片，进柏林电影节，沽名钓誉，我看是生活纪录片，慢节奏，单调无味，说什么体现时代变迁下的普通人命运转折，时代怎么变化了，有交代吗？用老旧的场景，就体现年代感了？老李悲惨的命运，怪时代变革了？城管怎么得罪他了，非要杀了他们？本剧交代清楚了吗？前面五集拍的生活琐事一大堆，全是浪费胶卷，本剧的主题是什么？是什么类型的片？侦探，悬疑？简直就是挂羊头，卖狗肉，只有猪才会买。每个人想法不一样，千人千面。导演如此的叙事方式和镜头运用，不知道目的何在？真心欣赏不来。,54刘帮主
44,看的节奏有点慢呀[捂脸笑],207C🧀
45,看看老舅,溫某某
46,都是狂飙看完过来的吗[呲牙][呲牙],匿名用户
47,第一集我竟然不知道在说什么,战国山瑞果果
48,这是网络嘛，才6集啊，看过最短的电视剧,爱的暴风雨🍀
49,一集看完了，愣是没看懂说的啥呀？？？,哦喜随
50,迷雾出品，必属精品[大拇指]在电影版上映前，先看看个剧版了解剧情[呲牙],八倍浓缩咖啡
51,总觉得海清演的不自然,喜欢骑自行车的欧阳巧蕊
52,耐着性子看完了，还好只有6集，从没看过这么……的电视剧，应该还是小说好看点吧，这么平铺直叙的拍摄手法没有纪录片的精彩也没有电影的美艳，从湖上开始又从湖上结束，很多场景都没交代清楚，这么好的一个故事，可惜了。四个字：莫名其妙。海清和董子健就是来撑场面的，而且演得那叫一个无奈[捂脸笑],Echo🦋🦄
53,这是一部披着迷雾探案外衣的《人世间》。用很多长镜头描述了时过境迁，工人大哥---下岗再就业---挣到钱---家道中落。可惜的是感觉后期服化道没跟上，都到新世纪了，和90年代没啥变化。,独钓绿鲤鱼
54,"看完第一集，目前的观感是时代气息浓郁，时代感真实，镜头语言颇为细腻，呈现效果却比较接地气，像是一部很文艺的纪录片，至少目前看着挺有意思。
缺点:挑观众[狗头]拍成这样，受众人群的定位初衷就不是“所有人”",有负光阴
55,习惯了现在快节奏的生活，人心太浮躁。之前的年代生活都快被人遗忘了，这部剧个人很爱看[应援][应援][应援],我就不信这个名字有人取
56,婚礼上唱《灯光》的是艾敬吧,邓明🌼
57,很多人说这剧不适合迷雾剧场  事实上是这个故事不适合互联网，互联网看剧的年轻人是主力，这波主力多数已经对八九十年代没什么共鸣了，所以不爱看。这剧应该上卫视，但能不能播是个问题哈。,斬左
58,首先，我觉得这种与现实生活紧密结合的悬疑剧比单纯的警匪片好看的多，看完建议去看《隐秘的角落》，《沉默的真相》，部部扣人心弦，贴近生活而不失悬疑细节。比那种用虚无缥缈的警察精神去争取人气到警匪片好多了,happy 时光
59,有木有从回来的女儿过来的[呲牙],杨舒予的俢狗
60,这部剧到底拍的是啥？刑侦不像刑侦，生活不像生活，伦理不像伦理。乱其八糟的！,喜欢喝白酒de公户兴昌
61,歌词不对啊，应该是时刻准备，建立功勋，要把敌人，消灭干净才对,爱吃苹果の王官靖易
62,平原上的摩西可能是我第一部放弃的迷雾，但是我看到现在为什么这部剧可以入围柏林电影节了，因为看不懂[捂脸笑],蘇児
63,故事性一般，但社会和人性刻画地很真实（有点杀人回忆的味道）。生于六七八十年代的观众会有更多共鸣。[大拇指],丑丫丫75419
64,第一集看了一半，到底第几集死人啊？到底破的啥案子呀？这剧下饭吗？,王长乐鸭~
65,磨磨唧唧，不知道放的啥,超爱喝橙汁de公上秋蝶
66,请问下有没有恐怖的,依依@BS
67,场景布置，和人物打扮都很有年代感，用心剧应该好看,@将军🍓
68,以第一集的水准看，超过了《隐秘的角落》成为了近十年最好的剧集，质感依然在线,伱宠不起㎜
69,老舅老舅,小羊羔3963
70,演员演技在线，片子画面还不错，节奏合适，故事真实而简单，走心，拍的和看的以及演的都得走心,啦啦嘻嘻宁
71,有没有没看懂的[捂脸笑],婷婷.๓
72,这个片节奏太慢！啤酒厂两人被杀没人破案，整天絮絮叨叨生活的鸡毛蒜皮，小树从小爱打架，直到2000年打架斗殴，还咱家有爸！没浪费时间，看2集看睡了2次！！！然后弃剧[捂脸笑]迷雾剧场沉默的真相好看！,语过添情  ｡◕‿◕｡
73,来看老舅,钟情你
74,优美的山西话[色][色][色],不是，你要干啥？？
75,这不是前几年的老片子吗？我去年看完的，怎么是2023年？,136****9975_m1484
76,"看这部剧就像看书一样，节奏缓慢而真实，得自己去发现去思索。
      所有的事情平淡无奇的发生着，就像我们生活，没有刻意告知，没有强调戏剧冲突，一切都是淡然的发生",樱🌺花🌺雨✨
77,这时长爱了爱了，空降迷雾必是精品[应援],🍍菠萝味的凤梨.
78,海清长什么样都没看清楚，拍的什么玩意儿，都是远远的看,好好好喽
79,看了半集，没一个人的脸能看清的，都是远镜头[捂脸笑][捂脸笑],好好好喽
80,导演是内蒙呼市人，他拍的八月拿了大奖。,小丸子780721
81,没有主题曲？,欢喜就好
82,庄树真是个有担当得男孩，看着巷口那个女孩背影眼光给我看泪目了[捂脸笑],李先生11😄
83,光看时长的话，六集已经够够的了[应援],-杨丽丽-
84,竟然有老舅,🥰木木三💝
85,谁是杀手 过来的,小仙女 ࿐
86,这部服化道简直神了，完美还原那个年代的黑龙江，代入感很强，只要不烂尾，在我心中绝对不输沉默跟隐秘,爱喝牛奶的士孙凌晴
87,值得看吗？看了一集，感觉不知所云。太慢了,пань 先森
88,拍的是太原吧？过油肉,啊深林乱了
89,正在追狂飙，看不过来了[应援],倾国倾城的屠夫
90,挺好看的剧啊，值得一追[大拇指],李淑馨_qq1846
91,最近真的好剧频出啊 真不错,幽玄(雨博)
92,要不是原著粉一直关注，再加上也盯着迷雾剧场，都不知道今天播放，这真是没宣传啊,蜜***日
93,在看最新一期的说唱，才发现庄德增是宝石Gem老舅演的[捂脸笑]会演戏的说唱歌手[应援],August NO.1
94,原著作者 编剧 导演和全体演员们太牛叉了[大拇指][大拇指][大拇指]为你们点赞打call[应援][应援][应援],A ꧁(=^x^=)三弟꧂
95,迷雾剧场又来了，真的好喜欢悬疑烧脑的剧，而且迷雾从来没让我失望过[色][色],芝士焗朱朱
96,没有人赠与你阳光，那就自己给自己,刺麽果子
97,漫长的季节来的,不会飞的胖头鱼
98,一集一个小时？然后六集，相当于六部电影的时常量。你最好一集一个案件,凩娛羐
99,这个也算迷雾剧场？！,sky伍² º
100,画面很抓人，80年代生活场景很真实,salamanka🤟
101,原谅我看不懂。。剧情也太快了，结完婚转眼小孩儿都在学校干仗叫家长了[捂脸笑],@把快乐买断💫
102,看了一集多到底在讲什么？,匿名用户
103,这个片子拍的感觉好真实,镜中的人🎀
104,70后表示第一集完美演绎了 工厂吃饭时间集体拿蒸饭场景的真实体验 一下就拉回小时候的跟谁父母的生活状态，追起来[应援][应援][应援],爱有米
105,嫌慢你去看速度与激情,麻沧
106,没有剧评吗,金九妹永远坚强
107,刚才在微博看到这剧入围柏林电影节了恭喜,supremecyk
108,迷雾剧场里沉默的真相是真的牛批[大拇指],終歸于暮😀
109,迷雾太绝了，尤其《沉默的真相》,爱吃橘子de澹大姐姐
110,回来的女儿真是不行，最后看不下去了……不知这部怎样？迷雾剧场越来越水了,zglyb203
111,还是挺好看的，值得推荐[爱心],Z形……
112,喜欢这种推理犯罪的剧[爱心][爱心][爱心],Rebel0012
113,没人？好看吗好看的话踢我一脚谢谢,我记得💋👁️
114,期待已久的好剧终于来了[应援],一念无悔🍧
115,没看过，还不错啊，追剧了[大拇指][666][应援][色][爱心],追风凌云
116,当年文字女青年艾敬居然老的差点没认出来[捂脸笑][捂脸笑][捂脸笑][撇嘴][撇嘴][撇嘴],🐭 太阳花📿
117,很好看想到了自己小时候的画面,VVIP⁺
118,看着不错，勾起了我的好奇心,龟虽寿⭐
119,看完狂飙过来看迷雾剧场[应援],c陳琪琪
120,很喜欢这类剧情，有节奏，不拖沓，会继续看的,扛刀姚妹儿
121,挺喜欢这类剧情的，会一直看的,幸福的小不点25
122,没狂飙好看吧,也行jsjs
123,喜爱海清，演技派，剧情迷雾，超级推荐[大拇指][大拇指][大拇指],LEE_LSC
124,挺喜欢这类剧情的，会一直看的，加油,迅儿后
125,迷雾出品的剧竟然不上首页，我还是看抖音上才知道爱奇艺有这剧，还用了搜索,用户4bb115a3
126,这剧不错，良心时长，少见的文艺剧,爱赛跑の公祖经纬
127,"沉默的真相yyds 不接受反驳
",不吃折耳根～💤
128,这节奏有点慢,👂👣敏敏🎆
129,迷雾剧场，yyds，时长，也是真不错[大拇指],夏沫殇颜🙈🙈🙈
130,这是志同道合了。顺序都是一样滴,马莲开花 也是爱。
131,6集不过瘾啊,头带大红花。
132,不错，那个年代就是这样子的。生活节奏不像现在这么快，需要慢慢去体会感受。,人在旅途_qq1180
133,这个一共几集各位亲们,喜欢跳远の叔孙暖梦
134,看了四十多分钟感觉不太好看[捂脸笑][捂脸笑],胖阿橘
135,这都说啥呢？,幻影666😀
136,看完了，这部剧怎么说呢，主要是刻画人物居多，剧情推进较慢，悬疑部分可以忽略不计，这部剧需要深挖，有很多隐寓,安仔你很酷
137,第一集是我打开方式不对吗？没看明白演了个啥,匿名用户
138,墙上的画好像小斐啊 一模一样,元申~小崔🤙
139,不好看不好看，坚持十几天才看完了，总想着到后边会有惊喜，但事实没有。前一两集大家都知道凶手是谁了，只是等着看怎么破案，有什么特殊的破案逻辑，谁知道就是平平无奇的案子就破了。而且很多镜头很突兀。整体意境偏文艺，有些镜头需要你去动脑想，但是这个剧真的不好看。喜欢看悬疑的不要看了，喜欢看节奏快的也不要看。,归.海✌
140,迷雾剧场已经拍出感觉了，水准应该是国内最高的，演员演的真实，导演摄像美工各个敬业，长镜头下的场景似在还原时代，又在制造悬疑的密境,喜欢吃豆包の刘傅白竹
141,还好我是八零后，一个小时全靠怀旧撑着了，导演，演员，道具都给力，但奔着悬疑来的，这节奏。。。。不怀旧的人能忍多久。。。@。@,品高+
142,真的不好看吗 不是说入围柏林电影节的吗？[捂脸笑],火爆星王
143,且不说剧怎么样，就说这个剧的时长，更新时间就比其他什么所谓的热播剧要良心,古道西汀
144,我的评价是不配进迷雾剧场,万户人家，几盏长明
145,挺好看的，棒棒哒,闫永🍓
146,空降的迷雾剧场！,哈哈哈哈哈💕⚡️
147,我挺喜欢这个男主[爱心],A龙叔叔
148,好看好看,《锁》5412
149,这片子是在我们呼市拍的，呼市体育场、青城公园，老厂子，好多地方,月野🐰😗
150,"[应援]剧情不错
",用户89800920
151,挺好看的[大拇指],若雨清风丶
152,"电视剧就电视剧  
不要搞入围柏林电影节的噱头  
即使是  也是人家电影版
平台连这点基本常识都没有",liyunyan iris
153,前面铺垫这么长？十七分钟了 就交代了相亲结婚。结果又生了个孩子[捂脸笑]。这节奏这铺垫[666],Jun🎧📀🏊🏻🍀🐒🔙
154,青城公园，是呼和浩特吧,哈日班迪
155,毕克旗是呼市的那个？青城公园也是呼市那个？,李岳衡ꪶäꪗღꪖꪸꪀ
156,背景是太原？,凶猛的羊驼哥
157,乱七八糟没看明白悬疑在哪里呀,Bobby996
158,多一些这样画风的悬疑剧吧，现在悬疑恐怖之类的大多清一色黑屏黑屏，灯都不舍得开。真正吸引人的悬疑不一定非要黑压压的色彩表现,女巫月牙🌙
159,有点意思，长镜头真敢拍啊 。,182****7421_m1159
160,看过的朋友来说一下值得看吗？,留守儿童CC
161,看完回来的女儿 无证之罪 沉默的真相 隐秘的角落 来的  最爱看迷雾剧场,派大星爱吃汉堡👏
162,看了半天没看清这个董宝石长什么样子,匿名用户
163,迷雾剧场[应援][应援][应援]悬疑剧yyds我喜欢,安娜晓主
164,千万别和回来的女儿一样难看，期待中,牡丹妈妈555
165,好多年前看过小说，今天刷到才知道竟然拍了电视剧。,祝枝山zzszzs
166,慢节奏的剧体现的是真实细腻的生活，喜欢。,Viper327
167,导的啥子啊！这不是拍文艺片是悬疑片，节奏慢得让人无语，勉强看了两集实在是没法看了,Grace＆Coffee
168,没个迷雾评论区都有沉默的真相,白雪不是公主723
169,初看好似节奏慢，但随着剧情展开有种娓娓道来又让人回味的感觉，有纪录片的真实感和时代感，一部好剧。[大拇指],匿名用户
170,"这剧情跟迷雾根本不沾边，不是大冤种，不是文艺青年，根本不用看
",药不染丶
171,酸奶演的好。是那个年代的,ZQYolanda
172,最喜欢看迷雾的，第一集看完了，都不知道拍的啥，没有悬疑感，直接不想再看后面的了。,陌想想
173,今天看了几集感觉还不错，镜头语言非常的电影化,西瓜透心
174,最悬疑的地方就是这个片子在悬疑剧排行榜上[捂脸笑],奶糖726
175,这个是在吉林市拍的吧,老男孩1999😁
176,回来的女儿刚播完就又出谜雾剧场了，这不符合爱奇艺呀，至少得再等几个月啊，这来的太突然了有点没缓过来[捂脸笑],努力它不好嘛！
177,平安夜蒋不凡为何让李斐爸下车，并起了争执？,7天设计狮
178,拍的非常好，每一帧每一秒每一段对白都那么有味道！不过没经过那个时代的人恐怕不能体会到，这就是代差吧。,明玉07
179,咋拍摄手法和场景那么像是文艺片……作为悬疑，有的镜头太长了……一个蒸锅也拍了5秒…,~断^弦~
180,看完了，表示没看懂！破案花了这么多年，也没说老李为什么要抢劫杀人！为什么要抢劫警察！海清演的角色是啥意思，[捂脸笑],喆之秋🔅
181,太棒了，演员，服化道都十分到位，原音也超级棒，拍出了那个年代的感觉。,上学人💝
182,就六集也不够看啊,马龙@🍄
183,为什么杂音很大？,我是八万
184,此片谨献于重度失眠患者[睡][睡][睡][睡][睡],Rafael雲NADAL
185,我是为了董子健才来看这部剧的，这演的我实在是看不懂，像回来的女儿，狂飙和三体这些都非常好看，这个有点没意思,武圣翔_qq1200
186,导演可能太懒了，拍完不想剪片子，粗剪个六集就得了,Movie concept
187,给喜欢这类片子的人推荐几部个人认为最为顶级的艺术大片，《恋恋风尘》台湾，《岁月神偷》香港，《美丽人生》意大利，《艳阳天》法国，《燃情岁月》美国。当然还有我们大陆的，《阳光灿烂的日子》《太阳照常升起》姜文导演，《与青春有关的日子》佟大为，《血色浪漫》刘烨，《独自等待》夏雨……暂时想起的就这些,凶残的棒棒糖😍
188,不喜欢我没文化看不懂，我以为是悬疑片呢，还等待着尸主,哈哈哈哈哈哈哈哈~🍁
189,迷雾剧场里这个最不好看，有点失望,wawj20070513
190,应该挺好看，觉的像纪录片，真实的场面,:试二
191,双雪涛 沈阳艳粉街的事 ,岳小尾
192,多谢导演，这是我看过最接近我们小时候的环境,思皓来了
193,喜欢迷雾剧场，但不喜欢海清，她约等于家长里短,cfsail👑
194,海平演的什么？看的我压抑[捂脸笑][捂脸笑][捂脸笑],王～二%小
195,我说是为董宝石来的，大家信吗[捂脸笑],超爱风月
196,"观感很不好，很装的一部电视剧，不推荐。
1.剧情推进非常慢，节奏拖沓。
2.很多长时间定格的镜头，故作高深，感觉很装。
3.演员各种口音，容易跳戏。
4.主线和主题都不突出，不知道想表达什么。",高飞一二
197,一分都不想给,"gggggggddddqunmd
qnmd"
198,看完了特意进来看看评论，果然喜欢的人不多，这种风格受众应该会很少，说不上喜欢，但还是一口气看完了六集,妞妞～~我的爱
199,狂飙看完了来这看看,啊噜啊
200,看过这么多迷雾剧场就数这部看的最无聊 总共就六集 前两集有点拖拉没多大的看点 刚看完第二集 我相信后面的会非常精彩 ，我是迷雾老粉了。有小伙伴们认同我的说法吗,悬疑剧爱好者💫
201,超级不推荐好吧,勿扰😙️😙️😙️😙️😙️
202,忍不住了，难道就没人知道这是沈阳吗？双雪涛写的短篇小说！[捂脸笑],岳小尾
203,真心奉劝不是太文艺就别不舍了，想悬疑的还是另寻他处吧。狂飙就很好,田布丁丁
204,想看快餐文化的可以提早离场，个人非常推荐此剧,榴莲啊好吃
205,刚百度了一下，凶手你们谁也不会想到，想知道就展开,闻乐WLe
206,节奏慢的让人想睡,紫流苏Daisy
207,这个悬疑剧的悬疑就只是让观众看不懂吗？看了快一集不知道要表达什么,超级小小小小新
208,说的什么，完全看不懂,lisa_qq3940
209,第一个镜头就有问题，体育场看台门口那个公交车不对，导演可能没见过当时的公交车,有志气的猪大爷
210,一集一个小时，看电影呢[666][666],tt茂茂🤗
211,电视上有第四集,局里福人
212,一小时不知道要演什么[应援][应援][应援][应援],喜欢吃梨の东里丝柳
213,三毛一个西瓜的年代，现在一斤都不止一块钱了,henrylau126
214,觉得这部是迷雾剧场最好的,远方有海_
215,这个电视非常值得仔细看看[666][大拇指],徽字21號
