,0,1
740,"这个节奏不是迷雾剧场的剧吧
",冷静兔妈
741,"谁是凶手好看吗 ，在哪看呀 爱奇艺可以吗
",郝梓凡富豪
742,这也就是研究生毕业作业的水平，没节奏、没手段。,千年不化823
743,幸亏不是孙仲怀那货出品的，不然弃剧,莫耐思
744,耽误男的呢在这儿,聪聪最美丽🥰
745,太原普通话，还是这句闹不成！哈哈哈,QQ亲亲✨
746,惊喜，这么好的国产剧许久未见，有贾樟柯的风格,超爱喝可乐の青阳凡之
747,哎呀妈呀，这不是老舅吗。哈哈哈,130****8558_m2171
748,"
这是大鹏吗？看不清，听着声音像",大耍🍀🌷
749,去看了一遍书，很喜欢导演的还原和风格,民月千里
750,一集就能放完非整个六集,183****4887_m1035
751,场景布置的太好了吧感觉像在我家拍的一样,爱喝啤酒の谷利乐山
752,不太明白李斐拜傅东心为老师是学啥？,我儿子是哈哈
753,实在看不下去,是的哈哈哈哈哈哈哈
754,[应援][应援][应援]好评好评,乐多🍒⛄👑⭐
755,只有开头5分钟是好看的,139****0783_m1980
756,这是根据书改编的，拍的真好，和书里的感觉差不多,鲜卑王朝Twq
757,我俩有可能在一起，哈啊哈[色],{￡晚风￡}
758,说实话，和这样的女人在一起生活，累,你真他们啰嗦
759,男主感觉撑不起来这种戏！,Asked一猎人
760,这是迷雾剧场！怪不得猕猴桃自己都没推,绿山墙的安妮贝尔
761,没怎么接触过文艺片，就觉得镜头拍的很漂亮,绿山墙的安妮贝尔
762,海清在公交车上读书我都感觉在看账本[捂脸笑],绿山墙的安妮贝尔
763,非常好看[666],天上地下💯
764,真的好看的电视,棒棒哒1🌟
765,挺好看的，不错不错！,285494673
766,很好看，剧情丰富,爱你曾不改变
767,平原的摩西,名字是很难取的都被占用了
768,想起小时候，捡人家没放要的鞭炮,一地幽蓝 龙哥
769,满满的回忆，都是小时候的画面[捂脸笑],丶渣渣鑫
770,这个剧的布景好真实，看看就有代入感,没有欲望的兔子
771,非常完美  好看,爱唱歌の宰父秋寒
772,拍的什么？没有海清三分钟都坚持不了,新科导演
773,时长感人 其他 电视剧楷模！,爱晨练的叱利书琴
774,看半天了还没看到案情，看不下去了,赤杨心
775,第一集看了半天，悬疑呢，,a是你的小宝贝呀
776,节奏感太慢,郑子威😃
777,值得推荐 懂得都懂  大赞,达叔。🍡
778,好看好看[应援],我说的都对-
779,这片子得慢慢品，细节埋伏得挺多,JimDK
780,好看的，节奏比较慢，但是挺舒服的，细节挺多,冰激凌💞♥♡
781,难怪只有六集，一集一个多小时,喜欢吃冰淇淋の小美女
782,什么意思？看不懂，一集了都没看出什么名堂,潇潇多米
783,这片子贾樟柯味道好重,小河神的神
784,剧情很好看！,风力机🍑
785,是不是这集啥内容没有啊？,匿名用户
786,宝石要在水里唱完野狼才能下水，这是原则问题！,抹茶抹茶冰淇淋
787,剧情精彩[色][应援][666][大拇指],喜欢越野de钟离海凡
788,开头这个相亲，太失败了，这女的咋看都像40岁了吧。,。刚好💤
789,看的一头雾水，是不是年代记录片啊！[捂脸笑][捂脸笑][捂脸笑],亮亮😄🍦☔👑👍
790,是不是站起来蹬的自行车,中国加油。🇨🇳
791,原著党审判完第一集，觉得还可以，有原创部分，但总体还是在原著这个框架里面，期待接下来，只要不给庄树和李斐搞啥恋爱戏份就行。,用户aab69aa81ac80
792,配角都是呼和浩特的吧，口音太魔性了[捂脸笑][捂脸笑][捂脸笑]我大呼和,鱼儿妈妈30而已
793,跟这样的男人过日子物质不差 ,劲妹v587
794,还以为电脑卡了，调了关天，这音量  啊啊哈,落凡尘8888
795,青城，呼市。青城公园离我家不远,凤阁鸾台
796,前两集太拖拉了，镜头也拖拉，剧情也拖拉,一兰11
797,据说是在内蒙古呼和浩特市取的景,安逸的清道夫
798,这个题材我还挺吃的，演技都太好了,卉卉看烟花
799,海清演得好好，剧情的设计感足足的,月亮奶油面包
