,0,1
462,纪录片式的叙事风格，对于年轻一代的观众可能看的会比较乏味，剧情紧凑，细节满分,喜欢武术の东方梓美
463,以这样的规格拍一部网剧，实在太奢华了。，高度还原，剧情高能,魔克黑猫233
464,片子拍的真的很好 全程电影质感，人物关系渐渐浮出水面,忆影_233
465,海清外形身段也好看，故事脉络+人物关系也很耐人寻味,淹死的鱼_w_
466,董子健小时候的戏的篇幅好长啊，论是演员，制作团队都很完美,抱住Clear
467,一眼看下来就是电影质感，细节要素众多，希望能继续保持,九时五十三分
468,演员阵容强大都是妥妥的演技派，开头就悬疑感拉满,用户3b0fae82
469,和回来的女儿 平原上的摩西相比 好看不止一点半点，整体氛围很高级,菜的安详A
470,竟然没看出来是董子健，这个妆化的可以，紧张而揪心,天后太后是我
471,导演转场真的厉害，节奏快，故事环环相扣过渡的流畅顺滑,Katydid13
472,全员演技在线细节超级丰富，快速虚影的形式也蛮新颖,轱辘和路古
473,竟然没看出来是董子健，这个妆化的可以，氛围感好强,M酱的小日常
474,影片对不同时代的特色与气息，拍得太棒了，气氛紧张兮兮的,做个牧师放牛
475,第一集里傅东心给刚小学毕业的李斐读的书是《卡拉马佐夫兄弟》，剧情分分钟高能,布宜諾斯A
476,太合我胃口了，特别现实主义，服化道真是到位啊，人物丰满,善变的吴莫愁
477,这个电视剧妥妥的是符合我的胃口了，质感依然在线,拓海不上树只开车
478,小演员眼神有戏又自然 牛批牛批，对人心的描写很细腻,魔鬼AllenA
479,镜头美学丝毫不输《隐秘的角落》，整个剧情节奏感非常好,清羽Fly 
480,节奏绝了不拖泥带水也不乱剪无逻辑，剧情分分钟高能,Olivia和小小O
481,海清真的太美啦！，细节要素众多，希望能继续保持,用户3b0fae5f
482,太久没有看这么令人兴奋的影视作品了，好紧张,月野鼠吃黄瓜
483,悬疑感荡然无存，整个剧特别的张大磊，特别的生活化，开局就让人感到紧张,不吃香菜不吃葱A
484,没想到悬疑剧还可以用八月的方式打开，全员也都是演技派,满月是大饼饼
485,爱奇艺对于电影创作者真的是最友好的了，导演和编剧都好棒,匆匆那年 
486,演员阵容强大都是妥妥的演技派，论是演员，制作团队都很完美,伍之R大大大
487,目前最喜欢的一个角色是男主他爸庄德增，人物丰满,家有贤妻王华华
488,果然作者性强的小说也需要作者性强的导演，去除东北味反而更普世，很写实,寄居蟹AA
489,看了四集平原上的摩西，非常贾樟柯啊，导演和编剧都好棒,谁说不是呢A
490,这一次的剧情完全抓住了我的胃口，开局就让人感到紧张,小刘同学0507
491,第一集里傅东心给刚小学毕业的李斐读的书是《卡拉马佐夫兄弟》，全体都是演技派,惯性的节奏 
492,很喜欢看这种世纪末背景下的悬疑剧，演员之间的衔接点做的自然,晴风万里A
493,平原上的摩西很多镜头都移动的很慢，演员会演，人物丰满,顶花带刺A
494,一看就是老物件，甚至有的我和我父母都用过类似的，感觉质感好好呀,財大發發發大財
495,董宝石这个路走宽了，正儿八经演员水平了，都是实力派演员,用户3b0fae41
496,这部剧太符合海清的气质了呢，摄影取景也很讲究,指鹿为马AA
497,好看！忠于原著而且又做了更大的延展，全员也都是演技派,慢慢58
498,平原上的摩西的镜头语言有一种电影感 ​，质感依然在线,丘不卡皮 
499,影片对不同时代的特色与气息，拍得太棒了，实地取景真不错,东篱下卷香蕉
500,看了2集，好看，长镜头特别多，真的都惊了，好厉害拍的，总体抱有悬念感,蓬蒿人吃西瓜
501,和回来的女儿 平原上的摩西相比 好看不止一点半点，好紧张,微尘碎墨
502,拉大了剧情的空间，跟情节形成了映照关系，角色演绎的很丰富,薛定猫的鳄A
503,海清是心目中的女神没错了，演员台词功底好棒,跑啊跳的小番茄茄
504,整体还原小说和年代氛围感，6集短剧都是精华，剧情紧凑，细节满分,橘枳橘枳橘枳枳
505,节奏很紧凑画面很舒适，论是演员，制作团队都很完美,凌寒独自开AA
506,果然作者性强的小说也需要作者性强的导演，去除东北味反而更普世，节奏转场掌镜都很好,小开心的确信
507,以这样的规格拍一部网剧，实在太奢华了。，被剧情深深吸引了,晚风知我意吗
508,一下让我回到了90年代，服装，自行车，建筑，公交车......里面还能听到太原普通话，剧情紧凑,用户3b0fae2f
509,老舅演戏真的厉害~ 跟海清对戏丝毫不差，人物关系渐渐浮出水面,尤以今朝醉
510,非常成熟的镜头语言，慢节奏的叙事，信息容量很大,用户3b0fae2c
511,新娘的头花真好看，我小时候可喜欢这样的头花了，可惜小时候买不起，长大了买不到，导演很注重细节,lynn小姐姐A
512,这剧有点儿厉害，真挺敢的，敢做的节奏这么慢内容这么精细，暗流涌动,井之木
513,平原上的摩西很好看，董宝石真好，淋漓尽致，导演和编剧都好棒,铃儿铃儿铃儿儿
514,海清的眼神戏很有层次，全员演技在线！看着太舒服了,怪可爱的呢呢呢
515,年代气息感很重 偏文艺风，全员原声台词这点最能打动我,小汤圆的十二月
516,平原上的摩西的镜头语言有一种电影感 ​，太刺激了,黎家大少少
517,发现像张大磊这一派钟情于还原上世纪某一年代生活、思考、行动方式的创作者，阵容很强,花开花落一夜散
518,庄树警校毕业唱歌那一段真的很戳人，镜头语言牛皮,火星情况站
519,张大磊+刁亦男版本的《平原上的摩西，很注重对人物心理的解析,用户3b0fae08
520,这时长太感人 一个多小时一集 看的入迷了，剧情也很符合悬疑剧,静心修身身
521,海清作为演员的魅力要溢出屏幕了，剧情层层叠进,言小衡520
522,今天也是被海清圈粉的一天啊，导演和编剧都好棒,火星包子AA
523,影片对不同时代的特色与气息，拍得太棒了，信息容量很大,游娇&何洛洛
524,镜头也多以缓慢悠长为主，总像是不忍心打断当中的生活一样，电影质感,⚽悲情小调
525,年代氛围和沉浸感拉满，天花板级别，演员选的都很好,豆沙团子A
526,海清是心目中的女神没错了，摄影取景也很讲究,空空等在飞
527,影版没等到，剧版居然先上了，质感肯定是拉满的，主演演技目前都在线,用户3b0fadfd
528,影版没等到，剧版居然先上了，质感肯定是拉满的，开局不错，调色很好,思修修他
529,邱天演得也很细腻，紧张、不知所措的深呼吸，主演演技目前都在线,橘子味柠檬水要加糖
530,剧版平原上的摩西终于演到了李斐拍婚纱照这段，这个造型好有8、90年代的那种复古感，人物关系渐渐浮出水面,浅念_彼岸花开A
531,是好看的！原著的年代感、氛围感、命运感全都给拍出来了， 剧本让我爱了,碎花残A
532,看了四集平原上的摩西，非常贾樟柯啊，演员选得真好,焰火少女
533,海清是心目中的女神没错了，剧情紧凑，全员演技在线,与梦人 -
534,隐秘的角落yyds,王蛐蛐.
535,就这速度[捂脸笑][捂脸笑][捂脸笑][捂脸笑],深海湖泊
536,结局有些让人堵 悲伤,舍得坊😄
537,全部看完了，有人说第一集看不懂演了个啥，我个人觉得好看，你就当是看生活就好了，这个片子的选地，场景，道具，服装，都是那么的精致，就是还原了那个年代，比人世间还好，多真实呀，那样的房子，防盗门，小区都是怎么找的呀，真是绝了。,森林空气水
538,看了原著过来追的，确实不好叙述，因为是短小说，年代跨度大，人物都各自多多少少有点瓜葛，第一集出场的人物最后串联到一起，也没什么高潮抓眼球的点，请耐心看看后续[应援][应援][应援],楼牌得～恰
539,忍不住了，难道就没人知道这是沈阳吗？双雪涛写的短篇小说！,岳小尾
540,差剧没狂飙一半好看,勿扰😙️😙️😙️😙️😙️
541,看着是80年代的剧情，可那时候没有酸奶啊，酸奶是90末00年才有的。,橘里。~。
542,给你一分都算给你面子,勿扰😙️😙️😙️😙️😙️
543,超级不好看,勿扰😙️😙️😙️😙️😙️
544,呼市人来报道，这地方熟悉啊，哈哈哈哈哈，拍这个剧的时候看到本人了还，[色],暖若安阳ccq
545,这个剧的特点不是悬疑，而是那种年代感，导演的拍摄手法和爱情的悲剧。[爱心][爱心][爱心][爱心]大爱，爱了爱了！！,二陈的妈妈
546,不好看差差差,勿扰😙️😙️😙️😙️😙️
547,有海清演的就不看了,guagua_qq1806
548,最难看的一部迷雾剧场，全剧充满阴暗，萎靡不振，拖踏，没一点精彩，打分的话0.5分,冉小峰
549,一家就一个，说明80后，有大单位的地方生活条件不差的。,没有昵称也是昵称呀～
550,第一集好看极了！[大拇指]期待,冰原狼斯塔克
551,明明是东北的故事，非要搬到呼市去拍[微笑],默樱败狗
552,给你分都算不错了,勿扰😙️😙️😙️😙️😙️
553,一分都不想给,勿扰😙️😙️😙️😙️😙️
554,艾敬客串么,洁尘
555,两个凶手就不知道怎么就抓到了，凶手行凶过程全剧一点没演出来，毫无意义，凶手的故事从没交代，简直就是依托答辩,Fshark..
556,海清演技太好了吧，细节要素众多，希望能继续保持,Tracymy~丿
557,那个时代的文艺女青年好惨啊，剧情紧凑，细节满分,Max1li~丿
558,董子健小时候的戏的篇幅好长啊，剧情能不能快些走,Sarahho︶
559,编剧细节填充很给力，演员之间的衔接点做的自然,baby华丽的奔跑
560,竟然没看出来是董子健，这个妆化的可以，剧情也接地气,Yatou2︶
561,平原上的摩西很好看，董宝石真好，淋漓尽致，剧情十分吸引人,花椒芥末柠檬
562,平原上的摩西每集能当个电影看，导演叙事牛！镜头剪辑牛！,jokers︶
563,我是真的佩服这部剧的道具和选景，质感是真的强，阵容很强,michae11~丿
564,优秀水平，是气息氛围的还原，在节奏感快，演技都很好，,枫羚好
565,第一集可以单独成为长片了，那鼓劲儿实在是太到位了,lilycagu2
566,邱天演得也很细腻，紧张、不知所措的深呼吸，镜头语言牛皮,流浪第三十六天
567,好多一镜到底只能说各位演技都很好，剧本也无疑是个好剧本,Aleeee9x
568,这部剧太符合海清的气质了呢，在节奏感快，演技都很好，,Danwe~丿
569,太久没有看这么令人兴奋的影视作品了，演员选得真好,Seyfried6
570,让我想到了童年生活！演员都挺棒的，人物的眼神、角色的设定等都很巧妙,Lietohe
571,海清又美又帅，又御又可爱的，简直绝了，很注重对人物心理的解析,不安的豆瓣组长
572,一集一个多小时里大部分是长镜头调度，全员演技在线,潘潘呆呆
573,的确不正常 海清怎么可能不关注孩子的学习，太刺激了,soarin︶
574,庄树警校毕业唱歌那一段真的很戳人，迫不及待想知道真相,短腿萌妹^★
575,平原上的摩西的美学，太好了，质感真的很好，导演叙事牛！镜头剪辑牛！,温凉少女！^★
576,张大磊+刁亦男版本的《平原上的摩西，导演叙事功底了得,岛歌少女@︶
577,第一集里傅东心给刚小学毕业的李斐读的书是《卡拉马佐夫兄弟》，质感依然在线,姐很高，也很傲^★
578,镜头也多以缓慢悠长为主，总像是不忍心打断当中的生活一样，每个人的演技都很在线,大号萝莉~丿
579,今天也是被海清圈粉的一天啊，故事环环相扣过渡的流畅顺滑,时光请你善待我︶
580,优秀水平，是气息氛围的还原，剧情和质感完全上等,奶油甜蜜兹兹少女i^★
581,东北口音好亲切 刚开始以为是大鹏，道具细节很用心,姐妹花︶
582,平原上的摩西很多镜头都移动的很慢，挑不出缺点的好,喊我女王万万岁i~丿
583,节奏绝了不拖泥带水也不乱剪无逻辑，画面美且有张力,单眼皮菇凉︶
584,我是真的佩服这部剧的道具和选景，质感是真的强，剧情走向让人猜不透,哇塞姑娘@︶
585,好多一镜到底只能说各位演技都很好，总体抱有悬念感,小倔强つ~丿
586,有刁亦男电影主角配角的影子在，塑造得不错，气氛紧张,下一次微笑。^★
587,宝石老舅演的庄父撑起了这部剧的东北含量瑞思拜，开局不错，调色很好,高跟鞋的嫁妝︶
588,看了四集平原上的摩西，非常贾樟柯啊，剧情紧凑,八卦女神i^★
589,在以流量快餐剧集为主的现在，这部剧是我们的福气吧，氛围和情节是够的,深情老梗^★
590,平原上的摩西每集能当个电影看，开局不错，调色很好,如鲸向海~丿
591,平原上的摩西的镜头语言有一种电影感 ​，扑面而来的悬疑气息,无声拥抱︶
592,在以流量快餐剧集为主的现在，这部剧是我们的福气吧，节奏转场掌镜都很好,与鹿相拥而眠?
593,宝石老舅演的庄父撑起了这部剧的东北含量瑞思拜，故事背景与悬疑结合就是有韵味,源少，带我走！
594,看了四集平原上的摩西，非常贾樟柯啊，阵容很强,一欢两梦~丿
595,真的好久没看这么好的剧了，全员演技在线！看着太舒服了,不谈过往ミ︶
596,董宝石的荧幕首秀真的很出乎意料，饰演的庄德增很像八十年代那辈人，全员演技在线,交敌交友不交狗.~丿
597,还原时代、刻画人物、推进剧情，角色演绎的很丰富,哭笑不得i︶
598,剧版平原上的摩西终于演到了李斐拍婚纱照这段，这个造型好有8、90年代的那种复古感，很写实,拜拜肉说拜拜^★
599,镜头也多以缓慢悠长为主，总像是不忍心打断当中的生活一样，剧情紧凑，细节满分,尼古丁很重——︶
600,这剧有点儿厉害，真挺敢的，敢做的节奏这么慢内容这么精细，台词功底让我震惊,哭过之后^★
601,估计导演是想呈现真实的生活场景。噪音太大了，听觉上不舒服。,格林幸运宝贝
602,迷雾出品，必属精品，在电影版上映前，先看看个剧版了解剧情,这人间☀
603,太有年代感了，我们小时候就是这样,洛一一🍁
604,就这还8.3分呢[捂脸笑]3.8还差不多,孙小多美少女壮士
605,这个剧道具太赞了[大拇指]，真的是满满童年的记忆，从发饰到网兜，还有大大泡泡糖[666]，嗯，还原度超高,粉红象🍰🍦
606,喜欢《迷雾剧场》的剧！,冬雨1218
607,细腻又真实 细节决定成败好片子！一集就回到那个年代,木文👑 好运来
608,不知道的看第一集还以为改革开放春风吹满地类型的。。,麓暮🎉
609,这部剧拍得真有质感，跟小时候记忆里的一样。怀念那个年代。,邬亮老师
610,剧情进展的太慢，第一集就没有高潮，说实话看了十分钟就看不下去了。,Tigress🐯
611,这第一集演的什么？连我都没看懂？是杀人悬疑剧吗？虽然你第一集1个小时但是隐秘的角落也是一个小时，两个对比这个后面不太想追啊，太生活了。,巴达克的骄傲！
612,？？？？？？？第一集？？？演了个啥,如意一如0221
613,刚看完第一集，意外地很好看！这小男孩儿演的是导演指导的吗？也太绝了！不过看完感触太多了，我要缓上一天，明天继续看～[爱心],呆子王l
614,"看了五十多分钟，愣是没看出演的是什么，没重点，没悬疑，没意思，整个一流水账，拍的糊涂，看得寂寞，有没有同感的？
",墨兮视角
615,小说相当不错的，没想到那么快就有剧了，还没来得及看，最近剧太多了，爽！,非要我取个好听的名字
616,文艺的手法，悬疑的外衣，讲述了一个忧伤的故事。通篇都充满了淡淡的忧伤，简直就是忧伤滤镜。众多忧伤的故事堆砌成塔，塔尖就是小树和小菲纯真无邪的情感遭遇的极致悲伤。或许生活本来就是这样，看起来才会让人更加悲伤，大过年的，看这个剧就是个坑！,hd123hd
617,太原话！居然是太原话[色],乱码来一串bsgwodnsgw
618,喜欢海清演的所有剧，都是意味深长 耐人寻味的细节剧和真实感；这部剧很还原了那个年代的背景以及人物性格和风格,喃笙北巷.
619,说的到底是啥内容，,朱一龙de老婆🌈
620,虽然暂时还没看明白，但是拍摄手法和节奏还挺让人舒服的,名侦探柯南1223
621,狂飙真好看,Super豌豆
622,虽然第一集节奏缓慢，但是拍得很真实，小时候满满的回忆。,Adazhang123
623,我们大山西话。晋语系。,中条山⭐
624,没看明白,匿名用户
625,明明不是东北，为什么说一嘴东北话？那个时候东北就人口迁徙了？海南呢？,zh岁月静好zh
626,拉的不能再拉了,Fshark..
627,迷雾剧场的每部电视剧都很好看 夏布烟雨在此推荐 并祝大家兔年快乐 吉祥如意,虾爆腌鱼
628,这部剧服化道细心的 小庄这身西服我在爷爷的衣柜里见过类似的 只穿过一两次 袜子加凉拖更是他夏天的经典搭配了,诸葛嗒嗒抡铁锤
629,最近的迷雾剧场有点子忙啊 又是跟着狂飙找坏人 又得跟着这部剧查案子 我这脑袋瓜和手里的笔记本都不够用啦[捂脸笑],诸葛嗒嗒抡铁锤
630,剧情太慢，受不了，走咧。。。,黄鹤的小舅子
631,这新娘好像老嫂子[捂脸笑][捂脸笑],用户456c3022
632,我也没看懂什么意思,我在哪里我是谁我是本宫
633,导演绝对是小津安二郎的粉丝，镜头风格几乎如出一辙,热心市民老赵先生
634,9000班就是花9000钱元入校！但要经过考试合格才有资格花9000元入校。就是因为学校不在片区内！,AKon（金阶传媒）
635,去年看的小说，很喜欢，终于等到剧了，电影啥时候能看啊,付伶栩
636,迷雾系列看得我停不下来，演员演技剧情推动都特在线，力推[应援][应援][应援][应援],好！！！🌷
637,海清竟然还能演绎这样文艺沉默的角色，想想就好笑[呲牙]，,乱世佳人慕容雪
638,这袜子皮凉鞋必须给导演加个鸡腿儿,王大爷沈阳分大
639,节奏太慢，很沉闷,达达米1234
640,董宝石演的真不错，很自然啊，第一部主演剧就发挥得这么棒[大拇指],伍六一的小太爷
641,慢节奏的迷你剧我真的好爱！董宝石和小董演技很可以[色][色],Aurora0203
642,回响、尘封十三载大家都可以追，👍,匿名用户
643,小树长得好像韩东君啊,jiahuirui3479
644,演滴是啥,139****5533_m1153
645,这电视剧六集吗？这么短,吴琼紫彧
646,迷雾必是精品，yyds，[应援],梅梅_wx4275
647,这不是老舅吗,遇鱼灬
648,怎么评分？,.  左大牛
649,这不是在我们呼市吗,喜欢跑步の侍其安容
650,这都不是呼市方言,匿名用户
651,这个是梁冠华的姐姐演的吧[呲牙],细听雪落花深处
652,场景还原的比狂飙好,GaryLucas
653,还没看岀悬在哪里,巧巧花坊
654,这种长镜头不多见了,2400241787
655,这简介太简陋了,小程程妮
656,剧情太拖沓了,宝了贝贝。🎊
657,介绍背景的时间长。,江渝山人
658,看的让人感觉好压抑！,g123hhgh
659,看不太懂 ,　Virgo
660,这是老舅吗？,S$ky
661,一共才6集啊？[捂脸笑][捂脸笑][捂脸笑],蜡笔小新/🎆Owen
662,这节奏，有点不想看了,骷髅头太冷了
663,磨磨唧唧,夸克：青山
664,少年歌行来的,金牛座♉磊
665,这说的是啥 没懂,是柑橘味💦
666,请问这个是讲什么,letᰔᩚ-
667,节奏太慢了,花花的爱齐艺
668,很有年代感,小兔多多
669,庄爸爸不错[大拇指],啤酒香蕉火锅
670,看得我一头雾水💦,糊里糊涂的小怪兽
671,这真的是悬疑剧吗,!!!!Nason
672,完全没看懂啊！,who123🍀
673,怎么拍的像纪录片,爱生活的小6
674,又是董总啊？妈无敌啊[应援],One Piece.🤗
675,好看吗家人们,骑手4****8
676,怎么没人啊哥们们？,江的对
677,好看吗各位,漂流的海藻
678,老舅牛逼,灯球儿仙子
679,时长感人[应援][应援][应援],淮南？
680,这是宝石老舅演吗？没认出来，就是听说话听出来了[色],西西玛吗
681,第一集耐着性子看看了一半实在不想看了，太拖沓了！,JUST IN TIME.
682,看完评论区，我都不想看了[捂脸笑],沐鑫 ✿
683,这剧情简介太简单了吧？都没有看的想法,青苔☀
684,这男的是真的厉害了，啥都行[应援][应援]，这老婆享福,巛巛巛巛巛巛巛巛巢
685,这发型咋这么多年没变过呀，盖眼睛[捂脸笑],巛巛巛巛巛巛巛巛巢
686,镜头拉得远远的，都不晓得拍的啥,cqwzph
687,看了一集了都不知道在讲个啥,hi奎奎
688,庄树以后估计做警察了,raymon song
689,俏丽哇，实习记者？快退休了吧,你強爹
690,这戏真搞笑，导演刻意在场景和服装上展示年代，不明白的是男主角在公园相亲，边上几个戴草帽的，他居然用吸管喝酸奶，太拉垮了。学生穿校服？？家里有彩电，最早应该是80年代末左右，看不懂这大杂烩剧。烂剧看不下去，浪费时间。,半个橙の甜
691,一部真实无华，却又质感非凡的好剧[大拇指],时时带带飞飞说说
692,看了三遍结合评论才看懂，带有浓厚刁导风格,痴痴呆呆痴痴
693,感觉这部剧的节奏好慢哦,智商已欠费୧⍤⃝🐷.
694,开始的五分钟好像不该有这个酸奶吧,sun20100411
695,这是真实事件改编的吗？杀人这段是真实录像吗？,爱懒床の刘傅敏叡
696,还是没有看明白，到底想表达什么[捂脸笑],洳鱼得氺
697,70后表示对这个场景非常怀念,罹三
698,是不是有点长，看小说才看1个小时,运动中的古古怪怪
699,八十年代，有点意思。比较含蓄。,   
700,看不懂，演的什么玩意剧情闷闷的,齐大圣.co
701,看第一集有点想睡觉了，看困了[捂脸笑],小小女娲
702,这剧讲什么啊？看了半天，不知道拍啥,DY天亮
703,拍的非常好看，太真实了，让我回忆起那个年代，[大拇指],li楠☀
704,非常好的一部电视剧，失眠患者的福音[大拇指],啥子j批东西哦
705,前面可以，后面不行，结局的有些潦草[捂脸笑],喜欢吃水果的一一
706,一集时间太长了，完全可以分成12集,AA🥝哦
707,这剧不值得看[捂脸笑]，演了个寂寞,纯纯纯纯正准备迎接挑战
708,"迷雾这个IP不打算要了？？？？？？什么片子都能进迷雾吗
",蓝黑西西
709,看不到半集 已经喜欢上这剧了，为它充会员！,斬左
710,预算少，找不到演员了，这个记者找个老太婆来演,我是厨师🎁
711,我去，海清这么老的？成老太婆了,我是厨师🎁
712,充会员准备进来看的，貌似[捂脸笑][捂脸笑][捂脸笑],爱吃炸鸡的小钻风
713,负东心、赵小东。。。。,阿特兹༡
714,这到底想演什么啊？又好奇又不愿意看,丸子玩团子
715,我怎么看新郎 像坏人呢,Yang jia yue
716,小庄为什么不能直起身子来,Yang jia yue
717,一群小鲜肉，迷雾剧场怎么了？,哥有6多兰
718,庄树这个小演员在哪里找的人[捂脸笑][捂脸笑],老男孩1999😁
719,第一集真的很啰嗦，看了这么久[捂脸笑],老男孩1999😁
720,"最近柏林电影节看到的然后就来看看
",奢罗
721,看了一会，海清真能装！弃了没意思,陌小西づ
722,这电视剧拍的，剧情不紧凑，太拖沓。,三哥 （劉誌惷）
723,看了第一集，实在不知道看什么，以为第二集会有点……，算了，不看了[捂脸笑]，,喜欢奔跑の即墨心诺
724,海清站在就别出来演了，老骨相出来了，尤其是嘴,，，，3566
725,这个胖妞演技碾压他两,黑帽🍀
726,看评分大概率不太行了[捂脸笑][捂脸笑][捂脸笑],hill6417
727,刚看到第一集，感觉太生活化了。,茹坤💦
728,感谢弹幕提醒，我还以为我耳机坏了,塬园源缘
729,很好看啊，剧情娓娓道来，很有年代感，剧组用心，,梅香竹影
730,手机看剧很累，不能投影电视机，非常讨厌,lin平淡生活
731,这看完一集感觉是个沉闷的生活片……,粉color
732,这部剧好看的，只是海清的确演的不好,发烧友🎐
733,音质太差，吵杂的声音,神光之龙
734,沉默的真相我看了好几遍都看不厌,还是那片叶子
735,不知所云,意达的花99
736,剧荒了，来得及时。看了一个戏骨演的偶像剧，急死人了。,hill6417
737,这前面铺垫也太长了吧,咻咻皮皮虾
738,女生的校服我们那时候就是这样的同款[捂脸笑],背影很孤单🤩
739,这是唱闪亮的灯球那个？,青萝卜白萝卜胡萝卜变
