,0,1
0,王鹤棣不是很火吗 怎么这部剧热度好低好低啊,O啦de胖胖O
1,啥时候开播的都不知道[捂脸笑][捂脸笑][捂脸笑][捂脸笑]才发现，这热度也太低了吧,东方大强哥🏖
2,好多人问为什么要改名字，其实我感觉是官方想给单纯喜欢西南联大历史的人一些自留地，剧集永远只是依托历史的二次创作，而真正的西南联大应该属于历史本身。战火中的青春也很好，他们的战火青春，我们的和平年代。,白月光与朱砂痣💜🆔
3,还以为没播呢[捂脸笑][捂脸笑][捂脸笑][捂脸笑]怎么都结束了,丶野猫九月
4,[捂脸笑]还以为没上映呢…这都播完了啊,胖大海泡可乐
5,有人比我更晚知道这个剧播了吗[捂脸笑],宇日俱曾生八个双胞胎
6,看了预告觉得真的太燃了，致敬那个年代，致敬战火中的青春，致敬那段艰难又辉煌的日子！！,是个猪咪kk🐱
7,什么时候啊我丢怎么没热度,云隰公子
8,历史老师看了 还推荐我们来看 说很多语句很标准 都是很准确的历史名词,小劉不是劉總
9,还以为没播[捂脸笑][捂脸笑]都播完了才知道改名字了,Verona😎
10,有没有诀人们啊[应援][应援],A_95A9
11,真真不是很喜欢看战争的，为了棣棣冲了,：无味
12,打开这部剧之前，我真的没想到它能怎么深刻，男女主的爱情戏是变少了，但这部剧带给我的震撼没有少，我很喜欢里面年轻一代演员们那种意气风发，我也很难忘记闻一多等角色带给我的无限感悟，他们给我一种靠信仰活着的感觉，我一开始觉得不真实，后来我又觉得无比的真实，在那个战火纷飞国破家亡的年代，如果没有信仰，又如何坚持走下去呢，影视作品或许是加大了对他们情怀的渲染，但我相信那个年代的人一定是这般闪耀着信仰的光，一定是这般纯粹的爱着我们的祖国。,H逅D
13,什么时候播的啊啊啊啊啊啊等了好久！还是在抖音护心的评论区知道开播了，赶来一看，好家伙直接大结局了，藏得这么严实，首页一次都没给我推过，真行啊！,药药的小屁猪
14,有谁和我一样是来看王鹤棣的，举小手吧！,奔跑在孤傲的路上😚😚
15,他播的时候什么我都不知道啊。[捂脸笑][捂脸笑][捂脸笑]宣传做这么少的吗？[捂脸笑][捂脸笑][捂脸笑],欣鑫馨💖
16,苍兰诀浮图缘今日宜加油理智派生活桃花坞你好星期六元气满满的哥哥 密室 奔跑都看完了，现在来看战火，还差将夜遇龙和流星花园，目标全部刷完,美女.🍰😄829
17,看完苍兰诀看浮图缘，再接着看战火中的青春[应援],嗯嘻嘻嘻哈哈好🍭
18,东方青苍真的牛，白马帅是真的帅，程嘉树是真的爱国！[应援][应援],奔跑在孤傲的路上😚😚
19,才知道这剧播[捂脸笑],♡马呱呱
20,他为什么接戏这么频繁啊,宇智波！斑
21,奔着男主来的我家的棣。为什么喜欢不起来女主呢？,Z竹竹竹竹Z
22,刚看完江苏卫视的又来看第二遍的王鹤棣程嘉树，放心我不会路透，你们慢慢看[捂脸笑][捂脸笑][捂脸笑],凤凰涅槃2
23,唉，又是一部脱熟人现实的剧，衣服太干净，脸太干净，看了就没意思……拍现实一点行不行？走点心行不行？用心拍行不行？去考证一下行不行？………………………………………………,客-评
24,毕竟是演员，没有信仰就是没有灵魂，徒有其表,霜华夜阑
25,可惜了故事的本质[捂脸笑][捂脸笑][捂脸笑]为了演而演,wahaha101
26,西南联大，一个特殊年代出现的一所特殊学校，那一代的文人真的是铁骨铮铮不输于战场上的战士。,mllyzb
27,无意间翻到[捂脸笑]怎么回事，一点水花都没,UA花🌸
28,暂停还能看王鹤棣上汽大众新途岳品牌广告，很不错，第一次这么喜欢看广告。,BunnyDiDi
29,#战火中的青春观后感#程嘉树他们每一个人都在战火中努力的成长，办夜校可以让更多的人学到知识，夜校就是那个时代最真实的产物。这部剧让我们体现了怎么用知识救国？,j路过
30,啊啊啊原来我爷爷也逃不过被太爷劝学哈哈哈,白月光与朱砂痣💜🆔
31,为什么没热度？？？,太美的承诺因为太年轻℡
32,男女主不行,☞猫咪，没有了鱼☜
33,"好剧，节奏感强，台词经典，演技一流，故事感人的泪点很多。希望更多人来看剧，来了解这段历史，来重温高尚的家国情怀，来触摸曾经那些闪光的伟大灵魂…[大拇指][大拇指][大拇指][爱心][爱心][爱心]
感谢导演，剧组全体人员辛苦了，致敬！",雅荷的天使
34,呜呜呜终于等到了，程嘉树！林华珺！预告就看了好多遍，真的很有电影的质感！！,是个猪咪kk🐱
35,"本次#战火中的青春观后感#话题活动圆满结束啦！按照互动数（点赞+回复）排名如下，恭喜以下用户抱走我们的奖品！

互动量排名前10位的用户将会获得爱奇艺黄金VIP月卡：
1.	傻妮儿爸爸
2.	潺潺流水😗
3.	帕帕棣
4.	十二月的桔梗
5.	小呆桃Victoria
6.	奶油泡芙.....
7.	见笑啦🥰
8.	臣花
9.	喜欢白宇的小宇宙
10.	认真追剧ing🍧

领奖流程：私聊官方账号“评论小桃君”发送“领取奖品”即可领取。奖品将在7个工作日内陆续发放，请大家耐心等待。
❗注意：7天内未主动联系“评论小桃君”领取奖励，则视为放弃哦！

谢谢大家支持，希望大家能在这里收获开心！常来互动#战火中的青春观后感#",评论小桃君
36,这部剧讲的与初中历史一样 喜欢王鹤棣[应援][应援][应援][应援][应援],我love 棣
37,棣棣也在追吧[呲牙] 20岁的演员王鹤棣很好[色]以后会更好[应援],599公共狼
38,看微博上说宗璞先生为这部剧的主题曲命名，所以这部剧有没有像宗璞《野葫芦引》那样风骨的角色呀？如果能展现出一点精气神就想追剧了,朝曛
39,梅校长常说水木清华，下一句是,福尔摩鸡o
40,#战火中的青春观后感#（我是王鹤棣粉丝）看了几集觉得很好看，以前就很喜欢看这一类的电视剧，再加上喜欢的偶像在里面。热血少年，青少年可以都来看看。,幸运猫❄
41,桃李满天下，老师这个职业神圣而庄严，为救学生老师也是什么法都想出来了,可爱的花12
42,古装的王鹤棣超帅，现代剧一般[应援],锦龙荣生书店
43,就喜欢这么不准时的你,拾光晚风
44,最大的败笔就是王鹤棣的头型，咋看咋不像那个年代该有的样子。,仙儿仙x
45,王鹤棣为啥要配音啊,gaowenquan
46,程嘉树，终于和你见面了！,army413
47,应该多看看这种抗日剧，告诉我们要牢记历史，勿忘国耻！国仇家恨不能忘,喜欢吃烤馒头的东里建木
48,女主角好看，演技还可以更好[大拇指][大拇指][大拇指],58同城😝
49,"好感人的一段历史，好有意义的一部剧。王鹤棣程嘉树
",大家闺秀Katherine
50,请问 原著叫什么名字 顺带想去看下,方小淇🍄
51,周也看见她就不想看，假死了,'杨成
52,发现王鹤棣什么造型都能hold住诶，好强的可塑性，程嘉树真的有民国贵公子的气质。,Azure🍉97
53,把双喜发配去银湖拉纤,亲水泡泡：）
54,加油加油  越来越精彩了  为什么热度上不去[捂脸笑],爱吃螃蟹の司空睿才
55,来看四年前的程嘉树[爱心][爱心][爱心],～～嘘、别闹
56,追棣棣的剧停不下来[色],嘉人粉Cheng
57,剧情好看不,久伴我心Gabriel
58,刚看完江苏卫视2集  现在又刷一点  抗日精神达到巅峰了！程嘉树扮演者真的不错！[大拇指],丶抽象派
59,怎么感觉演的好假？是因为演技吗？,［玺夙］
60,我看这部剧为的不是哪个演员演的，为的是这部剧的题材，为的是我的祖国，为的是我亲爱的热爱的中国[色],Purple.Zero
61,终于等到了！！！等了三年的血泪之作[大拇指],香河冰阔落
62,衣服都这么光鲜亮丽，一个补丁都没有,喜欢马拉松的叔仲半梅
63,好喜欢润名，温和大气，有理想坚持自己的信仰。润名演的太好了！,远阳
64,他们的战火青春，我们的和平年代！,·雪落万洲
65,1954年第5世界杯赛—主办地：瑞士本届杯赛，球员们首次穿上了印有号码的球衣(不知道名字是否一起印上了)，这部电视剧演的是1937年,狙神阿誌
66,来看这部新出的战争剧,花千骨8523
67,又来追棣棣新剧啦，在🥝看了几部棣棣新剧，都超级喜欢！,海豚请把星星吐给我
68,关闭评论,生梅芳
69,好看吗好看吗[应援],Sang_Y🌻
70,从《浮图缘》的肖铎彻底被棣棣的演技打动，到近期还在热映的白马帅，棣棣饰演的角色是多变的，可萌可欲可霸道，可以说是赋予了不同角色完全独特的灵魂和内核。这次民国时期的进步青年——清华物理系高材生程嘉树，又是一个在演技上有挑战的角色，预感到又可以看到棣棣在专业上继续突破自己了！,失独的陌生人
71,#战火中的青春观后感#嘉树和润名他们作为学生，都不过是战火中的一个浮萍。学校为了躲避战火而到处搬迁，为了学生们的安危而费尽心思。而学生们也被战火的危险气氛所渲染，增强了自己心中的报国热情，纷纷加入了参军的队伍，看着真的好激动啊！,j路过
72,真的很感人，青春、生命、战火，感恩我们这个和平的年代,又是一遍人生的开始
73,来了来了来了[应援][应援][应援],粽子ddd
74,挺好看的,j路过
75,《战火中的青春》不得不说每个演员都演绎的非常好，每一位人物都刻画的生动鲜活饱满。民国时期的背景下上演着这样的故事，看得我真的是热泪盈眶，感慨万分，这真的是一部好的作品，这个作品应该大火！让更多的看到。先辈们给我们创造了如今的和平年代，我们更应该好好珍惜读书的机会。致敬那个年代的每一位英雄！也感谢这个作品，看完后，我想真的需要更清楚的了解国家的历史！珍惜当下[爱心],请说姐姐你好
76,从高校知识分子这个切入点讲抗日战争，对我来说是很新颖的，我之前对抗日题材都是看到就换台的，这个剧真的有点东西。,欧皇昭昭
77,真的很喜欢 看不腻的那种 让我更加真切的去了解这历史文化 真的很不错 非常建议大家去看,逾祺🌷
78,那时候的清华叫清华园，不叫清华大学。,用户8a057a85
79,少年自有少年狂，身似山河挺脊梁！程嘉树，终于等到你！,宇里有个咭
80,别说还真别说，我还真爱看年轻明星演这种题材的剧,星辰昨夜雨
81,这应该是“我们的西南联大”[爱心],太阳山🌿
82,终于等到了,是棣棣吖✔
83,很喜欢这部电视剧，看了几集了[666],小兰🍑
84,很喜欢这个电视剧，看了好几集了！,😘️幸福的一家人😘️
85,来啦来啦，更新的太少啦,哭也要坚强！
86,这个封面我真的whd的362度是吧,你难以忘怀的姐
87,民国的爱情十有九悲 向先人致敬,卡卡牙
88,程嘉树在篮球场上对林华珺一见钟情，开启猛烈攻势，从此有林华珺的地方就一定有程嘉树。,emmmmkkkkA
89,估计是有点家乡口音，所以不用原音,快乐可儿1109
90,我是不会看的,随时侯补
91,王鹤棣在这边好土 周也的演技也不嵁恭维,爱吃麻辣毛豆🍓
92,所有的热爱都要全力以赴,爱吃螃蟹の司空睿才
93,那时候有那样的篮球服吗？,飘摇的咖啡杯
94,王鹤棣真的好百变，各种类型各种风格的角色都能掌握演绎，多方面发展，真的是很努力的演员、艺人，真的是越来越喜欢棣棣了！！,是个猪咪kk🐱
95,没有宣传啊。。,不合法你爹
96,啥时候开播的呀，爱奇艺给的意外惊喜吗,我累了，没哭*
97,一次战地帮忙让程嘉树决定留在国内，一次战火轰炸让他看清了自己对林华珺的感情。,as_np
98,真的好剧！！！,天生爱你—茜宝
99,来了也子[应援][应援][应援],爱在除夕夜xin
100,"每当民族危亡之际，总有人挺身而出

",iiiiiiiidly
101,润名是那个演员,远阳
102,哈哈哈哈,你是人间心动✌
103,来看棣棣了[色],鱼头欣欣子~
104,致敬先辈,乐乐＋🏖
105,"#战火中的青春观后感#只要剧好看就行，不用非争论谁的戏份多
而且我觉得这个剧情的发展是很合理的，前期就是程嘉树还不够成熟，他就是在以叶润明为代表的人物的影响下一步步走向成熟，然后后期独当一面的，所以大家不要争论了，真的很喜欢润明和嘉树了，看到预告好难过，呜呜呜   。然后这部剧真的传达给我们正能量，大家勇担责任，舍小家为大家，用血肉之躯去抵挡日本的侵略。历史在改变，但他们所传达的精神一定会感染每一个人",White sugar
106,不喜欢男主女主，流量明星不适合演这种题材电视。其他演员都是实力派。,愉快帅气的双
107,为了隶隶子,年年会乖吗
108,鸟叫声很熟悉,谢美云😃
109,抛开这些追星的评论，这个剧怎么样啊，很久没看历史剧了,不要太在意🎉
110,只要为你活一天,￡徐小康
111,女主假吃哈哈,BMW. X8
112,这部电视剧有很多历史影像片段，应该很尊重历史，具有很高的教育意义。,嘉言行
113,此剧题材很不错，现在的年轻人需要看一看了，不然荒废学业[捂脸笑],Annie囡囡😘
114,啥时候出的呀 我一直以为还没有出,ewazu
115,棣棣好帅，他的每一个表情感觉回到了道明寺[色] ,沈木兰
116,棣棣这配音不好,王太太101100
117,一般战争剧都不比言情剧吸引人（个人觉得而已勿喷[呲牙]）,莎莎莎莎莎莎sha
118,太期待了[应援],今天多睡会儿💋
119,看了预告觉得真的太燃了，致敬那个年代，致敬战火中的青春，致敬那段艰难又辉煌的日子！！,喜欢吃甜橙の独孤清宁
120,学生的爱国情怀都很高，何况在动荡的年代，我青年学子都有一腔爱国情怀,可爱的花12
121,为了棣棣必须看，大家一定都要看！[应援],我可真是一个小机灵鬼啊233
122,喜欢看这个[色],L.Z👄🥰
123,男主形象不太好,爱看ju🍓
124,怎么就两集[捂脸笑][捂脸笑][捂脸笑],晚睡小羊🐏.🍑
125,主角拉胯,点播无耻
126,看封面以为墨兰[捂脸笑][捂脸笑][捂脸笑][捂脸笑],榜一大表哥
127,更辉煌的未来由新一代的我们来接力，秉承壮志，砥砺前行！,海豚请把星星吐给我
128,这个好看吗,用户52bfd7c9
129,每天都盼着更新[应援][应援][应援][应援][应援],白鹭小妞
130,热度这么低吗,喜欢喝茶de王官天悦
131,这是一次性更新完的吗？怎么是全集啊？,siniamyiyi
132,奔着男主来的我家的棣。[色][色],爱笑的女孩💯⭐👍🍇68
133,虽然没有期待三年，但也期待了半年了，今天终于等来了,疯疯疯🍡
134,他人配音？,轩轩轩一人之下
135,为什么下载不了,hmal
136,来看程嘉树了,走开不要烦我
137,[大拇指][大拇指][大拇指]虽然是特定的时代。但是中国人的青春本就应该是这样的。血是热的。能让所有的人感受到。可是现在。这身体热度不高，都去追了，所谓的。偶像和仙侠剧。,Z竹竹竹竹Z
138,太喜欢这部剧了，希望多拍一些历史题材的电视剧。,绿门nn
139,好吧，就两集呀，我想多攒点，一起看，不然我会天天想看程嘉树的，王鹤棣，[应援][应援][应援][应援][应援][应援][666],曦^燚
140,王鹤棣再稳重一点，再成熟一点，就完美了,锦龙荣生书店
141,我的天  我一直在等的剧  改名了我还是无意中发现它播了,就就就就要看
142,感觉这个男主和女主和剧情格格不入，演技有点尬，男主形象也不好，代入不了剧情,社会我橙哥
143,今天看你好，星期六才知道剧开播了,GF依然在
144,这是古代还是现代，还有篮球踢还打仗[捂脸笑],ViP桃子呀
145,热度越来越低了，粉丝们在干什么？怎么对得起95第一抗剧生这个称号,肖步活了的
146,第一集才看了10分钟，就让人热血沸腾。真心感谢为之奋斗付出的前辈，才有了我们如今的国泰民安,想不出名字的名字🌈
147,演员就不适合演这种抗日题材的剧，剧情啰嗦，没有看点。后面越看越无聊。,状态ok吗？
148,终于开播了，我的程嘉树[应援][应援][应援],😘🦋～😘.
149,战争片硬要都成偶像剧,真爱@自由
150,致敬战火中的青春，致敬那段艰难又辉煌的日子！,萌鹿宝_qq1912
151,9那是一个山河破碎的年代，那是一个大师云集的地方。,Azure🍉97
152,演完了才看见评分,亚杰
153,王鹤棣就不能有原声出现吗？这么好听的原声,LY木子木
154,说实话，我一感动就稀里糊涂一顿乱写，文笔也很差，但是我只能说，《战火中的青春》它值得，还有说真的，能不能明天就更完啊？,午夜出動
155,不得不感叹男主的信念感体现的淋漓尽致。剧情虽然是满满历史感，但因为演员呈现的带入感让人惊讶和振奋，情感满满是一部非常好看的历史剧。,赵九号
156,比起这是哪个明星演的电视剧，更吸引我的是这段历史。可能我学历不够，我是第一次知道这段历史，而且是通过一部电视剧了解到的，我觉得这部电视剧已经成功了。就像当初看觉醒年代一样，让我知道了陈延年陈延乔，会主动了解他们更多的历史...,霞姐在哈
157,这边也上线了，来看程嘉树[应援][应援][应援][应援],LU噜噜啦啦NA
158,怎么才两集 是上星剧吗,喜欢喝果汁の东宫乐山
159,正在追战火中的青春，让我们现在的人了解以前的历史文化与那个年代的青年的热血沸腾！ ​,好大的风呼呼
160,来了来了,153****3219_m1787
161,两集 吾觉得不够,喜欢吃红豆沙の太公庄静
162,#战火中的青春观后感#时代动荡，硝烟弥漫，一群铁骨铮铮的热血青年也在经历严峻考验，逐渐成熟。,左耳右东😃
163,好看的，看了半集就把我的回忆拉到当年看我亲爱的祖国那时候，特别特别爱的一部电视剧。,猫小姐有一只大猫
164,国破山河在，城春草木深，烽火连八载，弦歌壮古今。乱世之中的铮铮铁骨，挺起了中华民族的脊梁！,30岁离异带俩娃🤞
165,"#战火中的青春观后感#赓续中华民族文脉 铭记文化抗战之史 

此前发布的《战火中的青春》终极预告中，以五位进步学子的成长轨迹，感受近在眼前的家国、同胞所处之境遇，讲述战火之下涌动在校园里的民族复兴，兼具青春感和历史感。同时浓缩了张伯苓、蒋梦麟、梅贻琦、郑天挺、闻一多、冯友兰、朱自清、赵忠尧等一代文化巨匠的人生片段，将观众拉入了那段艰苦卓绝的教书救国征程中，和这所传奇高校的师生一起踏上这段不同凡响的“长征”路。

剧集由南开大学遭受日军空袭展开，平津沦陷、清华被占、北大危在旦夕，三所高校为保存知识的火种，一路南迁。在漫长的中国历史上，西南联大只存在了八年，但却涌现了不少先锋、英雄，成为教育史上的一座高峰。",左耳右东😃
166,在网上看到他与周也的剧照，两个人坐在那里就很年代氛围感，就在等这部剧,2314229828
167,这就是九五颜巅的颜值吗？周也，你真的太让我失望了，演技严重退步，颜值全靠营销,作家碧晗
168,怎么不是首更六集或几集 怎么才两集啊[捂脸笑],山野俱晚
169,综于放假啦，程嘉树我来啦[色][色][色][应援][应援][应援],Love_Di♥
170,终于有影视剧拍联大这段历史了！,风一吹就油了
171,才两集？？？小家子气，给我一次八集能咋的？？？,薇淼
172,2019年刚满20岁的王鹤棣拒绝用替身亲自上阵跑了700多个炸点用生命拍摄的这部剧确实是战火中的青春！恰同学少年风华正茂，期待热血，期待热忱，期待王鹤棣的程嘉树🌲,迷·棣
173,好长时间了终于出来了[爱心],哈哈冰冰啦
174,觉醒年代很好看，希望这部不要失望[呲牙],老纪咯
175,看到评论区有批评王鹤棣演技的！的确三年前王鹤棣演技还不够好，但是在剧中他的演技也在成长，后面感觉渐入佳境了，他也很敬业，整部戏跑了700个爆炸点不用替身，就这一点就很值得夸奖,棣棠梨苑嘉树🎊
176,我发现王鹤棣的剧都在爱奇艺播出,野原新子☔
177,来啦，王鹤棣真的会给我们不一样的惊喜期待战火中的青春[应援][应援],pa pa biu
178,"山河沦落处，群星闪耀时

",iiiiiiiidly
179,我是来看看杨颖演技的,用户954a63a2
180,好好看剧。最讨厌有些人嚷嚷着说是为了谁而来看的。,超级无敌的叮当猫
181,我在封面上看到了，王鹤棣才点进来的，有时和我一样？,周周周周周路飞
182,"青年版的程嘉🌲树给人感觉真心就是：陌上人如玉公子世无双！未经磨难、世事变迁、对美好的未来无限向往之！
老年版的程嘉🌲树一眼望去：脸上写满故事的老人虽历经风雨、沧桑！但坚毅的眼神中却透着自信、坚强！无悔！
真的好期待王鹤棣战火中的青春！@王鹤棣_Dylan ",A💋Elena💋圜圜
183,太好了！自从看了仓兰决粉上了他，就已经沉迷了！完全无法自拔了！真的值得！帅是真的！演技很好也是真的！[色][色][色][应援][应援],滴滴Ddd💫
184,王鹤棣真的太棒了，演什么像什么，归国少爷，意气风发的爱国少年，每一个状态和表情都非常到位，respect！[应援],爱吃桔子の叔孙令美
185,刚刚在江苏卫视看了一遍棣棣的新剧 好激动 搞得现在脑壳痛 [捂脸笑][大拇指][大拇指],沈木兰
186,"生逢盛世，当不负盛世

",iiiiiiiidly
187,终于等到了[色],喜欢吃栗子的单于雪珍
188,来啦来啦,是棣棣吖✔
189,两集是不是有点太少了？？算了屯着播完再看吧[微笑],W•时光蓝了海
190,东方青苍和嘉树是同一个配音演员哦。,ᝰꫛꫀꪝ福
191,等到了，很合适的演员们，剧情好看,歪歪一起吃糖
192,不知道你们有没有看过贾青演的《战火中的青春》非常好看,超爱吃红豆沙de北堂友瑶
193,拍这些片子真的是扔钱，有什么意义？,什么玩意呢？⭐
194,西南联大的这些照片拍的真的很有感觉，就很有那个时期学生的味道，河堤真的是脸在江山在，女主也真的好美好有气质。,乔巴的小帽子
195,"边追剧边学历史

",iiiiiiiidly
196,来了，来看程嘉树,心悦星月
197,热泪盈眶,鱼头❄️
198,来了来了,甜喜涵💦
199,谁家好人开播只更一集,喊懿
200,王鹤棣男主挺好，女主不行，不喜欢周也[微笑][微笑][微笑][微笑][微笑][微笑][微笑][微笑][微笑][微笑][微笑][微笑][微笑][微笑][微笑][微笑][微笑][微笑][微笑][微笑][微笑][微笑][微笑][微笑][微笑][微笑][微笑][微笑][微笑][微笑][微笑][微笑][微笑][微笑][微笑][微笑][微笑][微笑][微笑][微笑][微笑][微笑][微笑][微笑][微笑][微笑][微笑][微笑][微笑][微笑][微笑][微笑][微笑][微笑][微笑][微笑][微笑][微笑][微笑][微笑][微笑][微笑][微笑][微笑][微笑][微笑][微笑][微笑],.Dr.w
201,除了浮图缘看不下去、最近的都挺可,停车场的那个💋
202,非常好看 主要是来看我老公王鹤棣,玉桂狗Kayla
203,"革命者只有站着死，绝不跪下

",iiiiiiiidly
204,演员一个都不认识，好看吗？战争片想看又怕失望。,汤圆211208
205,介于这么剧情，不如改名叫战火中的爱情算了，反正这名字挺适合这狗血的剧情[微笑][微笑][微笑],即兴1.0
206,这剧之前不叫这名字吧？,哥哥爱仙女
207,"
“听闻民国，十有九悲” 期待王鹤棣饰演的程嘉树[大拇指]奏响战火中的青春之歌",匿名用户
208,我以为我是为了追星来看的这部剧，就是冲着王鹤棣来的，结果看完觉得演的都太好了，不仅仅是王鹤棣演的好，片里很多老演员演得都很好，演出了国家危难当头每个人的勇敢担当，就连那个一股脑想着从军的演得也很好，让我忍不住想扭他耳朵骂他猪脑壳，哈哈。谢谢所有人的付出，让大家重温这段历史,为王鹤棣开vip🎐
209,一直想了解西南联大，纪录片看了不少，可总是没有这方面的剧，剧中明星我并不了解，但拍摄[大拇指][大拇指],浮生几许间
210,终于等到嘉树[爱心][爱心],小李同学敲甜
211,难道只有我不喜欢女主周也[微笑][微笑][微笑][微笑][微笑][微笑][微笑][微笑][微笑][微笑][微笑][微笑][微笑][微笑][微笑][微笑][微笑][微笑][微笑][微笑][微笑][微笑][微笑][微笑][微笑][微笑][微笑][微笑][微笑][微笑][微笑][微笑][微笑][微笑][微笑][微笑][微笑][微笑],.Dr.w
212,完美完美，一秒入戏，棣棣演的太好了,娇小娇呀✨
213,"他们在用一生唤醒祖国
",iiiiiiiidly
214,从电视上看了一遍，再来这里看一遍,云卷云舒花落花开
215,"终于开播了，好久没看过这种题材的剧了，应该很好看
",惠一生平凡
216,好看吗，各位,· Lonᴗg·ᰔᩚ
217,就两集啊[捂脸笑],queen👑♛♕
