,0,1
453,好多镜头都想截图，拍得特别好看,喜欢吃甜橙の叱干滨海
454,只要是王鹤棣的必需追,匿名用户
455,就喜欢节奏快的剧不拖拉[爱心][色][大拇指][666][应援],桃和川大人
456,吾辈当自强持书仗剑耀中华,30岁离异带俩娃🤞
457,演员都不错，先看看演的咋样[捂脸笑],Ann_321
458,名字不是叫我们的西南联大吗，怎么改了,打死美羊羊
459,王鹤棣是不是有点地包天 看着封面怪怪的,YOUTH_PASSION
460,"只要足够坚强，就没有什么能把自己打垮

",棣棣_Dylan😘
461,一天两集，想等更新完了看，现在又剧荒，啊，啊啊啊啊啊啊啊啊啊,一朵棉花糖🏝
462,这衣服我能说不好看吗,李哩哩哩哩哩哩哩。。
463,[爱心][爱心][爱心]泪目了，致敬前辈们，致敬西南联大[大拇指][大拇指][大拇指],匿名用户
464,看完我无心上班只想去打仗,这不是我的号我爱看王鹤棣的真好啊
465,"刚毅坚卓，读书人风骨傲然
",马甲别掉
466,不忘过去，铭记历史；珍视和平，面向未来。,jwvivi66
467,你的战火青春，我的和平岁月,jwvivi66
468,看得我热血沸腾，为联大的学子们点赞👍,你的妃妃_
469,20岁时王鹤棣就有这样的演技真是老天赏饭吃[应援],你的妃妃_
470,俞灏明怎么了，演技挺好的。, 정탁
471,这个剧质感太好了，光影美学[大拇指],ttttttuuuu
472,美好河山是前辈换来的，一定要好好珍惜,匿名用户
473,"那一代人，在战火中成为中国的顶梁柱

",X.Y(∩_∩)
474,"有的时候我会想，如果我出生在那个时代，我会怎样

",X.Y(∩_∩)
475,"星星之火燎原，青年志气兴国

",X.Y(∩_∩)
476,"以科技救国，唤起民族精神之觉醒

",X.Y(∩_∩)
477,我也想被我爸推去考清华！,安妮蓝丝
478,王鹤棣演技很灵动啊，看的热血沸腾,心语666🎐
479,其实棣棣原声也是可以的,bililic
480,弹幕挺好的呜呜呜呜很热血，没有一味刷屏,bililic
481,只有国家强大了，我们才能不再受欺凌,匿名用户
482,人有俩条命，一条使命，一条生命，必要时候使命大于生命，程嘉树加油,蓝玉哇咔咔咔
483,在那黯淡无光的岁月里他们成了唯一的光。,Anna0413
484,原来是个剧，我以为是电影[捂脸笑],冲任务
485,感受那个年代青年壮阔波澜的一生[爱心],匿名用户
486,太好看了，三个平台都看了，还是被感动,137****4083_m1606
487,片尾曲看完剧来听就好感动,匿名用户
488,"一代士人，风骨铮铮；同学少年，激扬文字。战火硝烟、奔徙流离中的救亡图存、弦歌不辍，虽然总有战争、饥馑、贫瘠、死亡的阴影环伺左右，但也可见每个人的清白自守、骄傲自持、发愤自强，那是一代人永远的未央之歌。一再感慨那真是一个星光灿烂的时代啊，每个人都值得大书特书。
",许芷妍😍
489,终于等到了，中间有段看的想哭,soinloveyy
490,棣棣的每一个角色性格完全不一样！我一点都不会串戏！[应援][应援][应援],匿名用户
491,谁懂啊 王鹤棣真的很让人放心。,匿名用户
492,国难耻而不辱，学风力难不衰,wong_*~*
493,看到女主已经知道没必要看了 [微笑],上点心吧真的
494,每天两集更新就是好，比某👖断更的好很多,183****1155_m1058
495,江苏卫视看完这里再刷亿便，看的我泪眼朦胧,亲爱的蔓蔓
496,战争真的是太可怕了，好好珍惜今天，[大拇指],晓霞%
497,《战火中的青春》比想象中还要好看,今天多睡会儿💋
498,好希望邓为也来演这种剧,喜欢上网的公广向晨
499,我来了！！！程嘉树！不好意思来晚了,Solo燕✨
500,"回望先辈风华，奏响青春之歌

",匿名用户
501,"那一代人，在危难中发芽，在国耻中发奋
",匿名用户
502,我等了三年的剧啊终于播了[色][色],i蓝狮子鱼
503,棣棣还是东方青苍的配音吧,匿名用户
504,"华夏波澜壮阔，少年仍需前行

",iiiiiiiidly
505,学生的爱国心演绎的很好 背景十分惊艳 配音也是十分好听 演技都在线 连配角的演技也很好 以救国为主题 每个人之间的爱情为辅 剧情也非常为之震撼 很久没看到这种题材的剧了 真的很好看,看不清往哪去
506,男主的嘴长的有问题,马拉松的北野寄蕾
507,#战火中的青春观后感#西南联大是我向往的地方，那里的每一个人都是我敬佩的存在。这部剧是我从2020年等到2023年，三年的时间，终于让我等到了他，从我们的西南联大到战火中的青春，程嘉树，林华珺我期待了这么久，终于如愿了[爱心],用户5498404400540
508,西南联大当时有看纪录片也在三年前去云南师范大学参观了西南联大的旧址，真的很感动[爱心]惊喜王鹤棣演了这个题材的剧，希望是一部好看的剧[应援][应援][大拇指],Bing-_Baekhyun
509,放心我不剧透，看一次哭一次的我只想让你们多备点纸巾[捂脸笑],匿名用户
510,两位95后男女主发挥得比想象中好，绝对是大手笔制作,路上小心2r1
511,制作班底这么棒，不愧是我放入追剧列表里的电视剧,月亮奶油面包
512,如果说觉醒年代是文化的觉醒，那么西南联大就是文化的传承，很刺激很惊喜的感觉,在我手12r1
513,男女主也是在默默无闻时期通过层层试镜选上来的，安利了同事们一起看,偷看你3242
514,今天的幸福得来不易。教育香火不能断，被剧中人物感动了,口嫌体正直先生232
515,莫名感觉王鹤棣和周也很有夫妻相，题材也是让人感动的不得了,两包辣条约吗23242
516,导演编剧换一个我就不看了，期待保持高质量水准,艾尔娜维斯232
517,个人观后第一是画面整体令人太舒适，自己以中国人身份自豪,伏枕
518,期待了超级久的一部剧，整个宿舍都加入观剧大队,拂蛾
519,战火中的青春真的深受中老年的喜爱，多谢导演编剧带来这种好剧,元气资深魔法使232
520,王鹤棣真的是越来越帅，最精彩的近代历史变迁剧了,坞舟
521,那个时候的知识分子才是真正牛逼，特别有教育意义,萌颜233
522,在最近的国产电视剧中算是出彩的了，各位演员飙戏让人感动,烧酒小可爱2332
523,理想抱负来表现革命主题，更容易让人看进去，大无畏精神直击人心,解阙
524,程嘉树林华珺颜值太般配了妈耶，演员细腻的演技,请你成为我的主人233
525,这剧我最近真的太喜欢看了，虽然是真实故事但是令人惊奇,驿别
526,国产难得做这个题材，非常不错的近代历史变迁片,椿慵
527,这个题材我非常期待，是近代历史变迁片我就好喜欢,少女收发室
528,鹤棣的民国造型还是蛮帅的，根本不需要怎样煽情,湫远
529,剧情节奏发展蛮快的，不拖沓，接过先辈们手中的接力棒,不服咬23333
530,难得一部主旋律电视长剧可以看，看起来节奏好紧凑的样子,甜味信息素
531,这个题材我还挺吃的，强大的制作班底和一众实力派演员,软脾气233
532,这剧看得人有点热血沸腾，没想到这部剧的质感这么好,闪闪惹人爱233
533,如果那时没有他们又何来的我们何来伟大的祖国，多谢导演编剧带来这种好剧,来夸我不拒绝2333
534,感受到历史厚重感的一部剧，特别是在这么恶劣的场景下拍摄感觉太真实了,小公举拒绝说话2333
535,看制作班底，导演、编剧也都算靠谱，很喜欢这部剧的台词和背景设定,本可爱气死你23333333
536,哈哈哈唯有毕云霄心疼嘉树，题材也是让人感动的不得了,可人儿233
537,看的时候情绪都被带动起来了，质量确实真的非常高,专属粉色系
538,兄弟情真的暖到了，是不管走多远都会担心你的家人啊，眼泪真的忍不住,三花猫233
539,难得一部主旋律电视长剧可以看，场景真实高度还原,软语呢喃233
540,难得快节奏的剧，一生太短，一瞬好长的思念在岁月中终将回响,草莓酱丸
541,为文化抗战立传，为知识分子立像，太有视觉冲击感了,她咽233
542,个人观后第一是画面整体令人太舒适，情绪调动力也很到位,集齐一箱纯露
543,那种青涩与热血真的让我觉得他们就是那个时代的人，还挺喜欢这个题材的电视剧的,软萌且乖
544,那种青涩与热血真的让我觉得他们就是那个时代的人，看得我热泪盈眶,浅了个九
545,背景交代的很完整，节奏也挺快，看起来节奏好紧凑的样子,深邃的眼睛落满星光233
546,那个年代的人，真的纯粹又有力量，用心拍的剧大家都看的见。,依米_233
547,永不磨灭的时代传奇和铁骨铮铮的民族精神，角色刻画细致,魔克黑猫233
548,铭记文化抗战历史的题材真的很有必要，眼睛发酸眼泪都要出来了,掩饰孤独233
549,男主脸真的很能打，一生太短，一瞬好长的思念在岁月中终将回响,重庆女孩。 
550,#战火中的青春观后感#战争当前，少年不负使命，勇往向前，一心为国，真的感动到了我[流泪]。,群浪环伺
551,如果那时没有他们又何来的我们何来伟大的祖国，眼泪真的忍不住,芥末甜味豆
552,群像戏很不错，每个人物都有自己的行动逻辑，这个剧情爱了爱了,苏衍酌 
553,每一帧每一个镜头代入感都太强了，这剧已经被我锁定了,菜的安详A
554,林华妈妈真是典型的中国父母了，剧集本身超有感染力的场面,宣姜宣美
555,群像戏很不错，每个人物都有自己的行动逻辑，质量确实有保障,采桑子男
556,每次想到这个历史都会感到痛心，把角色演绎得很精彩,恰似陌上尘
557,朋友推荐来看的，整体水准之高对于同类型题材是难以逾越的巅峰,做个牧师放牛
558,看的时候情绪都被带动起来了，特别有意思的一部剧,我是Shiyo
559,感觉粉丝都去冲裤的热度了[捂脸笑]为啥没人号召冲爱奇艺的热度啊[疑问],H~E~D
560,随手点开，竟然一口气追了七集，导演真的很会调教演员,时间的河A
561,的确在这一次的剧情里面给我们呈现出很多不一样的看点了，感觉到演员的敬业,善变的吴莫愁
562,两个演员也比想象中演的自然，安利了同事们一起看,沈甜甜甜A
563,那种青涩与热血真的让我觉得他们就是那个时代的人，一部少见的精品,没温度的外星人
564,救亡图存的进程中，有领袖人物如熊熊烈火，眼睛发酸眼泪都要出来了,老衲洗头用飘柔AA
565,导演的运镜太棒啦，很喜欢这部剧的台词和背景设定,窗边的小阿彻
566,鹤棣是归国学子的形象代言人，演员阵容很强大,家有贤妻王华华
567,在最近的国产电视剧中算是出彩的了，近代历史变迁剧的前茅,谁说不是呢A
568,镜头可真牛啊，没有一个是废的，这部剧果然厉害,吴花火
569,看的出来编剧和导演是用了心的，演员演技也都自然流畅,专业降妖 
570,这剧看得人有点热血沸腾，感动的不止是因为剧情，还有历史,柯闪闪想拥有猫
571,强大的班底，团队！还有让人期待，非常精彩的近代历史变迁剧,第9527号当铺 
572,突然觉得有点感动到了，非常精彩的近代历史变迁剧,洗白白香香
573,随手点开，竟然一口气追了七集，没想到这部剧的质感这么好,財大發發發大財
574,老戏骨云集的一部正剧，看了一集之后根本停不下来,丘不卡皮 
575,剧中的每一个角色都很鲜活，看了一集之后根本停不下来,杨某某同鞋子
576,很高兴能了解西南联大，各位演员飙戏让人感动,薛定猫的鳄A
577,永不磨灭的时代传奇和铁骨铮铮的民族精神，剧中美术、服装、摄影、特效方面也挺好,阿时的河流
578,看的出来编剧和导演是用了心的，情节上合理虚构,小开心的确信
579,了解前辈们的风骨，热泪盈眶，是中国近代历史变迁剧的精品,咪咪是只猫A
580,如果说觉醒年代是文化的觉醒，那么西南联大就是文化的传承，真的很好看,lynn小姐姐A
581,我是无脑自来水，电视剧是集体的艺术，从剧中可以看出编剧和导演的用功,井之木
582,画面真的是电影质感，非常不错的近代历史变迁片,Trina大宝贝
583,救亡图存的进程中，有领袖人物如熊熊烈火，感情刻画细腻,沈十六六六六 
584,程嘉树、林华珺原型诠释一生只爱一个人，演员阵容很强大,为你写诗为你沉醉
585,每一帧每一个镜头代入感都太强了，是中国近代历史变迁剧的精品,木木木木木木森森A
586,铭记文化抗战历史的题材真的很有必要，果然是实力派,火星情况站
587,最近能看的剧也不多了，虽然是真实故事但是令人惊奇,璇璇璇璇小林
588,一段沉甸甸的历史，一个到现在都熠熠生辉的学校，选的演员也都很棒,一条深海鱼A
589,随手点开，竟然一口气追了最新，选的演员也都很棒,火星包子AA
590,西南联大出的净是人才啊，挺喜欢的一部近代历史变迁剧,游娇&何洛洛
591,背景音乐听得我是热血沸腾，真的非常有信念感,天天天天做不好
592,王鹤棣的颜真的没的说，感动的不止是因为剧情，还有历史,豆沙团子A
593,个人观后第一是画面整体令人太舒适，剧情紧凑毫不拖沓,浅念_彼岸花开A
594,俞灏明这一次的角色塑造的还是很好的，太有感染力了,碎花残A
595,兄弟情真的暖到了，是不管走多远都会担心你的家人啊，剧情是在线的,大叔的电影院A
596,国产难得做这个题材，看了一集之后根本停不下来,路上小心2r1
597,我可真的太喜欢这个剧的架构了，剧情紧凑毫不拖沓,月亮奶油面包
598,首先非常喜欢年代大戏，电视剧是集体的艺术，从剧中可以看出编剧和导演的用功,心跳造反
599,制作班底，编剧，导演，演员我都好喜欢，电视剧是集体的艺术，从剧中可以看出编剧和导演的用功,在我手12r1
600,剧情也是满满的惊喜，强大的制作班底和一众实力派演员,偷看你3242
601,提起西南联大总会让人肃然起敬，太好看的一部剧,口嫌体正直先生232
602,个人观后第一是画面整体令人太舒适，太有视觉冲击感了,别弃我424
603,程嘉树、林华珺原型诠释一生只爱一个人，特别是在这么恶劣的场景下拍摄感觉太真实了,喘给我听4323
604,这剧看得人有点热血沸腾，满满的年代感扑面而来,第九片海23242
605,强大的班底，团队！还有让人期待，大无畏精神直击人心,四月祭23243
606,作为一个很久没看正剧的，看到好几幕都被感动的热泪盈眶，太好看的一部剧,动情周期223
607,以青春之我造就青春之民族青春之中国，整个宿舍都加入观剧大队,少女体检官14
608,如果那时没有他们又何来的我们何来伟大的祖国，电视剧是集体的艺术，从剧中可以看出编剧和导演的用功,想飞的仙女x
609,剧情节奏发展蛮快的，不拖沓，近代历史变迁剧的前茅,抹茶软糖看板娘23242
610,国产剧里极少见的很有魅力的男主角，细节也很到位,抖M橘子天然呆453
611,他们战火中的青春，我们的和平年代，选的演员也都很棒,软萌短尾中学生2343
612,铭记文化抗战历史的题材真的很有必要，服装上面看的出十分用心,宅系绮丽小红帽23242
613,王鹤棣你真的TT几个花絮看得我起鸡皮疙瘩，故事流畅,拂蛾
614,他们的校训，是“刚毅坚卓”，山河飘摇，吾心易坚，一生太短，一瞬好长的思念在岁月中终将回响,坞舟
615,演员的台词功底抓住了我，最精彩的近代历史变迁剧了,且共
616,这部剧棣棣是上帝视角，他阐述故事 ​，整个宿舍都加入观剧大队,烧酒小可爱2332
617,俞灏明这一次的角色塑造的还是很好的，整个宿舍都加入观剧大队,鹊叔
618,哈哈哈唯有毕云霄心疼嘉树，服装上面看的出十分用心,解阙
619,制作班底，编剧，导演，演员我都好喜欢，期待保持高质量水准,用户3b0428c3
620,俞灏明这一次的角色塑造的还是很好的，代入感太强了,驿别
621,画面真的是电影质感，特别是在这么恶劣的场景下拍摄感觉太真实了,椿慵
622,理想抱负来表现革命主题，更容易让人看进去，情绪调动力也很到位,少女收发室
623,今天的幸福得来不易。教育香火不能断，剧中美术、服装、摄影、特效方面也挺好,鹿耳甜心
624,导演编剧换一个我就不看了，很精彩的近代历史变迁剧,我可以吃了你吗233
625,制作班底，编剧，导演，演员我都好喜欢，破防了家人们,不服咬23333
626,两位95后男女主发挥得比想象中好，很适合家人一起追的剧,来夸我不拒绝2333
627,男女主也是在默默无闻时期通过层层试镜选上来的，一众实力派演员,草莓添加剂
628,好久没看这种题材的剧了，根本不需要怎样煽情,兔吻233
629,制作班底不错和老戏骨都不错，不愧是我放入追剧列表里的电视剧,软语呢喃233
630,看制作班底，导演、编剧也都算靠谱，眼泪真的忍不住,草莓酱丸
631,一段沉甸甸的历史，一个到现在都熠熠生辉的学校，没想到这部剧的质感这么好,她咽233
632,背景交代的很完整，节奏也挺快，感觉要带火近代历史变迁,软萌且乖
633,如此宏大深沉的题材和故事，共情能力真的太强了 ​,浅了个九
634,的确在这一次的剧情里面给我们呈现出很多不一样的看点了，演员演技是很大的加分项,阳光遮蔽心窗233
635,在最近的国产电视剧中算是出彩的了，编剧的想法都是很好,深邃的眼睛落满星光233
636,他们的校训，是“刚毅坚卓”，山河飘摇，吾心易坚，整体水准之高对于同类型题材是难以逾越的巅峰,白果_233
637,没想到我看的津津有味，整体水准之高对于同类型题材是难以逾越的巅峰,忆影_233
638,背景交代的很完整，节奏也挺快，特别好的电视剧了,淹死的鱼_w_
639,制作班底，编剧，导演，演员我都好喜欢，看了一集之后根本停不下来,抱住Clear
640,看制作班底，导演、编剧也都算靠谱，剧情真的特别棒,芥末甜味豆
641,最近能看的剧也不多了，感觉要带火近代历史变迁,苏衍酌 
642,最近能看的剧也不多了，我们的国家能够如此富强就是有这样一群人,肥胖珠理奈 
643,程嘉树林华珺颜值太般配了妈耶，安利了同事们一起看,天后太后是我
644,群像题材，剧集节奏很快，我们的国家能够如此富强就是有这样一群人,采桑子男
645,战火中的青春真的深受中老年的喜爱，场景真实高度还原,恰似陌上尘
646,背景音乐听得我是热血沸腾，好剧，莫过于如此了,我是Shiyo
647,永不磨灭的时代传奇和铁骨铮铮的民族精神，感动的不止是因为剧情，还有历史,时间的河A
648,这部剧棣棣是上帝视角，他阐述故事 ​，编剧的想法都是很好,沈甜甜甜A
649,俞灏明这一次的角色塑造的还是很好的，一众实力派演员,魔鬼AllenA
650,这部剧棣棣是上帝视角，他阐述故事 ​，导演和编剧太厉害了,齐整的男人
651,王鹤棣微表情太会表达感情了，挺喜欢的一部近代历史变迁剧,不吃香菜不吃葱A
652,铭记文化抗战历史的题材真的很有必要，编剧很厉害,薛定谔的 
653,演员卡司阵容太强，非常不错的近代历史变迁片,阿尔山竹
654,各种爆炸场面很逼真，特别是在这么恶劣的场景下拍摄感觉太真实了,匆匆那年 
655,王鹤棣你真的TT几个花絮看得我起鸡皮疙瘩，绝对是大手笔制作,晴风万里A
656,今天的幸福得来不易。教育香火不能断，眼泪真的忍不住,花火一瞬间A
657,个人观后第一是画面整体令人太舒适，剧情是在线的,一号狙击手A
658,王鹤棣真的很牛 演什么像什么，近代历史变迁剧的前茅,薛定猫的鳄A
659,这剧我最近真的太喜欢看了，一生太短，一瞬好长的思念在岁月中终将回响,阿时的河流
660,兄弟情真的暖到了，是不管走多远都会担心你的家人啊，很喜欢这部剧的台词和背景设定,小开心的确信
661,看制作班底，导演、编剧也都算靠谱，这剧情太感人了,果实豆豆A
662,角色的化妆技术真的一绝，形象很传神，自己以中国人身份自豪,尤以今朝醉
663,演员卡司阵容太强，非常精彩的近代历史变迁剧,Trina大宝贝
664,演员卡司阵容太强，不愧是我放入追剧列表里的电视剧,自然卷最好看了
665,男主演得很不错，演技征服了，剧集本身超有感染力的场面,安晨是强者
666,战火中的青春真的深受中老年的喜爱，眼睛发酸眼泪都要出来了,沈十六六六六 
667,两个演员也比想象中演的自然，特别喜欢这部近代历史变迁剧,为你写诗为你沉醉
668,通过这部剧多学点西南联大的历史，一生太短，一瞬好长的思念在岁月中终将回响,花开花落一夜散
669,群像戏很不错，每个人物都有自己的行动逻辑，这种正能量的剧就该多点,火星情况站
670,没想到这部剧的质感这么好，剧集本身超有感染力的场面,神马都阔以A
671,永不磨灭的时代传奇和铁骨铮铮的民族精神，又让我破防了,叶音符如云
672,随手点开，竟然一口气追了七集，致敬每一个功勋先锋,璇璇璇璇小林
673,群像题材，剧集节奏很快，强大的制作班底和一众实力派演员,一条深海鱼A
674,程嘉树林华珺颜值太般配了妈耶，题材是我喜欢的,火如潮云
675,他们的校训，是“刚毅坚卓”，山河飘摇，吾心易坚，背景音乐听得我是热血沸腾,碎花残A
676,随手点开，竟然一口气追了最新，一生太短，一瞬好长的思念在岁月中终将回响,月亮奶油面包
677,男女主也是在默默无闻时期通过层层试镜选上来的，太好看的一部剧,羞恥出沒
678,这部剧很精彩，整体水准之高对于同类型题材是难以逾越的巅峰,知世就是力量232
679,通过这部剧多学点西南联大的历史，看起来节奏好紧凑的样子,别弃我424
680,很高兴能了解西南联大，非常精彩的近代历史变迁剧,喘给我听4323
681,这阵容还有谁，剧中美术、服装、摄影、特效方面也挺好,咬樱唇
682,男主演得很不错，演技征服了，演员的台词功底抓住了我,四月祭23243
683,比想象中好，我们的国家能够如此富强就是有这样一群人,动情周期223
684,那种青涩与热血真的让我觉得他们就是那个时代的人，无法停止的喜欢,弱者无真交747
685,王鹤棣微表情太会表达感情了，整个宿舍都加入观剧大队,卡丽萝232
686,两位95后男女主发挥得比想象中好，强大的制作班底,想飞的仙女x
687,程嘉树、林华珺原型诠释一生只爱一个人，特别是演员的共情能力,希酱牌云朵有点甜
688,在最近的国产电视剧中算是出彩的了，特别有教育意义,英伦折耳黑长直32323
689,林华妈妈真是典型的中国父母了，这种正能量的剧就该多点,抹茶软糖看板娘23242
690,每一帧都是帅气的样子，既可以看偶像，又可以了解历史，里面好多细节,聒喃
691,一段沉甸甸的历史，一个到现在都熠熠生辉的学校，代入感很强啊,抖M橘子天然呆453
692,永不磨灭的时代传奇和铁骨铮铮的民族精神，导演真的很会调教演员,软萌短尾中学生2343
693,兄弟情真的暖到了，是不管走多远都会担心你的家人啊，情感饱满,猫耳无用战士232
694,程嘉树、林华珺原型诠释一生只爱一个人，台词话外有话,云幔
695,强大的班底，团队！还有让人期待，把角色演绎得很精彩,拂蛾
696,精彩的台词，剧中美术、服装、摄影、特效方面也挺好,坞舟
697,我觉得这一部剧更多的是一些情感的细腻，导演和编剧太厉害了,且共
698,那种青涩与热血真的让我觉得他们就是那个时代的人，特别有意思的一部剧,烧酒小可爱2332
699,很期待的一部剧，一生太短，一瞬好长的思念在岁月中终将回响,生绡
700,还挺精彩的，我们的国家能够如此富强就是有这样一群人,宇智波霸234
701,王鹤棣你真的TT几个花絮看得我起鸡皮疙瘩，这剧已经被我锁定了,我可以吃了你吗233
702,主旋律里很不错的剧，很喜欢这部剧的台词和背景设定,池烠
703,救亡图存的进程中，有领袖人物如熊熊烈火，适合全年龄段观众。,湫远
704,随手点开，竟然一口气追了最新，把角色演绎得很精彩,甜味信息素
705,看制作班底，导演、编剧也都算靠谱，眼睛发酸眼泪都要出来了,闪闪惹人爱233
706,国产剧里极少见的很有魅力的男主角，代入感很强啊,来夸我不拒绝2333
707,冲着男女主的颜和老戏骨的演技来的，特别有教育意义,本可爱气死你23333333
708,那个年代的人，真的纯粹又有力量，特别喜欢这部近代历史变迁剧,青鲤233
709,永不磨灭的时代传奇和铁骨铮铮的民族精神，真的非常有信念感,萌没理233
710,制作班底，编剧，导演，演员我都好喜欢，细节上没有瑕疵,兔吻233
711,角色的化妆技术真的一绝，形象很传神，近代历史变迁剧的前茅,三花猫233
