,0,1
218,我觉得程嘉树的配音有点不贴脸，怪怪的，有点出戏。,华脩然
219,男主古装还好，，这嘴和牙咋越来越不好看，，，,152****6600_m2549
220,这个更新时间也太晚了吧，都是要么七点半 要么八点的,CSL丶丶
221,时代背景选的很好，可，这是偶像剧场——情深深雨濛濛吗？,风啊风啊一起吹吧
222,莫明就是喜欢周也，王鹤隶的演技，早就看了预告，才放出来，希望不错！1937年太姥姥那个年代，好陌生啊！,爱别离19980818
223,好好看，有一帮爱国青年，在挥洒出自己热血的青春誓死报卫祖国，激发出了我们的爱国情怀,dsky
224,西南联大，一个特殊年代出现的一所特殊学校，少年自有少年狂，身似山河挺脊梁！,匿名用户
225,真的应该多拍一些这种剧给当代年轻人看，生活在和平年代的人，可能很难理解为什么他们用生命去保护书籍用生命去维护我们的文化传承！！人不能忘本，因为今天的和平来之不易，我们不能忘记历史不能忘记过去，这样我们的民族才能有未来！！,🐠lylie🐠
226,有诀人么[爱心],恋欣日记🐟
227,好看死了,喜欢吃酱包
228,每天都追，就为了看我家棣棣，棣棣演的真棒，看得我泪流满面，那个时代的人们太苦了，我们要珍惜现在的和平年代[爱心][爱心][爱心][爱心][应援][应援][应援][应援],LOVE棣棣D
229,"什么是西南联大 他们用一生来回答

凭借一身风骨，守护国家文脉

香港云校友报到
重走南渡北归，见证岁月荣光

",马甲别掉
230,"蒋梦麟、梅贻琦、张伯苓为校委，陈寅恪、朱自清、闻一多、沈从文、冯友兰、金岳霖、吴大猷等为先生，杨振宁、邓稼先、许渊冲、穆旦等为同学，8年11个月的联大，诞生2位诺贝尔奖获得者、5位“国家最高科学技术奖”获得者、8位“两弹一星”功勋科学家以及 174位院士。
",许芷妍😍
231,真的太太太好看了 战火中的青春看得我好震撼 演员演的很灵动 支持支持！！！牢记历史勿忘国耻！！！,棣 AWW
232,"一代人杰，文脉相承，栉风沐兩，危而不亡，砥砺前行，终成大器，家国情怀，永记铭心！烽火连天却无一日停课，每天都做到最好；物资贫乏，精神高贵，赓续文化血脉。
",晚舟1222
233,"剧集在尊重历史真实的前提下，选择以年轻人的青春热血、理想抱负及纯真情感来表现历史主题，力图展现西南联大学子救亡图存知识报国的爱国主义精神，重现一代知识分子的气节、血性和风骨。
[爱心]",许芷妍😍
234,为什么电视剧放映前都要改一次名[撇嘴]要不是看到主演我都不知道这是我们的西南联大,1颗大鸭梨
235,"一个特殊年代出现的一所特殊学校，那一代的文人真的是铁骨铮铮不输于战场上的战士。好些泪目的地方。
",路过审判下
236,看的热泪盈眶[大拇指][大拇指][大拇指][大拇指],仰望有你的星空
237,哭死了快救命[大哭][大哭],美少女214。
238,终于等到了[色],·雪落万洲
239,"上海云校友报到
",iiiiiiiidly
240,来看这段历史,明晃晃的太阳照的我睁不开眼睛
241,来了来了,旺仔牛奶ꦿঞ
242,来了来了[应援],太阳花•﹏•
243,主角在战乱中的环境下，他那头上浓厚的发胶，真是别具一格呀[吃瓜],喜欢喝橙汁的端木冬易
244,叶祖新这里看着挺像玄彬，还是结实点比较好看,155****6788_m1346
245,人的身上有两条命，一条是生命，一条是使命,余鹤h
246,什么，我一直以为这是一部电影，没想到是电视剧！！！！,你的女神琳
247,#战火中的青春观后感#从第1集能看出程嘉树内心是热血男儿，他在一步步的成长，从他的旁白中可以听出，一开始他是纨绔子弟，但是从，后来慢慢改变，程嘉树虽作为顽固子弟，林华珺虽贵为千金大小姐，但是她在大是大非面前，依然有理智的想法积极的投身于革命 程嘉树虽作为顽固子弟，但是大是大非面前敢作敢为。林华珺虽然出生就是大小姐，但是不娇纵，毅然投身革命，毕云霄就是个铁血男儿，在听到日军在实弹演习中，他第一个发表想法，勇于反抗，叶润名是一个成熟稳重的热血男孩，有着极强的责任心，他们同为清华北大的学生，但是有着一个精忠报国作为，勇于反抗，积极投身革命，这是一个充满了爱国主义的电视剧，值得追,夏末凉城
248,天啊，那么期待他来可是又不敢看，怕上头怕不够看[应援][应援],婷婷-Yoty
249,王鹤棣演古装剧，演这个年代白瞎了[应援],一生所爱儿
250,很正能量的一部剧，很长时间没有看过抗日类型的正剧了，这部剧不管题材和选角都好棒，每一个角色都塑造的很深刻，让人看得热血沸腾，这样有教育意义的剧很适合青少年观看，期待每一位演员后期更精彩的表现[大拇指],老张很可爱，，
251,一次更八集是个美好的传统,。✨星星
252,青春孕育无限希望，青年创造美好明天。青年的命运，从来都同时代紧密相连。时代各有不同，青春一脉相承。王鹤棣演绎战火中的青春太适合了[大拇指],匿名用户
253,#战火中的青春观后感#19集叶润青和林华珺间的对话改台词了？[疑问][疑问]在电视里看根本对不上嘴型和语速，咱就是说，这么粗糙的吗？[疑问]虽然说是奔着王鹤棣来看这部剧的，但是这么糙[微笑][微笑]真的很看不下去啊。。。,xi嬉
254,19集叶润青和林华珺间的对话改台词了？[疑问][疑问]在电视里看根本对不上嘴型和语速，咱就是说，这么粗糙的吗？[疑问]虽然说是奔着王鹤棣来看这部剧的，但是这么糙[微笑][微笑]真的很看不下去啊。。。,xi嬉
255,#战火中的青春观后感#青春朝气遇上战火硝烟，平地惊雷炸响，觉醒无数国人。从1919.5.4到如今，青年学子已经走过100多个年头。但愿热血仍在，精神仍存！,冰凉薄荷心あ
256,什么是西南联大 他们用一生来回答，文化的传承是一个民族的脊梁,woaiyingewei
257,"大雨落幽燕，
白浪滔天，
秦皇岛外打鱼船。
一片汪洋都不见，
知向谁边？
往事越千年，
魏武挥鞭，
东临碣石有遗篇。
萧瑟秋风今又是，
换了人间。
----《浪淘沙·北戴河》",匿名用户
258,为文化抗战立传，为知识分子立像，为青春理想立赞，为民族精神立碑。用心诠释的新角色程嘉树！,东鼎乌龙
259,"“我饰演的是一个从0到100有成长的角色”
共和国的一棵嘉树，战火里长成，如今苍颜白发，亭亭如盖。期待王鹤棣扮演的程嘉树",匿名用户
260,刚看完百年家书，从918到北平，从上海到长城战役，平型关战役，沪松战役，南京大屠杀，双12政变，到台儿庄战役，太多太多，而我们要做的就是铭记历史,匿名用户
261,想看又不太敢看，太容易[流泪]了,都好看!
262,支持弟弟接了这么好的剧，有情怀有智慧的演员，值得人们喜爱,随随1🤗
263,致敬先烈,茫茫人海看见你
264,结局是HE还是BE啊？,丸子探险家
265,真的非常好看 不要故意拉踩 实事求是 这部剧看得我热血沸腾[应援][应援][应援],棣 AWW
266,本来只是来观望一下的，看了一会儿，感觉剧还挺不错的，题材挺好,That Is Dream云海-
267,#战火中的青春观后感#知识救国,爱啵啵真的太好了
268,王鹤棣可真是剧甩脸，演什么像什么，可塑性太强了，这剧基本上素颜！,心语666🎐
269,棣棣真的可塑性很强,yoyo曲曲
270,剧情很好  很触动  已经跟着哭了两次了  致敬！ 演员们都挺让人入戏的  21岁的王鹤棣没让人失望！[应援][应援][应援],傲晴泠月
271,终于要见了，太好了,T皮猫猫T
272,来看嘉树了,188****5830_m1146
273,来看程嘉树啦[应援],俗人俗语俗评
274,看大家评价很不错,梦我😀
275,太好看了[大拇指],最寶貝    DZT
276,"一切暂停，我去抗日

",iiiiiiiidly
277,来看棣了,188****5830_m1146
278,终于等到你，来了来了,じ爱喝奶茶的兔牙妹
279,来了来了[爱心],王鹤棣圈内女友😛
280,来啦，猜到不准时,爱吃西瓜不吃豆芽的豆
281,前排前排,知足LMH
282,来了来了[应援],展堂，救肋
283,来了来了[应援][应援],爱喝咖啡の褚师韶敏
284,这剧有点东西啊，从高校知识分子这个切入点讲抗日战争，很是新颖，之前的抗日题材都千篇一律，这个剧真的有点东西。[大拇指],嗯嘻嘻嘻哈哈好🍭
285,这头发不像战火中,郝可可a
286,西南联大，近代史最巅峰的学校,匿名用户
287,都是来看王鹤棣的吧家人们[微笑],爱吃拉面の梁丘淑贤
288,我说，别喷，我怎么总觉得俞灏明更帅呢[应援],哈哈啊哈哈还哈🌷
289,这不就是西南联大吗？怎么改名了,学生朕晓
290,"#战火中的青春观后感#看的热泪盈眶。
勿忘国耻，振兴中华。",追剧的柚子🤩
291,尊的很好看，把民国的爱情表现的淋漓尽致,沸羊羊1222
292,和凭栏一片风云起同类型的剧吗？,158****5426_m1024
293,#战火中的青春观后感#什么破剧啊，看的我眼睛一直流口水。我真的，我哭死,无语住了💗💗😘
294,#战火中的青春观后感#每个时代都有不一样的青春,💤不想睡觉。
295,清华北大的学生如此忧国忧民！😎😎,达焕pp
296,#战火中的青春观后感#陈家树是一个勇敢有正能量的少年,繁花似锦觅安宁。😀
297,老爷子这个演员突然老成这样了,宓兒迷珀甘
298,#战火中的青春观后感#把西南联大的精神表现的淋漓尽致，选角也非常到位，闻一多造型十分逼真。让我们看到了抗日战争时期西南联大的学生和老师们所做出的努力。让我感觉最好的应该是青年演员王鹤棣所饰演的陈嘉树，不用替身跑了800多个炸点，可算是娱乐圈中的一股清流。可能有很多人在这里喷他的演技，但这可是他20岁的作品，青年还需青年演，剧中陈嘉树眼里清澈的愚蠢是现在演员们表现不出来的。如果大家看过苍兰诀，浮图缘，亦或是今日宜加油，在来反观这部剧，你会发现王鹤棣在演技方面的努力和成长。如果说这是一部战争片，我更认为这是一部青春励志片，我们生活的年代没有硝烟没有战争，但不代表我们当下的学子们不应该有西南联大精神，身逢盛世，必当不负盛世，我们应该学校西南联大精神，为祖国繁荣昌盛献出自己的一份力量。感谢本剧中所有优秀的演员，青年演员王鹤棣，周也未来可期！,櫻檸.🤩
299,林华珺真的绝美！！周也好棒，演技真的可以，真的好好哭[大哭][大哭][大哭],小鱼爱喝盐汽水
300,"刚开始没感觉后面越看越喜
[大拇指][大拇指][大拇指]",雀跃…⭐
301,一看抗战片，都想去把小日本灭了，有没有一起的,烟火🎆！～
302,人的身上应该有两条命，一条是生命，一条是使命,东鼎乌龙
303,有历史底蕴 演技也很赞喜欢[应援][应援],梦渃浅忆
304,东方青苍真霸气，白马帅真的帅，程嘉树真的爱国,公主模样♂女王范
305,来看王鹤棣，程嘉树终于见面了,公主模样♂女王范
306,战火中的青春有亿点正能量哈哈,Mmmmmmisakiiii
307,王鹤棣的每部剧都看了， 又来追剧了[666],匿名用户
308,怎么排到晚上10点 都睡觉了啊 太晚了,匿名用户
309,男演员大多都认识，女演员一个也不认识。,匿名用户
310,从学生视角讲述当年的历史真的很棒👍🏻,Miao咪▼先生
311,来看也子了呜呜呜呜呜呜呜老婆好棒,片面🍀
312,女主跟虞美人天差地别,好吃喲
313,尽量争取在我会员到期时播完吧[微笑]5.20号到期[捂脸笑],星星很闪亮哦
314,家是每个人的摇篮国是每个家的港湾,30岁离异带俩娃🤞
315,五星红旗熠熠生辉我的信仰光芒万丈,30岁离异带俩娃🤞
316,此生不悔入华夏来世还做中国人,30岁离异带俩娃🤞
317,爱国始终是青春的底色,30岁离异带俩娃🤞
318,如果奇迹有颜色那一定是中国红,30岁离异带俩娃🤞
319,信仰于心，无惧无怕；以梦为马，不负韶华,30岁离异带俩娃🤞
320,我们肩负多重角色，同样也肩负起青春,30岁离异带俩娃🤞
321,非常好看 主要是来看我王鹤棣,玉桂狗Kayla
322,"他们用奋斗绘就青春最闪亮的底色

",iiiiiiiidly
323,为祖国的前途而奋斗，是吾辈之责,喜欢吃甜橙の叱干滨海
324,致敬英雄，致敬那段热血的青春,952199
325,两集不够看，会员能多看几集吗程嘉树[爱心][爱心][爱心]@王鹤棣,超爱羊角波光
326,明天来看,嘀嗒嘀嗒🍭✨
327,好看好看,smile_vim
328,西南联大超热血[应援][应援],这是一个名字哦^0^
329,不是更完了吗,小煤球🥕🎋
330,以前不爱看战争题材的剧，现在居然看得有滋有味的，这部剧真不错[大拇指],苍兰绝恋
331,战火纷飞，青春盛放，让我们和@王鹤棣_Dylan 一起揭开历史厚重的面纱，去感受热烈而赤诚的红色记忆！,拾贰月🦋.
332,基本又是神剧，实忘了。,清水玉
333,"

知识分子要救国救民的这一段情怀，其实也是给大家带来了很多的泪点，每个人物角色的身上其实都是有着一条完整的故事线的，不仅仅有着对祖国的一种感情，其实也还包含着大爱和小爱，家国的一种意义。更加的打动了内心。",叶枫506
334,主要讲的是什么啊,许个鑫愿。🐾
335,非常喜欢这种的,小棣同学
336,什么什么,可盐可甜的钰公主
337,真的很好看[应援][应援][应援][应援],bigbig夏
338,这剧真的活该火[色],匿名用户
339,每天晚上等树儿,婷婷-Yoty
340,#战火中的青春观后感#很有质感,听闻7404
341,俞灏明这一次的角色塑造的还是很好的，演技可圈点,顶花带刺A
342,#战火中的青春观后感#我们都说，青春，每个人一生只有一次～我们生活在和平年代，无法体会剧中人物的命运。可是透过这部剧，我们看到了很多，正是因为无数爱国仁人志士的不懈努力，才有了我们今天安定的生活！向他们致敬！,蔷薇落花意
343,感谢先辈 , 怪怪  
344,这演技我看了都尴尬[捂脸笑]，,用户8fffda95
345,"为中华崛起而读书
",Cspecialnb.
346,来啦来啦[微笑],欧包塞满
347,西南联大精神，给我很大的鼓舞，在那么困难的时期，老师没有放弃，学生没有放弃。今天的我们又有什么理由抱怨辛苦,BunnyDiDi
348,全员演技在线，王鹤棣饰演的程嘉树很有热血青年的激情,玖阡㭍
349,[应援]来看也子,2256732877
350,终于等来了这部剧[应援][应援][应援],小祎宝宝💞
351,以青春之我，逐华夏之阳,WPWS0806
352,建议当代年轻人都来看看这部剧，真实的历史事件。那个年代的年轻人用血肉之躯保卫着国家保卫着一方热土。,xxx1061211
353,从初中等到高中啊[色],四百零二.八
354,好看，爱看,困困鱼不吃鱼🐟
355,程嘉树终于迎来啦！[应援][应援][应援][应援],莹棣🍁
356,西南联大[大拇指][大拇指],仙都贝贝
357,哎！看了十分钟，我就知道一个振奋人心的题材又被拍成了偶像剧……,270579277
358,个人觉得，为了让现在的年轻人看爱国题材，用有名气的年轻艺人，是一个好的方式。,六玥~*
359,上个月初才从西南联大旧址参观回来，感受颇多，当时在互动屏上留言希望自己早日考博上岸，为自己学科建设贡献力量。,平底锅煎五花肉
360,周也让我害怕，跟周冬雨拍的那个电影叫什么来着，就是校园霸凌那个，实在是太坏了，现在心里都有阴影。,Yaoqian0916
361,先看的肖铎，然后又看了沧兰决的东方青苍，所有的剧都看了，只可惜他的剧太少了,wang-zheng
362,好多《凭栏一片风云起》的演员，那部剧情也与西南联大有关。,要开心吼
363,拍出来历史的厚重感，剧情紧凑人物诠释到位，年轻演员王鹤蛮有灵气的!,匿名用户
364,非常好的一部电视剧，让这段历史重现，最主要是为王鹤棣而来的，我家棣宝演的不错，加油[爱心][爱心][爱心][爱心],LOVE棣棣D
365,目睹祖国、同胞困境，我心中已有答案，未来我必将致力于科学、尽我所能卫我家国！,年与糕
366,刚追完浮图缘过来,猪宝宝的妈妈💖
367,这部剧看了感触很深  棣棣的演技也是很棒棒  有些剧情总是心疼  想哭的感觉  期待棣棣越来越好[大拇指][大拇指][大拇指][大拇指],匿名用户
368,关于西南联大的故事一直很吸引我，前两集的剧情比较喜欢王鹤棣和俞灏明[大拇指],匿名用户
369,棣酱妈咪来了[应援]期待青年演员王鹤棣挑战更多极限更多不同角色,匿名用户
370,这群看似手无缚鸡之力的读书人，却用钢铁一般的意志，构筑了中华民族的脊梁。,大琳ZL
371,总体感觉主演们演的还是不错的，后面再继续审判下[大拇指],天天上班🎄Gavin
372,演什么像什么，就是王鹤棣啊，各种不同类型题材的剧都很贴合剧里的人物，可塑性[大拇指],一朵棉花糖🏝
373,"支持立场多样性，令思想的碰撞促进文明的进步
家人们好，都来看俺家树子来啦

",马甲别掉
374,战火中的教育奇迹，永不磨灭的时代传奇，铁骨铮铮的民族精神。,jwvivi66
375,本来少年，此去一生，关于战火，关于青春。这不仅仅是一部期待已久的剧，更是一代人的热血抗争。,喜欢武术の褚师翰林
376,片子的质感太好了，滤镜的色彩也特别舒服，全员演技在线[爱心][色],你的妃妃_
377,致敬战火中的青春，致敬在艰苦条件下仍然为国做贡献的科学家们！[666],咩咩羊cm
378,难怪程嘉树在里面的着装洋气些 原来是留学生 嘻嘻 皮衣 polo衫好帅[应援],周古月
379,即便是亿万枚【亿万万兆级氢弹】也无法净化倭寇杂奴犯下的滔天罪孽和累累罪行，那些投敌叛国的汉奸卖国贼当夷三族祸及百代。,天子親軍錦衣衛
380,为了王鹤棣演绎的程嘉树而来，但是看了两集哭了两集，不爱哭的人太难了太难了，没有那个时候的战火先辈英雄们，就没有现在的和平年代,蓝玉哇咔咔咔
381,拍了三年了终于可以看到了[应援][应援][应援]，不过这个时期刚刚好，趁着棣棣大火也可以让更多年轻人感受当时战火中的青春[爱心],匿名用户
382,这剧质感很不错啊 王鹤棣演的好有灵气期待他后面的成长[应援][应援][应援][应援],匿名用户
383,很棒，配乐，剧情还有爆破戏都非常和谐。节奏很好，紧凑，很容易被带入进戏里面，从程嘉树的回国时候的状态到轰炸之时，真的情绪变化很生动。其他演员的表情也非常贴合剧情，非常棒，一定要追完。,大Ckurin
384,太好看了 战火中的青春 支持程嘉树 支持王鹤棣！！！支持战火中的青春 牢记历史，勿忘国耻！！！ ,棣 AWW
385,"致敬伟大的时代 伟大的人 看的时候心里一直在想电影无问西东】里的那段话：“愿你在被打击时，记起你的珍贵，抵抗恶意；愿你在迷茫时，坚信你的珍贵，爱你所爱，行你所行，听从你心，无问西东。”
",许芷妍😍
386,发现王鹤棣什么造型都能hold住诶，好强的可塑性，期待程嘉树！,许芷妍😍
387,"这是一个最糟糕的年代、这也是一个最好的年代，难得的不是长途跋涉，而是在如此艰苦卓越的环境下潜心向学和不忘初心。
",许芷妍😍
388,程嘉树我们终于见面了[应援]好开心，看了两集把我感动哭了，棣棣在剧中演绎的人物程嘉树好棒[大拇指]，感慨现在的和平年代来之不易，铭记历史,匿名用户
389,先烈不朽，你们用青春与岁月谱下了我们今天的美好生活。,亲爱的蔓蔓
390,"不负时代、不负韶华、不负党和人民
每次看家国情怀的剧会突然庄严肃穆，刺激紧张

",冬眠兔💜
391,谢谢棣棣，如果不是他，我会错过一部这么热血，让人心潮澎湃的好剧[大拇指],潺潺流水😗
392,致敬战火中的青春！铭记历史缅怀先烈！永远爱国！,余蛋蛋哇哈哈哈
393,奇怪 王鹤棣演的角色都觉得很适合他 可塑性很强 好看,啥啥啥呀💪😉
394,用心制作的精品好饭不怕晚，剧组全程转移6000多公里，重走南渡北归之路，完美还原了西南联大师生见证过的岁月历史，期待战火中的青春，期待王鹤棣程嘉树。🌲[拳头],哒哒哒哒哒哒🍍Zoe
395,"这个题材很难拍砸..…事实上，片子也较好地发挥了影视较之文字的长处，人物鲜活，故事剪裁有章，动画典雅，配乐感人。虽不可能恣意挥洒，也算对那段金色岁月有了交代。
",路过审判下
396,一代人杰，文脉相承，栉风沐兩，危而不亡，砥砺前行，终成大器。,棣棣chen
397,太震撼了,329955131
398,程嘉树，终于等到你了[色],爱啵啵真的太好了
399,画质不错,有一种守候叫希望
400,西南联大,大白兔奶糖最爱的宝贝
401,来了来看了,泡杯养生茶
402,来看小也的[应援],匿名用户
403,"愿继前辈之志，行吾辈之路
",匿名用户
404,"民族希望 国之脊梁
",iiiiiiiidly
405,"缅怀先烈  感恩英雄
",iiiiiiiidly
406,开了开了,明晃晃的太阳照的我睁不开眼睛
407,来啦来啦[应援],匿名用户
408,来了来了,igxsae
409,看了两集就因为女主弃了这部剧，实在是看不下去。,倾城月光_wx2142
410,东方青苍的配音，太棒了！,GYH:)
411,“人的身上因该有两条命，一条是生命，而令外一条是使命，有的时候，使命会高于生命！！！”我觉得这句话特别有道理，就来看了，没想到是棣棣演的，现在就更好看了，我觉得很好看，有点儿中国的义气，王鹤棣真是什么都会演，古代、战争、社会，都非常好，你们觉得哪？我觉得特好看！！！因为有中国的义气，王鹤棣还演了《苍兰诀》、《流星花园》、《今日宜加油》、《浮图缘》、这次又又又演了这部剧，绝绝子～王鹤棣真是一部剧一部剧停不下来鸭！王鹤棣万岁，永远的神啊！永爱王鹤棣～永爱苍生！,如  蜜   如   桃  🍑
412,我想知道他哥最后是不是变坏了,7.7£
413,演员表为什么没有写俞灏明？,恩ccm
414,很喜欢演技也很好 ，也很引导青年人爱国 ，价值观很正 [应援][大拇指],didi棣☀
415,王鹤棣的配音还是苍兰诀里的配音吗？,孔创
416,题材，演技，演员，大爱情怀的好剧啊，顶起来啊,随随1🤗
417,评论怎么这么少啊，活人粉丝人都去哪里了,肖步活了的
418,谁借我纸巾，看完战火中的青春再还你,for-D
419,很好看，很感动，希望更多人看到这[大拇指]段历史,桃之夭夭，
420,居然来剧了，我以为只是广告，没想到播了,爱吃粉条の的花菇凉
421,又是小鲜肉出来演跨越时空剧了[捂脸笑][捂脸笑][捂脸笑]，,忠心✌🍀
422,那时的人有这么时髦？烂剧,体彩邱兴华
423,主旋律里很不错的剧，眼泪真的忍不住,果实豆豆A
424,都是俊男靓女呀！我喜欢[色][色][色],＊夏末秋初～
425,这部电视剧像电影的画质，拍摄画面也挺好看的！[大拇指],匿名用户
426,我觉得配音拉开了程嘉树和观众的距离,小朵朵2023
427,最近剧荒，希望这部剧不要让我失望啊[委屈],南宫雾宇
428,看了苍兰诀，开始追王鹤棣[应援],136****2027_m1403
429,冲着王鹤棣来追剧，这部剧真的很有意义，值得看,嘻咦嗯
430,看着帅哥小鲜肉演 感觉不怎么好看吧,尼古丁_qq2557
431,男主配音是东方青仓的配音吗 有点像,吃吃饭了吗你
432,尊严只在剑锋之上。真理只在大炮射程之内,萧萧爱大海
433,衣服都可以保持一尘不染,喜欢喝橙汁的端木冬易
434,这剧之前是不是叫  我们的西南联大？,卡拉泡泡122
435,对周也和王鹤棣印象很好[愉快]都是演技派,炸鸡酱板鸭
436,王鹤棣不怕批评，他会越来越好的！,棣棠梨苑嘉树🎊
437,他做错事只会说对不起 然后和你说 他好累,酸菜可乐ɞ
438,泱泱大河 国泰民安 山河永在 生生不息🇨🇳,棣棣的棣🍭
439,何其有幸生于华夏，愿山河无恙，祖国繁荣昌盛🇨🇳,棣棣的棣🍭
440,周也跟张婧仪长得真像,车车777777
441,民国时候还有这样材质的运动服吗,瑶瑶公主我无语
442,这部剧太好了，勿忘国耻 振兴中华,♛荧惑♛
443,"本来想看。但是周也演，果断放弃。
除非欣欣演",超爱打篮球de谷利敏叡
444,第一集都看不下去了太假了,无关风月，不问朝夕
445,这不是叫《我们的西南联大》吗？,匿名用户
446,是啊！等棣棣三年了，终于等到你了,姐永远支持你
447,又来三刷棣棣了，还没更新呢,姐永远支持你
448,说实话，这部剧充满了现代的影子,待风起云涌时
449,要考教资 挤出点儿时间 赶紧追剧,匿名用户
450,你也是怪六的感情全都给删了,ㅤ48554051
451,还没看的但是感觉好期待[色],满天星.Mia
452,这个剧怎么热搜宣传一些,Mi密
