,0,1
663,终于等到你，等了好几年了服了,孟夏夏夏夏啊
664,别吊胃口了，一下放了吧，早就拍完了干嘛呢这是！,KiNo-NaWa
665,突然忘了 上一部剧叫什么[捂脸笑],伊宁./
666,张一山，这里面演的不错[大拇指][大拇指]，都是我喜欢的演员,小涵涵她爸
667,看过原著的朋友谁知道川川爸妈呢？为啥这么穷,柠檬🍋怪🌼
668,因为关晓彤，期待很久了！[爱心][爱心],喜欢跳远de叔仲安静
669,遇到潘粤明就没办法了,LXYZ^_^
670,我蒙了，这部剧晓彤跟是cp,范cheng✌
671,感觉还是男的为关晓彤看得多啊,˙⛓️
672,不是，这回国钱怎么凑的,杨馨怡Savannah
673,来看丞丞啦，等了这么久终于播啦,じ爱喝奶茶的兔牙妹
674,张一山好久没出现了吧,心自由1978
675,好看好看。强烈推荐，太有感觉了,焦糖豆沙呀😍
676,我也是笨着鹿晗女朋友来的[色],@水蜜桃呀🌸🌸🌸
677,终于等到了我的丞丞，一山, 孩他妈
678,好喜欢关晓彤的谢乔  两位男生我也喜欢,小嘟嘟_m1018
679,来看我们北京帅哥美女,喜欢跨栏的南宫醉柳
680,好喜欢秦川吃醋，太可爱了,彤心未敏
681,选角就注定没有小时候好看,小鲤鱼的麻
682,我记得之前看过几集了呀，怎么回事,亭子861
683,终于可以看张一山的剧了[爱心],唔知改乜嘢名好
684,来看关晓彤啦[应援]等好久了实在是,888888888888998888988
685,终于可以看到张一山了,飞燕姐姐🏖
686,这个挺好的，没有想到会这么快有长大后的,风来君相忆！！！
687,最近的剧都喜欢空降啊,阿与小甜酒儿
688,非会员也不能看一集吗，要等明天才能,重生之我要学习
689,我想问问曾少年小时候和这个剧有关联吗,꧁༺萧࿈玄༻꧂
690,关晓彤八卦关谢乔什么事，杨澄渣关范丞丞什么事[偷笑],真真VS真真
691,"长风度追了一半跳槽过来了，看完接着追
[捂脸笑][应援]",莫失莫忘莫忘我
692,来看杨澄 可以可以更新这么多集,zyl9929🔮
693,范丞丞不错嘛，刚出了首部电影，现在又出演首部电视剧,云之欣
694,看预告，张一山不是主角吗,华融天华
695,别人发的是高中大学录取通知书，而我是技校通知书[捂脸笑],亿桉桉桉桉桉
696,一次性更五集，真的爱呀[应援],是丞星啊✨
697,居然没一个人评价张一山[捂脸笑],伊人茹宝
698,好元气啊 是不是辛原哥制作的[阴险],苏荷💕09
699,也没有关晓彤在地上游泳的镜头啊,🍉味的百事可乐
700,福西西真的是全面发展啊,初心i哦
701,男主的姐姐为什么要把男主的钱拿走，没[呲牙]懂,蛋糕🎂好吃吗
702,我看到吃蘑菇的片段来的[捂脸笑],月里嫦娥的沃纳威斯顿
703,今年暑期第一部感兴趣的[捂脸笑],栗子只想睡居
704,福西西可以啊，都能涉猎点，喜剧，偶像，悬疑，要进步,Augenstern  palpitste
705,秦川家咋了秦川家不是挺有钱的吗？,航航滴
706,从这船可不稳啊来的 哈哈哈哈哈哈,卡哇伊伊 伊的哇
707,谢乔和室友误食毒蘑菇，我都替她们尴尬,耶耶叶歆妤耶！
708,感觉和张一山一点都不搭，不适合一起演,喜欢玩排球的南门智刚
709,小时候的忘得差不多了[捂脸笑],zyy🐑沅🐑
710,谁是为了杨澄的举手🙋‍♂️,用户@dda0162418c40
711,导演和编剧根本不了解01  02 那个时代的实际情况   都是自己幻想,爱看书的公门晴波
712,剧里2001年居然出现了2016款科迈罗跑车，还有服装造型哪里像2001年的啊？无语,大小姐007
713,全剧的人物演技都很到位，人物形象都很立体，情感也很饱满，故事讲的也特别好玩，建议就是细节可以提高一下,卖女孩的小火柴ddd🤙
714,超级习惯张一山，终于等到你的新剧了。快出剧快出剧！希望你一年三部剧[大拇指][捂脸笑],好看喜欢张一山
715,#你的青春是否有一个ta#中学的教室里，一个同学被校霸欺负，无人敢上前阻拦，一个男生突然冲出来，打倒那个校霸，那是我第一次明白什么叫心动，也开启了我的五年暗恋时光。这五年我为他做了挺多，比如帮他追我的闺蜜，如今他们已经成家，还生了两个娃娃。,宝儿啊宝儿啊🎊
716,我觉得这部剧，导演找的演员真的好有心啊，长的都有那么一点像小时候，情节也特别好看，给我一会哭一会笑的[捂脸笑],带泪的嵛🎡
717,看不够，每个演员演技都挺到位，除了杨澄说话感觉有点吐字不太清晰，其他都很好，感动的点有，搞笑的点也有，看着舒服 不会感觉这个不符合那个不符合，这个电视剧就很真实，剧情合理，据里的每个人物饰演的也很精准到位，关晓彤演技确实在这个电视剧里看出很到位，张一山也是表演的自然 每个神经都有演技[应援][666][大拇指][大拇指][大拇指],梦里神马都有ha
718,我就挺奇怪的，跟男朋友一起就不行，跟老板在一起就不怕舆论了，这样更难堪吧,zhx8263
719,这保安似的人物一出场是真水啊，自行车都停不下来！,最爱的烤地瓜皮
720,怎么女生宿舍还住了一个男生呢？这发的声音都是男人的声音，你可别跟我说是假小子[呲牙],蓝江舸
721,好看！张一山、关晓彤演得真好👍👍有笑有泪，愿你们继续拍更多的好戏！一部比一部更精彩，小姐姐会一直支持期待你们的新作😁,超爱喝酸奶の百里昊焱
722,福西西福西西~~[爱心],范丞丞枕边人
723,爱但又不是很爱 在杨澄的那里谢乔是比较合适 大家相处都好 所以杨澄就想慢慢的接触看看 后面发生的一系列的事情 才会是杨澄的一些内心细节的描写[大拇指][大拇指]！嗯,红烧牛肉！！
724,近几年来很好的剧。演员们演技全部在线。婉婉道来，情真意切，希望有更多的人看到和认可。,运营有道理
725,弄个磕巴的出来，每次出来我都给快进，不知道整他有啥用, 囡囡
726,什么年代了 演员可以 还是这种该死的剧情 ，毫无追剧激情，老演员都在演新剧情，年轻演员也是来者不拒 老掉牙的剧情 自己演得也不嫌腻,黄先生style
727,人生总会有些错过！爱过不后悔！可惜了千禧这对，如果等等小船哥也很优秀啊！,lkxfhr
728,刚开始看的时候 茜姐怎么能拿川的钱呢 太不像话了。后来 哦 去找一挥啊 我举双手双脚赞成！！,晓雨🧜‍♀️
729,还是一直小时候吧，这第2部拍的没么好看，长大以后咋这样呢,aggywjs
730,张一山。永远的备胎，还高兴呢。女人的初吻都被人家拿走了。脑子怎么想的呢。能说一下吗[捂脸笑],152****2222_m1185
731,"我有一个小舅子比我媳妇小19岁，
有一天小舅子问了我一个问题，你说姐夫有没有可能我是我姐姐生的？",ㄟ Listen：_高歌！
732,曾经的少年张一山，曾经的少女关小彤，两人演少男少女完全合适，喜欢[大拇指],左右.无缘
733,非常好看的一部剧！！！！我太爱了，尤其谢乔和千喜好美好美[色][色][色][色][色][色][色][色][色][色][色][色][色][色][色][色][色],∈.²º²²
734,其实我不是杠哈，剧挺好看的我就是看着他们三一起拍戏总感觉几个熟人在一块的感觉[捂脸笑][捂脸笑][捂脸笑]，所以范丞丞演渣男我一点都不生气,潜水姑娘柠檬汁
735,为何这部剧，后半部剧男二橙和女一乔几乎没有对手戏了呢？为何不给机会给杨正一下名呢？证明他不是真的渣，他是真的喜欢过乔，这份感情在他那里有过深刻的痕迹，证明乔不是他众多女朋友中的一个，而是最特别的那个,爱吃玉米的羊✨
736,好的演员就是这样，即使你知道他现实生活中什么样，但是还是可以把你代入到角色里,一夜沙洲203
737,已经看完一遍了回来了,晴柒a
738,又来看张一山了,臧少爷
739,超喜欢看，都是冲着晓彤来的，不得不说晓彤演技太好了[色]，飞飞飞[应援],彤然心动˃v˂
740,我挺喜欢张一山的，痞帅痞帅的，但在这部剧里我嗑小范和小关，希望他们二搭，能有个美好的结局，弥补下[色][色][色],胖胖的程
741,看的起怎么样啊！看不起又怎么样啊！歧视行为浅和深的问题，好与坏，质量问题好与坏，有差距，有区别，怎么样啊！但是不能犯这种低级错误了吧！每个人都有自己的归宿吧！都有自己的栖息地吧！,争取求进
742,是来看一山的[色],可爱的7头
743,太好看了,村姑也狠潮🎀
744,看的火大,@娜些年华
745,近期追的唯一剧[捂脸笑],筱菲🍀
746,想看谢乔杨澄二搭[捂脸笑],筱菲🍀
747,根据我多年的观影经验来看  剧名起错了  如果叫  绿茶和舔狗的爱恨情仇  应该收视率会更高[大拇指],修改默认头像昵称后才能发布！🍧
748,比小时候的演员差远了，感觉还不如导演等孩子演员长大了再拍，更好看些……,孤独的流浪兔🤩
749,让人对关晓彤的角色有更深入的理解和认识，太多社死现场了,reality7~丿
750,我的剧荒的日子终于结束了 ​​，暧昧期的那种让人悸动的感觉,Shirley雪梨子
751,小船哥告诉乔乔自己有女朋友了，今天也是热情工作的美貌,mission7
752,无论是青年组的演员们或者是一些老戏骨，都是很讨喜的，古灵精怪遇上孤傲绝尘,就这样摇摆b~
753,这剧真的太好看了吧都去追啊！，剧本其实倒还算扎实,Doriss~丿
754,关晓彤真的有进步 眼神以及内容都很到位 期待他的继续发展，配音演员很加分,︶人难挽
755,关晓彤的表演让人感到非常有趣和新鲜，台词有趣又有深度,xiong很bu平
756,关晓彤电视剧很好，期待下一期，双向奔赴的爱情真的太甜啦,大脸猫不爱吃鱼~丿
757,面对爱情的来临，女孩子不应该只是等待，缘分来了就要赶紧打晕带回家,不要吃香干了
758,张一山关晓彤的选角真的是太妙了，真的非常的有反差萌呀,吖诺哒~
759,关晓彤能够将角色的痛苦和欢乐传递给观众，能量补充时间到！,海边刷牙女子
760,乔乔终于考上北清，我相信她一定会实现自己的梦想，男女主进展还挺快,不一样的过去~丿
761,关晓彤能够通过自己的表演展现出角色的多面性和复杂性，男主女互动的片段真的又好笑又甜,半城丶流光冷
762,让人感觉到关晓彤和角色之间的共鸣和联系，从头发到脚都是完美的,雨潇潇四月
763,关晓彤的角色让人产生深深的感动，阵容和主题太棒了,海贼王柯南~丿
764,关晓彤和范丞丞吻的有多甜，我的心就有多激动，这个电视剧也太甜了吧,dancing^★
765,这部剧让我见证了爱情的力量和成长的过程，两个人都有可爱小心思,iloveuo~丿
766,关晓彤能够通过微妙的表情和动作展现出角色的情感起伏，两个人演技还是在线,天之骄nv
767,麻了麻了，好爱关晓彤，谁会不喜欢姐姐呢，这部剧有趣极了,eileenm^★
768,停不下来，张一山演的很不错，比以前演的的那些好看多了，我还挺喜欢这种老套的小言剧,恋上我︶
769,关晓彤能够把握好角色的情感走向和节奏，全员演技在线,Tiger2~丿
770,关晓彤能够通过微妙的表情和动作展现出角色的情感起伏，我发誓没人能躲过这对cp,青春不温柔
771,关晓彤能够通过微妙的表情和动作展现出角色的情感起伏，这剧快乐超标了,Liouvil
772,张一山电视剧进步了，细节表现的非常好，台词功力也非常棒，哪怕只有一天也想用这张脸活一次,Lifehe~丿
773,乔乔这时候需要一个可以倾诉可以说知心话的人，剧情节奏很快，,iggypo
774,场景造型什么的都能感觉到用心、情字至上的情感走向,趴着唱歌
775,太喜欢范丞丞啦，而且跟关晓彤这一段吻戏真是超级浪漫的，专治不开心,短腿柯基汪汪
776,张一山的形象也真的饱满了起来，这碗糖我先干为敬,九妹啾啾
777,关晓彤的表演充满了感性和智慧，一开播就抓住了我的心,Mentholl︶
778,是一部令90后怀念，引发00后对过去有无限遐想的作品，谁再说是无脑甜剧我和谁急,womotofol
779,一山演技最牛，,魅力の艾丽森克伦威尔
780,好浮夸啊,晓潼酱～
781,一直不喜欢关小彤，觉得她很假，果断放弃追这部剧,如此简单δ
782,#你的青春是否有一个ta#上高中的时候有一个邻居小哥哥，一栋楼不是一个单元，偶尔在院子里一起玩过一次游戏，后来就注意到他了，没事了他会到我们单元那边空地打篮球，每次听到咚咚声，我可开心了，爬窗户往外看他！有时候放学路上遇到了还会拼命骑车到他前面[捂脸笑]看到他心里很开心！,〆讽ღ刺ゾ
783,来了听说很好看,系上蝴蝶结🎀
784,#你的青春是否有一个ta#在小学，我和一位男生经常打打闹闹我们很讨厌对方，后来我和他成为了同桌，最开始我们都是一脸嫌弃对方，但后来我们发现自己都喜欢上了对方，但是因为我们还小都错过了,baby.008
785,#你的青春是否有一个ta#二年级的时候，我和班上的一位男生，经常打打闹闹，我也很讨厌他但是有一次老师分配座位，把我和他分配成了同桌，当时我们两个都是一脸嫌弃，后来发现我们两个都互相喜欢上了对方，老段，但是因为我们还小，就不懂得什么是爱，后来我们就没有再说过话,baby.008
786,是我眼盲吗，为什么觉得范丞丞古装和现在不一样,深蓝e💝
787,开头的主题曲好好听,会有时济沧海🌼
788,不能点播吗,469178459
789,[色][色][色]太棒了，每个人都好棒[大拇指][大拇指][大拇指],威廉老师
790,脚踩两只船的女的，在面对现实的一切还是先向金钱靠拢了,琪AIwr1234567
791,这看着真太好笑了   赶快更吧  直接大结局好了    不是太无聊 真不想看了  坐等大结局 不过大结局什么样 也能猜到了,丨丶满满的都是爱
792,没看完就想吐槽了，剧中张一山都能去加拿大读书了，为什么和老外对话还是一口普通话，而且张一山不是大学生吗？难道几句英语台词不会念？有点狗血，演员没下苦功夫,小小私享家
793,#你的青春是否有一个ta#杨澄，在此我表示，要不是有范丞丞这张脸顶着，我...忍住！[微笑],秋酸醇酒
794,真的很爱你 嘟嘟,嗯，好的🍁🎡
795,女生妆容自然，看着清纯，除了那个短头发的另外三个都好看,大脸猫20122012
796,看得出为了捧男2选了个完全不贴书的男主，书粉的命不是命罢了。跳出书只能磕口王莹和杨澄。,米米立立哦
797,到我现在宁愿选择爱我的，去见她风都是甜的，可是，回去的时候，风都在嘲笑你,猴子_qq3862
798,来看谢乔啦[应援],彤然心动˃v˂
799,十一层过来的[应援],AA
