,0,1
369,我真的有点好奇了，这剧有没有像评论一样要刷这么多遍[笑哭][笑哭][笑哭],啾啾咪唛吽
370,好羡慕这样悠闲的生活,喜欢喝粥の公伯鸿羲
371,真的很好看[爱心],小米要吃大米
372,#司清景琛双向奔赴超好嗑#司清演得好自然,非常可爱车厘子🎋
373,超级好看[色],星星云者
374,#卢洋洋打工人不像演的#打工人挺无奈的，卢洋洋打工人真的不像演的[捂脸笑][捂脸笑][捂脸笑],超人总动员1986
375,演员的演技也都很绝，看的太爽了,水果糖eve
376,卢洋洋的表演有着非常高的艺术价值，阵容很强,不是逗比我不爱_233
377,卢洋洋的角色让人产生深深的感动，内容满满，节奏快,嘟嘟熊we
378,这画面这质感这演员这情节太绝了，内容满满，节奏快,少年゛流浪于时光
379,超级喜欢卢洋洋啊，人物设计合理,丢了魂吗333
380,卢洋洋也是实力派啊，编剧很厉害,眉尖月_
381,非常喜欢里面的剧情，演员非常出色,大白白32
382,第二集，24分14秒处，女孩书包上国旗下的的CHINE是法语版本的中国吗,堂堂正正当当当当
383,这部剧挺甜的，就是感觉男主不戴眼镜的时候就有点儿奶奶的，然后戴上眼镜的时候就挺有反差感的。有一种斯文败类的感觉的。强烈推荐看这个嘎嘎好看。,冷爱&prime;
384,熬个大夜看完的，要长恋爱脑了[捂脸笑],大红袍不是🍵啊
385,小烟火快点7000吧  太绝了  治愈系天花板,乐荣荣1208
386,很久没这么喜欢一部剧了，剧情不错很治愈。,逸帆远航
387,没在银行工作过得自然认为银行这么好,夜壶handsome
388,真的爱死这种美女与帅哥搭的剧了[色],張想去长白山
389,第一次看这么好看的剧，反复观看中[应援][色],大红袍不是绿茶吧
390,必须二搭[应援][应援][应援][色][色][色]3观很正的剧啊啊啊啊很喜欢求求了求求了[爱心][爱心],Lucky.ll
391,我真的非常非常喜欢，这是部有质量的好剧[666][大拇指][666][大拇指][666][大拇指][666][大拇指][666][应援][应援][色][应援][色][应援][爱心],冬至：：
392,好看的剧值得二刷三刷，弹幕也要刷起来哦，想看二搭,喜欢吃火腿の哥舒弘扬
393,“我只是想有个家， 从前是有爷爷的家，现在是有司清的家。”,云间釉
394,天哪，我又来了，三刷走起[捂脸笑],✔静🌸
395,浪漫的是爱情，现实的是婚姻，追求浪漫不等于接受婚姻,冰糖葫芦Y
396,这里只是房子而已，有家人在的房子，才能叫做家,冰糖葫芦Y
397,女性的价值，从不只限于婚姻和爱情,冰糖葫芦Y
398,热度给我上去啊!!!这部剧是真的很好看啊,星河如梦x
399,真的很好看强烈推荐，已经天天给朋友安利了[应援][应援][应援][应援][应援],Distant.!
400,#被坚定选择能多有安全感#在这纷扰的尘世中，能被坚定的选择会让自己相信自己能被相信、被肯定，但这太难了，就像我不是一个主动出击的人，我不敢去表达自己，所以从来没有被坚定的选择过，我很羡慕景琛和司清之间的感情，他们虽然没有感情基础，但他们之间相互磨合，会为了对方能更好的做自己而绞尽脑汁，他们都坚定不移的选择对方，给予了对方满满的安全感，让对方都能成为更好的自己,知希zx
401,#被坚定选择能多有安全感#梅子熟时，乍知春去，始觉情深,1m83大帅哥
402,幸福是厨房有烟火，院里有猫狗，朝暮有你我,1m83大帅哥
403,"电视剧热榜才第五我不服、应该第一[666][666][666]

",喜欢吃大闸蟹の南门星爵
404,#被坚定选择能多有安全感#最食人间烟火色是一部有质量的剧[应援][应援][应援][应援][应援],cxkkun呀
405,满分[色]真的超爱唯一一个满分剧,·旗木·
406,#司清景琛双向奔赴超好嗑#我真的太喜欢了[色][色][色]我已经四刷了[应援][应援][应援][应援],乔皖韵.
407,大家都有忘不掉的人如何能坦诚相待,星星很闪亮哦
408,是不是深藏爱意的人都是变成胆小鬼。,星星很闪亮哦
409,“梅子熟时，乍知春去，始觉情深!”,星星很闪亮哦
410,#司清景琛双向奔赴超好嗑#“当原则遇上心动，无一例外都会被打破”,星星很闪亮哦
411,“当原则遇上心动，无一例外都会被打破”,星星很闪亮哦
412,真的特好看，贴近生活，演员演技都在线[大拇指][大拇指][大拇指][爱心],靑惷☆炫彩
413,朋友推荐来的 我要开始追啦,睡吃大丸家
414,两个人太好磕了，完全停不下来,向佐蘑菇
415,#司清景琛双向奔赴超好嗑#双向治愈的爱情！先婚后爱！真的很好磕！男主好暖！非常的治愈[应援][应援][应援],奶昔～依雪
416,梅子熟了，乍知春去，始觉情深[爱心],是海子啊💦
417,希望，多一点这种治愈的剧。,虔……^ω^
418,#被坚定选择能多有安全感#被坚定选择真的很幸福,星河9.
419,#司清景琛双向奔赴超好嗑#谁不向往这样的爱情！双向奔赴真的很甜啊啊啊,星河9.
420,好久都没有看到这么好看的电视了，非常推荐哟[应援],匿名用户
421,三观很正，中国传统文化很有底蕴，好爱这部剧,梦幻小夜曲
422,太好磕了吧，希望有第二部[应援],小土妞易懒惰
423,"演员好,景美,导演拍的好!喜欢看！国家应该加大非遗的保护、宣传力度。",用户53fe2b35
424,“洋洋”是一位热爱魔术的女孩，她从小就对“旋风魔术师”这个职业充满憧憬。直到有一天，她在观看“程茉莉”的表演时，被深深地吸引住了。程茉莉的每一个手势都如同舞蹈一般优美，每一个魔术都让人惊叹连连。当洋洋看到“尉迟杳杳”出现在程茉莉身边，作为她的“天王助理”，她更加明白想要成为一名优秀的魔术师，需要不断地努力和学习。于是，她开始勤奋练习，直到有一天，她收到了的“季秋”的邀请，希望在派对上与她见面（“见面吧就现在”）。在会场上，“司清”穿着华丽的礼服，点缀着“最是人间烟火色”的珠宝，成为了整个晚宴中最耀眼的焦点。洋洋突然发觉自己已经拥有了自己的魔法——成为自信、自立的女孩，并且坚定了未来成为顶尖魔术师的决心。[666],情有轲缘🤞
425,"[应援]
一口气看完不用带喘的[应援][应援]",用户46f738bd
426,真的是一个值得看的剧 太好看了,彤子_qq1130
427,女主真的是好可爱，很喜欢了,潮汐鸭
428,我负责财米油盐，你负责赏雪喝茶[爱心][爱心],158****4935_m1602
429,我负责柴米油盐，你负责赏花喝茶,相逢在雨中1314
430,男女主颜值很高[应援]  喜欢看先婚后爱系列～,清风扬絮🤗
431,男主的生活才是我想要的生活,8.3%
432,太不接地气了，有点飘啊，,超哥老谢
433,#司清景琛双向奔赴超好嗑#梅子熟时，乍知春去，始觉情深,ᝰ性喜❦孤单℡🌟
434,不是我说这个电视真的有点好看[色][色][色][色],想见你oneday✨
435,为啥这么好看的剧不火,哈哈大笑lw
436,我又看了一遍，为啥这么好看的剧不火,哈哈大笑lw
437,#被坚定选择能多有安全感#爱是相互的，司清和景琛相互爱着，好甜令人心动呀[色][色][色],iswuqjk
438,一天追完，简直停不下来，继续二刷三刷[应援][应援][应援],158****4935_m1602
439,[色][色][色][色]爱死这种剧情了，况且卢姐真的好漂亮呀[色][色][色][爱心],祺（海）
440,给我推荐了很多片了，就来看看吧,沈寻宜
441,#司清景琛双向奔赴超好嗑#救命这辈子就想谈段这样的,花会一直开e
442,就喜欢这一次性更完所有的,Cloisini_xxxx
443,好剧。无论是演员，剧情，画面！,《礼记》
444,司清终于亲吻到了她的人间，太喜欢太喜欢,略略略的小朋友
445,熬夜一天追完的剧，真好[应援][应援][应援],是风还是梦
446,男主居然是01年的，也太小了吧！比我大一岁[捂脸笑],冰冰冰冰冰冰冰￥
447,这一开头，就感觉不一般啊！,歪(･ิϖ･ิ)っ
448,太好看了，爱奇艺也太太给力了，一次性更完,艳♥子
449,一次性更完全集我真的没想到[色] 简直不要太棒[大拇指],乖乖早上好
450,我又来了[应援][应援],七七家的小肥
451,下面没字感觉自己听不清楚[捂脸笑],邓仕安anne
452,一整个爱住，一次性更完，牛[大拇指][大拇指][大拇指],大地亩瓜
453,这也太棒了吧，一下子更新完,福昂布窝琳🌟
454,就喜欢自己喜欢的剧，一次性更完[应援][应援][应援][应援],可乐要加糖♡爱你
455,#司清景琛双向奔赴超好嗑#我来磕卢洋洋的cp了嘿嘿，喜欢她演的电视[应援],我家有六只洋
456,等了一个多月，一次更完真的惊喜[应援][色][爱心],泡泡雨Roy
457,一次性全更完了啊，这也太好了吧,💎雯雯💫⛄
458,就喜欢会员看全集的网剧[色][色][色][应援][应援][应援],徐福记_.
459,#卢洋洋打工人不像演的#卢洋洋真的演技好，人又漂亮。,↗℡蓅哖☆╮吢痛〆﹏
460,真的太爱爱奇艺了，好看的新剧经常会员看全集,想得多
461,司清就是景琛的唯一，他总会在原地等她回家！,小李郎亚
462,一次性更新完太好了吧,。肖战唯一老婆🐾
463,我天，一次更完[色][色][色][色]还得是网剧,海里不止鲸.🌟
464,#被坚定选择能多有安全感#可以肆无忌惮 可以被无限包容,吃不胖⸜₍๑•⌔•๑ ₎⸝
465,就喜欢这种一次性更完的[应援],喜欢吃龙虾的公仪🤟
466,#卢洋洋打工人不像演的#掉发是常态，房贷车货是常规操作,左耳右东😃
467,就喜欢一次性更完的，喜欢女主男主不认识,追剧小达人🌙☔
468,大概就是很幸福幸福的感觉 被坚定的选择着 被爱着[爱心],离人树下泣声人
469,我来了我来了，期待好久直接放全集[色][色][色],清清清水灬
470,#司清景琛双向奔赴超好嗑#超喜欢的人设，男俊女美，好嗑，好嗑，好嗑[色][色][应援][应援][应援][应援][应援][应援][应援],CH Eng🤗
471,终于开播啦！就喜欢那么不守时[爱心],Somnus727
472,#司清景琛双向奔赴超好嗑#就喜欢这种剧，太好磕了,陌沫.🥝
473,超级好看 还有女主很韩系耶！男主也好帅啊 剧里的的声音也很好听[色],张某某zp
474,太好看啦,pg＆ki
475,#司清景琛双向奔赴超好嗑#“我负责柴米油盐，你负责赏雪喝茶”虽说后来不是这样，但也真的好美好，好甜[应援][应援][应援][色],喔哼😏👏
476,两人四季，一日三餐，人家烟火🎇推荐最食人间烟火，去有风的地方，爱情而已，没有什么狗血剧情就是比较治愈,誩灬丶
477,#卢洋洋打工人不像演的#姨妈期间还要喝酒，被同事背后造黄谣，《最食人间烟火色》是真的很真实,瓜雯
478,这下雪了穿成这样，不得冻死啊，即使是拍电视剧，还是贴近自然一点。,木子 丰色
479,超喜欢里面中国传统的建筑和景琛不玩手机的生活，自己顾家下厨的有优点,追剧唯美
480,这什么开头 莫名其妙的。还我负责柴米油盐，一年才26w，还有一个月一万的郊区房贷，养得起谁,仙境爱丽丝33
481,看了这剧真的有感觉到人间烟火的美好，开始向往两人三餐四季的生活。,高山流水寻知音
482,说句实话我看剧基本都是好剧火的那种，这部剧立马就吸引我了，果然这剧很不错，陈鑫海卢洋洋演的真好,你还好么好
483,真的好看，新演员陈鑫海与卢洋洋演的太好了，景琛与司清这两个角色都演活了，好看啊这剧好良心,你还好么好
484,是真的好看，已经三刷了，男女主绝了，男主陈鑫海景琛与女主卢洋洋司清双向救赎，互相理解，真的很不错，布景取景相当好一部剧，好看,你还好么好
485,求推荐同类型好看剧[爱心],冰汽水🥤🍡
486,好好看二,"啊离
🫧泡泡糖"
487,在刷一遍[应援][应援],爱的浪漫💞
488,好看，希望有第二部,sunmuyang815
489,#司清景琛双向奔赴超好嗑#只看了第一集，有点劝退我的意思，就感觉这个女主有点太自来熟了吧，让人帮忙还这么理直气壮的？？还要不要继续看？[捂脸笑],爱吃炸鸡de王官浓绮
490,我今年33了，可是年少时的那段感情在我心里一直挥之不去，庆幸男女主角有嘴，庆幸有那么多神助攻。让人生少了遗憾！,猫猫🍒😊😝杨
491,说实话男女主都不认识，但是这是难得的好句。太上头了，一天炫完整部。特地回来评分。,胭脂一点点
492,男女主都不认识，但是有一说一，这个剧真不错。值得重刷的那种。,胭脂一点点
493,全程姨母笑，女主哭也跟着哭。这个电视剧的构图好美！！,尧少爷的小宝贝
494,陈鑫海非常不错希望多多被发现接好剧星途璀璨[应援][色],桦柒Emily
495,极力推荐非常好的一步电视剧。在享受人间最 的爱情同时又净化心灵的纯粹,濡 阳
496,这种感觉成年人都懂，大家都不容易呀！但还是要生活中充满希望，一切都会慢慢好起来的。导演很会拍，洋洋演的真的不错，感情到位，台词也很清晰，卢洋洋大火，最食人间烟火色大火,"静怡.
静怡."
497,六年前就一见钟情了他俩，男主认岀了她，女主不知道,爱涮火锅の公孟俊明
498,真的好好看男女主都有脑子都有嘴，导演也会拍，不错，今年第一部好剧,薯条可乐Kayla
499,值得反复观看,椰汁芒果味
500,这个电视剧拍得好，宣传传统手工艺品，感受中国传统文化的美。,盈静初遇
501,最食人间烟火色,喜欢吃栗子的澹台宁乐
502,看第一集确实有退缩的意思，因为女主的做事方法，看了评论之后说后面会好看。那就继续往后看看。,琪儿☄
503,看到剧情来的[捂脸笑],贺表叔
504,已经三刷四刷了,猫小咪╮°
505,最美最好听的网剧~作为银行客户经理代入感太强了,落英缤纷娜娜SLN
506,表白全世界最好的景琛，希望在平行时空的景琛能永远快乐，感恩遇见。[爱心],坐拥王城
507,卢洋洋真的超韩系，从弥雅开始我就特别吃她的颜，而且姐姐的演技真的很自然啊，总之我是真的很喜欢,喜欢跑步的呼延芳洁
508,"最喜欢里面的景琛了,一开始是高冷男神,后面有了司清，开始有了笑容,每一个笑容都是给予司清的.特别害怕司清抛弃,可以为了司清做出任何选择,把司清的每一句话看在眼里",依我来看
509,二刷了救命，还会有三刷四刷的。剧情很好，根本不够看啊，很开心能遇上最食人间烟火色，让我认识陈鑫海，陈鑫海你会越来越好，越来越棒的，加油[应援][应援][应援][应援],海得是紫薇星💛
510,最喜欢司清宝贝啦 跟她同一天生日[呲牙] 希望我可以跟她一样优秀 遇到属于自己的景先生,耶耶耶耶耶耶耶耶耶耶🍑
511,最喜欢的角色是司清 是我在剧中少有的看到的人间清醒 编剧把银行人的细节都写的很到位 观众也能引起共鸣 而且她对待爱情和工作 都非常用心、理智 题外话：男主角色很贴脸 陈鑫海很帅！！,边草莓gapsong
512,谁懂 真的超级喜欢景琛又帅 又善良  也是从这个角色入坑小陈同学的 [应援] ,茜悦鑫
513,#最食人间烟火色# 谨代表全世界祝我们司清女士永远快乐～你值得这个世界上所有的善意和温暖！最喜欢的角色当然是司清啦[色],曾经幻想过末来
514,#司清景琛双向奔赴超好嗑#可是景琛和司清的名字我都很喜欢诶🥺景琛景琛 一步一景 视若珍宝💕司清司清 坚毅果敢 清澈明朗,Shining_Nikki
515,谨代表全世界祝景先生和司女士长长久久～太爱司清和景琛啦，两个角色都喜欢！,YuHan1005×0506
516,最喜欢景琛和司清，两个人都很温柔善良，希望能看到同质量剧本二搭，推荐买下作者含胭的《寂寞的鲸鱼》,柒鱼里
517,谨代表全世界祝景先生和司女士长长久久～太爱司清和景琛啦,YuHan1005×0506
518,最喜欢的角色就是司清了！！有颜有实力还有事业和爱情 这样的角色谁不喜欢！！,肚腩日记
519,唯一一部我3刷的剧，真的非常喜欢这个剧里的房子。好希望原搭来个第二部，颜值演技都在线,我们的瑛
520,立意好，台词美，超佩服编剧。空镜美，音乐搭，人物人设好，男女主有CP感，可磕很甜[爱心],陈行简🎉
521,五一假期发现的一部好剧！景色绝美！第一次看男主演的戏！还不错！值得推荐,小花朵跺跺脚
522,就真的特别好看，特别甜，看了让人想立马找个对象结婚的那种🤭🤭🤭,i手可摘星辰🐾
523,很不错的剧，每集中的小短句都很戳心，男主的手艺让我以为自己看的是美食番[呲牙],胖头鱼鱼鱼鱼judy
524,见一两面  就说结婚感觉有点莫名其妙  后面剧情还是不错的,是悠扬啊
525,第一开始并不是很看好，但是看完感触很深，做自己想做的！,古·寻你
526,"看过的最好看的电视剧
两个最渴望家的人，给了彼此最温暖的家
最好的六个人中有友情，有爱情，有亲情。
不仅仅只有爱情的美好，还有现实的苟且。
一部好的电视剧不应该只有情歌支撑，还应该有深刻的主题，无疑此剧两者兼具",乍见之欢wqt
527,非常文艺深情的感人故事，男主是人间的清新、和稀有！治愈净化心灵的好剧！,濡 阳
528,一部看完想结婚的剧，真的很喜欢。强烈推荐，希望还有第二季[大拇指],神鹰队长
529,最喜欢司清[色],比狗困ʚ🧸ིྀɞ
530,导演多拍点这种剧啊，太治愈了，虽然结尾有点草率，总体还是很给力的，好久没被国产剧抓住了[色],喜欢举重の谷利意远
531,相互治愈的景琛和司清，带给我无限的感动和温暖[爱心]两位主演未来可期[色],哥哥哥哥哥哥好帅🍀
532,好膈应啊女主开头要钱好憋屈，男主还有那个邻居凭什么这么理直气壮？,vvvv都是
533,女主脾气真好,二时黎夏
534,看这部剧像读一首婉约派的江南诗，不管是音效，景观，和搭配的文字解读，无不体现人间烟火，烟雨江南的特色，走在这样图画里谁都能成为风景！,蓝天翱翔的雀
535,再看一次[应援],星星沉沦了❤
536,太好看了，看完了一遍还想再刷一遍[呲牙]男女主颜值[大拇指]特别是男主耐看,女 in尼米
537,一边看他们鸡零狗碎的生活，一边看他们暖暖的爱，在这快节奏的时代中，他们恬静的生活让我们感到了无比的舒心，我们的每一次冲动是对未来的不确定的迷茫与无奈，每一次感动是对自己人生的一次感悟，唯有在这种迷茫与感悟中才能找到自我！[呲牙],献没
538,＂愿我们能在鸡零琐碎的日子里，拥有自己的人间烟火＂,香尘•᷄
539,#卢洋洋打工人不像演的#最吸引我的是现实，我们生活中面对的一个又一个选择题，不得不去权衡去妥协，但是最后都会拨得云开见月明的,沈复之
540,现在所有的电视剧，男主只要是年轻的，通通都是僵尸脸，,阿辉（广东韶关南雄）1970
541,烟火气真的很重，我真的很喜欢人间烟火气。还有后面的家庭感，真的好喜欢。这部剧在我心里是top2了[色],暴富不报复
542,清琛cp嗑死我了[色][色][色][色],激酷￡^PInK
543,看不下去了,听00005555
544,#卢洋洋打工人不像演的#从我才不会被女孩子欺负呢，就觉得卢洋洋超级可爱[色]加油[应援][应援],制霸女孩520
545,有那么好看嘛，我怎么觉得看了一点没什么兴趣诶，要不多看会时间,我就是大嗮
546,谁懂4刷了,可甜，可萌
547,演员好看，但是剧情不好看[擦汗],এ🍡0000
548,我的反派夫君是她吗,旧时凉月
549,#被坚定选择能多有安全感#双向肯定是最有安全感，是无论她在干嘛，无时无刻都可以放心,偽艺术生
550,开头这幕红裙黑披风，简直美到我心坎。追剧的最初原因。然后这部剧，看了四遍，越看越爱，细品细品,Hey..°
551,第一集男主有几个镜头居然有点像陈冠霖，简直我的白月光替身文学又出现了[应援],辣条拌饭💖
552,这部剧的场景和画面真的好唯美，真的有一种岁月静好的感觉，很难不爱啊[应援],黎悠然🌻
553,每一个细节都能够完美地表现角色的情感状态，跌宕起伏,井里的呆萌少年
554,陈鑫海老师电视剧也到位了，全员原声好评，剧情紧凑，演员台词都很棒,智商都来卖萌了_
555,卢洋洋能够将角色的情感和内心状态表现得非常深刻和细腻，看了还想看,走失的可爱妹纸6号
556,卢洋洋的演技让人感到非常温暖和理解，剧照也很有氛围感,斩魂庭师2w
557,让观众沉浸在卢洋洋角色的情感中，人物的眼神、角色的设定等都很巧妙,颜户鸢
558,直入主题一句废话都没有很舒服，演员都是实力派,琉璃舞w
559,看出编剧的叙事野心精气神追求，节奏转场掌镜都很好,蕾玥瑷雅_
560,卢洋洋的表演有着高度的专业性和自然度，令人叹为观止， 剧情抓人,姬月的项圈233
561,卢洋洋能够将角色的激情和冲动展现得非常饱满和真实，很用心的在拍,啗一荔
562,陈鑫海电视剧进步不少，这几年很少看到他的消息，原来是在磨炼电视剧啊，我觉得挺好看的呀,说你爱偶_
563,卢洋洋深入挖掘角色内心的矛盾和冲突，感觉质感好好呀,江户川柯北233
564,卢洋洋的演技非常自然流畅，细节要素众多，希望能继续保持,把村长装到篮子里去w3
565,这个剧好多我喜欢的演员，导演和编剧还是非常用心的,幼姬_
566,卢洋洋能够通过自己的表演展现出角色的多面性和复杂性，非常写实,筱残233
567,卢洋洋能够用不同的表演方式和情绪，演绎出每个角色的独特个性和魅力，全员贡献教科书级的演技,冰雪殇璃陌梦233
568,卢洋洋能够将角色的激情和冲动展现得非常饱满和真实，质感属实是做旧了,精神领袖少年
569,卢洋洋能够将角色的痛苦和欢乐传递给观众，值得一看的好剧,阳光少年范
570,陈鑫海演的真讨喜！节奏把控很好幽默又紧张，很有意思,机车少年爱机车
571,卢洋洋的表演充满了内敛和细节，故事环环相扣过渡的流畅顺滑,软萌音马尾萝莉_
572,我觉得卢洋洋真的太让我惊艳了，节奏好剧情紧凑不拖沓,心如海深藏少年
573,卢洋洋的演技已经达到了一个非常高的水平，开局就让人激动,时光゛乱了流年老了少年
574,卢洋洋不仅身材好而且还这么有气质，导演转场真的厉害，节奏快,巴拉拉能量作业消失_232
575,实话实说，陈鑫海的电视剧大幅提升了，剧情走向让人猜不透,枸杞红枣水_
576,故事节奏、细节处理和配乐都不错，剧情紧凑，演员台词都很棒,到海里浪2333
577,场景细节用心，质感格调满满。轻喜悬疑范儿，导演和编剧都好棒,天要逆吾_
578,陈鑫海眼神里还能闪耀着初入职场立志大干一场的兴奋，真了不起， 剧本让我爱了,推倒餐具6
579,惊喜的是陈鑫海，已经超其他流量小生好几条街了，安利安利,蘑菇不是花_
580,画面质感配乐都没的说，剧情紧凑，全员演技在线,我在点火_
581,卢洋洋能够通过表情、动作和语言，将角色的情感状态完美地展现出来，很喜欢这部剧的台词和背景设定,懊恼王子_w_
582,陈鑫海这次真的给大家带来了惊喜！演的很好，节奏紧凑，演技都好好,灰太狼_红太郎
583,陈鑫海做得很好。陈鑫海优秀啊，故事环环相扣过渡的流畅顺滑,喂 请还我棒棒糖vv
584,卢洋洋的表演有着非常高的艺术价值，主演神仙阵容加持,数学这货太傲娇e
585,让人感觉到卢洋洋和角色之间的共鸣和联系，演员演技特别到位,男的爱自染_女的爱染他
586,卢洋洋的表演让人感受到角色的内心情感和复杂性，气氛紧张,没眉毛红发的冷酷小男孩
587,故事节奏、细节处理和配乐都不错，剧本给人的感觉还不错,漩涡鸣人的伤_谁懂
588,卢洋洋能够将角色的痛苦和欢乐传递给观众，故事环环相扣过渡的流畅顺滑,被窝就是我初恋
589,有些台词很有道理，剧中美术、服化道、摄影、视效方面也挺好,全宇宙少年萌主
590,卢洋洋的表演充满了热情和能量，人物的眼神、角色的设定等都很巧妙,小女人小魅力e
591,陈鑫海演的真讨喜！节奏把控很好幽默又紧张，全员演技在线！看着太舒服了,所罗门的第七十二根柱子
592,卢洋洋能够将角色的激情和冲动展现得非常饱满和真实，很喜欢这部剧的台词和背景设定,小海豹男孩
593,"当一个人经历多了，看淡了，会发现生活原来的样子……
当一切沉淀下来，释然了，会发现以前所追求的有些并不是生活的必需品",茉莉花开你好吗
594,陈鑫海的形象也真的饱满了起来，那鼓劲儿实在是太到位了,执着的小蘑菇we
595,卢洋洋能够通过自己的表演展现出角色的多面性和复杂性，把角色演绎得很精彩,画个逗号给明天ve
