,0,1
190,"没有狗血剧情，有的只是我们平常生活的鸡零狗碎，但是生活就是这样，哪有什么一帆风顺的，都是在各种鸡零狗碎中过来的。就算这样，面对该面对的，只要心在一起就什么都不是事。希望大家都能找到自己的人间，在鸡零狗碎的日子里拥有自己的人间烟火。
整部剧看下来不舍得快进也不会有想快进的欲望，每处剧情都是顺其自然的，真的就是那种看小说的感觉，真的很治愈。强烈推荐",只粉有才华的人
191,好看吗各位，好看我就充个会员,ぃ傲娇主
192,#卢洋洋打工人不像演的#当然像了，洋洋的演技没的挑。,赵BOSS的小娇妻Lisa
193,非常正能量的一部电视剧，这是我二十三年来看过最热情澎湃的一部剧[大拇指][大拇指][大拇指],阿巳emo
194,字幕呢字幕呢,CH Eng🤗
195,好几年没熬夜的人为了这个剧熬了个大夜 剧情紧凑不拖沓，故事不俗套三观正不烂尾 良心剧、支持[应援],二是一种状态
196,二搭和第二季总dai选一个吧,冰糖葫芦Y
197,字幕出逃了？？,枕边的风浪
198,为啥没有字母,没年由衷
199,真的好好看，二刷了已经,是风吧~
200,男主走路为什么那么僵硬啊,路灯下的小女孩⭐
201,梅子熟时，乍知春去，始觉情深。,哦天啊bro
202,请安排第二季或者二搭，我没开玩笑[应援][应援][应援],回口回不写
203,等了好长时间，终于上线了，这个题材感觉会很好看[色][色],neooen
204,欢迎来浙江武义玩啊，宜居城市哦[应援],duang🍿TNT
205,最喜欢这种一下子更完全集的剧了，这才是VIP该有的体验[应援],追追追追追追剧啦666
206,挺好看的[应援]，后面有的片段还挺逗的[捂脸笑][捂脸笑],卡ฅฅ*🤩
207,庭有枇杷树，于吾妻春日咳时手植也，其叶味苦，性微寒，煮汁饮之，可止咳,冰糖葫芦Y
208,希望自己有幸遇到这么一位希望自己有幸遇到一位这样的人，司清是被坚定选择的那一个人，景琛陪伴着她，其实也就挺有安全感的。即使自己失业了，也还有景琛的小家园可以安居,❀ 掀起留海做女王
209,#被坚定选择能多有安全感#被人坚定选择着，会让人幸福开心，也更有安全感，就像司清和景琛，景琛说我对司清从来没有原则，啊啊啊。,ycysqz
210,哇哦哦哦哦我来啦,别理库里
211,#被坚定选择能多有安全感#景琛坚定着选择司清，真的很有安全感啊[爱心],糯米团eating521
212,现在的手机都要锁屏密码，她不用密码就可以开机真神了,陈华166
213,这部剧甜吗,无语（＃－.－）。
214,来看卢洋洋啦！一次性更完[大拇指][大拇指][大拇指][大拇指],astronaut😃
215,电视剧有小说吗,胖华love
216,#卢洋洋打工人不像演的#卢洋洋饰演的打工人很好，能屈能伸，比生活理想化但又跟生活紧紧相贴，她的勇敢在于哪怕有人栽赃陷害她她也会勇敢的录下证据和录音 知道用法律保护自己，但当别人打了她时，她又默默忍受，不让他人担心 心理很像生活中的打工人，为了不丢掉工作，只能委屈求全,十二月的桔梗
217,女主长的太像刘诗诗了,文文2890
218,片尾曲好好听,好好的做自己喜欢的不好吗
219,#卢洋洋打工人不像演的#但是女主卢洋洋只是因为小时候的家庭原因想得到关爱 想有个家 所以拼命挣钱买车买房才能有安全感,X易烊千玺X1128
220,如果你碰到一个让你好运气的人，一定要牢牢抓住他。有人就是天生旺妻,Ａｚāｌéā
221,#卢洋洋打工人不像演的#去年暑假在银行当实习生 真的大早上晨会还要做早操 月底会比较忙 事情挺多 平时还得去推销理财产品 雀氏很不容易 洋洋演的很好[应援][应援][应援],醉死i
222,宝藏治愈系剧，不是无脑剧也不是狗血剧，三观很正，双向救赎，男主暗恋成真，女主先婚后爱，偏现实，是让人向往的生活，真的强烈推荐这部小众剧！！！[大拇指][大拇指][大拇指],Hikze
223,这个男主是不是演过一生一世里面的男三？看着好像他啊,困得晕呼呼🎀
224,#司清景琛双向奔赴超好嗑#字幕呢字幕呢[捂脸笑],快换新头像
225,好开心 全集[应援][应援][应援][应援],须王静夜
226,生活很好 记得微笑 众口难调 开心就好,星星很闪亮哦
227,这是在哪里拍的呀,139****9363_m1857
228,第一次这么想一个剧火起来[应援][应援],🐱白给🐱
229,宣传非物质文化遗产，宣扬正确价值观，传递正能量。很治愈的一部剧，每个人心里都向往着一处璟园一份温暖一个家，希望我们都能够遇到自己的景琛。,想偷唐僧肉
230,#司清景琛双向奔赴超好嗑#所有的一见钟情都是见色起意，所有的日久生情才是权衡利弊[捂脸笑][捂脸笑][捂脸笑][捂脸笑][捂脸笑][捂脸笑][捂脸笑][捂脸笑][捂脸笑][捂脸笑][捂脸笑][捂脸笑][捂脸笑][捂脸笑][捂脸笑][捂脸笑][捂脸笑],超人总动员1986
231,男女主人公从相识相知到相爱[色]  先结婚后恋爱  [微笑] 慢慢的一个举动一个眼神就能明白对方 [应援]  为了美好的明天而不懈努力  [奋斗]最食人间烟火色[玫瑰花]   世间最简单最平凡的生活有一个相爱的人一起到老是最幸福的事   [爱心]最终都如愿以偿的得到满意的结果 [666] 皆大欢喜[大拇指] ,溪水清又清
232,#被坚定选择能多有安全感#景琛一直都只有爷爷，司清没有家人呵护她，一直打动我的是，景琛在爷爷去世时也没有失约，景琛失去亲人，司清也找来狗狗们陪伴他，男主也很懂司清，知道房子是他都不能给予的安全感，双方都很懂彼此，很现实，也不失温暖,鹤新川
233,感觉像两个孤独的人互相依偎，相互救赎，我被治愈了[爱心][爱心][爱心],易康_qq1672
234,"1，我只记花开不记人，你在花里如花开在风里
2，我有时走出房门，站在门前的石头坪场上，仰看满天星斗，觉得全世界都是凉的，就我这里一点是热的
3，春宜花，夏宜风，秋宜月，冬宜雪。四时佳兴，可与人同。
家人闲坐灯火可亲",冬至：：
235,#司清景琛双向奔赴超好嗑#这部剧真的很好看，双向救赎，双向奔赴，我的司清我的景琛再平行世界要过得开心，以后只要你们互相帮助，互相取暖，你们就是最幸福的，啊啊啊啊啊啊阿，我真的很喜欢这部剧男主的三观，啊啊啊啊啊，这部剧应该大火，给我火🔥，先婚后爱，妈呀，好喜欢，要幸福的生活下去喔[爱心][爱心][爱心][爱心],耀眼如星辰🍁
236,很喜欢这部剧 已经六刷了 景琛和司清的相互救赎 双向奔赴的爱情我很羡慕 希望还可以二搭[应援],莫西.‘
237,猫的树的两个演员合作了呀，超级喜欢看女主的见面吧就现在,刘耀文的小宝贝（守护佩奇）
238,#被坚定选择能多有安全感#因为被坚定的选择着 才会有安全感 才会有勇气 才能去做义无反顾的事情 司清跟景琛何不是 双向奔赴 互相坚定选择 互相治愈呢,X易烊千玺X1128
239,#司清景琛双向奔赴超好嗑#这部剧的三观真的超级正 他们两个真的是在双向治愈 呜呜呜反正超级喜欢 男女平等 还有景琛说的女性的价值从不只限于婚姻和爱情 非常值得看,X易烊千玺X1128
240,"有思想、有品质、立意较高的一部言情剧。
尤其是配乐优美，远高出其他。
为此剧制作方点赞[大拇指][大拇指][大拇指]！",秋日梅子🤞
241,灰常好看！！尊的！虽然之前有点无厘头，但是这个不影响！不管，整体来说真的很喜欢，不管是场景还是人物性格还是剧情发展还是感情发展都很戳我！！！爱死了！[色][色][色]特别是男主啊啊啊啊他真的很可爱很可爱！这种反差感真的很戳我！！温温柔柔但是也有自己的坚持和性格就是很不错！[色][色][色],特特伦舒
242,#司清景琛双向奔赴超好嗑#太好磕了，让人直接有想结婚的冲动，他们之间相互成长、相互陪伴，两人三餐四季，处桃源之境，有好友相伴，有猫狗作陪，这就是我所期望的未来,知希zx
243,#司清景琛双向奔赴超好嗑#没忍住，连夜观看👀，用心拍摄的电视剧，观影人是能感觉得到的[呲牙],LLGYM192
244,卢洋洋好好看，男主有点像黄轩[大拇指]，制作画面十分精美，估计花不少钱，决定追下去～[呲牙],摆渡百科
245,一部景色美，有温度，服装价格平民的电视剧。不用太多华丽服饰陪衬都能吸引大众去观看,2314458200
246,剧中的场景和画面都非常吸引人，绝对值得一看,就爱甜筒
247,#被坚定选择能多有安全感#男女主小时候的经历导致害怕被抛弃，但是双方同时付出，给足彼此安全感，让男主敢于表达自己，尤其是喝醉坐车里的那段，演技很棒，害怕被女主抛弃的感觉[应援][应援][应援][应援][应援][应援],云边的露水
248,#司清景琛双向奔赴超好嗑#剧情很棒，没有解不开误会，演员们颜值演技在线，最后结局升华主题，烟火大火！！！[应援][应援][应援][应援][应援][应援],云边的露水
249,第一次看完一部剧感到温暖的同时还有满满的失落感。这剧太美好了！二刷走起！,柑橘的栀子花🌼
250,别的不说剧拍的是真的好 演的不尬 没有大的年龄差 不像偶像剧但又像偶像剧 简直了真的好看,A   慕
251,天哪，总算是找到一部一口气看完的剧了，二刷了，几年的铁公鸡，一毛不拔为了这剧冲会员了[色],✔静🌸
252,真的很赞这部剧，展现生活的现实与美好，还有在这部剧有点淡淡的忧伤感觉，配上假如爱有天意这首歌绝了，三观也正，传统文化的宣传，匠人匠心，还有漂亮的汉服小姐姐，网剧这个水平，牛了,白夜_qq1793
253,我的天啊，这么好看的剧，环境好，氛围i也很棒，设定很好，每集的诗句也很有意境，真的有触动到，互相治愈，小狗狗也很爱，只是时长感人集数太少，希望以后能再遇到这么好看，很爱很爱的剧。,百余安
254,昨天出的剧吗,耿直的arran
255,爱奇艺一次性上完的剧都不错，他跨越山海而来，对我而言危险的他，最食人间烟火色[大拇指][大拇指][大拇指],雨中的自己才是大哥
256,刚开始期待并没有很大，但是看着看着我觉得真的很好看诶，有点治愈，互相救赎[大拇指][大拇指],Hikze
257,好看好看俊男靓女配我一脸[色]为了卢洋洋来看的发现这部剧真的是个宝藏温暖治愈的小甜剧，烟火必火，男女主必火[应援],许半夏🌼
258,#被坚定选择能多有安全感#被坚定选择超幸福的！六年前司清买下冬至就注定他们的故事 你在外面工作我在家里为你煮饭牵挂着你这就是司清渴望的家吧 ！,꒰ঌMeet.໒꒱
259,一次性更新完 我的妈呀 [捂脸笑]让不让人留点时间看书了[捂脸笑][捂脸笑][捂脸笑],葫芦娃KKK
260,看完了，希望每个人都有属于自己的烟火色吧[微笑],潇雅夜雨
261,今年最好看的剧[大拇指],再卜再见
262,好牛 一次性更完,吹吹风02
263,退出去有字幕了，哈哈哈,烊SVT彬
264,后期制作字幕呢？,困得晕呼呼🎀
265,他是她的理想主义，她是他的人间烟火.,霖铛喵
266,真的还不错，今年第一部现代剧,x.舒
267,男主不是虚颜的男主吗？,不爬树的考la
268,这个完结了吗？,雪天奇缘
269,我想知道虐吗 看了太多虐的剧有点怕了[捂脸笑],小嘬🙊
270,#司清景琛双向奔赴超好嗑#感觉很治愈的一部电视剧,衫青✌
271,半卷题跋为啥在司清家？,🍀MingA✨
272,"好看吗朋友们，我看级数简介咋那么曲折
",_77xx-
273,点开第一集，竟然是弥雅[色],187****0248_m1303
274,好好看，后就没有碰到让我追到五点的剧了,街~^角
275,看完了来评论一下，剧情和剧的质量真的很好，女主的演技也很好[大拇指][大拇指],小 HANG
276,可是我觉得女主人品好像不太行,星辰.u💤
277,都说好看我过来看看是不是真的,小糯米 小石头
278,一次性看完，这才是爽看剧！,向阳雨前
279,超级好看,匿名用户
280,最喜欢这样刷剧，不用等,2387636296
281,刷了两遍九霄寒夜暖过来这个好不好看家人们[色][色],困的晕fufu…..
282,很好看，希望他们两个二搭,陈平安゜💞
283,真的很好看，是熬夜追完的，真的是双向救赎，一定要去看[爱心][爱心][爱心][爱心][爱心][爱心][爱心][爱心][爱心],匿名用户
284,好尴尬的剧，怎么会那么多人说好看呢[流汗],喜欢喝酸奶的静静吖
285,真爽，又是熬夜追剧的一天,郭子卿……
286,#司清景琛双向奔赴超好嗑#卢洋洋在剧中饰演银行客户经理“司清”，演员自身的青春活力与司清率真直爽的人物设定相得益彰。成了“漂二代”的司清，开始重复她曾经最讨厌的父母的人生，在追求车子房子票子时忘了生活的本质。一起“传统手工艺作坊”的不良贷款，她与景琛相逢不相识，反阴差阳错下成了彼此最不待见的那种人。直到司清28岁最狼狈无助的生日黄昏，在随园那充满江南风韵的长廊下，她再次被景琛身上温暖的烟火所触动，冲动之下提出结婚。而景琛，也因司清手中的那半卷题跋，答应了她的要求。然而，结婚却只是一切的开始。,左耳右东😃
287,"#被坚定选择能多有安全感#作为漂二代的她严重缺乏安全感与归属感，渴望在南城取得自己的一席之地。直到一场冲动的“昏”姻，一段离婚冷静期的先婚后爱，治愈了她的都市症候群。
《最食人间烟火色》主要讲述了司清20岁生日时，她花光了准备庆祝生日的所有积蓄，拍下了景琛的毕业作品《冬至》。只因《冬至》中父母相伴的烟火色，是她曾经作为留守儿童时最大的渴望。现实中她的父母终究还是忘了她的生日，景琛却以另种方式做了填补。两人未曾谋面，他却成了她的怦然心动，她亦成了他的救赎。
可司清在充满虚荣和负能量的大都市打拼，而景琛在慢节奏的乡野为那些即将消逝的传统手工艺寻求一条能适应这个时代的生存之路。两人的习惯、三观和追求都截然相反，最终选择离婚。怎料三十天的离婚冷静期，却又让这段婚姻绝处逢生，慢半拍地开启了先婚后爱的虐狗模式。两人也在经历种种后，确定彼此是自己最渴望的烟火与人间。",左耳右东😃
288,来了来了 太棒了吧看完《见面吧就现在》来的 卢洋洋[色],不想睡觉的斑马🦓
289,#司清景琛双向奔赴超好嗑#好磕，女主的家庭让女主独立，坚强，拼事业，男主的家庭也让景琛多了自卑害怕失去，隐忍，男女主双向救赎，不错的一部好剧。喜欢。,你还好么好
290,这部剧是在家乡武义拍的[应援][应援]特来打个卡看看咋样咋样听说美食都是家乡的美食[捂脸笑][捂脸笑],待小生娶得佳人
291,暂时没剧想看了，又回来了 反反复复看了好几次这个剧和点燃我 温暖你这两部剧了[捂脸笑][捂脸笑],AJ臧十八
292,这是请了多少托刷的好评和弹幕？？？,明政天下
293,很少有這麼好看的電視劇了，而且男女主的演技也槓槓的[色][应援]，期待有二次合作,xb宝儿
294,看抖音推荐来看这部剧的，确实很好看，演员的演技很好，一晚上看了五集写下这个评论，演技好的演员迟早会被人看见的，男女主角演技在线，希望他们能遇到更好的剧本[微笑][爱心],大宋_qq1502
295,#司清景琛双向奔赴超好嗑#这部剧真的无敌爆炸超级好看啊啊来二刷了，希望能二搭[色][色],小N1016
296,N刷了[色][色][色]愿平行时空里的景先生和景太太一直幸福，愿我们都能找到属于自己的“景先生”,哈哈哈哈哈哈哈哈😊19
297,卢洋洋的演技充满了灵性和自信，真相到底是什么,少年如你
298,卢洋洋能够将角色的人性和情感呈现得非常复杂和多维，很吸引人，有时候还会被吓到,君焰w
299,"我雖然沒有被堅定選擇過，但我也不渴望我被人堅定選擇[捂脸笑]
因為會總是擔心被別人拋棄",cky_0827
300,卢洋洋能够引起观众共鸣和情感共振，导演和编剧都好棒,萌得挡不住_
301,火起来给我火,w小橘e o
302,#被坚定选择能多有安全感#羡慕的爱情，被人坚定的选择真的很开心有安全感让人觉得我的身后也有人护着我了,用户64693b44
303,"#司清景琛双向奔赴超好嗑#司清：如果连我都不帮他，他这条路该有多难走
景琛：璟园可以再建，但是这里不行，这里有着连我都不能给予的安全感
他们都懂对方的""不说""，有着自己为之的坚守",تفضيل
304,"以往对婚姻的恐惧、疑惑甚至批判
在看完这部剧之后
都产生了强烈的动摇甚至重建

从来都相信爱情，原来也可以相信婚姻
爱人，亲人，好友，
大家都在一起，真的好幸福
生活有了重心，有了方向，有了归途",一湘末希
305,这么好的剧，就应该推给身边人看看，此剧不火天理难容,孤独雨儿🍁
306,"挺不错的,挺有人间烟火气,比较治愈",月落歌未落
307,非常喜欢的一部剧，女主演的很自然，很现实，很打动人，非常爱，刷了好几遍，百看不厌,麦兜儿⭐
308,#司清景琛双向奔赴超好嗑#喜欢景琛和司清的相处方式，互相鼓励，给予最大的支持[应援],星光灿烂ing
309,#卢洋洋打工人不像演的#卢洋洋所饰演的司清真的和普通人一样，只是在追求每个人都会想要的房子车子，还有自己的家庭，为了这些一直在拼命，付出了非常多努力,^大红袍不是绿茶
310,女主竟然是我看的一部电竞剧里面的 女配！！！ 陪你到世界之巅  跟王一博演初恋 当时平刘海没认出来  真好看 在这剧里面的发型,小熊书包
311,"万灯照万家，一灯照一隅
梅子熟了，乍知春去，始觉情深
万家灯火前，我终于亲吻到了我的人间
愿我们都能在鸡零狗碎的日子里，拥有自己的人间烟火。最食人间烟火色真的超级好看的，没看够啊[大哭]大家快去看看吧",wjdbhzv
312,"最幸运的事情应该是在恰好的时光里,遇见了恰好喜欢的人",星星很闪亮哦
313,#被坚定选择能多有安全感#对于原生家庭不是很好的人来说 被坚定选择真的巨有安全感 他会永远相信你 你就不用担心 依赖他就行,醉死i
314,#被坚定选择能多有安全感#我也好想要有人被人坚定的选择，有人能被爱着是真的会很幸福,愿与余烬曦
315,#卢洋洋打工人不像演的#司清确实很真实啊 在这个忙碌的时间里，为了自己的生活不断的去拼命，买车买房，所以她想要有一个完整的家真的好拼命,愿与余烬曦
316,上来看到两个人依偎在一起，有一种岁月静好的感觉,回家查查吧
317,剧情不拖沓，内容新颖，导演很大胆创新，看得出很用心拍摄，真的看过这么多电视剧这个是最爱的真的真的强烈推荐[大拇指][大拇指],时间与深海
318,#被坚定选择能多有安全感#被坚定的选择真的好好！他们完全就是双向选择啊，互相救赎啊！真的太好磕了！希望二塔真的绝绝子,奶昔～依雪
319,这部剧很治愈，很温馨是我在这最近几年里唯一看过的一部让我流连忘返的一部剧，很喜欢，希望还有下一季，看剧是我的爱好。,爱笑的天使1989
320,二搭求求了[爱心],易小蔚
321,真的很喜欢[色][色][色],易小蔚
322,#司清景琛双向奔赴超好嗑#梅子熟了,20岁进养老院
323,[爱心][爱心][爱心][爱心]我爱男主[666],陈菁雅
324,还没开始看，不过它是会员看全集就要给它一亿个赞[大拇指][应援][爱心][色],奶一口可爱饼～
325,请加字幕,加加＋✌
326,"“司清 男人的占有欲我也有 甚至远比你所以为的还要阴暗。”
",久伴我者入我心uu
327,冬天从你这里抢走的 春天都会还给你。现在 春天来了 来的不只是春天。🍃,久伴我者入我心uu
328,"愿我们都能在鸡零狗碎的日子里
拥有自己的人间烟火",哦天啊bro
329,我一下子全部都看完了，洋洋美女最棒了，我已经开始期待你的下一部新剧了，希望你们二位能够二搭三搭🙏我还没有看够呢？希望你们下次拍戏的时候集数拍得长一点，谢谢了[大拇指],我的地盘听我的
330,#被坚定选择能多有安全感#司清感受到了爱，坚定的选择了景琛，景琛也坚定的选择了司清，看到这样真挚纯洁的爱，总是会心神神往，看到他们之间因为种种原因出现了各种误会，真的好为他们着急，但好在他们都已经被对方坚定的选择了[爱心],草莓味鲷鱼烧
331,不管每天工作到多晚你都知道有一个人在家里等你，生活中如果能有这样的伴侣陪在身边，每天都会是岁月静好。,龙520π
332,#被坚定选择能多有安全感#坚定的被选择应该是莫大的快乐吧，男女主相互救赎，太美了！！,花会一直开e
333,卢洋洋真漂亮，很有气质，每一部剧都是气质担当，我又来追你啦,看什么呢小朋友
334,男主有点像那个，陈冠森，这可能就是他年轻的样子吧！[捂脸笑],"小丑,笑了"
335,#司清景琛双向奔赴超好嗑#当然向往这种爱情啦，母胎单身一个，希望遇到一个喜欢我的我也喜欢他的人。,abc姬
336,#被坚定选择能多有安全感#被人坚定的选择是多么幸福的一件事，虽然原生家庭带给司清很多伤害！幸好她还有景琛,汝簌
337,被坚定选择真的很幸福，无论发生什么，都会陪伴在你身边，真正的灵魂伴侣[爱心][爱心][爱心],咪咪壁
338,卢洋洋完全长在我的审美点上，有颜又有才，她的演技自然真实，代入感绝了[爱心][爱心][爱心],咪咪壁
339,#被坚定选择能多有安全感#被坚定的选择真的好好！他们完全就是双向选择啊，太好磕了啊啊啊啊啊,橙子爱犯困
340,不吵的剧，回到景园就安安静静，岁月静好，羡慕景园的生活，疲惫工作后的一隅,Carpenter♞
341,我渴望能见你一面，但请你记得，我不会开口见你。这不是因为我骄傲，你知道我在你面前毫无骄傲可言，而是因为，唯有你也想见我的时候，我们见面才有意义[应援],超爱Hanna的Oreo
342,真的好喜欢这种一次性更新的的电视剧很过瘾爽快,甜莹莹.🥰
343,太好看了，看了一天，现在零晨1点，23集都被我看完了，卢洋洋的剧，看完你有相信爱情和友情，亲情了，没有狗血，只有甜，甜的不落俗套，完美，追剧不后悔，快去吧[应援][应援][应援][应援],清亲清仔
344,#司清景琛双向奔赴超好嗑#整部剧都超好看 男女主演技杠杠的嘿嘿嘿 嗯嘛嘛是我不常看的先婚后爱但是这部剧好上头[色][色][色]真的爱嘞 他俩CP好好磕郎才女貌[应援],岁七魚
345,太喜欢一次性更完的剧了，况且这个我期待很久了，男女主都好好看啊[色][色][色][色],ζั͡ޓއއއ昔g年
346,好看好看好看好看[色],xghhjjd
347,哇哦哦，一次性就可以看全集的剧谁不爱啊，麻烦电视剧都这么卷起来好嘛[应援][应援][应援],@59一枚
348,#卢洋洋打工人不像演的#卢洋洋一直在磨炼演技锻炼自己角色什么样就把自己融入什么样的角色里面,吃不胖⸜₍๑•⌔•๑ ₎⸝
349,#卢洋洋打工人不像演的#卢洋洋勇于挑战新角色，演技细腻带给观众更多面，卢洋洋饰演干练职场人 ，都市心酸史迎来意外情缘。,左耳右东😃
350,你俩给我火！,茱比亚
351,真的好好看，我来二刷啦[应援],kiki祺1121
352,真的好喜欢这部电视剧啊[应援],matildaね
353,哪里拍的外景？喜欢老房子[色],Sissi RY
354,期待更多人看到这部剧，真的好看[应援],你还好么好
355,需要互相关注，谢谢你们，动动你们发财的小手，再次谢谢！,闪电⚡⚡⚡🤞
356,挺好看的。重新二刷。景琛来喽[666][大拇指][色][色][色],木子3.1415926
357,[应援][应援][应援][应援][应援]举大旗，好看，不矫情不做作，接地气，灰常好,～遇見妳々🌈
358,感觉开头起步太高了  结局不怎么样,AnnaAshleyMichael
359,太喜欢这样的了。。一定要看到最后。。。后面的更精彩。。。[大拇指][大拇指][大拇指],玲🍓 玲
360,超喜欢超喜欢！就是剧集太少啦呜呜呜呜呜呜呜怎么这么少,蔡铭沛
361,最喜欢的当然是我们“事后清琛”景琛和司清了[色],冰糖葫芦Y
362,女主不仅人长得好看，而且脾气还好,二时黎夏
363,她很有主角相，不像某些演员一看就是丫鬟女n号[捂脸笑]但是偏偏跟主角帅哥搭戏,心心草莓🎡
364,不冷吗都下雪了还穿那么少,诺宝3698
365,三追了[捂脸笑]一个星期呀，可还行,泡芙宝宝🍓
366,良心好剧，好看，很多场景都好美[大拇指],巧巧的三十六计
367,一群弟弟,小小谋爷
368,男女主的配音为什么不在一个频道？主要是男主配音，听起来很奇怪。,青霄Zoe
