,0,1
596,卢洋洋也算是很有实力的一个演员了吧，很用心的在拍,栎森其
597,卢洋洋能够通过微妙的表情和动作展现出角色的情感起伏，情节上设计合理,此昵称不存在21
598,陈鑫海的电视剧又给了人一个惊喜，细节要素众多，希望能继续保持,相見不如懷念vd
599,卢洋洋的表演让人感到非常有趣和新鲜，演员演技都很好,你是我穷极一生的梦魇
600,演技放心制作放心真心高品质好剧，镜头都是电影级的,ㄡ冇誰會吢疼涐_w
601,陈鑫海台词功底飞一般进步，剧情和质感完全上等,北港不秀
602,剧情太精彩了！陈鑫海太帅了，剧中人物以及剧情走向都是很好的,勋你一鹿奶茶香ew2
603,卢洋洋能够将角色的情感和内心状态表现得非常深刻和细腻，拍的挺好的呀,西瓜头好看
604,卢洋洋是当之无愧的一位演技派女演员，镜头语言牛皮,鉴标师
605,陈鑫海眼神里还能闪耀着初入职场立志大干一场的兴奋，真了不起，导演叙事牛！镜头剪辑牛！,请叫我痴情先生
606,陈鑫海的电视剧又给了人一个惊喜，人物的眼神、角色的设定等都很巧妙,狮吻鹿
607,陈鑫海电视剧提升了不少。，导演和编剧还是非常用心的,基劳成疾
608,陈鑫海电视剧真挺好的，反正就是好好看！看他就完事，看着真不错,安塔利亚w2
609,卢洋洋能够将角色的情感和内心状态表现得非常深刻和细腻，期待后续,空空姬w2
610,Get到了陈鑫海的颜值和电视剧，会讲故事，导演组会拍,希洛梦w
611,卢洋洋能够将角色的痛苦和欢乐传递给观众，太刺激了,井里的呆萌少年
612,每一个细节都能够完美地表现角色的情感状态，主演神仙阵容加持,十秒萌定你23_
613,二刷，期待男女主二搭，感觉剧集太短了，意犹未尽！,一陌纤尘
614,卢洋洋的角色让人感到非常自然和真实，导演镜头精准，没有废话,智商都来卖萌了_
615,#司清景琛双向奔赴超好嗑#双向奔赴真的很治愈，真的好喜欢这剧的氛围感！！其待司清景琛[应援][呲牙],(^^)ʘ‿ʘ
616,卢洋洋的表演充满了人文关怀和情感体验，非常写实,一生所爱赫萝v
617,卢洋洋的表演充满了人文关怀和情感体验，制作太用心了,希羽岚梦_
618,陈鑫海这次真的很不错！电视剧和颜值都有get到，剧情紧凑，演员台词都很棒,上杉夏香23
619,卢洋洋呈现出独特的魅力和个性，导演和编剧还是非常用心的,我在你的怀里吃炸鸡
620,卢洋洋的角色让人感到非常自然和真实，超出预期~,打小我就淘w3w
621,陈鑫海太帅了，追电视剧，开头高能，全员演技在线,风璃殇_
622,卢洋洋的演技让人感到非常深刻和独特，气氛紧张兮兮的,江户川柯北233
623,节奏紧凑不错喜欢，剧中美术、服化道、摄影、视效方面也挺好,冰雪殇璃陌梦233
624,卢洋洋对角色和剧情的深入理解和把握，情节张紧有度,羽灵233
625,这部剧已经完成得很好了，导演镜头精准，没有废话,心如海深藏少年
626,陈鑫海电视剧一直不错，主要也是长得帅，我是挺喜欢的，镜头都是电影级的,虎了吧唧_w
627,卢洋洋能够把握好角色的情感走向和节奏，画面高级,可爱型号_
628,卢洋洋的表演让人觉得非常舒服和自然，质感属实是做旧了,巴拉拉能量作业消失_232
629,卢洋洋的演技让人看得非常过瘾，全员演技在线！看着太舒服了,枸杞红枣水_
630,陈鑫海太帅了 演的真好，很吸引人，有时候还会被吓到,背叛太乱
631,陈鑫海的表现让人惊喜，十分优秀的塑造出了编剧构建的人物形象，取景也很美,心跳造反_
632,卢洋洋令观众产生强烈的共鸣和情感共振，很有诚意！,羞恥出沒_
633,陈鑫海电视剧台词都有很大提升，服化道滤镜还不错,梅干菜煮汤_
634,陈鑫海电视剧真挺好的，反正就是好好看！看他就完事，强烈推荐,蘑菇不是花_
635,卢洋洋能够深刻地理解和刻画角色的内心世界，阵容很强,oser的生活方式
636,近几年看过最舒适的电视剧，没有植入广告这一点就很清爽！,很淡很淡-.-
637,卢洋洋能够通过自己的表演将角色的历程和成长展现得非常淋漓尽致，是好看的没错,简译的
638,剧情太精彩了！陈鑫海太帅了，镜头语言非常的电影化,懊恼王子_w_
639,这部电视剧一定很好看,小星星点灯🍧
640,#司清景琛双向奔赴超好嗑#缘分是两个人的事 只有你情我愿 你欢我爱才是有缘有分 。有些人即使见了一眼，却在对方心里待了一辈子 。没有爱情的花朵 无法到花开到极致 任你用怎样的热情去 浇灌，最终还是会枯萎 ,爱新觉罗·斩荒
641,好喜欢啊！双向奔赴的 先婚后爱！真的好喜欢这部剧 里面的文案也很有才[应援],情有独钟79
642,三刷开始[应援],清醒1908
643,#被坚定选择能多有安全感#因为被坚定的选择，拥有了勇往直前的勇气，有了牵挂，拥有了安全感，司清选择了景琛，景琛选择了司清，两个人互相治愈，给对方安全感。被坚定选择真的会很有安全感。[色][色][色],付慧敏
644,冥冥之中早已注定，只有景琛可以给司清一个可以牵挂的家，也只有司清可以治愈景琛内心小小的黑暗，他们注定就该在一起，司清是景琛的人间烟火，景琛是司清的理想主义，仅代表我自己祝愿平行时空的景先生景太太永远幸福。,意气自如的萨蒂亚吉特巴克纳
645,也许是一碗甜酒鸡蛋，也许是误会的礼物，让司清在这个委屈的生日里感受到了一丝的温暖,意气自如的萨蒂亚吉特巴克纳
646,真的很好看 看完大结局了 还是觉得男主的台词太棒了[应援],兮木0
647,剧情线有点乱  但是剧情真的很好  两天追完  追完还走不出剧里的意境很真实,川儿睡不着
648,真的好好看，太治愈了，已经推荐好多朋友看了！希望能二搭呀[愉快][愉快][愉快],181****0811_m1416
649,奔着治愈性小剧来看的，看完后有着一种共鸣，可能是与主角相似的原生家庭遗憾感吧，或许我缺失的家会在自己珍惜的未来慢慢拥有它，有烟火色的地方便是家,谁家迷妹丢了
650,我还以为是陈冠霖，结果不是就算了，这是一生一世里面那个二哥吗，就害死妹妹的那个,★·°瀡鍝亻而荌;︶︵︶
651,长大后你会发现，所谓的岁月静好，不过是家中那碗热汤和始终为你亮着的那盏灯，这句话戳中人心！#被坚定选择能多有安全感#,阿宋🐚🐬🌅
652,梅子熟了,你好宇儿
653,不是，第一集第一幕就很有夫妻相怎么回事！！无关剧情，就看面相🤤,你看个毛🌷
654,最最暖心的剧，太久太久没有这种一定要推荐给别人看的剧了。太棒了[应援],小鬼妞的蓝色精灵
655,"一屋二人
三餐四季
便是他偏爱的人间
这个剧真的好好看，强推[应援][应援][应援]",不凡乐趣
656,"
梅子熟了，乍知春去，始觉情深。愿我们都能在鸡零狗碎的日子里，应有自己的人间烟火。",甄海君
657,二刷！忘不掉,也许爱你无期
658,[应援][应援][应援][应援]第一次看剧打call，真的很喜欢这种类型的电视，这院子真的是好爱(⑉°з°)-♡,Anna_晶晶
659,冬天还穿这么少，真是美丽动人,花间🔥小路🍓
660,#被坚定选择能多有安全感#被坚定的选择，背后就像有了依靠，这样可以发泄情绪，有人挺你，内心也会十分开心，坚定多有安全感啊,小橘的橘☺
661,第二部啊啊啊[爱心][爱心][爱心],再靠近一点点❤
662,很温暖治愈的一部剧 男女主永远双向奔赴彼此治愈,张文炜_qq1929
663,#被坚定选择能多有安全感#司清其实非常非常幸运，有景琛、有璟园、有璟园的小伙伴，虽然父母给的关爱不多，但是司清很好，有大家的宠爱，有猫有狗，还有自己的小家，司清身后有景琛保护，景琛给司清满满的的安全感,一只追剧的裤兜.
664,#被坚定选择能多有安全感#谨代表全世界祝司女士永远幸福快乐。司清其实非常非常幸运，有景琛、有璟园、有璟园的小伙伴，虽然父母给的关爱不多，但是司清很好，有大家的宠爱，有猫有狗，还有自己的小家,一只追剧的裤兜.
665,#司清景琛双向奔赴超好嗑#手艺+这个景色，农村的乡景，景色很美，景琛在璟园做手艺，等司清回家，做好吃的等她回家，然后养猫养狗，双向奔赴[应援][应援][应援],一只追剧的裤兜.
666,#卢洋洋打工人不像演的#打工人很真实呀，我们现在打工也是这个样子，为钱而折腰，没有办法任性，朝九晚五的工作,一只追剧的裤兜.
667,#被坚定选择能多有安全感#被坚定选择是幸运的呀 不是谁都可以被坚定选择的 真的会安全感满满[害羞],粥米🍂
668,#被坚定选择能多有安全感#每个人都想被坚定的选择 司清和景琛做到  他们深爱着彼此,六六想看海
669,男女主人公从相识相知到相爱[爱心]先婚后爱[应援]慢慢的从一个眼神一个举动就能明白对方[大拇指]为了美好的明天而不懈的努力[奋斗]最食人间烟火色[微笑]最简单最平凡的生活有一个相爱的人一起到老是最幸福的事了[大拇指]最后如愿以偿的得到满意的结果[微笑]此剧值得一看[大拇指],溪水清又清
670,看了第三变[应援] 谨代表全世界祝司女士永远幸福快乐、祝卢洋洋女士平安喜乐一路生花。,姣姣522
671,热度怎么回事啊，怎么还往下降了，这么好的剧不火天理难容,大红袍 不是绿茶
672,来二刷了，根本不够看！！好喜欢这样的角色，好治愈，立意真好！,顾1985759
673,[色][色][色]真的很爱这剧，很温馨，看完怅然若失，有对于我这种理想主义来说有人在坚持，也有现实的追求，和好朋友一起[应援],山间无风
674,第一天上线就看完了，这剧本写得很好，女主角演得很不错，就是男主角有点不来电。,匿名用户
675,立意真的很好，拍摄的很美，不脱离现实生活，浓浓的烟火气,喜欢吃麻辣香锅de东方惠美
676,"姐妹们有没有类似的剧了
看完念念不忘，就是有传播中国风景，文化和非遗文化的剧
女主卢洋洋和何与的看过。
提前谢谢姐妹们",扶摇小迷妹
677,#司清景琛双向奔赴超好嗑#好看，这就是我们的现实生活呀！双向奔赴的爱情永远令人心动💗,1485@AL
678,真的超喜欢这种治愈型的，很戳我心，好久没遇到这样的了，给了上学压力大的高中生假期一些温暖吧[色][色][色][色],福尔小斯……
679,弃剧前说一句～知道人间烟火招人气是个好事但。你们没拍出来,溶龢
680,男女主角都板着脸让我这个在压力下挣扎的人果断弃剧,溶龢
681,这部剧是我看过最接现实的剧，没有一直的美好，也会有不顺利的时候。只要他还爱着她，就一直美好。[呲牙],黎夕Lily
682,就是觉得女主长的很精明，不太好接近的样子，只是从外表论,健康平安洒脱
683,#司清景琛双向奔赴超好嗑#他们这种爱情是我喜欢的，我的天呐，他俩真的好甜，真的羡慕了[色],笑生075
684,一刷结束，洋洋和小海演的太好了，双向奔赴，双向救赎，看完真的很想结婚！,衬衣别在裤衩里
685,两位演员都要大火啊,半夏萧萧
686,剧情合理，演员养眼，金句多多，弘扬中华传统文化，支持非遗[应援],听禧
687,人生海海，跌跌撞撞。在妥协，在失去，在长大。才懂得……离别是人生常态，谁也不例外。,喜欢吃面条的诸葛平莹
688,明明之中她们会再次相遇，不管六年前还是今天她们都是双向的,小菜花6🌸
689,我觉得这个大婶很有心机 签的合同绝对知情 可能和她老公一起骗贷款的,莔536
690,#被坚定选择能多有安全感#大概就是你永远不用担心周围有什么危险，他会替你解决一切,魏羽晗我是你大嫂
691,#司清景琛双向奔赴超好嗑#司清景琛双向奔赴超好嗑导演真不错，演员辛苦了[大拇指],八年六班林毅杰40
692,今年唯一第一部不快进不开倍速观看的剧！！！景琛真的好绝[色][色]好喜欢温柔的男主[应援][应援][应援],匿名用户
693,都多久没冲过爱奇艺会员了，为了这个剧特意冲了会员，这剧不火天理难容，希望出第二部，最近上头就刷这个剧了，最近那些狗血烂剧真没法看，快出第二部，希望资本方能看到用户需求,孤独雨儿🍁
694,这部剧不论从演员演技还是剧情细节上，导演简直太用心了，真比那些狗血烂剧好太多了，求求导演出第二部吧,孤独雨儿🍁
695,"[色][色][色]支持卢洋洋姐姐的新剧，好看到爆[爱心]
男主也好奶啊，整部剧三观很正[亲亲][亲亲]爱了爱了，已经追完正在二刷了，一天通宵看完的，看完心里空荡荡的[流泪]",.Mirai
696,二搭二搭,妮妮close
697,巨巨好看，空境很美，三观超正，男女主双向奔赴，互相救赎[应援][应援][应援],玖狰果汁👏
698,#司清景琛双向奔赴超好嗑#哥们真的第一次见这么清醒的爱情观，司清景琛给我锁死[应援],梓卿lucky
699,好温暖治愈的剧！！景琛简直是我的理想型啊啊啊啊导演快安排第二部！！！！大爱司清景琛,我要两个酱猪蹄
700,#被坚定选择能多有安全感#双向奔赴真的很好磕诶！[色]你以为的是一见钟情，但是其实往往是命中注定。司清&景琛，就是双向奔赴且双向选择。,依旧  安然无恙
701,#司清景琛双向奔赴超好嗑#一屋两人三餐四季，司清和景琛一样孤独，但她们的爱情很让我羡慕，她们是命中注定的，平平淡淡也是很大的幸福。希望每个女孩始终要相信:总有人，山高路远为你而来。祝愿我们都能幸福!,依旧  安然无恙
702,太喜欢这种播放方式了，喜欢看的，自己开会员，不用天天等，一口气刷完，啊啊啊啊，太爱了，主要剧太好看了！,明月依旧🐾
703,看完真的很失落，因为太过美好了，美好到告诉我们，除了过好当下，更多的就不能奢望了，因为现实太难遇到了，难到几乎为零,Brave@ANM
704,好喜欢！难得不倍速不尴尬的剧，女主男主颜值巨高而且格局很大！只能说是科幻片了哈哈，好上头！,酷爱科幻片（）
705,都给我去看，谁还不看啊，真的好好看，演技，剧情，人设，男女主颜值都在线，这么好看的剧，谁还不看啊[应援][应援][应援][应援][应援][应援],奕奕奕奕奕海海海
706,这电视剧 我咋感觉不好看呢  剧情这么慢  好评哪儿来的？,😘秀~秀😘
707,虽然有毒点，但男女主先婚后爱，慢慢了解，真的好看,倾一城烟雨🍧
708,#被坚定选择能多有安全感#想到了仲天骏和欧雅若，认识到你的不完美不会因此不爱你而是更要好好保护你​。,今天别在熬夜了
709,好看好看[应援],小鞠kiku♡
710,#司清景琛双向奔赴超好嗑#人间烟火，超级好看，剧情，氛围，色调，画质，立意，拍摄手法，都是一整个大爱住，一定要看啊，在此催更第二季[应援][应援][应援],WXY❄️
711,好看好看，给我二搭[应援][应援]，愿我们都能在鸡零狗碎的日子里拥有自己的人间烟火,相伴小鞠
712,#被坚定选择能多有安全感#愿我们都能在鸡零狗碎的日子里拥有自己的人间烟火,相伴小鞠
713,真的很治愈，双向奔赴的清琛，没有那些狗血的剧情，好温柔好治愈，你是我的人间烟火[玫瑰花][玫瑰花][玫瑰花][玫瑰花][玫瑰花][玫瑰花],苏思贝耳
714,即使曾经是双向奔赴的感情，也抵不过岁月的变迁，再美的风景也逃不过四季更迭，但双向奔赴很美好[应援][应援],佚zuru
715,真实不是什么都是男女主想的那样,aqy澜
716,第一集就求婚，好好，命中注定的，无论在哪里都会在一起的,愉快的临暗
717,我刚开始以为它是古装剧,ʚ白茶与风.ɞ꧔ꦿ🐾
718,专门冲了个会员来看，抖音上刷到的被男女主的颜值惊艳到,在欢声笑语中度过
719,我已经开始三刷了 认认真真看的 不加倍速超级好看 决对不入坑[色][色][色][色],keyide丶
720,"#司清景琛双向奔赴超好嗑#
""谁会不爱那个长的帅、会做饭、带着金丝眼睛、田园系男主占有欲极强的景琛呢?""
",风月过半
721,演员演技很好，挺好看的,时光゛乱了流年老了少年
722,#被坚定选择能多有安全感#愿我们都能在鸡零狗碎的日子里，遇到属于自己的人间烟火[呲牙],爱吃泡面の赫连痴柏
723,這個劇值得一看，感動人的地方很多，讓人產生共鳴的點很多，本劇不全是情情愛愛，有很多的點升華了整部劇，看到傳統手藝人想起了百鳥朝鳳那部劇，還有字幕文案特別暖。,小姐姐乖🎂
724,烟火色破7000努努力 这么好看的剧不能被埋没了[色][色][色][色][色][色][色] 评论加加油[应援][应援],keyide丶
725,愿我们都能在鸡零狗碎的日子里总有自己的人间烟火,成毅傅诗淇的果子哈哈哈哈哈哈哈哈
726,真的，这个男主不就是在包庇老赖吗？还在那个假惺惺的说什么“你们之间的纠纷不要扯上我”，那你在那里搞什么乱，本来以为女主想看的，结果，就这，算了。不看了[捂脸笑],想忘……却总是记起
727,已看完，真心不错！男女主演技在线，可以多出些这样的好剧,U&M旅行的意义
728,#司清景琛双向奔赴超好嗑#已经要三刷了，看一遍被治愈一次，真的好爱男主这种慢节奏的生活方式,布拉克的夜_qq1909
729,谁懂？我真的很喜欢这种表面很冷，内里很温柔可爱的男主[色],特特伦舒
730,很久没有看到这种演员剧情都很棒的剧，没有以往剧的套路，很真实，为卢洋洋来看的被男主吸粉了，男主带金丝眼镜简直绝了。安利一下卢洋洋的演技，哭戏感染力特别强。以后继续给我们带来更好的作品吧！祝他俩一起走花路，大红大紫！,赵BOSS的小娇妻Lisa
731,看了后，有种不想看别的剧了[捂脸笑]剧情很温馨，看似平淡，却充满了感动[应援],/aiq世界哪有真情在
732,后劲太足、过不去、放不下这部剧，网剧就按这个标准来吧,匿名用户
733,#被坚定选择能多有安全感#被坚定的选择，独一的偏爱，谁不想要啊，可是真的很难,惜汐_qq1588
734,现在看剧我只喜欢看古装剧，都不怎么看现代剧了，以为对现代剧寡淡了，直到看了这部剧才知道不是我不喜欢看现代剧了，而是我喜欢看这样的现代剧，喜欢这种剧情不拖沓的剧，喜欢这种没有勾心斗角的剧，喜欢这种忙碌了一天之后能让我放松心情的剧。[色][色][色],钮钴禄兔🤞
735,#卢洋洋打工人不像演的#一气之下做出一直很纠结的事又败于现实急于挽回是我没错了[捂脸笑],心头血糖
736,"就喜欢这种有故事感的甜剧，看着不会腻！！！
期待男女主二搭，陈鑫海原声太适合演小奶狗啦，期待卢洋洋本色出演唱跳全能角色。期待洋洋唱歌跳舞哦",L小洋籽
737,愿我们都能在鸡零狗碎的日子里，拥有自己的人间烟火[爱心],爱做梦的嘟嘟哇
738,#卢洋洋打工人不像演的#的确演的很真实 朝九晚五 可能这就是一位好演员该具备的吧 把戏演活 女主这张脸好有辨识度，很亲切，很贴近生活的长相，但又不普通，被圈粉了。,张昕懿的小宝贝
739,#司清景琛双向奔赴超好嗑#双面奔赴真的好喜欢 我心目中的理想爱情 这剧真的好有氛围感 女美男俊 人设也设在了我的点上 真的太好磕了 好喜欢 这种一次性更完的氛围感剧给我来一打[色],张昕懿的小宝贝
740,#被坚定选择能多有安全感#能被坚定的选择，当然是安全感满满啦，希望所有人都能被坚定选择,橘如~
741,#司清景琛双向奔赴超好嗑#谨代表全世界祝景先生和景太太幸福美满，平安喜乐[爱心],橘如~
742,愿我们都能在鸡零狗碎的日子里拥有自己的人间烟火,谷一🎧
743,我觉得女主演技很自然啊特别是各种细微表情我觉得都很到位[哭惹R][哭惹R][哭惹R]夸一下男女主的哭戏是真的好[偷笑R],cxkkun呀
744,男主是不是演过二十不惑？第二部喜欢段家里的那个小男孩,💕陈ᶫᵒᵛᵉ
745,愿大家都能在鸡零狗碎的日子里，拥有自己的人间烟火[应援],析木❄️
746,#被坚定选择能多有安全感#因为司清很喜欢很喜欢景琛，所以哪怕误会他对云篇旧情难忘，误以为他曾为爱割腕，她也愿意去开解他，甚至换一种方式去标记那道疤。,延乔集贤
747,剧情发展紧凑，男女主演技好，后面升华，宣传传统手工艺人的坚持，以及发展[大拇指][大拇指][大拇指][大拇指],好好减肥IK
748,#被坚定选择能多有安全感#司清和景琛双向治愈，双向奔赴的爱情太好磕了吧，我为事后清琛打call[爱心][爱心][爱心],lock☞lucky
749,看完了 超级好看 而且很现实 很有教育意义  期待二搭 ,桃子独美
750,这是今年我看过的 除归路以外最治愈最好看的剧 这就是大多数人要面对的现实 自己拼命努力来的还要被别人指指点点  也很有教育意义  大火  [666][666][666],桃子独美
751,#司清景琛双向奔赴超好嗑#就喜欢这种双向奔赴的爱情 好幸福 恐婚人瞬间不恐婚咯,醉死i
752,一个人能被另外一个人坚定选择，是你的底气，更是幸福的来源,花千骨89654
753,第六遍了,&prime;轮回转世
754,好喜欢这种江南生活，哇哇哇，最爱的就是三朋好友在一起,🙃🙃🙃haha🎪
755,就喜欢这种纯甜无虐的剧，本来生活就够苦了，何必还看苦情剧来为难自己。甜甜的，在线发糖，感觉坏人（肖总）也不是很坏，还带点搞笑。颜值在线，剧情丰富，挺好看的，符合胃口,匿名用户
756,女主一个那么厉害的银行工作人员（这是她的设定），结果被劣质伎俩碰瓷得哑口无言？？？男主一开始也好无礼，好像别人欠她几百万一样，然后女主还一直贴上去。。。。。。,李葡萄吃西瓜
757,银行职员好卑微哦,超爱吃龙虾の子书寄波
758,#司清景琛双向奔赴超好嗑#愿我们都能在鸡零狗碎的日子里，拥有自己的人间烟火,小燕子12101
759,双向奔赴谁能不爱呢[色]但是每个人遇到双向奔赴的概率或许很高也或许很低，但是总会遇到,鸡汤再好终要被我喝掉
760,姐妹们，我在抖音看了个片段，这个剧是不是有个小病娇啊[色][呲牙],尹夏
761,超级好看，希望以后，一整个爱住了，给你两条选择啊，二搭或者出第二季[色][爱心],＆亚飞＆♥
762,真的好久没看到这么温柔的男主了，好喜欢他！女主也好可爱！全员无恶人，好好看！一天刷完！[爱心][爱心][爱心][爱心][爱心][爱心],长颈鹿1💯
763,"超赞[应援][应援][应援]没想到甜甜的剧画面还这么美[色][色][色]风景太美啦[666][666][666]还有偶尔的配的文字是那么识人间烟火[应援][应援][应援]反正我是爱了
值得推荐",莋茧洎缚と後
764,在喧闹的时代里寻求一恬静之处，在追逐名利的生活中看看这烟火气,vivian章章
765,好喜欢这句话，长大后你会发现，所谓的岁月静好，不过是家中那碗热汤和始终为你亮着的那盏灯,童年记忆深刻😝
766,愿我们都能在鸡零狗碎的日子里，找到属于自己的人间烟火气。,爱画画的琦琦222222
767,来看洋姐了！！！司清天选打工人，哈哈哈哈哈笑死了，支持卢洋洋新剧,小宝大宝16
768,#被坚定选择能多有安全感#司清是被坚定选择的那个人 景琛也很宠[色] 超有安全感的 还是得说一下女主好美男主好帅啊啊啊,susu～啊
769,主角演的很好，剧情真的很贴近现实生活，希望更多的人发现这部剧，太值得了，导演拍出这么好看的剧[大拇指][大拇指][大拇指][大拇指],450353033
770,好喜欢卢洋洋，演技在线，颜值也在线，让人很有共鸣，很真实,万事有始有终加油
771,这剧看得我三观都没了，看到女主同情老赖就于是弃剧,lyllylylyly
772,[色][色][色]剧情紧凑不拖沓，不仅仅表现男女主之间的情感，更带有对于生活中的坚持和守护[大拇指][大拇指],愿耀文璀璨
773,不得不说里面的景色真的好漂亮呀，男主女主的颜值也好高呢，这一对特别的好磕呀,蓝色的柯里
774,就是说被坚定选择真的会让人觉得安全感爆棚！！,生而平凡^0^
775,导演好会拍啊，镜头下的景色很美金粉飞扬四目相对绝了,zxcvbnm/
776,#司清景琛双向奔赴超好嗑#好看呀，很意外的收获，偶然刷抖才知道这部剧，一口气看完简直不要太爽了,欧兰诺伊
777,上班人的假日慰藉，女主颜值好高，戳中我的审美点了[应援][应援],人什么时候可以不上班
778,真的好喜欢这个剧啊，海子哥，咱们就是说搞事业，现在事业有起色了，别听爸爸的回家相亲,虞头丸子
