,0,1
0,我是不是有毛病，我都4刷了……我好想看他们二搭 三搭 四搭……,★逍遥殇★
1,高考完了，终于可以追剧[应援],桐华🤞
2,和景琛四目相对的瞬间，司清的整个世界仿佛都安静了下来，那一刻的怦然心动有谁懂啊！！！80元门票换来的一见钟情超值的！,卢洋洋0219
3,刚看完长风渡，不知道看啥，随便找个看看,画芷xh
4,二刷完了剧荒了，谁给我推荐一下还有没有这么温暖的剧啊[捂脸笑],墨弦墨念
5,我觉得男主和周翊然好像   我都以为是周翊然,浪里格浪🥰
6,虽然她拿着手机对着我呆呆的样子很可爱，虽然她分不清大红袍和龙井，但我还是想说......把她手机摔坏那事我真不是故意的!,陈鑫海 Ocean
7,我平时只喜欢看悬疑片的，刚看完不完美受害人剧荒了，大家建议看吗这部剧？,哈哈，小尼子
8,"
“你是归路也是救赎，是一腔的热血与热爱，是撞了南墙也不愿回头的痴迷与喜欢”",星星很闪亮哦
9,为什么这么好看的剧没有热度[捂脸笑][捂脸笑]我不允许还有人不知道这部剧[色],那抹天真丶笑
10,#被坚定选择能多有安全感#被坚定的选择着，不会被抛弃，那么也就注定了，以后会有更加好的人，会一直陪伴着自己，司清景琛，就是这种相处方式,余音绕梁梁
11,问一下？好看吗？, 魅
12,看完了又有一种没看完的感觉，明明那么美好，但是心里有失落感,RT婷宝吖
13,我都不知道看了多少遍了，还没走出来，这部戏对我影响很大[捂脸笑][捂脸笑][捂脸笑],哈伦你看看
14,#司清景琛双向奔赴超好嗑#司清和景琛提出结婚其实是意外的，但其实也水到渠成了，毕竟两个人心里其实都是喜欢的，都在为了彼此努力，真的很好磕,余音绕梁梁
15,一看人名乱七八糟的，溜了,德云一哥于大爷
16,这个男女主真的很好看，而且百看不厌。我是看了无数遍还还看的，一部电视剧。再也找不到这么好看的电视剧了。,暮色伊人✌
17,我有点看不下去了，谁懂啊[大哭][大哭]才第一集，觉得这部剧氛围不是很好[流泪]土里土气的,SoeS_March.4
18,来了来了，一次性更新完真好[666],舞动的茶叶🍂
19,用一生爱你,橙子果冻DW
20,我到现在都还没走出来 已经3刷了 怎么办啊 有没有好看的剧推荐一下呀[捂脸笑],程八方呀
21,好喜欢男主这样的性格，很有气质，温文尔雅，而且也很全能，太温柔了,Double ling 哈哈哈
22,#卢洋洋打工人不像演的#卢洋洋，没房没车没存款，其实是一个典型的社会打工人的形象。为了能够有着自己的小窝而努力着，努力的工作，完美体现了打工人打工魂,狗🐶里狗🐶气
23,千万不能看这剧，看完觉得心空唠唠的,无边海滩
24,反复刷了好几次了，这个剧真的好用心，立意很好：人间烟火气治愈人心，保护非遗！而且在银行工作过的我，真的很能共情司清！景美人美，关键旁边文案写得好美，不是那种俗套的爱情剧，我喜欢，我支持！,上古一一
25,前面20集很好看，后面3集一般般建议不用看！！！,龙王GX
26,#卢洋洋打工人不像演的#卢洋洋所饰演的司清真的和普通人一样，只是在追求房子车子。为了一个小小的家而努力，需要去担心自己的工作没有做好,尘缘火火火火火
27,#被坚定选择能多有安全感#被坚定的选择着，不会被抛弃，那么也就注定了，以后会有更加好的人，会一直陪伴着自己，司清景琛，就是这种相处方式,小涵啦～
28,谁懂啊，我一个几乎不看第二次的人，已经在这里泡了一个半月啦。走不出来，根本走不出来,北港未睛🌸
29,作为一个多年追剧的资深观众，这部剧是我鲜少能够认认真真去看的剧，挺有深度。一开始就是当普通网剧打发打发时间的，没想到才看了几集就令我刮目相看，男女主都将人物诠释得特别好，当代社会的我们又何尝不是像女主那样的打工人呢？演技自然，感觉演员令角色从剧本里走了出来，剧情合理且吸引人，全程没有快进过一次，而且还没有那么多奇奇怪怪的虐点，希望两位演员能够在演艺道路上扶摇直上，平步青云！也希望更多人能够注意到他们[色][应援],不追剧我会S的
30,有谁和我一样为了卢洋洋而来？终于等到了。激动哇。等了好久了，终于等到了。就喜欢这种一次性更完的剧。不吊胃口。[大拇指],七宝茶
31,还有类似的好看的短剧吗[呲牙],简_qq3575
32,我是走了多大运，才能有幸看到一部这么好的剧！！！,安世年
33,最喜欢的角色是司清。她工作认真，敢爱敢恨，处处替别人着想。就算原生家庭给予不了她爱和安全感，她也会通过自己的努力去满足自己。她少女时的爱心也让她拥有一段良缘！她值得被爱！[爱心],超爱弹吉他de端木正祥
34,铁汁们好看吗？说句老实话？,許一世浮华
35,为什么我觉得不仅不好看，还…,安玖f
36,这么好的剧，必须安利，非物遗产是我们国家的国宝，但是保护力度还是不够，应该让更多人去了解,鯨＆雒
37,这部剧看了7遍了，别的剧拜托大家推荐下[应援][应援][应援],法国好吃vvv
38,#司清景琛双向奔赴超好嗑#真的是在双向奔赴啊！相互依偎在一起的时候，真的觉得岁月静好。司清，工作很累，但是也很努力，是在向着彼此努力,尘缘火火火火火
39,二搭什么时候啊啊啊啊啊啊,紧紧嘻嘻😍
40,谨代表全世界祝景琛先生和司清女士永远幸福,千夜云川
41,还有同类型的日常治愈系的剧推荐的吗[笑哭][笑哭][笑哭],B级De霜儿
42,#被坚定选择能多有安全感#男主太动心了，知道女二喜欢他用了些手段让女二失望，然后对女二讲 我知道你对我有好几层滤镜，我不介意亲手撕给你看。从来没见过哪个男主这么果断干净地撇开关系，疯狂心动！[色]男主视觉的暗恋成真，女主视角的先婚后爱，从不爱到死心塌地，他们给予了彼此最大的安全感和底气，真的好甜！[应援]两人都缺乏安全感，相互治愈，是彼此的救赎！[大哭],是咯于咯⛄
43,要耐心才可以看到乐趣，某些自然场景很漂亮，女主的服装也很好看，赞，可以多次看的剧。,猕猴桃你不要脸
44,只能说这种现实的剧真的很戳人，而且情绪稳定的对象谁不想要！,龙xxdragon
45,最少要30集，太短了没法看,老来俏曼曼
46,一更新就是全集，爱了爱了,小橘猫的阿柴
47,太极宗师,用户6d9eee2b
48,走不出去啦，怎么办，第一次这么惦记一部剧,北港未睛🌸
49,这部剧真的很有看点，很接近现实，像男主一个月的工资就很现实，毫不夸张；一句“梅子熟了”来表达对女主人公的思念，是一部很特别且值得回味的剧，挺喜欢，也经常推荐,💕•͡ω• 顽皮
50,这剧我看了三遍了，我一个男的都看上头了，正常吗哈，这剧情绝了，在看看现在的电视剧又是大碗大制作什么狗血仙侠剧，真不如这些小制作，不是什么大碗明星，确实真的用心，每一个镜头台词剧情，导演真的用心呀[大拇指],孤独雨儿🍁
51,对她印象还停留在绿茶那个角色，好漂亮，现在终于有新角色啦！。[色][666],派大星╯^╰
52,最喜欢景琛啦！这样品学兼优、淡泊名利、外型优越、尊重女性、厨艺超群的禁欲系男主谁不爱啊[色][色] 另外提一嘴，景琛真的让我有一种想结婚的冲动啊，但这样好的人上哪去找啊[捂脸笑],catherine😋😉🍰❄
53,熬夜追完来评价了，剧情很好不拖沓，男帅女美有演技，剧里的三观也很正，又有民族大义，美食也拍出了特色，这样的剧应该被更多人看到！,暖言（小六）
54,#被坚定选择能多有安全感#司清和景琛，就是坚定的选择彼此。被一个人坚定的选择着，不需要担心任何事情，可以永远相信自己的身后有一个后盾，安全感满满哦,彩虹の晴天💕💕💘
55,没有代餐，咋办？,爱健身de公广鸿祯
56,真的第一次这么希望一部剧的男女主二搭 求求了 二搭三搭快来,风间澈子_
57,男主角就是那个 那个叫什么来着[捂脸笑][捂脸笑]忘了,刘 娜娜😃😃😃😃😃😃😃😃😃😃😃😃😃
58,#卢洋洋打工人不像演的#作为演员的卢洋洋一直活跃在各个影视作品中，在不同角色中磨炼演技，从电视剧《我才不会被女孩子欺负呢》《追球》《陪你到世界之巅》《初恋了那么多年》到电影《在乎你》《他她他她》，诠释过双面反差，甜美动人，个性率真的多个角色，精准展现对不同人物性格的拿捏，出色的表现也让她圈粉无数。而此次首次挑战更具现实感的漂二代女青年，相信又将给观众呈现多一面精彩。,左耳右东😃
59,这真的超好看[应援][应援][应援],若离🔥⛄
60,强烈要求出第二季[应援][应援][应援]怎么会有人把网剧做的这么好看，画面那么唯美，故事情节又很贴实际，然后又具有正能量，有爱情也有爱情，有亲情也有亲情，有事业也有事业，把女性这个角色烘托的十分好，还夹杂着中华传统文化和非遗，很完美的给观众树立了一个正确的价值观，同样也烘托了当前社会的现状，非常现实的一个剧，结尾也很好，但就是缺了一场婚礼和后续，希望作者可以多更新，也可以继续翻拍这种好剧[应援][应援][应援][应援][应援][应援]，总之这个剧的，很多场景都可以当壁纸使用，希望出第二季！！！！！！！[色][色][色][色],酵母君4545
61,看这个视频的有叫李小静的吗,候一场烟雨
62,#司清景琛双向奔赴超好嗑#司清景琛两个人在为了适应彼此而努力，为了让对方接受自己而努力，逐渐的变得越来越接近，这种双向奔赴真的很舒服,彩虹の晴天💕💕💘
63,这穿着，下雪[捂脸笑][捂脸笑][捂脸笑],愉悦相处
64,男主女主颜值和身高挺般配的，故事剧情给人一种互相治愈和救赎非常感动。,亦木沭
65,我总是在想 你失去我会不会难过 会不会后悔 但是我现在明白 至始至终都只有我沉浸在爱里 是我自己不放过自己,爱小美🌹
66,#卢洋洋打工人不像演的#卢洋洋长得好看又耐看，演技也在线，我真的太爱了！,奔跑在孤傲的路上😚😚
67,哇，水月洞天的导演导的[应援][应援],媛心娃娃
68,熬过前三集就好了，但是为什么要熬呀？你不能第1集就做的有点逻辑吗？,宝延呀哈
69,我喜欢他们的配乐《假如爱有天意》，搭配场景好有感觉啊,慎言西子
70,"
“梅子熟时 乍知春去 始觉情深。”",久伴我者入我心uu
71,女主是真漂亮,名字难取，Ssd
72,什么时候出的,晚安啦亲爱的额减
73,第一次看，这部剧虐不虐？,派大星0809🏖
74,这个网剧我觉得真的拍的好好，演员和剧情还有氛围感都非常好，什么时候能搞个第二部，男主这类型真是人间理想了[色][色],🐱白给🐱
75,有点像明玉,赵辛民
76,女主哭戏真绝啊，带着哭腔说台词 表情 眼泪开口就到，有这种演技的新生代不多啊，可能剧情好容易发挥？还是我孤陋寡闻了？,思想者aqi
77,这里的广告文字说明是不是把男主的名字弄错了？男主真名不是叫陈鑫海吗？[捂脸笑],璨年
78,#司清景琛双向奔赴超好嗑#爱与被爱同时发生，爱才会变得有意义！,是张不是脏🌈
79,冬天穿凉鞋，厉害[捂脸笑],小🐑杨👏
80,喜欢女主，是个好演员,爱看电视的冷雨
81,这部剧，我反复看了第三遍了，从1.5倍到1.25倍，到现在原倍看，发现这真是一部值得好好看的剧，看第三遍了，还在慢慢发现剧中惊喜！,luckYan彦宝
82,#司清景琛双向奔赴超好嗑#首先，我真的很向往，不单单是这种岁月静好的生活，还有一点就是男女主都很懂对方，女主懂得男主的坚守，男主知道女主想有一个家，知道房子对女主的意义，我很向往这样感情,鹤新川
83,这些都不认识,好高好高🌈
84,#司清景琛双向奔赴超好嗑#最喜欢的就是片尾的那一句，愿我们都能在鸡零狗碎的日子里，拥有自己的人间烟火！,姗姗and妞妞
85,只有我是冲着刘宇宁唱的OST来的吗？,MD小芬
86,只看了第一集，有点劝退我的意思，就感觉这个女主有点太自来熟了吧，让人帮忙还这么理直气壮的？？还要不要继续看？[捂脸笑],🌸 哎呀哈 🌸
87,好看好看,"狮子座
狮子座"
88,"小烟火2023年最爱的一部剧没有之一🎇🎇
这部剧主打一个双向治愈双向救赎
有充满烟火气的小爱也有大爱
让人们了解到传统手工艺文化了解非遗
手艺即“守艺”整部剧三观正立意深刻
是一部很值得n刷的剧 
演员导演编剧全员真诚良心好剧[爱心][爱心]
希望有更多类似小烟火这样的良心好剧
有美食美景有景琛司清双向治愈救赎
让人看了直呼想要结婚的冲动
纯爱战神应声倒地[流泪][流泪]
还有令人动容的友情亲情 
每一条线都诠释的很到位 
男女主cp感超强很有夫妻相[笑哭][笑哭]
谨代表全世界希望平行时空里的
景琛司清永远幸福白头偕老 
璟园里的每一位都幸福的生活着

最后希望导演能原班人马来个第二季[色][色]
陈鑫海卢洋洋二搭N搭 这么强的天选cp感必须多搭",逸群之才的洛希极限
89,这是我唯一一个没有看演员，却被吸引了的剧,小王在整牙🥺
90,字幕去哪里了？,2368621787
91,景美人美剧情好喜欢[大拇指],啊娟姐姐🎁
92,鬼知道我刷了多少遍, xue
93,[色]不错的一个作品，还没看够，有系列吗,←═╬∞昱~
94,#司清景琛双向奔赴超好嗑#很向往这种爱情，一个人的喜欢很常见，而双向的喜欢就是上天的恩赐！！,Relaxxxx🐰
95,女主的颜绝了[色][色][色][色][色],『默』守~
96,看第三遍的我，告诉大家，这是一部有温度有维度的剧，从演员到导演，从编剧到剪辑，从布景到服化道都很棒，值得静下心来细细看进去，越来越感人，细细流淌进人心的温暖……,luckYan彦宝
97,恋爱脑天花板,狼太灰🎊
98,请加字幕，谢谢[敲打][敲打][敲打],贰叁壹肆
99,真希望能火啊,噜哩噜哩?
100,这么好看的剧值得更多人看到，不管是服化道景色还是剧情都是很好的[应援],你还好么好
101,走不出来了,雨棠./
102,#司清景琛双向奔赴超好嗑#最喜欢的就是片尾的那一句，愿我们都能在鸡零狗碎的日子里，拥有自己的人间烟火,照耀风眠月
103,听说这部剧很火，剧荒了来看看，结果看了第一集感觉女主人设好没礼貌啊，为啥这也能吹火？？看着剧情有点子无语,猪事顺遂🐷
104,[爱心]谢谢编剧导演各位演员出品方 给了我一场人间烟火 原来 我真正想要的是这样的生活[流泪]一个可以互相温暖的人 认真对待生活[玫瑰花]许我一世人间烟火色吧,王瀞萱
105,好喜欢这部剧，太治愈啦，每天来看,北港未睛🌸
106,#卢洋洋打工人不像演的#来看洋姐了！！！司清天选打工人，感觉就是在演我哈哈哈哈哈哈哈哈笑死我了[应援][应援][应援]，支持卢洋洋新剧[爱心][爱心][爱心],吉祥如意ing💖
107,这部剧爱看的大多都看了好几遍，大概是多数人心中向往的美好~,用户855146ce
108,这个女的第一集，没礼貌又霸道，这男的是有受虐倾向吗？,现男友的爱俐舍
109,一定要看完，再对这部剧评价,往前一步是深渊🎁
110,台词听不太清楚，有同感的人吗？[难过],千飞雨浪
111,有人觉得这个电视剧好看吗,用户7342918403b40
112,第一集还没看完看得真的很难过[捂脸笑]，催收还被讹，拼命上班还得练技能，还被男主给怼了被大姐难为了，还就这么点工资，银行人狠狠代入了[流泪],今天进步了吗🧀
113,这画面是什么拍摄手法 ？看着真别扭看不下去了！,阿莹Amy
114,#卢洋洋打工人不像演的#真的很真实啊，打工人真的很不容易，拿着乞丐的工资，干着保姆的工作，还不能有怨言[捂脸笑],勿言大大~
115,男主和周翊然好像啊,另一ly
116,这个剧绝了，网剧居然太上头了。故事内容，都是弘扬中华文化，手工灯笼，榫卯建筑，汉服，园子，木雕，特别是中华美食，不得不佩服古人的智慧啊。还有不得不低头的现实，为了理想还是出卖自己换取金钱。男主对女主的好应该是科幻片。相信更多的姐妹看了会有恋爱冲动，可是更大的后遗症是没有这样的人，从而对感情更失望了。不管怎样，很打动人。人性揭露到位。很佩服坚守传承的匠人，匠心。对于这个时代算的上是奢侈品。毕竟金钱至上金钱大于家庭生命的人比比皆是。很有意义。这个剧太酷了[应援][应援][应援][应援],11.11😃😉🙆🍀
117,二刷了，好看,໑ຼ₂ₒ₂3ℳঞ᭄💞
118,#卢洋洋打工人不像演的#好像在演我哈哈哈努力工作努力生活，活在当下最重要,cici欧尼＆
119,反正就是很喜欢，可惜不会有第二部,秋日私语晚晚星河.
120,太好看了，连刷了好几遍[色],Double ling 哈哈哈
121,让人眼前一亮的国产剧，颜值高，立意好，愿你我都能在鸡零狗碎的日子里，拥有自己的人间烟火[应援][应援][色][色],祝清风～
122,#被坚定选择能多有安全感#当然，被坚定选择很酷的，安全感满分，对于没有安全感的人来说被坚定选择真的很棒！,赵BOSS的小娇妻Lisa
123,怎么想的？下雪穿夏天的裙子，光脚丫，是我对冬天有什么误解吗？[捂脸笑],偶儿🍧
124,！！！虽然才看第一集但是感觉这剧真的好好有韩剧的味道，特别是女主的选角[捂脸笑][捂脸笑][捂脸笑]说不定换个语言我会自动把剧情里的一些bug合理化了,化名苏哲*
125,差点错过一部好剧,七彩云南欢迎你
126,长大后你会发现，所谓的岁月静好，不过是家中那碗热汤和始终为你亮着的那盏灯，这句话戳中人心！,小李郎亚
127,已经不记得看了多少遍了[应援]剧荒了就来。暖心养眼,人生如戏0519🎂
128,冬至穿裙子，穿凉鞋👡,喜欢喝汽水de澹台茜茜
129,抬头纹严重,幸运五彩石.
130,#被坚定选择能多有安全感#可以被坚定的选择，永远有一个人在背后支持着真的会有很大的勇气面对一切困难,Relaxxxx🐰
131,没看好看不,小孩开学
132,"这眼神 搁你你不心动啊
修勾眼神里的爱意都要溢出来了🥰
",倾他城做他妃oio
133,脱离现实的开头,tomaijun2019
134,#卢洋洋打工人不像演的#卢洋洋演技在线，颜值也在线，让人很有共鸣，很真实,🍍菠萝味的凤梨.
135,问一下是姐弟吗 不喜欢姐弟恋,代汐_Chen
136,超级好看 已经完全走不出来吗555希望以后还有二搭[应援],瓜刀酱哇呜～
137,无意间打开的电视剧，真不错，一口气看完。演职人员都很陌生，剧情不错。[大拇指],未知水JunJun
138,#司清景琛双向奔赴超好嗑#双向奔赴真的太赞了，可惜我没这样的福气[捂脸笑][捂脸笑],奔跑在孤傲的路上😚😚
139,到底好不好看？？,鲁大茜520
140,已经好几刷了  太爱看了,邱邱130323
141,剧情好看，氛围感很强，烟火必火[应援][应援][应援],山岗上有风
142,这个女的看起来很势利眼 真的喜欢不上！？,bbbeven
143,真的很喜欢卢洋洋[色],吃一口巴豆
144,就是说，我已经看了一个月啦，不知道多少遍，走不出来，真走不出来[捂脸笑],北港未睛🌸
145,为什么现在只要会哭的都一律说演技炸裂，这也炸那也炸到处都炸，除了炸裂已经不会用别的词形容演技了吗,生数工
146,卢洋洋演的司清真的很贴近我们的生活，每个月有房贷车贷，没有跟以往的剧一样，男主也没有很有钱，没有霸道总裁这一说，女主并不会为了爱情就放弃事业，很独立，理智，男主也很支持她做的每一个决定[爱心],钟意pmh
147,真的特别好看，就感觉像是对现实生活中的一种慰藉[色][色][色],秋辞墨┏┛墓┗┓
148,特别好看，看过就不会失望[呲牙][呲牙][呲牙],青春无悔@🍦
149,年龄大了，前十几集很喜欢，抨击心灵，很像自己的内心，逃不开世俗对物资的欲望，又忍不住向往岁月静好的生活！,豆腐的豆子
150,#被坚定选择能多有安全感#被坚定的选择不仅有安全感，更是一种幸福！因为他会在意你的想法，时时刻刻呵护着你，爱着你，保护着你！,奔跑在孤傲的路上😚😚
151,天哪，竟然放那么早了，可是我都不知道，错过了这么好看的剧,噜哩噜哩?
152,这部剧真心不错[爱心]演的挺自然、编辑编的好、演员好、导演拍的好、唯一不足就是男女主角缺个婚礼缺个宝宝、不然真的可以打💯分,梅子熟了♥海洋
153,这个剧最大的不足之处就是三年了，狗没长大[捂脸笑],…奈…何
154,#司清景琛双向奔赴超好嗑#先婚后爱真的好嗑,退堂鼓艺术家🍡
155,太爱了 我都n刷了 上头 好喜欢景琛司清[应援][应援][应援]海洋之鑫就是最配的 赶紧安排二搭三搭四搭五搭啊啊啊,草莓牛奶味的xx
156,当然最喜欢景琛和司清啦[应援][应援][应援]司清勇敢，清醒  景琛坚定。他们都坚定选择彼此,Y大红袍不是绿茶Y
157,这部剧真的良心剧也很有自己的特色，里面有着平淡生活的一屋二人三餐四季，岁月静好；也有着弘扬非遗传承文化的大格局，非遗传承人的不容易；没有因为要HE硬让很多事都趋于理想化，HE中带着BE，而BE未必不是一种HE，这反而更真实～值得安利的好剧，剧本好 三观正 演员演技在线,风诉零
158,#卢洋洋打工人不像演的#哈哈哈哈哈太真实了，简直就像我本人,退堂鼓艺术家🍡
159,好好看下去 确实双向奔赴的感觉甚好,用户bc2cc3c418b00
160,我来看杨洋恋爱学习一下[应援][应援][应援],我都能揣死你
161,无论看多少次还是会惊艳 走不出来了 永远把陈鑫海盯死在景琛身上 卢洋洋大女主也太美了 不婚主义者看得我想谈恋爱 真的超推荐啊啊啊啊啊啊啊,恬酱yo
162,#被坚定选择能多有安全感#无论发生什么都知道自己在被爱着,是张不是脏🌈
163,为什么之前都不知道，是才放的吗,噜哩噜哩?
164,他俩居然差7岁，男主居然01年的,136****1524_m2688
165,来二刷，本来想等高考完事来刷的，但是实在忍不住了[色],喜欢吃香肠の夹谷碧巧
166,立意非常正的一部剧，可能是因为没有多少宣传的关系，热度不高，但是整部剧三观非常正，也没有俗套的恋爱脑这些，非常推荐[大拇指],linda～～～😃
167,天哪，真的好好看啊，这部剧,噜哩噜哩?
168,场景很美 人也好看 故事也很写实，感触颇深，还有我向往的那种爱情 一切的一切都是很普通人的普通生活 很美好 [应援],桃梨困橘
169,说句实话，这才是当今电视剧该有的样子，打分我打9.9分，无论是主演，剧情，取景，导演都是双一流的[大拇指][大拇指][大拇指],爱江山更爱美人~王彦海
170,有一个问题我很好奇啊，既然这是个景区，那她每次进来是不是都需要交80元钱的门票费呀？,爱吃提拉米苏的小博
171,这就是没车没房没票子？,恛憶優悵
172,为什么不是程响的（最是人间烟火）,《当我娶过她》💝
173,演员演技可以，就是剧本不行，废话太多,田田轩🍂
174,#被坚定选择能多有安全感#被坚定选择的感觉真好，景琛给了司清很大的安全感，他俩真的太好磕啦！！！！[爱心][爱心][爱心],吉祥如意ing💖
175,下雪了还穿凉鞋,用户915b79d236
176,就喜欢这种一下就更完全集的,杺芋8023
177,我觉得前面好看后面的没有前面的精彩吧就觉得比较平常吧,用户af1ad7841fd80
178,[捂脸笑]导演是没见过农村吗？，还是农村也就这样了？[捂脸笑]。就这条件的房子和景色。够买市中心多少套房了,难以抑制🏝
179,这里面有南笙[色],小熊看剧🎋
180,抖音来的[呲牙] ,爱小斐😘😘
181,喜欢喜欢喜欢喜欢,用户@e8d258041fa40
182,#司清景琛双向奔赴超好嗑#双向奔赴真的太甜啦！！！期待司清景琛[应援][应援][应援],吉祥如意ing💖
183,现在还有看的吗？[应援][应援],艾米尼w
184,字幕怎么没来,ML龙族
185,男帅女美,风的信使yq
186,看全集的感觉不要太好[吃瓜][吃瓜][吃瓜][吃瓜],纯傻de
187,怀疑这部剧导演打过赌，长大一定导出一部又甜又磕不是俗套路的VIP看全集的剧。[应援][应援],我是VIP客户💖
188,我看好几遍都开[色][色][色]看不腻,朋英
189,#司清景琛双向奔赴超好嗑#双向奔赴的恋爱怎么会不好磕呢，世界这么大遇到两情相悦的人何其难，司清景琛就是最配的[应援],勿言大大~
