,0,1
456,我有点看不进去呀[捂脸笑][捂脸笑],凌晨六点 .太阳升起海平线
457,只是觉得很可惜，这剧很有内容的，如果你开始工作你看这剧对生活中也是有帮助的，只是热度被压了，第一季的时候就有人故意去豆瓣打低分，就很无语，我还期待第三季呢,晚风知云意:
458,迫事部必须登顶！！！好剧不应该被埋没！！每一集都有立意，搞笑的同时反映各种社会现象和职场规则，从来没有一部喜剧让我认真做笔记，是真的学到了干货，我永远的下饭神剧！！第三季在拍了吧，第四季准备好了吧，第五季在写了吧[火][火][火][火][火],今天椰开心🍊
459,韦正：“我决定了，如果我这辈子还有希望拍破3，我要在破3里重搭公寓，把两个宇宙打通 ”大家赶紧顶热度！！,逗逗萌
460,破三破三破三！！！,云孟理飞
461,热度掉的太快了，没戏了[捂脸笑][捂脸笑][捂脸笑][捂脸笑][捂脸笑],菰独到底
462,兄弟们，为了小破三！！冲冲冲！！[应援],喜欢喝红茶de东12581火
463,好看死，真的绝绝子,R11SE
464,爱了爱了,chacokakat
465,求第三季,R11SE
466,好剧不能被埋没,甜菜兴～🍓
467,破三破三,😇😇VV..
468,大家推呀！一定要破7000,病态的绅士
469,力争破三！,臭屁小黑子
470,去年三刷了破事1以后还特意搜了2什么时候上忽然就看到微博热搜2出来了！！！激动\(≧▽≦)/,画画的贝贝🌸
471,虽然质量高低不齐，但是真的很用心，情景喜剧真的没人做了，硕果仅存，且看且珍惜,2000957901
472,我看过爱情公寓，就觉得5好看（不是踩一捧一啊 真的题材编剧好看）以为再也没有机会看到几位演员了 没想到有了破事精英！！你知道那种感觉吗？？[爱心][爱心][爱心][爱心][爱心],乐乐本乐🎐
473,这热度上不去呀[捂脸笑],东极岛7750
474,破事快冲！！！！！,木鸽释梦
475,期望第三季上,凶手✨
476,还有四百 加油加油,搞笑女周小姐
477,破3必须上,你的月亮我都心
478,刷播放量继续继续,"l
lgq
lgq"
479,小螺丝大作为,"l
lgq
lgq"
480,可惜了，还是没过7000,"库里FMVP,"
481,还不够吗？,Delete 过去_qq1459
482,我想看破3,Serena kong
483,7000热度 冲冲冲,朤月
484,为什么热度还降了点[大哭],小崽子唉
485,超级好看[应援],酥林林
486,怎么还差500[捂脸笑],当个太空人吧
487,冲冲冲，为了破三，努力努力，拜托拜托,多吃维C嘻嘻嘻
488,破3就靠大家一起加油[呲牙],耿♡geng
489,兄弟们冲啊,公瑾阿巴阿巴阿巴
490,热度高一点求求了[应援][应援][应援],蓝蓝1478
491,破七千有第三季,蓝蓝1478
492,第一季结尾我还以为胡强雄起了原来是这样啊[捂脸笑][捂脸笑],覃宇扬
493,哎随随便便一个剧都6000➕热度，辛辛苦苦拍半天这么好看的剧就是热度上不去，上第一部充的会员，这次上第二部继续充会员，希望能有第三部，只为破事充会员！小破冲呀给我干碎排行榜！,夏目祐衣
494,昨晚熬夜追剧，今儿一整天都恍恍惚惚红红火火，破事精英真的太好看了[应援][应援][应援],白辞茉茉
495,事实证明坚持早睡并没有使我皮肤状态变好所以今晚开始继续熬夜追剧了。,白辞茉茉
496,忽然明白了那些明星下面评论刷的各种像写的诗一样的评论啥意思了[捂脸笑][捂脸笑]原来是为了热度,小甜甜的小草莓
497,家人们破一破二都很好看，真的希望有破三，大家看完剧也可以去豆瓣写写评分呀，感觉破二热度没有破一高，豆瓣评分都没显示[捂脸笑][捂脸笑],今日無事
498,助力破事3,一个坏人sang
499,破3，我要破3[微笑],结结实实大比兜
500,我要看破事3,opg3
501,第三季！一定要出,用户@7228ae640f500
502,热度刷起来！,用户@7228ae640f500
503,说好的CP呢，CP剧情太少啦[捂脸笑]剧情,a4382677yanpi
504,之前没看过第一季，偶然点开追了两集，哇！！！！！！太有意思了这个剧，真的好久没看过这么有意思的剧了！好笑又现实，看的时候真的会哈哈大笑的那种程度，尤其是胡强参加同学会那一集，笑死我了哈哈哈哈哈哈哈哈哈哈哈哈哈，都给我看！！！,08522嗯啦没看
505,第十二集感觉是人间百态。往往我们想做一些事，总是因为各种原因导致没有做,小鱼子爱吃炸酱面
506,球球大家多刷点评论弹幕，有钱的帮忙开个会员谢谢了，热度破七千才有希望第三季呜呜呜[委屈]韦导说第三季会把爱情公寓破事部次元壁打破​,绯红色👴🏻
507,必须要有第三部[666],light027
508,喜欢，支持[爱心][爱心][爱心][应援],梦醉煮酒
509,多来点热度吧小破事,呓语灬🌈
510,来了来了，终于等到第二季了[应援]太喜欢李佳航了，又帅，演技又好这么快乐的剧必须要追[捂脸笑][捂脸笑],小可爱milfoil
511,举个小手来有，谁和我一起来看李佳航的？真的太看了，特别喜欢这部剧,mimang3540
512,刷了才有第三季[应援],小李广花荣531
513,哇喔 就喜欢不准时,summer熙姐姐
514,哇哦，终于上线了，加油加油[应援][应援][应援],凌凌1234
515,破事精英2我来了[应援][应援][应援],喵咕喵咕咕
516,第二季都有了，第三季也赶紧安排上吧,用户6d7cc6a8
517,单纯的蛋疼的人看蛋疼的剧，这类剧现在太少了。,这小子哈
518,有脏辫的女生演的太刻意,我喜欢吃辣条和麻辣烫
519,刚看完破事1现在开始看2了,早点睡觉～等等等等
520,喜欢喜欢，希望还有破三破四破五破六[色][色][色][色],去托斯卡纳赏花
521,挺好看的，看了一就在期待二了，说了很多打工人的现实,反正你们看的也是备注
522,非常棒的一部剧，希望出第三季，加油！！[大拇指][大拇指][大拇指][大拇指],无惧的芙蓉王
523,破事精英真是一部宝藏！十分推荐大家!,匿名用户
524,好看，支持，想看第三季，韦导牛逼[大拇指][666],匿名用户
525,为了这剧开会员，其他的一律不看！,你牛大了🎋
526,期待破三还有胡作菲为[色],澄む
527,加油，胡强莫菲这种懞眬的cp感太爱了[应援],爱唱歌的uhhhj
528,熬夜看完第一二部 不错 [大拇指],超爱吃薯条的宇文清漪
529,"拜托，我想看破三[委屈][委屈][委屈][委屈][委屈]
为了和《爱情公寓》",领😄⭐
530,啊，我才知道第二季都有了，等我考完试我要追啦,小狐懦尾
531,太久没看过如此优秀的好喜剧了,深海恒星
532,超爱 第一部第二部都超爱 个人觉得蛮有深意 又讽刺意味,个性一.
533,这两天一直在看第一季，今天开始接着看第二季，无限刷剧,李小冉专属
534,我真的很想看破事精英3,念想，久远
535,打通宇宙之后会以撞脸怪来处理吗[狗头],蛊毒终身
536,太爱了，希望第三季一定要出来打通宇宙[应援][应援][应援],蛊毒终身
537,太好看了，为了看小破专门充了会员，希望能有小破3,执念*青春
538,支持[应援]真的非常想要第三季[应援][应援][应援],风韵影雪
539,"希望有下一部,好久没有看过这么好看的剧了[色]",乐叶.
540,一定要有第三季啊，我想看到韦正宇宙打开,匿名用户
541,能不能好好讲故事 天天搞互动[微笑],最近的遥远。
542,所以这部剧是教我们成为更好的打工人吗[微笑],匿名用户
543,这么好看的剧为什么不火呀[大哭][大哭][大哭],宁 殷
544,这集骂人看到周星驰的影子,今晚打老版
545,我去，这热度为什么不增反降。。。。,💧💧Aurora A🍄
546,破事也拍五部好吧，根本不够看啊[捂脸笑][捂脸笑][捂脸笑][捂脸笑][捂脸笑]，韦导yyds！！支持,景观城＆
547,期待三！[应援][应援][应援][应援][应援][应援][应援]好看好看 ，开始二刷啦,Cxy9729M
548,什么鬼电视剧 看了半天,匿名用户
549,现在播完了，现在刷热度还有用吗,Iraqis_🐣
550,为什么又掉了昨晚六千今早就五千了,加油破3
551,看不过瘾！求求了！继续拍成系列剧！拍到10季！不！拍到die!,宋songminhao
552,真心求破3！！！，真的是我的快乐源泉,匿名用户
553,天哪，悄无声息的2怎么不通知我,宝宝 宝宝 宝宝 宝宝 宝宝 宝宝
554,我已经把这部剧当做是爱情公寓6来追了,柠檬其实特别萌
555,六公主出手了，第三季一定会有的,火麒麟k
556,在电视上看了这么多集，越看越爽，真的好看，喜欢沙乐乐[爱心],匿名用户
557,这么多评论干不过一个一个古装剧,匿名用户
558,好消息，小破被六公主点名了，破三绝对有望,小魔女♚μψ
559,乐死我了先升职降薪再自愿降薪离谱,肯德基靓仔
560,我腹腔做了个微创，躺在病床上看这个，流血了[捂脸笑][捂脸笑][捂脸笑],笑白白🧐🧐🧐
561,别啊，还没到七千，没有破三我的人生是不完整的,匿名用户
562,加油，为了破三，特意来看，希望能涨一点热度[爱心][爱心],匿名用户
563,喜欢爱情公寓，更期待破事精支持支持[应援],匿名用户
564,最高已经6800了，咱就当7000了好不好？,A666✨
565,一周直接更新完了，牛逼,指尖。流沙
566,我爱破事精英的每一个人[应援][应援][应援][爱心],笑嘻嘻的LY。
567,破事精英冲冲冲第三季第三季希望有第三季希望有第三季希望有第三季,康康我🍓
568,非常好看希望有第三部,大原丫
569,还是喜欢这个剧组，真的不错,Mage217
570,我们一起努力，希望有第三季,伍灏宇_qq1921
571,更的这么快嘛 几天就更完了,吕橙橙💛
572,一扇门申请两年，太现实了[色],爱天进
573,把热度维持顶住，晚上集中冲一波,清灵9981
574,这部剧要是不火，这辈子不充AQY!!!!,电影小猫0505
575,想看破三，想看破四想一直播下去[爱心][爱心][爱心],康康我🍓
576,为了破二充的会员[爱心][爱心]我爱破事精英,蘑菇蘑古腻
577,"今天看完了，必须得7000
期待破3",安笙、🌼
578,希望大家多支持，顶上7000才有第三季[应援][应援][应援],苏玄均
579,期待破三，真的很想看看爱情公寓和破事精英的联合，破事精英三！！！！！！！,大力小鱼
580,"
兄弟们加油，我想看破三特别期待[应援][应援]",第三届😗
581,为毛热度这么低。。。我已经死命安利了,寓言也是预言
582,破三什么时候拍呀？安排上啊,煎蛋螺蛳粉.
583,该说不说这几个女角色都挺不错的,染血一生终不悔
584,特意下载爱奇艺来支持一波[应援],LOLo_wx1997
585,热度被压，再见了破事精英，再见了好剧[鼓掌][爱心],柴圆滚滚.
586,谁告诉一下怎么刷热度😂。,烟黑了我的肺
587,这两年为数不多的好剧,以前de
588,破事拍的太真实了，讽刺了很多东西，才受到打压,以前de
589,兄弟们[爱心]要多支持这个系列，一定要支持。,立其身  正其本
590,众筹拍破事精英，我愿意！！！,匿名用户
591,所以唐海星不会真是董事长儿子吧？？？,匿名用户
592,真搞不懂啊，这个热度是咋算的,匿名用户
593,真的好看这个剧，真希望能有第三季，被更多人看到,嵄九
594,充会员就是为了看破二,星空萌爱
595,三万多的评论没有两千多的云襄转热度高？？？？？？,"_王大锤"""
596,刚刚完结我就重头看了，谁和我一样[呲牙][呲牙][呲牙][呲牙],匿名用户
597,永远忘不了一个工作日吃饭的中午，看到韦导和航哥果子发微博，当时还以为韦导开的张伟大力的番外，当时还沉浸在爱情公寓完结的悲伤中。没想到是新剧，这一下就两季，让我工作下班之余有了新的期待，陪伴了我人生中最低谷的两年，所以一定要继续啊[应援],匿名用户
598,什么嘛。小白一个人伤心的故事,哇哈哈呀🎊
599,这个热度真的太假了这还不上吗,鹤御南北天
600,虽然没看过，但是就是为了整热度[色],必备💓
601,一定要冲上热门看破四！[应援][应援][应援][应援],匿名用户
602,好害怕哦，看不到破三我会很难过[捂脸笑],池魚＆
603,大家多评论多刷弹幕破3才有望啊大家一起加油！！！,月月月月…
604,那集算算乐真的好气啊，怎么可以那样对莫菲大大[泪]，如果不是唐海星炸了算算乐，可能那些人会一直沉迷其中，每次都是莫菲默默的支持守护胡强，那集黑与白真的哭死，即使这个世界是灰色的她永远都是他世界里唯一一抹鲜亮的色彩永远坚定的给他撑伞[泪]，逆光而来啊[送花花]胡强一定是上辈子拯救了银河系,君佛啊
605,蛙趣，我爱破事部全体，希望破三早点来，破事部一个不上，go go go,阿尔托莉雅潘德拉贡🥝
606,"韦正：“我决定了，如果我这辈子还有希望拍破3，我要在破3里重搭公寓，把两个宇宙打通 ”热度往上顶啊啊啊啊啊一定要继续拍求求了大家多多评论多多弹幕！！！！！！
从搜索界面搜破事精英点进来 多刷弹幕多评论 不要倍速不要跳过片头片尾 主要在七点半到九点半之间看集中热度加油
[666][666][666][666][666][666]",喜欢探险的宰父英逸
607,[色]希望有破3跟爱情公寓打通,小羊不愁💦
608,我真服了。上热度啊！！！！！！我要看破3！！！！！！！！[呲牙],认栽与你
609,今晚大家一定加油破7000，才有可能有第三季[捂脸笑],一起干火锅
610,从第一集再刷一遍，为热度做点贡献,一起干火锅
611,破二我来了，希望看完破二就能看到破三的剧本写好[色],笨蛋失眠.
612,兄弟们加油啊，破3就靠我们了,giao哥giao爆了
613,赶紧上去吧，我要看第三部,筱明😘😘😘
614,这个热度的指数是怎么算的，包括哪些方面呀,浮熙111
615,太现实了，少有的好剧，导演真敢拍啊,石墨随你呀
616,拜托 看了多长时间了 还不加,终于眼红i 😁
617,再来评论两句，一定要冲破7000,淏シ
618,不会真的自己压自己热度吧[666][666],无糖加冰😁🌙🍇☁
619,真的好想看破事精英有下一季，大家加油，冲冲冲[应援][应援][应援],喜欢K歌的单于绿海
620,必须要我的伟哥再次变成胡强[色][色][色][色],阿龙要成果.
621,兄弟们推上热搜有机会看破四[应援][应援]兄弟们推上热搜有机会看破四[应援][应援],王冠昭
622,来增加热度了，希望着能看到第三季,梦怜🐣
623,预热一下，离7.30还有十分钟,内个傻子
624,期待 真的很好的片子  快大结局了 意犹未尽,至尊丶小Q
625,冲冲冲，就算是水帖子也要有气势！[奋斗],搏你一世青睐
626,支持破事精英2，希望能看到破3加油呀兄弟们！,匿名用户
627,让破事精英延续我的爱情公寓[捂脸笑][捂脸笑][捂脸笑][捂脸笑][捂脸笑][捂脸笑],匿名用户
628,今晚7;30刷弹幕 破事精英3 热度7000就有希望拍破事精英3 加油！！！,匿名用户
629,终于到最后一集了好开心呢,泼墨小鸟
630,我来评论是为了能有破三，大家帮忙提点热度[呲牙][呲牙][呲牙],匿名用户
631,很喜欢他一定要有三啊,匿名用户
632,冲鸭，无产阶级，联合起来，联合起来！联合起来！！！！！！！！！。,匿名用户
633,喜欢喜剧，但是喜剧片太少了不好搞……,风继续吹秦轩
634,继爱情公寓之后最好看的喜剧,匿名用户
635,真的很有意义，很好看的一部电视剧，希望能有第三季[大拇指][抓狂][抓狂],匿名用户
636,我要看第三季！我发这个会不会涨热度啊,六六六ㅣ
637,"好看，爱看，真心喜欢，也希望可以一直出下去
[玫瑰花][玫瑰花][玫瑰花][爱心][爱心][爱心]",熊先生rose
638,各位加油啊，热度破7000，破三就有希望了,匿名用户
639,一定要出破3啊大家加油顶热度[大拇指],清醒曳
640,救命🆘热度都刷起来，破事給我一直拍下去,匿名用户
641,顶楼精英也来一部，应该也巨搞笑，,果果🌙711😄
642,终于等到2了，希望还能继续拍，看着很轻松的,df61519
643,导演和演员们都一定要一直拍下去破事！,小猫十三💫
644,一部让我笑笑停不下来的剧，破事精英演的太好了,小月月月月😆513
645,冲一冲加把劲破三还有戏要不然的话看不到了[捂脸笑],赐美⭐
646,谁懂啊 我的破3就差那么一点点,匿名用户
647,只要能到7000 我们就有破3了加油啊！,匿名用户
648,喜欢这种喜剧效果，爱情公寓十[爱心][爱心][爱心][爱心][爱心][爱心]遍老粉,面壁者-Mewtwo
649,爱情公寓我看了10遍以上，看最有种的男人来的[爱心][爱心][爱心][爱心][爱心],面壁者-Mewtwo
650,说实话，破事精英两季都非常好看，破3快来[应援][应援][应援][应援],匿名用户
651,真的很希望破事精英有第三部,泽茫渡断
652,"🍕🍗🍖🍟🍔🌭

吃꙼̈ 货꙼̈ 最꙼̈ 高꙼̈ 境꙼̈ 界꙼̈

眼꙼̈ 见꙼̈ 为꙼̈ 食꙼̈[色]",绯红色👴🏻
653,好剧看不够啊，多来几季,怡树蛋花TTL
654,破一就很好看，破二也好看破三冲冲冲[色],匿名用户
655,真的以为翻身成董事长哈哈哈哈哈,散落漫天的樱花碎片
656,破事精英第二季真的好看，希望大家多多支持,匿名用户
657,只要热度够，就有破三看[应援][应援][应援],匿名用户
658,没有第三季就太可惜了,游熙
659,感觉很贴合现实的好剧,匿名用户
660,想看破三，热度up up[应援][应援]真的很爱破事部,匿名用户
661,我的天，我一猜就是黄辉冯，没想到猜对了,布破
662,[色][色][色][色]太棒了破事精英，一定要有第“五”季啊啊啊,HS12138
663,热度快上去！！！小破他值得,喻什么呢.
664,第三季快开始拍啊！不带这么休息的！,匿名用户
665,继续继续，第三第四第五部冲！新声代情景喜剧！！[色][色][色][色],匿名用户
666,韦导一定要继续拍下去啊[应援][应援][应援],匿名用户
667,真的好看！第三季给我冲！[应援],XXXATO.
668,其它的都很好。第七集就删了算了,一直很安.静
669,欢迎来到破事精英2……D楼层的大冒险还在继续[应援][应援][应援],Latano🐣
670,冲冲冲，这么好看的电视剧值得n刷，加油，多拍几季[应援][应援],xin tian xue dian.
671,太爱莫菲了！拽拽的性格[色]太酷了,小海仙er
672,李佳航的演技肉眼可见的进步，开局就让人激动,Katydid13
673,18集封神，大家把热度顶起来！,奥兹呀
674,看过第一季很好看，没想到出第二季了太好了[应援],极其真诚热情的小熊妈咪
675,我竟然刚刷到第二部上了,im歪脖葫芦娃
676,什么？第十季已经拍完了[色],兔之夭夭v
677,"第一季我都看了好多好多好多遍了

第二季终于来了",萤虫儿🖤
678,看完第一季，非常期待第二季，现在终于来看了,萤虫儿🖤
679,希望《破事精英》能一二三四五六七八季！！！！[色][色][色][色],凉凉1314666
680,每个人演技都很棒，新人也很棒！！！！！,凉凉1314666
681,每个人都能跳脱出人物性格，太棒了,凉凉1314666
682,哇哇哇 超级开心 重要开启第二季啦,兔兔与梅梅啊
683,好好看啊，真的 要继续出啊，求求了导演[爱心][爱心],匿名用户
684,只有我看不下去吗？有点压抑[微笑][微笑],走神无敌
685,感觉沙乐乐可塑性好强啊,小甜甜的小草莓
686,"什么时候出的都不知道
",阳阳阳一
687,"怎么发不了弹幕哇！！！！！！胡强我来支持你了！！！！
",015bala
688,之前破1被针对了破2是早拍好了的不知道破3还有没有了,覃宇扬
689,如果破三能够拍，自己也会有参与感[应援][应援][呲牙][呲牙],匠！
690,大家还是多发弹幕，评论没什么用[捂脸笑],匠！
691,"现在《破事精英2》豆瓣的打分人数和评论数量实在太少了，离豆瓣开分需要的人数差很多。
      开始我以为是热度问题，后来发现有很多新人会在《破事精英1》里评论和打分，这样分流会导致破2的出分会晚很多。
      现在破2在豆瓣的评分一旦出分会很不错，会吸引很多喜欢高品质剧的观众来关注，希望大家在豆瓣评分时找到破2，不要刷分，客观评价，让豆瓣早日出分，拉一些热度吧。",Latano🐣
692,出第三季吧。时间会证明一切,匿名用户
693,这么好的剧不能被埋没，支持破事精英[666],匿名用户
694,据说热度不够，特地过来刷评论![爱心][爱心][爱心][爱心][爱心][爱心],枝子$
695,破3！破3！破3！破3！破3！破3！破3！破3！破3！破3！破3！破3！破3！破3！破3！破3！破3！破3！破3！破3！大家刷起来涨热度啊[应援][应援],独行dragon
696,老期待了，希望可以看到破事3,烟消云散12138
697,来冲热度，兄弟们多发弹幕多评论，为了第三季,墨轩烨
698,加油兄弟们[色]期待破三和爱情公寓联动[色][色],小鱼子爱吃炸酱面
699,我感觉比第一季更精彩了，好看，祝大火！,尊重物种多样性
700,大家多支持我们小破吧 想看第三部[应援],南门二c
701,支持韦正导演，我要看第三季！！！,匿名用户
702,希望破事精英一直拍下去[爱心][爱心][应援]真的好喜欢破事部的大家,是左边的叶子掉下来了
703,为了有破3必须来多多评论～～真的很好的剧！！！,匿名用户
704,真有第二季呀 昨天无意间看到了，泰棒辣,落日归山河02
705,期待破三，真希望这部剧热度可以高一点,白辞茉茉
706,为了第三部，拼命发评论，加油,凡饿赛
707,演员们的表演真是太精彩了演员们的表演真是太精彩了演员们的表演真是太精彩了演员们的表演真是太精彩了！,凡饿赛
708,感动！[爱心][爱心][爱心]希望小破一直把这个系列做下去！大爱啊[应援][应援][应援],果力成ovo
709,超级喜欢！！！！！希望一定有第三季！！！,匿名用户
710,看过第一季的帅锅美铝来集合啦[应援][应援],匿名用户
711,竟然更新了 错过错过 好喜欢了 ,纯纯的爱186
712,"让我看看有多少人是来看狗哥的[狗头]
",简单爱1
713,哈哈说话幽默，人工智能，哈哈弄个学区房[大拇指],匿名用户
714,看过第一季的，好期待看第二季,小小雨蝶✌
715,还是同样的味道，同样的剧情哦,我爱学习2022✨
716,[爱心][爱心][爱心]超级好看！！！希望一直播下去[应援][应援][应援]~[色][色][色],零淇淇
717,这种反应现实工作的真的太好看了,dzy～68
718,沙乐乐是我的不要再抢了[666][666][666],晨曦公主231
719,这个剧组真的好会哦，拍的也太好了吧,兰花lanhua5059
720,太喜欢李佳航的了又帅又有演技,玲玲来了💋
721,太棒了，大炮果然诚不欺我，连续6集,哪九一一
722,来看李佳航的职场剧了[应援][应援][应援][应援],杨洛🤫
723,真诚提个建议，看完了全部，强烈的感觉是，如果正常速度看，很容易犯困，一是梗比较密集，台词信息量太大，二是部分演员本身讲话速度较快，如果不看屏幕有点听不太清楚呢。个人看法，请酌情采纳,超爱喝白酒の尉迟秀
724,龙门镖局，武林外传，都是这种剧的鼻祖，好几个角色都是武林外传的翻版。佟湘玉，郭芙蓉的原型都在里面。,2楼-雅座
725,说正经的，最近几天睡觉都是开着听视频模式，听着破事精英才睡觉的，真心希望有第三季，国产良心好剧，讽刺拉满，内容深刻，贴合现实，，，总之，一定要有破事三啊，，，，，,TRY  FOR U
726,真的好看哎，心情不好的时候看看感觉挺开心的，感觉他们这个工作组好温暖啊,yyyuanybyyy
727,如果现在电视剧是牛粪的话，这是其中为数不多的鲜花。,云逸先生哦
728,究极无敌好看!我觉得蛮好玩的，很喜欢这种形式的电视剧！而且胡作菲为好好磕啊！！[应援],重生之都市仙尊龙傲天
729,都不知道第二部上了，今天晚上才看见，又可以熬夜了[色],残雪goring
730,第一集就超出上一季的期待了，感觉笑点更密集了，而且真是敢拍，太现实了[捂脸笑],浮华↖
731,"希望第三季有咖喱酱[色]
",最美的空白👌
732,"喜剧的背后是悲剧，但是没有关系先笑为快，剩下的等明天再说[呲牙]
没有满分是怕他们骄傲，赶紧接着出下一季。",匿名用户
733,别老是翻拍改编了，我们也是想看的这种真正好的创新剧的[捂脸笑][捂脸笑],果子哩☀
734,好喜欢莫菲的穿搭！我的输入法打出来第一个就是莫菲哦！不是莫非呢,爱赛跑的上官云蔚
735,在2季的破事精英评论区，我好像就没有看到过对于剧情的深入讨论[抠鼻],😇骗子💦
736,期待看破三！爱情公寓以后最适合休闲适合看的电视剧啦,2005259898
737,破事精英第三季[爱心],星恋啊传说
738,破事第三部[色],星恋啊传说
739,破事精英三，加油[应援],恶魔～7爷
740,快出破三,估计的🌟
741,[666][666]神剧亮了，真的让愚蠢大学生感受到了职场的压力和崩溃[捂脸笑]感觉在剧里看见了以后的生活写实,爱奇艺VIP什么时候降价
742,我以前都看爱情公寓来消磨时间，现在有新的剧看了,抹茶甜点
743,第三季求求了,氵BANI YUAN 原
