,0,1
225,14集都看完了，重新再刷一边，好康(●°u°●)​ ,chenyuan辰
226,二刷还能增加热度吗,Iraqis_🐣
227,没想到还是没有上7000，明天19点半再次相约，希望能帮上一点忙[流泪][流泪][流泪],熊二哟🍭
228,让他火起来,英樱ter
229,[应援][应援][应援][应援][应援][应援]  一定要有第三季！！！！！！！！！！！！球球了  真的好好看！良心剧！因为第二季刷了第一季  我错过太多了[可怜][可怜][可怜][可怜],零食即
230,什么样的情景喜剧才是我们想要的，破事精英给了一个很好的答卷，贴近生活，充满笑点，不缺温情，求求破3可以出，不然情景喜剧脑袋要得看了[流泪][流泪][流泪],叶大妮的鸡汤店
231,热度还是上不去啊,北冥有鱼@m
232,表演的都好自然,chenyuan辰
233,“诙谐”贯穿全局,chenyuan辰
234,察言观色很重要,chenyuan辰
235,这一季进步太多了,chenyuan辰
236,演技提升的好快,chenyuan辰
237,万兽以人为本[狗头],chenyuan辰
238,有第二部的剧就是牛,chenyuan辰
239,所以说当老板哪有那么好当，那些抱怨的人真的很讨厌根本没有良心和理解。,天体3464
240,自从听说有破事精英二就一直很期待，终于等到了,美美763
241,太牛了，等了这么久，这不是我的原版吗。搞笑天下无敌！,可乐1314🧁%
242,破事上面的是什么玩意啊,澄澈rr
243,有生之年还是想要看到破3的,晗家军啾咪
244,我来助力破3了！！！破事精英一定要给我拍下去！冲冲冲！,痴心的湫℡
245,这条是刷热度的，希望看到第三季,1年2班李狗蛋
246,资本的力量太强了，根本比不了,菰独到底
247,就为了这剧才下载回来的爱奇艺，第三季出啊[爱心][爱心][爱心],符华上仙我没有撒谎
248,我不服为什么还掉热度[666],顾渊空河
249,大家可以把破二顶上去啊[应援][应援],塵丶無數
250,家人们多多发评论这样就有热度了！[应援],酥林林
251,这样的小破你怎能不爱,果力成ovo
252,真的很喜欢，一直坚持做下去可以吗,风间琉璃☺
253,我爱破事精英 强烈要求第三季唧唧唧唧唧唧,Dirtykiss$
254,剧本是不是有问题  人物角色不鲜明 强行逗乐 就向奔跑吧兄弟 第一季和第六季的区别  极限挑战第一季和第五季的区别,用户4cd8cd58
255,为什么热度这种低！！！！！,岁月如歌中找我吧
256,为啥热度这么低,氧气手机家
257,热度上不去！！！,退堂鼓巅峰演奏家
258,为什么不涨热度,真好🎆Isabella
259,这热度是被控了吧[狗头],紫府元君
260,一定要给朋友安利[奋斗][奋斗][奋斗][奋斗],月下烛火
261,这么好看的剧给我爆[色][色][色][色],英樱ter
262,为了破四兄弟们，冲啊[应援]，这可是我唯一的下饭神剧了！！！！[捂脸笑][捂脸笑][捂脸笑][捂脸笑][捂脸笑][捂脸笑][捂脸笑][捂脸笑][捂脸笑][捂脸笑][微笑][微笑][微笑][微笑][微笑][微笑],笑嘻嘻的LY。
263,破三！破三！,刘云龙_qq1836
264,小破事，活下去[应援],Ken•Mason
265,大家点点选集上面的爱心可以增加热度！真的很喜欢这部剧！编剧、导演和演员都太好了呜呜呜呜呜！大家多刷刷评论和弹幕 最好15字 第三季要靠大家啦！,有毒呀呀
266,反正我喜欢看，比脸却白的古装小鲜肉剧好看一百倍,微笑的小爸爸
267,从爱情公寓开始看的，韦导的剧真的都很不错，值得打高分，破事精英感觉就是爱情公寓的延续，一定要突破7000，期待第三季[应援][应援][应援],路过的DCD。
268,一定要有第3集啊，太精彩了，太精彩了，我每一集都要发这个评论。[爱心]兄弟们都投票，一定要有第3季。,立其身  正其本
269,看了其实感觉挺不错的，没有很狗血的剧情，每一集都展现着新的主题，搞笑却不缺乏深意。,老黑不喝水
270,朋友说巨好看，希望出第三季，不然我朋友会活不下去的，谢谢,卬云前
271,不为别的，我就想看你把公寓和破英两个宇宙打通,喜欢吃红豆沙の青阳起运
272,韦正：“我决定了，如果我这辈子还有希望拍破3，我要在破3里重搭公寓，把两个宇宙打通 ”第三季！！！！,GARY徐嘉乐
273,22集是真的绝，最后的谈话将商场如战场诠释的非常贴切,『念￡殇』
274,一定要有第三部啊 还等着老胡跟莫菲在一起呢 乐乐跟阿杰 金秘书跟海星 小白和房车[捂脸笑],Chen  haonan
275,热度上不来可惜！,感觉好久不在人间
276,完美电子榨菜[色],gran...
277,请大家看《破事精英2》同时希望大家在微博和其他社交平台多多推荐和影评。破事精英3就靠大家,半步萧音轻过尘
278,破三破三我要破三[色],時逝如夢
279,越来越有深度了，真的是好看的剧啊，真希望能一直播下去[应援],嘻嘻嘻嘻769
280,增加热度啊！！！,就要变坏/
281,我要看下一部,Jason YU🤟
282,我已经开始二刷了[应援][色][色],哈哈哈哈哈吖🍁
283,[色][色][色]，爱死这部剧了[色][色][色],寂寞天，恋，五月:-O
284,终于更第二季了，爱奇艺你一定要看到这部电视剧！诙谐的同时也写实，没有无脑乐没有无脑苦，每一集都有深度，看着放松也没有感到太压迫这样,和印陆宝来怀里
285,破事精英2好好看，导演又进步了！近四年在爱奇艺充会员都是为了看韦正导演的作品。好喜欢，加油,Yucheng Liu
286,每当我不开心的时候，我就会狠狠地看上一天的电视，这是一个电视迷的基本本领。,凡饿赛
287,最爱每天结束日常回到家的治愈小时光，一个人下厨或者是点份外卖追剧。,凡饿赛
288,好激动…上一部的破事精英看到了白领们的生活工作状况…我送过外卖，现在是个出租车司机，除了练摊第二集里三份工作也算做过两份了！加油啊！！！！,SzzzMinG
289,为了热度热起来，一定得有第三部第四部第五部，希望和不良人一样高开疯走吧！,包子包子啊啊
290,我的电子榨菜大侦探完结了，幸好又来了个电子榨菜破事精英[应援][色],一起干火锅
291,我认为每一集拍的都非常有意义。加油期待破三！！！！！,云仲七
292,记得打高分，破一好多恶意低分的,Mr .zhang💖
293,唐海星真的是陆喜发的儿子吗？,A666✨
294,这热度也太离谱了吧，什么时候上7000啊兄弟们,喜欢吃海鲜の司徒英华
295,如果我这样一直发能提高热度吗,赫尔巴特jdheb
296,真的好看，每天8点准时看，就是太少了，看不够！！！！！[应援][色][微笑][应援],Atlantide💝
297,火起来 火起来 这么好的剧 是被资本压了吗 这么都不火！[应援],张元吃芋圆
298,一定要有第三季，顶顶顶，顶上去,吴鑫12138🌻
299,应该支持一下 毕竟没抄,上海堡垒太烂了
300,没有笑声背景，我可能会更想看,叮咚哥哥
301,这么好的剧为什么一直不宣传,LOLEESY
302,快点多刷刷热度吧！过了7000就有破三了家人们,嵩嵩21⭐
303,很推荐  巨好看  一定要有第三部啊  期待期待,陈阳_qq2665
304,大家有什么群都说一下关注破2，让热度上去,白鲨.🍁
305,兄弟们推上热搜有机会上破四[应援][应援],Gytosine.
306,为了7000破三大家冲呀努力啊555,学之司徒
307,我是来支援评论的，避免破产,孟露628
308,韦导真的是用事实打了资本的脸啊[应援],三潭映月
309,感觉比第一季好很多，希望有3.,阿巴阿巴3213
310,真的很好看，希望出破势精英3。[色][应援][应援][应援],叶天乂
311,我真的想看第三季，这样的好剧不该被埋没，国产情景喜剧的探索之路韦导是先行者之一，喜欢小破事的大家多多给家人朋友安利，我们的观众数量基础确实不如第一名，热度上不去播放量是个难题，但是非vip还没有更新完，我们还有机会的，只要热度冲上7000我们就还有机会看第三部，不过韦导实在不行干脆众筹吧，把收款码放出来[捂脸笑][捂脸笑][捂脸笑],芋圆zyh
312,如果不出3，我明年就不续费会员了。。。,晚晚12345👏
313,兄弟们，为了第三季，大家冲呀,慵懒的海阔天空🎁☺
314,冲啊兄弟们我还想看破事3呢,，，，，1121👌
315,我想看破3，麻烦大家评论刷起来，提高热度，感谢大家！！！,NERO2022
316,你一票我一票，破7000，争8000，破三指日可待,爱吃泡面的仲孙南珍
317,太难了吧给我上去啊热度,可可爱爱小桃美眉
318,爱五破六吧！一定要有3啊！！！！！！！拜托了,用户4bc04ed0
319,现在最高才6500，来不及了我感觉。,随风而语🎋
320,看完之后只想说一句，小螺丝 大作为,幸福的橘子花
321,云襄传凭什么和我们比,🇨🇳NPC
322,"不是,兄弟们冲冲冲啊，破7k看破三了",神秘的空青
323,时常能让我看的捧腹大笑，破事精英加油啊！！！[应援][应援][应援][应援][应援][应援],暖心 哈哈
324,真的好喜欢看，求求了出第三季吧，真的好期待,当dang当当当
325,#分享你的战绩#破2目前热度还不够理想，希望会有好转能有破3！,回到过去回到未来
326,我这辈子看过最好的剧,꧁꫞꯭CLR7꯭꫞꧂
327,感觉真的非常不错，很反应现实，期待下一季[应援],阿尔托莉雅潘德拉贡🥝
328,韦正是真会选角色阿 每个人都选的很好,雪人知道该怎么做
329,太喜欢破事精英了 希望一直拍下去,◆◇肉丸子
330,破三破四冲冲冲[应援][应援][应援]守住咱们滴快乐源泉！[爱心],零淇淇
331,不止第三季，第四，第五...都来。我们都爱看[应援][应援][应援][应援][应援],暗黑执事
332,不是你这热度怎么算的啊[微笑][微笑][微笑],薄青💖
333,这部剧一共10天播完，宣传根本没有多少时间,Omegalomaniac
334,天哪，评论都要破9000了！！大家加油！！[色][应援][应援],喜欢吃香肠的轩辕良奥
335,真开心，有第二部。好不好看都顶[大拇指],139****1345
336,超级好看，强烈推荐，家人们冲起来[爱心][爱心][爱心][爱心][666][666][666],用光洗面奶
337,看了一整天电视真是过瘾啊，穿越回来评论,凡饿赛
338,这部电视剧的剧情非常清晰，演员的演技也很不错，非常好,凡饿赛
339,如果你也喜欢破事精英，那我们就是pos（破事）机啦[应援][应援][应援],匠！
340,看过第一季，奔着第二季期待很久了[应援],巨蟒之人戰
341,我是因为破事精英才下载爱奇艺的破事精英立大功[应援][应援][应援][应援],微辣好辣🎋
342,开播了我都不知道，还在那里重温第一季,時間在指尖溜走
343,什么时候？更新了不叫我……,不坚持就一定不会~~
344,偷偷更新不告诉我，好坏哦,池魚＆
345,都是看了第一季过来的吧[应援],爱喝粥de公山水蓝
346,希望今后每年暑假都有,H   a   o
347,我不是来催更第二季的，我就是想问问第三季是什么时候,汝何秀666
348,从一部来的，都快等一年了,喜欢喝红茶の上官巧蕊
349,感觉第二季比第一季还有意思，什么时候有第三部啊[色][色][色],Lonf papamo
350,为啥没有宣传呀？我才知道,冗词🎄4649
351,如果你也喜欢看破事精英，那我们就是破友啦[应援][应援][应援],匠！
352,发条评论，加破事的业绩，一定要有破3阿,咚不哩奇
353,太好看了 还是第一季的感觉[应援],不破司城
354,从来没有看过这么搞笑的电视剧，很喜欢,dj大姐大🍓
355,"热度都下5000了，特地发评论来增加热度，还是希望看到第三季的。我平时都不充会员，这个APP也是为了看这部剧才下的。希望能有第三季[应援][应援][应援]
",意义翼翼异议薏苡
356,破事宇宙！韦正拜托你了！我敢说，身为初入职场小萌新，我的一些职业观以及职场小贴士，从你的破事精英里获得了很多很多。一边笑得我腮帮子疼，一边戳我的心窝子恨不得把真实拍在我脸上。敢说实话，敢批判现实的好剧，特别是好喜剧不多了！韦正拜托你一定要好好拍下去！谢谢！,狐狸的夹竹桃精
357,期待第三季，从来没充过会员的我为了这个剧充了，加油加油，一定要有第三季，太好看了,梅 吹群主
358,该出三了！该出三了！该出三了！该出三了！,宛安安安
359,评论增加热度,喜欢吃梨の微生若南
360,大家把热度顶上去,末年的曰忆
361,评论可以增加热度吗,霹雳卡pika
362,看完第一季，就一直期待着第二季甚至更多季，很喜欢这种风格的喜剧！其实就是喜欢韦导的风格[色][应援][呲牙],尐哖伱結殙莪僦劫殙
363,虽然没有流量演员但是这么用心的剧导演和主创很用心了，再接再厉！[色][大拇指],cobion
364,真的很好笑[色][色][色]没想到居然有第二部！！！这样就会让我很期待第三部[呲牙][呲牙],飞飞飞飞飞废旧
365,"特别完美，好久没有看过这么好看的电视剧了,天天追着看,希望有下一部[应援]",乐叶.
366,大家给热度,大约在冬季，。？！
367,欢迎回来！,白宇5972
368,破7000是什么鬼,LonelyKing灬丶
369,刚补完第一季，第二季我来啦！！！一定一定要有第三季啊，这种良心的国产情景剧不多了！！！！,航慕清
370,怎么推上热搜啊,有志气的$$$$
371,热度是实时吗,"Autumn,"
372,上热搜第四季[应援][应援],憨憨👑♂
373,再来重重热度,"西餐厅小甜甜笑容
习惯性提醒估计"
374,超级喜欢，职场里很多东西都很真实，大家也一起进步一起成长，带来欢笑的同时也引发思考，喜欢喜欢[爱心][爱心][爱心][爱心][爱心],非非非6
375,"这你们觉得好笑？没有做过高管才相信这个，人家请你们来干嘛的？
",Alpencの皇官国淳
376,一定要要有破3啊[狗头],╬┅刑天┅╬べ_
377,加油啊把热度升上来啊微博韦导说了到7000才有可能拍三[捂脸笑],近墨者黑🍡
378,如果还有破3真心希望韦导在其他家上架aqe太欺负人了,寒月天冰
379,每个人的演技台词都非常棒让我有了很好的观影体验并且每集又好笑又有深度剧本非常的不一般,微微一笑7105
380,走过路过点开这部剧了就继续看下去吧，真的非常好看[应援][应援][应援]不会失望的,耶耶耶耶+烨
381,韦正：“我决定了，如果我这辈子还有希望拍破3，我要在破3里重搭公寓，把两个宇宙打通 ”[色][色][色][色][色][色][色]韦正：“我决定了，如果我这辈子还有希望拍破3，我要在破3里重搭公寓，把两个宇宙打通 ”[色][色][色][色][色],遥遥的药药
382,最后一集的悬念这么大，你们甘心只是这个紧紧的悬念吗，难道不好奇最后的结局吗？看剧看到一半，那种没结果的心情，想必大家都有所体会。为了让这部剧有个美满结局，为了破事精英与爱情公寓，为了我们的青春岁月，冲啊，热度破7000就有破三，加油💪💪💪[应援][应援][应援],工藤玉龙
383,"破三！破三！破三！一定要有啊！爱情公寓/破事精英，就是青春的联动啊！
",墨禹的声
384,现在我想让破事精英陪伴我们！！！我们大家一起努力！！希望看到破事精英三啊啊啊,王哈哈哈吼吼
385,zhun的太好看了，第一部的时候就觉得这个很有意思也很有深意，希望可以有第三部、第四部……,樊🌟星闪闪
386,破事精英既夸张又隐晦地表达了职场中的各种规则 套路 还有在其中生存欲极强的职场人的努力 心酸 坚持 上一分钟还在笑 下一秒就可能戳到泪点 这么棒的剧值得被更多人看到 希望能继续拍下去 [应援],c.g5
387,希望这个小办公室陪伴一代人的十年，就跟公寓一样,逆转命运💪
388,各位，今天19点半大家相约一起准时观看，发弹幕，点赞，发评论，成败在此一举，热度达到7000哪怕一刻就行，拜托了，我想看破3[大拇指][666][大拇指][666][大拇指][666][大拇指][666],c.g5
389,我希望能出破事3，有笑有泪的好剧，人生不是只有欢乐，人生处处都是无奈，在看到剧中的人物仿佛看到了自己，为了生活不得不一次次与现实妥协，擦干眼泪为了自己在意的人继续努力。[大拇指][666][捂脸笑][微笑][应援][大拇指],c.g5
390,压热度就代表猕猴桃想用最小的利润换最大的热度，奇迹会降临的！！！,xbmw
391,太好看了！好久没有看到这么有意思的喜剧了，爱奇艺，有破事精英你就享福吧！[应援][应援][应援],小讨喜134
392,"从破1看到破2，超喜欢
虽然是喜剧，但有故事，有内容，很真实",柠檬百香果Zz.
393,之前剧播出时候看热搜上的片段觉得好违和，这次在朋友强烈安利下看了选角真的很绝，其他配角的表现同样可圈可点。当然年轻演员们的演技还有待提高，略显单薄，但总体瑕不掩瑜，还是值得肯定和鼓励。[应援][应援][应援][应援][应援][爱心][爱心][爱心][爱心][爱心][爱心][666][666][666][666][666],简简单单就好啊🤞
394,刷了一遍又一遍,尼古拉丝广坤
395,看完了破事精英2了，无剧追了，决定再去看看破1，啊啊啊期待看到破3，加油加油加油[爱心][爱心][爱心][爱心],耐心小马
396,"十年过去
中国好看的情景喜剧还是得看韦正导演
实在是太厉害了
破事精英真的很犀利又很暖
当时的爱5很多线都没能和爱4衔接上
我就觉得可能是因为时间太匆忙，导演来不及打磨剧本了。
但是破事精英却很好的结合了爱4，厉害了。一看就是用心之作，希望破事精英可以火起来！！！[送花花] ​​​",devojustin
397,热度上去upupupup，真的希望有三啊，还可以联动，jrm加加油，真的真的韦导一定可以拍三。[捂脸笑],Woooioi
398,今晚冲这两集，多设备一起刷播放，不快进不跳片头片尾,清灵9981
399,希望有破3[爱心][爱心][爱心][爱心],^梦夜^
400,期待第三部,白鲨.🍁
401,我们一定要有第三季！我不要我的青春留下爱情公寓那样的遗憾！等了十年才等来爱5。现在我想让破事精英陪伴我们！！！我们大家一起努力！！！[爱心][爱心][应援][应援][应援],君傲宇🤟
402,啊啊啊啊啊啊啊啊啊啊，爱情公寓可能与破事精英打通，简直是梦幻联动，我要第三季，第三季！,伊雯彭格列
403,热度给我上去求求了,超爱看电影de闻人欣跃
404,希望有第三季啊！,越见三石
405,第一部都没坚持看下去，整片跟坨翔一样，堪比小学生的流水账作文 ，竟然还能出第二，不用再开发张伟这些了 ，早就过气了,用户84dcc829点
406,期待破三，真的很想看看爱情公寓和破事精英的联合，这感觉就像八岁的我和二十一岁的我见面啦，破事精英三一定要有！！！❤️❤️❤️❤️,S蛇蝎美人
407,非常好看，是这几年为数不多有深度的戏剧作品[爱心],野原-新之助-
408,极具现实主义色彩，点缀密集的笑点，可看性很强，很能引起反思,酥·貔貅·凡·FAR
409,真的舍不得破事精英哇，呜呜呜呜，为什么要压破破的热度啊，哭死了呜呜呜呜,酥·貔貅·凡·FAR
410,这是我们的青春，也是他们的落幕，请不要为我们和他们的青春留下遗憾，都给我顶上去，让这部剧更好的延续下去，这是我们的使命，去奋力执行吧！士兵,很虚和
411,加油！比起批量产的仙侠爱情剧，还是破事这种带着创新的剧吸引人[应援][应援][应援],Dweight
412,顶热度！！！！快顶到7000，咱们人多力量大，不能被爱奇艺压一头！！！！！！,车车车车车车cheliye
413,真的很好看，反应了很多社会现实最后两集最好看，有悬念很期待出破三,接吻高手⭐
414,求求韦正导演一定要出第三季啊啊啊啊啊 什么剧情我都喜欢 爱情公寓我也很喜欢 我愿意为了破事精英一直充会员[应援][色][爱心],小杨w
415,从最后一集来，不知道怎么提升热度！！！很希望继续拍下去！！！,无所谓结局mm
416,韦正：“我决定了，如果我这辈子还有希望拍破3，我要在破3里重搭公寓，把两个宇宙打通 ”兄弟们，冲啊[奋斗][奋斗][奋斗][奋斗],依    韵
417,很好看！想到有这部剧看，就很开心，希望有破三，破三里面有花瓣飘来的地方…,runing😉😃
418,"韦正：“我决定了，如果我这辈子还有希望拍破3，我要在破3里重搭公寓，把两个宇宙打通 ”
小破 3 冲冲冲",想要变瘦的伟
419,"兄弟们为了破三！为了破事和爱五宇宙的互通。
为了我们的青春，为了下一个“爱五”我们再拼最后一次也或许是唯一一次了。
尽管希望渺茫，但至少一起努力过，一起期待过，相信过。
最后希望破三可以破茧重生，以一种全新的姿态展现在我们面前。",不吃糖也甜☀
420,这剧真的好看 不要退出看了一集你就会停不下来 入股不亏,耶耶耶耶+烨
421,"因为喜欢爱情公寓和破事精英很久了，所以自己写了一本同人小说，《某不正经的破事经理》
请大家多多捧",心中的一束火花
422,我认为这样的好剧不应该就此埋没，希望还能有续集[爱心],白鹿仓😄
423,加油啊，第一名都有200多万弹幕了，破二才七十多万。加加油兄弟姐妹们[应援][应援][应援],白鹿仓😄
424,第二季开播了，真不错，当时看完第一季就想着啥时候出第二季，现在出了看起来。希望接下来有第三季。,在宁波吃西瓜
425,很喜欢破事精英得，大家一起加油冲啊，为了我们的破事精英三[应援][色][应援][应援],念尘 ＆昭野
426,韦正：“我决定了，如果我这辈子还有希望拍破3，我要在破3里重搭公寓，把两个宇宙打通 ”,喰wo竜神z剣啦
427,真的笑了 这么久才加了一百多点热度，猕猴桃要不要看看你在干什么,洛汐蕴啦
428,非常喜欢这部剧，李佳航演技太好了，很反应现实,Ym18261567724
429,我决定了，如果我这辈子还有希望拍破3，我要在破3里重搭公寓，把两个宇宙打通 ”,蓝蓝1478
430,我要第三季,心中有暗
431,"第三季，我要第三季
",心中有暗
432,[应援][应援][应援][应援][应援]热度给我涨,白鲨.🍁
433,这一集胡强的梦碎也太快了，个人感觉可以把观众带入得更深一点再跳脱出来，这样的反转才有意思,2402531845
434,真的好好看第二十一集太真实了原来生活的意义在于自己去寻找进入社会就没有标准答案,千秋时.🌼
435,破3加油 把热度搞上去 希望爱情公寓破事精英联动 建议爱破宇宙播到进养老院为止,LIMBOCHEN
436,大家都在帮忙刷热度，质量不高也正常[捂脸笑]这部剧被压的太厉害了，韦导说热度破7000才有希望出破三，制片方没钱，只能靠观众刷了[捂脸笑],比迪卜
437,回来发评论了我希望过年的时候可以看到破事3，我希望过年可以有好剧看[应援][应援][应援],豪放不羁Brandon
438,韦正导演没有让人失望，永远值得期待，所以我期待破3、破4、破5、破6.....一直拍下去,woshifenglang_1142
439,"热度提升维度
1.用户观看行为数据。即单个视频内容被用户看的整体时长数据和用户对单个视频内容观看完成度。（视频要看完）

2. 用户互动行为数据。即用户在观看内容时产生的评论、点赞、转发、弹幕、点击拖拽等数据。（多评论弹幕 转发）

3. 用户分享行为数据。即用户在观看内容时产生的对内、对外分享数据。（分享再取消也算分享）",乐乐本乐🎐
440,破事这么好的题材和故事现在很少了，真的希望可以一直拍下去！,小猫十三💫
441,加油加油小破事！一定要有第三季！！！看破事的这几天真的好开心！,小猫十三💫
442,我等着看唐海星到底是不是董事长的儿子呢，还有，董事长到底长啥样，苏克杰会不会和小袁袁在一起？唐海星会不会和若愚在一起？莫菲会不会和胡强在一起？,葑嗝嗝
443,真的很好看，希望热度够出第三季，所以说把热度刷起来[色],应无忘
444,我想看破3，所以我刷一个字数看看能不能把热都给推上去一点。[吃瓜],苏小榆~
445,破事部的同事们都是好样的，希望一直拍下去，真的太下饭了，每天都在等着更新。演的真好，加油加油加油！！！[应援][应援][应援],一怡一鸭芽
446,要怎么做才能看到破事部3啊！我都看了好几遍了，真的太好看了[应援][应援][应援][应援],一怡一鸭芽
447,非常非常好，搞笑并现实，演员们演技很好，剧情优美，主题明确[色],阿尔托莉雅潘德拉贡🥝
448,呜呜呜真的很希望有破3！！！特意为阿破开的会员，上一次还是为了青你看甜妹[大哭],斯嘉丽分丽
449,来了来了来了,敷衍罢了.
450,第三季第三季,北田小五
451,兄弟们冲1w！,书包。🍡
452,怎么才能刷热度呀,廿二222
453,我只希望破7000 出破3,我傲娇🌙
454,真的很搞笑第一季都看完了，才知道更第二季了马上就来看了[应援],_ X X .
455,三刷三刷，今晚看完更新的两集，开始三刷，兄弟们热度顶上去，为了我们的破3！！！,为了破三
