,0,1
0,不打十分对不起我对这部剧的喜爱，希望能有第三季第四季,抹茶甜点
1,一定要有第三季啊！！！！！！！真的很喜欢（哭）！！！好久没有这么喜欢的国内电视剧了！！！一定要坚持拍下去！！！求求[大哭][大哭][大哭][大哭],冷漠无情的菇凉芯子
2,兄弟们推上热搜有机会看破四[应援][应援],.酒笙🍦
3,第二季。韦正就是我的神！前10年看公寓，以后破事就是我反复刷的电子榨菜了[大哭],是泡泡🦆🏖
4,我怎么看不懂，也觉得不好笑[捂脸笑],润喉糖💞
5,啥时候出的2？今天刚知道,喜欢举重の漆雕2
6,韦正：“我决定了，如果我这辈子还有希望拍破3，我要在破3里重搭公寓，把两个宇宙打通 ”,✔烟花易冷か
7,小时候看爱情公寓，长大就看破事精英了，希望今年能开拍破事三，韦导加油，豆瓣评分8.6应该不低了吧！,不会的克里斯💝
8,导演 看到十多集了还没看完  忍不住来给你评价  制作非常用心  特别是看到非黑即白这里 小时候看爱情公寓长大  导演  你是不是没钱买流量 都出第二季了不声不响的qwq  我好想狠狠的支持你  可是不知道该怎么支持你 给爱奇艺充会员能落到你手里吗？ 我希望你能得到应有的报酬   你真的太棒啦！！！！！！！[应援][应援]希望优秀的电视剧能让更多人看到,小欧妮2016
9,没看第一部能接上吗？,朝阳必将东升♥
10,没做宣传嘛，上了我都不知道[大哭],酥蟹君
11,非常好，三刷了，还是觉得好看,追逐流星之人
12,救命啊我好像脱离这个世界了，为什么2出了我一点不知道，我还是今天才点进来才发现的，热度呐，短视频呐[捂脸笑],喜欢吃锅巴的诸葛绍钧
13,看了十来分钟看不进去了，就像之前爱情公寓，武林外传，从来没看过，个人感觉没意思,爱吃火锅de南荣云溪
14,有谁和我一样是来看李佳航的，举小手吧！,奔跑在孤傲的路上😚😚
15,[应援][应援][应援]等待破三！,1004275709
16,这个电视是唯一一个让我专门来写评论的一个电视剧，内容有喜有悲人生意义深重角色选配非常完美，希望能拍第三季[爱心][爱心],完颜亮🏖
17,宣发有点………………播出了很久我才知道出第二部了，，，来迟了！！！！啊啊啊啊啊啊啊啊啊啊啊！真的质量高，可惜没什么热度，，，欸，希望大家都顶顶,王王今SAMA
18,看过第一季的集合了！,奔跑在孤傲的路上😚😚
19,梦回那个花瓣飞舞的地方，和那5季不变的橘子[大哭],用户8e4ce6841fa80
20,专门为了破事冲会员 有第三季吧[应援][应援][应援][应援][应援][爱心][爱心][爱心][爱心],萱萱0415
21,怎么打分？？？这么好看的剧！[大拇指][呲牙],初五川
22,看过第一季，为第二季而来的请举手，看看有多少人啊！,翩然入君怀
23,破三什么时候出啊[色],啊哈哈哈23333
24,看了四分钟不到，确定这剧能看下去.受不了，什么鬼,亩域
25,第一次评价电视剧，爱情公寓刷烂了，破事精英简直更上一层楼！韦导牛逼！期待第三季！[大拇指],ycmlwhw1985_bd1682
26,"因为喜欢爱情公寓和破事精英很久了，所以自己写了一本同人小说，《某不正经的破事经理》
请大家多多捧场",应是缘未了
27,好久没有看过这么好看的情景喜剧了,qzuser_qqw05r1
28,热度怎么搞啊！我想看破3,重生之都市仙尊龙傲天
29,"看了几集，真心看不进去，继续拍爱情公寓6吧
",用户@41fc392f
30,一起开头让我想起了群星里面的一段话:巨型企业可以保证其雇员永远不会没有工作。永远。在他们的生命燃尽之后，尸体会被分配到一些简单的工作。这样他们就可以继续养活自己的家庭，并偿还自己的债务。,陈嘉龙🍧
31,超好看！！！希望能有破三！！！[应援],尹殇灵
32,这剧诙谐，又带有一些讽刺，到底还得是有点社会经历的人，才能看懂其中内涵了些什么,ctrlc潸然
33,三天刷完整部剧，它真的太搞笑太好看，根本停不下来,造梦机🎐
34,这就开始逼他们离职了，破一让集团硬生生止住裁员，然后董事会就开始了，你们不愿走，可以逼你们走，呵！老套路！,拥护啥意思嘛🍡
35,这也能出来？？？？,冰封之心.
36,谁懂啊兄弟们，喜剧之光应当如此！,咖喱辣椒▲
37,宣发怎么回事，我等了好长时间，以为暑假出，要不是今天刷视频意外发现，我都不知道已经出了，完结都俩月了。,孤独变成习惯
38,和破事精英二合影留念,潞潞吖
39,我就想看炸掉万兽的视频,克丽奥的驾车人
40,为什么有2不知道[捂脸笑][捂脸笑][捂脸笑]看了小红书才知道……心中了苦说不出靠这部剧,看书呆呆
41,不是 几乎没有123星 你告诉我8.3分 271你脑子有点问题吧？,150****1562_m2630
42,让我看看有多少人是来看狗哥的[狗头],努力小铭
43,大力的发型不适合她[捂脸笑][捂脸笑][捂脸笑],橙子先生爱你哟
44,加油加油希望有第三季好喜欢破事精英[应援][应援][应援][应援][应援][应援][应援],萱萱0415
45,从第一季追过来的，当时就和身边的人强力推荐了，有梗有主题有爆点，能给人带来欢乐但又不是单纯的喜剧，很有意义，我的快乐源泉，这一季来的悄无声息（至少对于我来说[捂脸笑]），听说之后就立马来看了，已经成功带动周围的人一起看了，大家都很喜欢。良心好剧不怕没人看，希望出破三，继续往下出，我会一直追下去的！[呲牙][大拇指][应援],酷盖的帝国女孩
46,看微博，导演说这剧热度不够。特地发评论增加一下热度，还是希望看到第三季的。我平时都不充会员，这个APP也是为了看这部剧才下的。希望能有第三季吧,emilia2018
47,真的很用心，艺术方面和思想内容方面，都可以说是至少第二梯队的,Decemberier
48,轻松还又脑洞大开，还是熟悉的感觉，超爱情景喜剧，希望破事精英34567快快上线[应援][应援][应援][应援],wenwen雯儿~
49,看弹幕好多人都讨厌唐海星 说炒海星打海星 海星明明这么好 工作认真工作量还多 为什么都讨厌海星😭,:::::✔️
50,评论怎么感觉都像水军啊[捂脸笑],宝妮nim
51,以为还没出，就等着看2了[捂脸笑],c.c...
52,一定要有第三季啊！！！！！！！真的很喜欢（哭）！！！好久没有这么喜欢的国内电视剧了！！！一定要坚持拍下去！！！求求了！！！,ileaiiiiii
53,不知道怎么才算给增加热度，但是真的很期待破3[爱心],王瘫瘫
54,我糙，不是8点上映吗，现在居然就能看了,nono_-3-
55,希望有第三季，虽然我还没看一，好好康[应援][应援],か←_←
56,破事2加油啊，真的很喜欢这部剧,chihiro-plus
57,破三冲冲冲呜呜呜怎么历史热度才6600啊,灿g98k
58,一部让我笑笑停不下来的剧，破事精英演的太好了[爱心]莫菲天生就是来克胡经理的吧，胡经理的台都是莫菲拆的。这特效牛逼，还得是韦导导演选角很棒，把每一个人都放在他们适合的角色上[狗头][狗头][狗头],🐍阳光7858💍👏
59,求求韦导了，一定要出破三啊[大哭][大哭][大哭],『王爸爸』
60,有些剧情反应了社会的现实和问题，描写小人物的职场生活，很真实。总体来说还不错。,cfhb xfhb vhh
61,我感觉要是有第三季的话给胡强 跟墨菲融入爱情公寓的记忆是不是会更有意思,want you warming me up
62,就是喜欢不准时,歼灭天使fx
63,破3破3破3 一定要有啊 韦导的神作 希望是下一个爱情公寓 继续陪伴我的青春[应援][应援][应援][应援],Astronaut＆7
64,破事精英真的是个很好的剧啊为什么还不大火,杉野遥亮♥
65,求求了出三的话宣发稍微给点力吧，一的话靠着爱五结尾还算是有点宣发力度，二真是完全没看到宣发……不是同学在看我刚好看到根本不知道三啥时候出的,hvkuifc
66,喜欢爱情公寓，更期待破事精英，支持支持[应援],脸媛圆
67,一定要上热榜[色][色],，家。？
68,我真的是现在才知道有第二季，我天热度这么低嘛[大哭],猫柒与鱼玖
69,怎么才两部，和爱情公寓一样刷好几遍啦！！！根本不够看！！！！,叶子虞
70,！！！！不是八点上嘛！！！一看评论竟然提前了！！！！！[捂脸笑][色][色][色][色][应援],霍格沃茨杰出学生
71,你啥时候有第二季了？！,墨染天下923
72,只有我感觉《地狱之门》这首歌像爱情公寓的主题曲吗？,喜欢吃肉夹馍の慕容峻熙
73,也不知道什么时候第三季出来，看完了一二季，现在不知道看什么了没有电子榨菜了，特空虚，啊啊啊，第三季求求了第三季！！！！！,突破使者历三湘
74,"流量时代，好多剧只要有大牌明星，流量演员就能撑的起来尽管他们剧情做的再不用心。
《破事》没有大牌流量演员，不过所有人都在努力，这部剧十分用心，值得被更多人看到。",影视迷小q
75,破事精英三[色][色][色][色][色][色][色][色][色],^O^念念^O^
76,来啦[色]最后还是为了小破事冲会员,闪闪爱行星
77,《我的省钱式》在哪能听[大哭],铜锣烧-_-
78,看了第一季来看第二季的来集合[呲牙][呲牙],Alexoey
79,给我一口气出到十季节[爱心][爱心][爱心][爱心][爱心][爱心][爱心][爱心][爱心],GORWING
80,破事二完结一个月了，热度也一直在下降，不知道破事精英三还有没有，唉,虚怀若谷的夜书
81,二刷开始！！！我要看破三！！！为什么要看破三？？？因为阿杰和乐乐，若愚和海星，莫菲和胡强还没在一起！！！,糖醋小排多加肉
82,韦正你大声告诉我现在是几点[色],.JOKER.XUE.
83,我也才知道出2,用户@ce50892411600
84,拍出了现实社会公司底层打工人和中年人的无奈 辛酸，用夸大诙谐的方式演绎酸中带甜 甜中带酸 这种剧还能有人故意来打压热度 什么成分就不用多说了[大拇指],乐男3366abc…nd?
85,好久没看到这么下饭的国产剧了，天天古装悬疑，烦了,Duncan Cheng
86,这不比那烂大街的古装好看？这数据是怎么回事？,151****9776_m1135加油吧
87,还有比我晚的吗？,用户6aac4a6b
88,破事爱好者在哪[应援],凋谢了&的花*
89,什么时候出第三部,At凌凌
90,大家喜欢的话多多打五星哟，因为一定会被平台压分的，咱们支持的观众就别吝啬了,清灵9981
91,韦正，咱能不能搞把大的，咱搞一个热播二十年的系列片出来，咱镜头里出现的每个演员每段对白都是经典，期待破n,MAGNIFIQUE澜辰大海
92,李佳航发福了，以前多帅啊，减减肥哈，太胖对身体不好,筱婉^O^☁
93,韦正微博曾说过:若此生能拍摄破事精英第三季，则会打破爱情公寓破事精英的次元壁，将这两个时空打通！！！兄弟们，快把热度顶起来！[呲牙],明天我等你🥰
94,评论加一[应援]我来盖楼大家支持本剧的可以在这层楼加一 给剧加评论数,Poor Bank
95,好希望看到董事长长什么样子，第三季第三季[应援][应援][应援][应援],哈哈哈哈ssssas
96,每天每集十条 我就不信没有破3！,快乐冲浪
97,会员就是看破一开的，一直在等这部剧的更新,______べ浅情、
98,一定要有破3呀，唐海星是董事长的儿子的这个洞补上呀[应援],爱你6666🍄2
99,第一天6集，还剩18集，也就是还有9天，18/9=2集/天后续[应援][应援][捂脸笑],匿名用户
100,真的很好，虽然是喜剧，但是反映的是现实[大拇指],青山羡鱼.
101,没有热度的话，经费就不足，就没第三季了,青山羡鱼.
102,第二季果然没让我失望，开头甚至还联动了爷青回[狗头],一口肉松加海苔i
103,热度低，可能没有第三季了。[大哭][大哭][大哭],cfhb xfhb vhh
104,怎么没人告诉我第二季播了，才看到😭😭😭,名人名言宝典
105,来了来了，终于等到第二季了[应援],星空与海❤️
106,啥时候上的啊[捂脸笑]更完了才发现,啊哈哈哈哈嗝更
107,靠  什么时间更新的  我都不知道[捂脸笑],Rainbor.
108,很喜欢破事精英，真的希望出第三季，宝子们快冲，多增加一些流量，好出第三季~,戏江.⭐
109,顶一个，是没怎么宣传吗，才看到,爱看电视的东方碧曼
110,真的非常好看，已经数不清看了多少遍了[色][色][色],我若踏雪寻梅折枝相寄
111,这个宣发也太拉了吧。  我到现在才知道他出第2季了。。。,网盘6666
112,4800大厨，这导演认知等于零，看了半集 啥也不是,1111关
113,我不管了，伟大CP怎么可能不再去确认？,）绝色护额吃饭打电话
114,破事骗赞[狗头],啧啧啧999☔
115,韦导加油一定要出他个10季[呲牙][呲牙],Shieda·Kayn
116,感谢破事精英2带给我们的快乐，期待第三季[大拇指][大拇指],情自鈡慕
117,很喜欢破事精英，真的希望出第三季，宝子们快冲，多增加一些流量，好出第三季~越来越喜欢看了😍,dj大姐大🍓
118,你他妈热度怎么还能降,宛安安安
119,为什么又要白金投屏高清了，[捂脸笑][捂脸笑][捂脸笑][捂脸笑][捂脸笑][捂脸笑][捂脸笑],唐景佳a
120,有没有没看过第一季的？,夏荷A88
121,第一集我怎么就感觉有点真实了,世无碍🎪
122,四万多的评论变成一万八是什么鬼,德云死忠粉👑
123,看过第一季就知道会不准时了[呲牙],牧歌无人机
124,若愚海星cp组啥时候能有进展呀[应援][应援][应援],优秀的别别别
125,不知道说什么发这条提升热度,相貌堂堂的夫夫
126,不知道如何提升剧的热度，但是我发15字以上的评论说不定也是一种方法，总之破事精英热度给我破8000！！！！我们一定要有第三季！我不要我的青春留下爱情公寓那样的遗憾！等了十年才等来爱5。现在我想让破事精英陪伴我们！！！我们大家一起努力！！！[玫瑰花][玫瑰花],破事部永不散场！！！
127,已经刷了一遍现在二刷，真实感受，第二部的质量高第一部不少。剧本在现实情况和娱乐之间拿捏的很好。剧情的流畅度，内容质量真高了不少，所以更期待第三部，到底会让这个故事到达什么地方！！！！,李！路远
128,[应援][应援][应援]支持破事精英2，看破事精英的，绝大部分都是爱情公寓的老粉，有老粉支持，热度不会差的，大家为破3加油吧[爱心][爱心][爱心],婷儿呗😊
129,导演拍这个剧是用过心的自从听说有破事精英二就一直很期待，终于等到了[应援],听雨🎋🐷✌
130,热度最高居然才6000多，现在还在持续下降[捂脸笑]真的很期待破3最好还有破4[应援],爱奇艺VIP什么时候降价
131,3遍了给点热度吧。要不来年没得看了。,呵呵呵默默
132,唯一值得充会员追的剧,余香炒肉丝✨
133,这一季 哪些集是互动的或者多结局的呀？,荧光照耀了
134,还不拍第三季呢？驴都不敢这么歇,2236386132
135,芜湖！！！就喜欢你的不准时！！！,向霸天
136,嗷嗷，发现一部好剧破事精英一定要出三哇。。。一定要！！！！,爱喝红酒の司空水竹
137,前几天还在热度榜上，现在怎么掉下来了呀,王云曦9527
138,来了来了！！！下饭剧来了,她的鼻子没有孔
139,什么下头电视剧,从前有座山 山里有个喵
140,"说看法吗？我是为了破事精英才开的会员！要不然我是不会用爱奇艺的！
希望破事精英3赶紧拍！[应援][应援][应援]",破事精英2
141,悄无声息的就上映了，破事部你太低调了,青柠檬味的雨点
142,"看第一季的时候我还想唐海星会不会真的是陆喜发的儿子，看完第二季后我觉得唐海星真的就只是患有妄想症。现实中，这种人挺可怜的。
网上都说喜剧的内核是悲剧，我并不很赞同，因为很多喜剧确实只是单纯的喜剧；但破事精英的内核的确很悲，我想，这也是它没有大火的原因。当今，大多数人都活得很压抑，自然就更喜欢看一些无脑爽的剧。当然，观众也能喜欢上破事精英这类影视剧，但前提是批判的力度得足够大。为什么呢？因为批判力度小约等于没有批判，这样一来就仅仅只是把悲剧展现在观众眼前，只有力度够大，观众才能从中收获鞭笞罪恶的快感。",全世界最好的酒
143,"这评分不对啊，几乎都是10分怎么就只有八点几分呢
",葡萄不酸1
144,全剧我抢到第一了,小样☺️🍀
145,终于出第二季了！！！！！[色]说到做到的导演谁懂啊[色]绝不溜观众才是好导演[害羞],一世欢喜，一世流浪
146,这部剧热度不够是不是宣传上少了一些，可是真的好好看啊,抹茶甜点
147,自从破事二路透出来就期待，终于等到了[呲牙],清风🎈璞玉
148,为什么天天刷还是上不去，明明我们弹幕多,Railway Ren
149,"第一季咋没了。呜呜呜呜 请问有人知道还可以在哪儿看吗？
",【Why？】～
150,家人们大家努把力，猕猴桃的算法是这样的，大家尽量都在晚上19.30更新的时候一起观看最新的一集一起发弹幕评论，这样热度才能上去，有的朋友可能之前没时间观看前面的集数，但也希望这几天晚上更新的时候观看新的一集，大家集中观看发弹幕评论热度才能冲上去，能不能有第三季真的靠大家了[奋斗][奋斗],今日無事
151,坐等破3上线  大家多评论呀  刷刷热度,我们不散场
152,兄弟们，快把热度顶起来！破三就在你们的点赞评论[应援][应援][应援][应援],明天我等你🥰
153,强势回归，慕名而来，破事精英2还是一如既往的好看,向日葵的呼唤
154,增加热度[应援],萱萱0415
155,为什么我对所有情景剧都不感冒呢？就算是曾经的经典～[捂脸笑],点了个点儿😁
156,"好家伙，这居然还能有第二季
[狗头]",Felixwzs
157,这热度怎么还倒退啊无语,xxxxxyou❄
158,真心推荐 耐下心看了几集后绝对上头的那种[应援][应援]好喜欢,真的是小白啊
159,这里面的演员演技真的在线，代入感很强，让人身临其境，男主真是我生心目中的男神呐[色][色][色],空之要5e84
160,太好看了,兜都，
161,#盘点剧中很敢说的名场面#来了来了，听说第二季更好看[大拇指][大拇指],安娜晓主
162,第二季果然没让我失望啊！唯一值得充会员追的剧[应援][应援][应援],离心TNt💋
163,怎么增加热度,武姑娘家的董先生
164,看完第一季破事精英，来支持第二季的,辉辉174☔
165,终于上映了，期待很久了,弃♡爱ᝰ
166,就是喜欢不准时的来看剧,断桥烟雨73833
167,大家一起加油把热度弄上去，多发弹幕和讨论，导演才可能拍第三季[应援],一起干火锅
168,不说了 小破值得[应援],皮蛋瘦肉周女士12138
169,#盘点剧中很敢说的名场面#狗子好帅！[666][应援]莫菲的白裙子好看[色],果离一梨
170,开场原来像是做梦一样，我以为就这样的剧情[捂脸笑],芯～🌟
171,"我就猜到绝对不可能准时的
",温文尔雅的✧*。٩(ˊωˋ*)و✧*。🌟
172,说句实话以前是看狗哥，张大炮过来看的，现在里面每个人都好喜欢，已经被带进去希望有第三季大家加油啊有没有看我们的了[应援][应援][应援]点赞评论转发啊不然第三季悬了[捂脸笑][捂脸笑],小薇薇的小跟班
173,更新了，我来了[色],然然你在哪adsry
174,这剧太好看了，看了笑坏肚皮[捂脸笑],小松鼠xiaosongsu
175,六公主都推广了[微笑][微笑][微笑]热度你该涨涨了,璃墨幻雨
176,就喜欢你这不准时的样子[狗头],七月清风灬
177,这部剧所展现的拍摄方式，以及播出的方式。对于社会现实问题的反应。对于未来科技发展的一些思考。已经已经不能用喜剧来定义了。编剧，演员是有生活体验的。拍摄方式的创新，表演方式的，题材的创新。是其他的剧不敢涉猎和不能涉猎的。其他的剧​没这个能力知道​吧。,萤之光啊
178,破事部真得很新颖，而且是可以让人接受的，现在电视剧的确很多新颖的，但是简直无厘头,韓夫人lb
179,请叫我第一名好吧[色][色][色],宽容的烧掉你的脑
180,江湖瓦舍没还没上线你倒是来了,我美吗～🏖
181,热度昨天还有6500，咋又掉下去了[敲打],浅清风😀
182,破事精英就是这个社会，破事部里面每一个人，都是我们自己，老胡代表着为家庭不得不低头的我们，乐乐代表这我们的初心，若愚代表着我们想得到的交际能力，莫菲代表着我们反抗的想法，乐乐阿杰代表着我们内心懦弱的一面，海星代表着我们幻想的一面，这些都是我们自己啊[应援],"l
lgq
lgq"
183,在班级里面看小破事[捂脸笑],渡梓騰
184,大家一起顶，争取能有第三季[爱心][爱心][爱心][爱心][爱心],用户4eba9adb
185,看过第一季的来集合了,爱上你了2022
186,真的很喜欢破事精英，以及剧中的的每一位演员，韦导真的是用心了[应援][应援][应援],不是安徒盛
187,[色][色][色]这几个演员在一块 这部剧就不能差，我要看他们飙戏了[大拇指][大拇指],🌸花好月圆图片🌸
188,李佳航终于站起来了，500强,清墨￡921
189,啊啊啊啊啊啊居然有二，我哭死,郑植玮
190,哇，我的快乐又续播了，终于又有电子榨菜了，之前破一我都连续观看好几遍了,白辞茉茉
191,这部电视剧简直是一场视觉盛宴，每一帧都充满了细节和美感，让人不禁想要一遍又一遍地欣赏,凡饿赛
192,"虽然会有点疲惫,可是好看的电视作品确实就是有吸引我的力量。",凡饿赛
193,趁我不注意第二季就开始了。本来还在重刷着第一季,7小妮🌼
194,第三季第三季啊,ZSF一直在原地打转
195,第三季第三季,ZSF一直在原地打转
196,什么时候更新的,一杯浊酒一笑天涯
197,超好看的情景喜剧，笑得我饭都喷了,凡饿赛
198,大家快多多支持破事部，让破事部能延续下去，其实最主要还是为了能看见狗哥[狗头],秋梨丶
199,啊啊啊啊啊啊导演你终于拍第2部了，终于等到你,醉卧皇城叹风月
200,啊啊啊啊好速度的第二季！！！[色][色][色][色],陈怂怂哦
201,拍的很烂除了搞笑一无是处远不如爱情公寓拍的好感性一些问题在现实中根部本解决不掉好假,我爱眼巴巴
202,不理解不理解，那么好看的电视剧热度那么低？,凡饿赛
203,居然开始二了！！！火速赶来,仙人掌_MW
204,超赞，延续了第一部，却又比第一部多了一丝欢乐，很期待后面的剧情,凡饿赛
205,强尼和兰尼相爱相杀,chenyuan辰
206,破事精英x   cp精英✓,chenyuan辰
207,好喜欢里面的人物。,晨曦dxc
208,去年差不多这个时候看的第一部，没想到居然还有第二部,桃城武1
209,真的不希望有第三步,差不多samik
210,丽萨是爱情公寓里的丽萨吗？,我是姚较瘦
211,为什么热度上涨的这么慢[微笑],白鹿仓😄
212,韦导做这部剧真的好用心阿，质量肉眼可见的高，破事不仅仅是单纯的搞笑剧，更多的是讽刺了生活工作的种种不合理，每集都感觉过得好快，这就证明了这部剧真正的让我全身心投入到里面了，希望小破2能达到它该有的热度，我好想看破3阿,狂野π🍂
213,莫菲新皮肤真不错[大拇指][大拇指],安娜晓主
214,安利好看好看[大拇指][大拇指][大拇指],安娜晓主
215,热度为啥上不来呢？,姜大大f
216,"挺好看的 但是不吹不黑的说一点吧……感觉成果的演技很尴尬
",铜锣烧真好吃.
217,出三季 谁懂我这种小时候一直看爱情公寓到破事 我真的很爱 希望一直出 求了,云间杳杳星
218,乐乐笑容很治愈,chenyuan辰
219,第一季刷了二十多遍，有空就看，有空就看，第二季更有趣，更炸裂，希望破三、四、五、六…一百，早点上线[666]。         破事部是能带给我力量的好伙伴[应援],super。。。hou
220,看完大结局了，期待破事3,刘Rainbow0429
221,从第一季一直看到第二季，看似每一集都没有什么关联实则关系重大，而且每一集都有新的立意，每一集都站在一个新的视角去看一个很大众的问题，让人感同身受，很容易共情，也会埋下许多伏笔，（比如今天的兰尼）还有许多科技集，也是不禁感叹韦导脑洞太牛，其次就是演员敬业程度简直了，全员演技派每一个配角放到如今娱乐圈都吊打一众流量，这么好的剧就因为没有“流量”被一众烂剧吊打，压热度，271你们好意思吗，这样的好剧被看到才是你们的本事，一直打压算什么，欺软怕硬 总之我相信好剧是会被看到的，像这样写实敢写敢拍的剧真的不多了，大家且看且珍惜。也希望大家可以多多贡献热度，别问为什么问就是孩子还想看😭,CokeZERO⭐
222,近两年唯一一部比较期待的剧,chenyuan辰
223,这些剧情都是一镜到底的，太厉害了,chenyuan辰
224,这全部服装就得花不少经费了吧,chenyuan辰
