,0,1
0,要是没有女主的话可能会更好点,@垃圾人物
1,"#洛星星身兼数业惹人心疼#本次话题活动圆满结束啦！按照互动数（点赞+回复）排名如下，恭喜以下用户抱走我们的奖品！

1-5位的用户获得随机主演签名照有：
1、＆`Miss、you＇
2、吸氧气的懂事
3、木子那个李
4、氧气满满
5、教练我想打篮球

6-10位的用户获得周边T恤1件的有：
1、会吸氧飞的鱼
2、大虾大虾大虾
3、松粟酒有五十度甜
4、同珠
5、3209雁

11-15位的用户获得黄金VIP会员月卡1张的有：
1、静呀~
2、咯叽咯
3、大李的小懂事儿
4、炸毛可乐
5、帅哥13141526

领奖流程：私聊官方账号“评论小桃君”发送“领取奖品”即可领取。奖品将在7个工作日内陆续发放，请大家耐心等待。
❗注意：7天内未主动联系“评论小桃君”领取奖励，则视为放弃哦！

谢谢大家支持，希望大家能在这里收获开心！常来互动！
折叠
#洛星星身兼数业惹人心疼#",评论小桃君
2,木子洋的帅气可不止一点，那可是帅气爆表[应援],大虾大虾大虾
3,#洛星星身兼数业惹人心疼#身兼数业的星星让人心疼也让人佩服更让人羡慕！心疼他每天早出晚归的挣钱，佩服他的不怕苦不怕累，羡慕他有何阳光和一群好伙伴！,同珠🤗
4,看到中间我还紧张死有女朋友。看到后面笑死了，女主真的只是工具人，我只能感叹导演真的很会，真的很会[大拇指],CrisKaa
5,#嘴强王者木子洋是有点帅气在的#有被木子洋惊艳到！好帅[色],木子那个李🍑
6,这是双男主吗[色],杨玉环飞天
7,cp是不是双男主 不是就不看了,雷咯路
8,#嘴强王者木子洋是有点帅气在的#不光帅气，木子洋还很温暖善良啊[可怜],氧气满满
9,嘿嘿就喜欢这种双男主的剧[应援]刚看完棋魂,皮皮子💯
10,心疼星星，真的太不容易了,咯叽咯
11,来一个木子洋这样的大帅哥！我可是非常专一的人，爱男人只爱李洋,Dasy呆兮
12,这是爱情剧，这不是两个男主吗？[呲牙][呲牙],紫泪无痕love薰衣草
13,#洛星星身兼数业惹人心疼#这个我一天内全部看完了，给我感觉还是很不错的，大家可以看看[色],帅哥13141526
14,有谁是磕cp来的吗[应援]？,夜木木夕！
15,#嘴强王者木子洋是有点帅气在的#木子洋超帅的，演技也棒棒哒！,喵喵喵喵喵🐾🐾🐾~
16,"#嘴强王者木子洋是有点帅气在的##嘴强王者木子洋是有点帅气在的#本次话题活动圆满结束啦！按照互动数（点赞+回复）排名如下，恭喜以下用户抱走我们的奖品！

1-5位的用户获得随机主演签名照有：
1、教练我想打篮球
2、吸氧气的懂事
3、＆`Miss、you＇
4、木子那个李
5、氧气满满

6-10位的用户获得周边T恤1件的有：
1、大虾大虾大虾
2、喝水楠
3、海底小呼呼oO
4、McHdtls
5、My欧气满满

11-15位的用户获得黄金VIP会员月卡1张的有：
1、喵喵喵喵喵~
2、用户449d1e3e
3、一头肥美的牛
4、irissssooo
5、有一只可爱的小羊

领奖流程：私聊官方账号“评论小桃君”发送“领取奖品”即可领取。奖品将在7个工作日内陆续发放，请大家耐心等待。
❗注意：7天内未主动联系“评论小桃君”领取奖励，则视为放弃哦！

谢谢大家支持，希望大家能在这里收获开心！常来互动！",评论小桃君
17,#洛星星身兼数业惹人心疼#心疼星星，还好有何阳光在一直陪伴他，还有一群好伙伴,＆`Miss、you＇
18,为周楠来的,好名字一次就够
19,[应援][应援]真的很好看具有文化艺术气息，集聚正能量[爱心],დ与樱花祈愿ˡᵒᵛᵉ✨
20,"何阳光这嘴欠的样子，真的让我觉得是木子洋在本色出演哈哈哈哈
",阿童voA
21,这部剧怎么这么不火，感觉挺好的[捂脸笑],时迁月.
22,二刷了，小吴真的很上头[捂脸笑][捂脸笑],用户1f9498a420841
23,#洛星星身兼数业惹人心疼#新的一年，积极的生活吧！[奋斗],木子那个李🍑
24,懂不懂规矩呀，狮角不能用手拿的！[咒骂],Killer－澤
25,是不是双男主cp,莫炅梅
26,#洛星星身兼数业惹人心疼#积极的心态去积极的生活，加油！,氧气满满
27,"是双男主吗
",风一样的人生，水一样的性格
28,封面双男主,哎呀0123🍭
29,#洛星星身兼数业惹人心疼#真的很辛苦，心疼,教练我想打篮球🏀🏀🏀
30,是周楠啊，又出国啦，这是阳光励志的剧吧给他一个好结局哈[大拇指],麽麼糖小钰
31,哪有那么神经病的人，我还投诉你呢,点了个点儿😁
32,何阳光贼聪明！,-脆脆鲨.
33,是双男主吗？,Johnson_小白
34,"＃被木子洋墨镜造型帅到＃
冲浪了这么多年，这是我第一次这么认真的对待。我怀着忐忑的心情拿着手机盯着屏幕，迟迟不敢下手。我怕我一旦说出来，有人会觉得我在拍马屁，又怕我的评论会误导后来的网友。为了写这次评价，我鼓起勇气喝了999瓶忘崽牛奶有信心。我客观，公正，如实的写下自己的评价：木子洋是我见过最帅的男人！谢谢！",海底小呼呼oO
35,这里面的洛星星和人世间里周楠人设差别好大，吴幸键角色塑造力还是可的,珂Jessica
36,夏天和黄轩那种气质真的还有点像的,麽麼糖小钰
37,木子洋这么帅不多拍戏真是可惜了！,海底小呼呼oO
38,木子洋是我的天菜无疑，看起来很潇洒，但实际上很温柔的一人呀,桾梨4.4
39,来4刷了吸吸,拾祺睡不着_.💤
40,#被木子洋墨镜造型帅到#洋哥戴墨镜超帅的,昊哥的 na宝
41,"有被狠狠拿捏到,李洋你照镜子真的不会被自己的脸帅到吗？",軟妹文文
42,"谁能不说个洛星星惨！跟奶奶相依为命，没有父母，身兼数业来回奔波，幸好他有一群好朋友
",南凉小姐姐
43,啊哈哈他们两个在一起真的好嗑啊，感觉你们才最般配,1简单低调1
44,超喜欢热烈阳光的人！喜欢木子洋就是这个原因，总是笑得很开心,六曰的安
45,双男主剧情？,是禾禾呀.
46,谁不想要一个竹马？从小玩到大，最后长成一个大帅哥！今晚就做这个梦!,杰儿的猴
47,来了来了提前开播一次性看完全集不错,笑呵呵的暮雪流年
48,何阳光大聪明[应援],给自己的所有心事
49,木子洋真的好适合演戏[色][色]喜欢！！！,kkkkk子
50,双男主吗,Sariel_qi
51,能一次性看完是我没想到的[色],木貔貅.05
52,除了奶奶和盈盈，星星又多了一个号哥们儿，这样的生活还是值得期待的,小陳很奈斯_
53,木子洋[应援][应援][应援]干啥都好厉害啊！,kkkkk子
54,可爱又温柔 谁会不喜欢呢[色],海底小呼呼oO
55,木子洋帅气温柔身材好 每天看剧都好享受 要二刷三刷四刷[亲亲][亲亲],海底小呼呼oO
56,#洛星星身兼数业惹人心疼#用积极的心态来治愈心中的伤痛，还好有阳光陪在身边，从未远离。,森林里有个女巫
57,何阳光和星星一起出现的画面，我怎么觉得特别养眼呢,我的宝贝微微
58,#木子洋是何阳光本人吧#来一个木子洋这样的大帅哥！我可是非常专一的人，爱男人只爱李洋,逸晨想要点一杯Mojito
59,谁不想拥有一个这样的竹马！李洋你下辈子投胎到我邻居家里吧，我们做青梅竹马呜呜呜,温礼恭谦让
60,听说有在我们大英县取景,LiaoAxc
61,两男孩子都挺帅的，好喜欢呀,，，，，，2🤟
62,#木子洋是何阳光本人吧#来看何阳光啦，竟然能一次看全集，爽诶！,卢江宁
63,#嘴强王者木子洋是有点帅气在的#木子洋好帅啊，还幽默风趣,教练我想打篮球🏀🏀🏀
64,冲着封面双男主进来的，没带很大希望，但[大拇指]没想到把我拿捏了，不错不错,诺宝儿崽
65,确实是有一些的吧 不过肯定是跟我们的小吴相比还是差点的[大拇指],tomorrowKaitlyn
66,为了屠芷莹来看的，难道没有人觉得这个女生长得非常可爱吗，五官这么精致，演技也很自然，而且年龄还很小，我太喜欢她了，可她就是不火，人气不够，拍的剧都是小成本制作的，微博评论少的可怜，期待她被更多人喜欢，我要为她充会员去了,雪莲冰帝
67,洛星星是不是演过他在逆光中告白？ 感觉看着有点像呢🤔,Aurora.！😄
68,那么多年不见，还能一眼就认出来，这样的友情让人羡慕,敖梦彬
69,夏天好优秀，把舞狮都带到外国去了，人还那么帅气，身材还那么好,哟哈哈哈@
70,夏天这个名字就很好啊，主要是现在正冷的时候看着很温暖,二木成林🎀
71,奶奶不记得星星了，看着就难受，毕竟她那么疼爱自己的孙子,瓜皮紫云阁主
72,有时候真的看不得老人家生一点病 也好心疼星星啊 交换生的机会也放弃了,养一只猫。💤
73,看看还有谁不服我们中国舞狮的，就是要这样发扬,魔仙堡小仙女🌻
74,不得不说这个还是很有特色的，比较我们传统文化可不是吹的,零玲玲啦
75,我就说很脸熟，原来是人世间的周楠，楠楠你懂事点，别让你爸妈操心,sky森烯
76,看多了舞台造型，第一次感受到青春版木子洋~这个男人可塑性有的说的！,ShoshanaI
77,一次性看完好爽！,海底小呼呼oO
78,何阳光贼聪明！,海底小呼呼oO
79,竟然可以一次性看完[应援][应援],Lee~_qq1209
80,#嘴强王者木子洋是有点帅气在的#木子洋！！他不帅谁帅！！,＆`Miss、you＇
81,为啥都是全集啊[流泪]没会员,西瓜味的奶昔✨
82,#嘴强王者木子洋是有点帅气在的#拜托！这可是木子洋他不帅谁帅😎,明天，你好！_qq1238
83,为什么这部剧在爱情榜中也有名次啊[666],livelybe0402
84,#嘴强王者木子洋是有点帅气在的#真的好帅！剧里真的很男大学生！,何阳光大帅哥
85,#洛星星身兼数业惹人心疼#太辛苦了[大哭]星星好不容易啊,Jellyyyyy211
86,#嘴强王者木子洋是有点帅气在的#我们准确一点，木子洋不是有点帅气！是帅气值爆棚啦！！！[应援][应援],Jellyyyyy211
87,#嘴强王者木子洋是有点帅气在的#岂止是一点[色][色]李洋直接帅死好嘛[可怜][可怜],大帅b nb
88,我被电视剧封面给吸引过来的～[色][色][应援][应援],金鱼草姐姐
89,让我看看，有多少人和我一样，是为了兄弟情来的,芦泪花
90,好喜欢这个剧啊，全都是少年人,斓曦whcr
91,能去国外宣传咱们的传统文化，星星也足够优秀,开心哈哈哈哈哈哈😜
92,"我趣,我觉得吴幸键真的很有青春疼痛男主那味~",你蟹吖凯凯
93,洛星星就是个移动基站接收器，台词功底让我震惊,心疤i^★
94,喜欢吴幸键才来看的，论是演员，制作团队都很完美,~丿出声来
95,吴幸键小奶狗造型赢很大，全员演技在线！看着太舒服了,几回悠世^★
96,大过年的看点此类轻喜剧真的很舒适，全员贡献教科书级的演技,我是混蛋i~丿
97,我宣布何阳光是本剧颜值担当了，内容满满，节奏快,烟瘾︶
98,我们家吴幸键真的太帅气可爱啦！，故事立意高！完美,拼凑心脏~丿
99,洛星星鬼马天真的性格还挺讨喜的，剧情紧凑，演员台词都很棒,你不止是朋友i~丿
100,吴幸键和木子洋唱的那首歌还挺好听的，故事环环相扣过渡的流畅顺滑,雨未停~丿
101,吴幸键难得演正面角色，马上就拉朋友一起追剧,我奢求不起^★
102,吴幸键的洛星星好帅气可爱好御，开局就让人感到紧张,强烈苦味
103,好喜欢洛星星这种钓系元气哦，演员演技也都自然流畅,不是你爱的人~丿
104,大过年的看点此类轻喜剧真的很舒适，摄影取景也很讲究,玻璃渣子扎我i
105,吴幸键把我的梦中洛星星演活了，镜头都是电影级的,弹钢琴的小女孩A
106,吴幸键的声线太适合洛星星的元气人设了，主演神仙阵容加持,爱看花花的草草
107,有些小bug，不过也无伤大雅，导演转场真的厉害，节奏快,余温缠绕i
108,吴幸键入股不亏好吧，那鼓劲儿实在是太到位了,痴情狗儿是你@
109,可以算得上是恋爱何阳光之光了，跟着老爸老妈看的,不如承诺来过
110,终于有个何阳光颜值符合恋爱定位的剧了，情节张紧有度,小仙女不怕
111,很喜欢这部剧的群戏，剧中美术、服化道、摄影、视效方面也挺好,葬心爱。’
112,何阳光和洛星星在屋顶的戏真的很动人，马上就拉朋友一起追剧,专注吃喝玩乐
113,喜欢“贴贴夫妇”的甜蜜日常，这个电视剧我看着还行啊,___空城旧人
114,我宣布何阳光是本剧颜值担当了，主演神仙阵容加持,解脱ing︶
115,有种独特的可爱，何况谁说只有帅哥才能是主角，看了还想看,寂寞渐浓~丿
116,从预告到剧集，其实完成了另一重转化，编剧很厉害,trickttt-ai
117,木子洋台词听着就是舒服 轻重缓急拿捏到位，镜头都是电影级的,全世界我都不怕呢
118,木子洋台词听着就是舒服 轻重缓急拿捏到位，气氛紧张兮兮的,给你点体谅i吧
119,终于有个何阳光颜值符合恋爱定位的剧了，气氛紧张兮兮的,我超凶的AA
120,挺搞笑的，吴幸键绝帅，细节要素众多，希望能继续保持,他心太拥挤了
121,木子洋台词听着就是舒服 轻重缓急拿捏到位，细致的人物刻画,想要一个男朋友A
122,木子洋真的是自带喜剧光环的演员，故事立意高！完美,Woobeibei 
123,不开心的时候一看到这俩人就开心了，节奏好剧情紧凑不拖沓,吃福建人的广东人A
124,太有cp感了，没有为了衬托何阳光弱化洛星星，摄影取景也很讲究,分开以后呢
125,好爱木子洋颜值演技全部在线，服化道滤镜还不错,我是易烊千玺的铁头
126,比其他恋爱剧好很多，很幽默的下饭剧，开头高能，全员演技在线,bts的Micasa
127,这应该不是那种纯喜剧，算是轻喜剧或者微喜剧吧，这个故事我爱了。,隔壁家的孩子AA
128,喜欢何阳光大直男的样子，节奏转场掌镜都很好,林允儿的小甜豆︶
129,大部分演员都是用的原声，这个电视剧我看着还行啊,自作多情的霸王花
130,吴幸键演技有进步，一集好短啊，刚追上劲儿就没了,鞍山小家薯
131,吴幸键把我的梦中洛星星演活了，台词功底让我震惊,源味二奶奶^★
132,木子洋演的何阳光可爱度满分，马上就拉朋友一起追剧,月野小梨~丿
133,作为一个爽剧他还是值得五星好评的，把角色演绎得很精彩,一杯四季玛奇朵三分甜
134,就凭木子洋这台词功底也不止这么点呀，这也太好看了吧,元气少女爱赖床
135,洛星星的霸道总裁戳我啊，全员演技在线！看着太舒服了,不想上班的sleep
136,洛星星真是搞笑担当，剧中美术、服化道、摄影、视效方面也挺好,Leo-28Q
137,里面吴幸键的造型服化真的太绝了，情节上设计合理,请叫我肖夫人A
138,洛星星被何阳光完完全全抱在怀里太有安全感了！，剧情紧凑，全员演技在线,chindroid yeah
139,是长在我审美点上的男孩子，灵气得很，导演叙事功底了得,狮子座的射手座A
140,木子洋真的是自带喜剧光环的演员，马上就拉朋友一起追剧,若心向阳A
141,可以算得上是恋爱何阳光之光了，导演和编剧还是非常用心的,大雄弄丢了哆啦A梦
142,何阳光又直又可爱的设定戳我，剧情紧凑，全员演技在线,ECHO爱吃荔枝
143,足够的单纯，雀跃和一点小心思，这个开头就比其他几部多了,擎天一猪
144,有种独特的可爱，何况谁说只有帅哥才能是主角，演员和编导继续保持水准,嘉闻在加温~丿
145,脑洞满搞笑的，又是一个小爽剧，情节上设计合理,摘星星给小闻^★
146,吴幸键和木子洋唱的那首歌还挺好听的，剧情十分吸引人,每天八杯奶茶A
147,吴幸键出道以来最好的角色贡献了最好的演技，剧照也很有氛围感,克劳帝斯大公
148,何阳光误会洛星星喜欢自己的那些桥段 也太搞笑了吧，是好看的没错,边伯贤怀里住
149,吴幸键光听声音都觉得好性感，主创团队真的辛苦了，谢谢你们,梵高的爱人~丿
150,好爱木子洋颜值演技全部在线，全员贡献教科书级的演技,观一叶天下秋周
151,木子洋突出情感也丰富，小表情小状态都很出戏，剧情也接地气,wiki juice
152,吴幸键小哥哥真的太帅气可爱了，剧情能不能快些走,Yoshigahara Riku
153,喜欢预告那种风轻云淡扮猪吃老虎的爽文，镜头很棒,羽言羽生
154,看好吴幸键，是个超级棒的演员，马上就拉朋友一起追剧,等不到结局等时光
155,为了看吴幸键去的，很喜欢这部剧的台词和背景设定,YoungChimpanzee
156,好爱木子洋颜值演技全部在线，论是演员，制作团队都很完美,元气满满小野马
157,说一句吴幸键好漂亮啊，不管是剧的质感还是节奏称得上是优秀,小刘在线磕cp~丿
158,木子洋突出情感也丰富，小表情小状态都很出戏，我觉得挺好看的呀,没事想想球
159,洛星星被何阳光完完全全抱在怀里太有安全感了！，节奏比较明快,想挣钱了^★
160,木子洋关键是抓住了角色的灵魂，让人越看越爽，道具细节很用心,西华门女阿姨。
161,就凭木子洋这台词功底也不止这么点呀，剧中美术、服化道、摄影、视效方面也挺好,毛毛的下午茶A
162,太有cp感了，没有为了衬托何阳光弱化洛星星，值得一看的好剧,小语小于
163,木子洋台词听着就是舒服 轻重缓急拿捏到位，剧照也很有氛围感,黑暗中的微光A
164,终于有个何阳光颜值符合恋爱定位的剧了，剧情也很抓人,丛初柔小童鞋
165,这部剧比恋爱小说的故事情节还要精彩呢，刚开始那剧情真的有点感人,蓉儿正梳妆妹妹
166,比其他恋爱剧好很多，很幽默的下饭剧，镜头都是电影级的,粉红色的天际线
167,好爱木子洋颜值演技全部在线，剧情和质感完全上等,变美变强变厉害
168,吴幸键和木子洋唱的那首歌还挺好听的，拍摄手法也比较细腻,晚冬20210301
169,我真的笑yue了，好久没碰到这么逗的国产剧了，导演很注重细节,是寒少鸦A
170,喜欢吴幸键才来看的，各方面都很有质感的一部电视剧,落泪必有渣男
171,吴幸键难得演正面角色，导演转场真的厉害，节奏快,万物归壳A
172,觉得木子洋演的还是挺自然的，论是演员，制作团队都很完美,叁剩三十来了
173,洛星星被何阳光完完全全抱在怀里太有安全感了！，演技让每个观众折服,少爷起床吃饭啦
174,哈哈哈剧情有意思，弹幕也有意思，人物的眼神、角色的设定等都很巧妙,SixoneA
175,感觉吴幸键木子洋两人还挺有CP感，这个电视剧我看着还行啊,绵羊绵阳
176,不开心的时候一看到这俩人就开心了，剧情能不能快些走,小刘在线吃瓜
177,木子洋演技不错，原声听着舒服，剧情和质感完全上等,如此完美_宝贝
178,剧里的洛星星属实元气天花板了，台词功底让我震惊,小狐狸在线~丿
179,何阳光误会洛星星喜欢自己的那些桥段 也太搞笑了吧，故事立意高！完美,造物者_XL
180,吴幸键把我的梦中洛星星演活了，马上就拉朋友一起追剧,咕噜丹er
181,里面吴幸键的造型服化真的太绝了，台词功底让我震惊,众生膜拜永久
182,吴幸键把洛星星鬼马的样子演得很自然，编剧的立意还是蛮好的,饭圈小刘
183,木子洋演技、台词比流量小生好太多，马上就拉朋友一起追剧,勇气一直在的A
184,吴幸键和木子洋还蛮配的，主创团队真的辛苦了，谢谢你们,控制_悲恸
185,洛星星原声出演台词很不错，，导演镜头精准，没有废话,Zhang莹莹︶
186,这是第一部我感觉故事和广告之间那么契合的一部剧，会讲故事，导演组会拍,爱滑雪的猫
187,何阳光这个颜我真太可以了，演员台词功底好棒,Forksss~丿
188,洛星星是喜剧人吗，一集好短啊，刚追上劲儿就没了,立风飒我A
189,好喜欢洛星星这种钓系元气哦，台词功底让我震惊,D宛宛宛与
190,吴幸键好可爱好灵动，演员们的精彩演绎看得让人目不转睛,花少一生推
191,大过年的看点此类轻喜剧真的很舒适，论是演员，制作团队都很完美,地下天鹅绒A
192,吴幸键出道以来最好的角色贡献了最好的演技，节奏好剧情紧凑不拖沓,Katrina9A
193,吴幸键演技依然很不错，这个电视剧我看着还行啊,landcruiseA
194,我家吴幸键拍的好开心呀，在节奏感快，演技都很好，,梦梦在学习。
195,木子洋关键是抓住了角色的灵魂，让人越看越爽，场景真实高度还原,Dharma_Geek
196,洛星星被何阳光完完全全抱在怀里太有安全感了！，服化道滤镜还不错,亥乃亚克山冬
197,喜欢预告那种风轻云淡扮猪吃老虎的爽文，剧情挺流畅的,晴空正好追星日
198,终于有个何阳光颜值符合恋爱定位的剧了，演员都是实力派,玛绿莲white
199,光颜值都能撑起一部剧，叙事的节奏很有沉浸式,PolarisbaiA
200,吴幸键的作品，值得一看，剧情紧凑，演员台词都很棒,🌙沐呈悦
201,#嘴强王者木子洋是有点帅气在的#木子洋是有点帅气在身上的，他的帅气不同于以往我们所认知的帅气，他是一种很多元的帅气，融合了以往我们认知中觉得普通但组合起来却很惊艳的特点。,森林里有个女巫
202,出不去了[捂脸笑]就喜欢嗑糖,💙BKPP❤️00
203,这封面[捂脸笑][捂脸笑][捂脸笑]两男主谈恋爱,的地方换个号哈哈哈
204,喜欢木子洋还是在李雪琴的抖音里，觉得这个男孩好贴心又帅,老婆婆家呢
205,双男主吗宝贝们[色],白king..
206,#嘴强王者木子洋是有点帅气在的#那是自然，何阳光简直就是木子洋大帅哥本色出演,yang咩咩1997
207,#嘴强王者木子洋是有点帅气在的#哥真的有进步！自己配音听着确实更舒服一点。很喜欢～洋哥多多演戏！！！ost也好听[色][色][色]是我近期的电子榨菜了,坚持吃糖不蛀牙
208,#被木子洋墨镜造型帅到#他戴墨镜一向很可以的，肩宽穿西装也特别好看,喜欢喝牛奶的诸葛芮欢
209,夏天这样子真的很帅啊，简直就是我心目中的男神,年少太轻狂😍1
210,你们这样子我可就要误会了啊，不过确实是很好,酱心酱意
211,盈盈这口才，就没什么是她办不到的事情，是个做生意的好料子,需要的人解释权
212,搭档没在，一个人也可以搞定所有事情，夏天的能力也很强,壬秋的夏天
213,看不出来嘛，奶奶居然这么会打麻将，这就是老年生活[666],元哈基宁
214,木子洋简直不要太搞笑 看他跟人吵架的时候 我都不生气非常想乐,自带bug的少年
215,也体验一下外卖小哥的生活吧，看看他们多不容易,今LOL哦可以
216,何阳光真是好阳光 我想跟这种人做朋友 会温暖身边的人,九月茉莉xfgh
217,没有最喜欢，只有更喜欢！木子洋我听说你在剧里也有舞台？一把子期待住了！,IC亚瑟
218,何阳光这嘴欠的样子，真的让我觉得是木子洋在本色出演，好喜欢看👀👀👀👀,骥一跃
219,异地恋很多人都失败告终，但是相爱坚持的人我觉得不会,日不落雨花
220,这就所谓的闺蜜友谊，我也觉得可以呀，你们要幸福哦,呜呜呜，🌈
221,两人互相都对彼此好好啊，不会都喜欢着对方吧，有莹莹照顾奶奶，夏天都很放心,哟哈哈哈@
222,何阳光这个角色是本色出演吧太可爱啦有点儿欠嗖嗖的的哈哈哈哈哈[色][色][色][色],八号同学8
223,这么好的机会可不能轻易错过，就是说下次可就没了,茉莉7506
224,妈耶 希望我也可以遇到一个好哥们儿，有福同享，有难同当的那种,思福
225,老师真的很为夏天着想，希望我也能有那么好的运气,我就不是可爱的宝宝👶🏻😍
226,老了约着人一起打麻将，奶奶的生活过的还是很充实的,孔雀暖暖
227,何阳光，感觉你唱歌真的太好听了，我听得真的很快乐了啊,在你面前我就是我
228,这就是你们不理解舞狮的魅力，这是两个人合作的默契,分飞🎁
229,也不知道，到底是多铁的关系，才会被人记那么多年,滴滴  .
230,看着星星努力生活的样子，我都被感染了，没有什么是不值得的,骨灰该喝喝
231,哈哈哈第一次听说，舞狮和打牌是一个道理，我觉得很对,kvhiciy
232,"虽然台词衔接、布景等等都还有些瑕疵，但作为网剧来说已经很不错啦！着重表扬现场收音！！别配音了真的很怪[奋斗]
以及木子洋饰演的何阳光，演技有点突飞猛进的哦~",格舐
233,希望星星奶奶身体好点儿，这样他就可以离梦想越来越近,和泉🍀
234,从单纯的阳光男孩，到扛起家庭的男子汉，星星改变了很多,花海的心灵🍑
235,梦想和现实总得坚持一样，坚持了梦想就没办法照顾奶奶，夏天太不容易了,舒暖和
236,就知道夏天没有那么容易就留在新加坡留学的，果然奶奶就病了,抵扣卷怕特特🎉
237,阳光的演讲确实很有感染力，才制服了一些不听的人,故人归，旧人回
