,0,1
543,吴幸键是我心目中的洛星星，演员演技炸裂,麻木的那么快A
544,木子洋的演技越来越好了，演员演技炸裂,常驻火星的火星君
545,哈哈哈剧情有意思，弹幕也有意思，强烈推荐,小龙出生在世界
546,吴幸键也太御了，跟着老爸老妈看的,有_的地方就有我
547,吴幸键很适合这个角色，画面高级,小福泥我爱
548,木子洋好有灵气我觉得，很有意思,火龙果冰淇淋^★
549,吴幸键是我看这部剧的快乐源泉，气氛紧张兮兮的,薛定谔的猫宠物
550,这剧的节奏我真的爱了！！又快又稳，实地取景真不错,很好次的葡萄干儿
551,吴幸键可可爱爱就适合演洛星星，追得津津有味,精致的不愿揭穿
552,木子洋真可爱，感觉质感好好呀,鹿家小树懒
553,我宣布何阳光是本剧颜值担当了，安利安利,能够吓到你的哥斯拉
554,木子洋演技也有进步，剧情和质感完全上等,○安之小小
555,大过年的看点此类轻喜剧真的很舒适，看起来很舒服,阿完家的n次方
556,吴幸键好看！，会讲故事，导演组会拍,懂得人能看透
557,木子洋的演技越来越好了，运镜很专业,笑看万物是假象
558,对于男性的镜像讽刺也很到位，看了还想看,小小海螺~丿
559,木子洋演技不错，故事立意高！完美,半世流理小野狼
560,星星居然有点子帅，这个故事我爱了。,xiuxiubiubiu^★
561,喜欢何阳光大直男的样子，真的追上头了,jc小尹姐姐
562,这应该不是那种纯喜剧，算是轻喜剧或者微喜剧吧，追定了,浮夸只属于华总
563,看了目前所有更新的集数，挺好看的，这个故事我爱了。,小朋友你好^★
564,洛星星是惊喜，服化道可以,幼儿园最靓的障仔
565,木子洋性格真招人喜欢，烧脑呀！,白月光_炸
566,为了看吴幸键去的，编剧真的还不错,天仙落泪_卷
567,我是来磕颜的，从剧情到镜头都很自然,Cc来吃烧仙草
568,吴幸键外形身段也好看，角色充满感情,壳总王者不朽
569,吴幸键的眼睛大大的，好有灵气，情节上设计合理,不熬夜只养生
570,洛星星原声出演台词很不错，，已经推荐给朋友了,认真摸鱼的菲菲
571,怎么那么会说情话啊，运镜很专业,好景多长_暗香
572,洛星星演技还不错诶，剧情紧凑,原味小仙女A
573,木子洋真帅，人物的眼神、角色的设定等都很巧妙,五块钱的抄手
574,何阳光真实的当代男友模拟器，烧脑呀！,说有多复杂
575,强调两性平等，三观正，已经安利同事,古今天地_任我主宰
576,吴幸键演的很棒，导演叙事牛！镜头剪辑牛！,天尽头苍茫
577,大部分演员都是用的原声，这个画面爱了,春暖花会开*
578,太甜了这个剧情，服化道可以,绵绵_随机掉落
579,何阳光太符合原剧设定了，伏笔很多,黑土养一方人
580,吴幸键也太御了，剧情也很抓人,来自火星的土豆A
581,洛星星的演员演的不错，气场十足，暗流涌动,短野原美绪A
582,令人惊喜的默契，剧情的起伏很合理,擅长清空的猫
583,木子洋演得不错，会讲故事，导演组会拍,Seven_VA
584,太好看了吧，好喜欢木子洋，质感很不错,OmegaLeeA
585,吴幸键很灵动很放松，剧情和质感完全上等,似风如诗的喜
586,太有cp感了，没有为了衬托何阳光弱化洛星星，非常喜欢,意难平也得平
587,洛星星演技很在线，质感很不错,地面煎蛋的夏天
588,何阳光怎么那么会说情话啊，编剧真的还不错,中年人类
589,洛星星是喜剧人吗，在节奏感快，演技都很好，,家住白云区的周先生A
590,大部分演员都是用的原声，看起来很舒服,儒雅的嬴乐安
591,吴幸键很适合这个角色，导演很注重细节,努力维持人形的香菇
592,木子洋看久了，也挺顺眼的，电影质感,LakeOnFire
593,木子洋太有观众缘了，开局就让人感到紧张,中场休息时搓澡
594,吴幸键也太可爱了吧！，演员选的都很好,吃不起水果的嗑盐人员
595,好爱木子洋颜值演技全部在线，运镜很专业,黑暗里的49天
596,我家吴幸键拍的好开心呀，剧情也很抓人,怒罗为门
597,#嘴强王者木子洋是有点帅气在的#拜托了，他是谁？他可是木子洋诶！,柠檬hxy
598,在我们学校拍的必须来看看,匿名用户
599,我从天才基本法追过来看吴幸健的,栀暧🌈🤨
600,这是耽改剧吗，有知道的可以踢一下我,理发师肖邦✌
601,直接被帅死，剧里的造型都很好看,shen_qq2870
602,[应援][应援]我们木子洋岂止是有点帅气[应援],兔花哥啊
603,#木子洋是何阳光本人吧#和木子洋一起积极的生活吧✧*｡٩(ˊωˋ*)و✧*｡,爱吃糖的草莓🍓
604,可算是能看了 木子洋我来了,不是何怂怂
605,#木子洋是何阳光本人吧#开始看啦[应援][应援]先留下个脚印,1的³
606,路人来问，这部剧好吗？坐等回复我再看,不想再码字的猪妈
607,#木子洋是何阳光本人吧#都是阳光帅气的大男孩[应援],Ol_iO
608,#木子洋是何阳光本人吧#哥收敛一点哈哈哈哈哈哈哈哈，别把本性暴露了,喜欢喝牛奶的诸葛芮欢
609,就算不能到国外，也得先照顾好奶奶啊，星星,兰兰的天空呢
610,从交换生变成了外卖小哥，正好锻炼一下自己,萌萌星同学
611,有奶奶的支持，一切都变得轻松起来了,嘉 命 难 违
612,星星这英文演讲也太流畅了吧，看着羡慕,移动城堡👏
613,用英文演讲，展示中华技术，可以的！,静雅梅
614,如果奶奶身体好点儿，星星应该就出去留学了吧,水不转山转
615,上来就是英文演讲，这也太有才华了吧,A尔卑斯甜遍整个欧洲
616,这是我喜欢的偶像剧，欧耶,星辰g之恋
617,还有谁能不喜帅欢气的洋哥呢,留星雨☔️
618,看到木子洋我非常开心,世纪如春
619,这集的剧情好好笑，何阳光好帅这集,俩个人的回忆gydh
620,木子阳真是本色出演何阳光。,新城大海✨
621,很喜欢何阳光这个角色,秋天的梦y
622,何阳光贼聪明 老公别抽奖 抽我！,一丝青丝bhgu
623,何阳光的身材真不错，养眼[666],细品岁月dgyy
624,洋哥帅的真是倾城倾国啊[色][色][色],金晨尚
625,舞狮真的是太好看了，太有魅力了,雨歌伴舞
626,"谁能不说个洛星星惨！跟奶奶相依为命，可怜哦[捂脸笑][捂脸笑][捂脸笑]
",糊涂仙人掌
627,木子洋看起来很潇洒。但其实很温柔,吹着海浪的蜗牛
628,木子洋的演技太棒了，终于等到你了,南飞的枫叶
629,木子洋演得真不错，让人有点惊喜！,借风拥你fgy
630,终于开播了，特别喜欢木子洋,楚楚动人r
631,洋哥已经不能说是帅了真是倾城倾国啊,枫树鱼山
632,喜欢木子洋就是这个原因，总是笑得很开心[大拇指][大拇指][呲牙][呲牙],霖霖峰
633,吴幸键角色塑造力还是可以的支持下[色],蔻琦玉
634,周琦这大长腿，想不动心真的有点难，看着养眼[爱心][爱心][爱心],精英余66
635,又是一部精彩绝伦的好剧,洪荒岁月🎋
636,何阳光真的太帅了。木子洋真是本色出演。,旋风少女浩然
637,洋哥带墨镜超帅的。照镜子不会被自己帅到吗？,帅气的名💤
638,精彩的剧情安利给朋友了[爱心][爱心],美丽人杰
639,一群为了梦想努力的人[色][色][应援][应援][应援],女侠仙仙
640,精彩的剧情值得推荐给朋友,香.妃0788
641,又有好剧可以追起来了哦[色][色][色],葛涛哥😁
642,好喜欢男主的歌声，唱的不错。,咔嚓嚓盼盼
643,男主阳光帅气，女主温柔大方，CP感强,欣鑫荣
644,男主阳光帅气，女主温柔美丽,乔乔wa🌈
645,里面的每一个人都超帅，好喜欢。,萌神ớ ₃ờ
646,看到木子洋真的太开心[爱心][爱心],貅美丽
647,看到木子洋真的很开心,信念诶
648,这部剧很有特色，让我很感动。,卡公信
649,支持洋洋，太漂亮了 还喜欢,孙杰影
650,终于开播了，真的是太好看了,春风化雨~🤟
651,看到木子洋就好开心哦,提拉米苏呢🤩
652,一开场就将我强烈吸引了。,鹏鹏哥哥哥哥✌
653,哇，真的太帅，让我芳心荡漾。,甜蜜糖糖老🍡
654,洋哥戴墨镜超帅的，我喜欢,aaa咪咪
655,这剧一定很精彩！男演员是我最喜欢的！,婷子！✨
656,这个剧好有趣 何阳光又帅又憨 乐死我了,青涩童年💤
657,这样的剧情超级棒很精彩[爱心],我想静静呀丫
658,被里面的演员的演技惊呆了。,刚刚完成个
659,这样的剧情超级棒很精彩。,刚发现黄
660,又看到了我最喜欢的男演员。,丰富的风格
661,可能是把名字搞错了吧，不然不会认错人的,晨晨的可世界
662,看到木子洋就特别开心,美丽的枫叶情
663,看他说话还是挺有自信的，这样的男孩子更耀眼,爱你不后悔LZD
664,我有一个像这样的朋友就好了，我可是很羡慕得了,爱笑牙哈哈
665,能有这么孝顺的孩子，奶奶也是很幸福的呢,vvhibfyi
666,从他说话的方式来说，我觉得已经很不错了撒,噫噫噫呀
667,像他们这样在一起我觉得也还是蛮好的，我是支持的,是心情复杂
668,我相信你有一天一定会成功的，毕竟你是这么的优秀,清风-圈
669,夏天这么的优秀，估计会有很多美女喜欢的,晨晨的可世界
670,还好有莹莹照顾她的奶奶，我觉得还是很不错的,呜呜呜，🌈
671,我觉得像这种有才的人，肯定大家都喜欢吧！,爱笑牙哈哈
672,还好他来的够及时哦，不然就危险了哟,vvhibfyi
673,人家在演讲现场啊，直接去现场找就好了,大公鸡头
674,这样的夏天怎么能不爱呢，又孝顺又有才的,爱吃菠萝999💤
675,阳光看到星星就忍不住要追过去哈哈哈,很期待1我
676,洋洋太单纯了，怎么可以随便刷人家的二维码呢,Ink sans1
677,莹莹真的很好，颜值在线，性格还好，经常帮星星照顾奶奶,A丽丽爱化妆～💃
678,一个演讲，一个唱歌，完全不同的乐趣,做自己ling🌸
679,就喜欢阳光这个聪明的脑袋，哈哈哈，可爱至极,傻瓜啊，我去
680,看过的家人们，有女主吗，，有的话不看了，,又充了会员🤩
681,这部剧的主题很棒耶宣传中华传统文化[大拇指],月茗慧是小趴菜
682,除了酒量之外，木子阳就是何阳光本人嘛,月茗慧是小趴菜
683,傻傻的何阳光不就是木子洋吗？[应援],月茗慧是小趴菜
684,看简介是没有女主的意思吗,Ice莎莎🐇🐇
685,四川话听起来特别有感觉，这必须点个赞,遇到了
686,这个歌曲听着真的是太棒了啊，确定是一部好剧,已重置🌻
687,阳光找不到星星，真的很失望啊，快点找到！,小憨699
688,真的好看家人们！！！木子洋演技越来越自然越来越好了👏,蝴蝶蝴蝶小姐
689,何阳光也太搞笑了哈哈哈哈哈感觉是木子洋本色出演[呲牙],小狗今天也在偷喝红酒
690,#被木子洋墨镜造型帅到#这也太帅了吧？没见过这么帅的！！[色][色],小狗今天也在偷喝红酒
691,不是吧不是吧，不会还有人不喜欢这种剧吧,EDwardGaming
692,男大学生何阳光真不错,有一只可爱的小羊
693,木子洋再演几部校园剧吧,有一只可爱的小羊
694,#木子洋是何阳光本人吧#真的很喜欢这部剧！！！木子洋加油！！！！,不是小田是小甜
695,老奶奶孙子有这样的成就真的是值得骄傲啊,爱上李木子
696,这个舞狮是认真的吗，真的是大爱啊,小耳+
697,跟外国人辩论那还不是轻轻松松，安逸,Mr静🤞
698,期待了这么久，今天一看，感觉特别不错,斓曦whcr
699,什么？居然是两个男主的戏，这一下真的有看头了,。清柩
700,我懂了懂了，这就是麻将场上带来的默契,前卫杀手
701,阳光这首歌也太积极向上了一点哈哈哈,大姐一枚
702,醒狮想的可太喜庆了，符合中国人的意向,除了坚强别无选择🤞
703,小哥哥都养眼的很，完了 感觉我不能只喜欢一个,不不期而遇
704,放心吧这里有她照顾奶奶呢，你就安心的去吧,@飘渺😝
705,那真是难兄难弟呀，一点默契也没有,～任颜
706,自己的孙子有了这样的成就怎么能不炫耀呢,快乐树下你我她
707,嘴欠的样子也太可爱了吧？阳光大男孩,落尘TIME👑
708,这部剧真的把氛围感拿捏的死死的，好喜欢,✅。🌸🌸🍧
709,看起来好棒呀，好喜欢这种类型的,喜欢你呀√
710,从抖音那边过来的，期待好久了，看起来真的挺不错,还有谁用这个名字！
711,在这里看看有谁还不爱舞狮的，全部拉过来教育,一场游戏一场梦丶☔
712,好喜欢看这种甜甜的电视剧，根本就停不下来,ELK♡26
713,两人是真的一点也不在意啊！,喜欢9881
714,原来奶奶神智出问题了，是不是阿兹海默？,平平淡淡yxrong
715,是不是男儿还没有出来啊，他们两个太般配了吧,匿名用户
716,看他们同款，我控制不住的姨母笑啊,忆~昔
717,感觉奶奶神智不太清醒了，可能要出事,v你不错
718,阳光真的好帅呀，这样青春大男孩去哪儿找呢？,斓曦whcr
719,阳光一出场就把我给惊艳住了，这人设太有才了,懒鱼仙女
720,奶奶是真人不露像啊，肯定对舞狮很了解,抵扣卷怕特特🎉
721,看小姐姐支支吾吾的，我就知道出了事,🦷小谭
722,星星出去也是为国争光啊，家乡人都骄傲的很,谭二娃🤩
723,阳光也太高了，又逗又帅，这种人间大帅哥我可以！,总琑周知
724,老奶奶太有意思了，还讲舞狮跟打麻将一样,树木—森林
725,星星肯定会一直在奶奶身边的，不会放弃,会疯的快乐小猫
726,阳光真是又能干又帅气，没有星星我肯定要嫁给他,平淡如水 生命如歌
727,阳光真的好呆啊，傻傻的好可爱，剧情走向有点意思,陈越_qq1425
728,奶奶笑起来的样子真的好可爱啊！,抵扣卷怕特特🎉
729,台上的夏天真的是眼睛里都有星星，太帅了,抵扣卷怕特特🎉
730,这竟然全部更新完了，真是让人惊喜啊,浅夏の平淡
731,奶奶这样的性格就挺好的，还有心情在这里打牌呢,匿名用户
732,好喜欢像木子洋这样的小哥哥，要不给我来一打？,爱你不后悔LZD
733,何阳光的出场真是和他的名字一样阳光帅气啊,多可爱啊🐾
734,奶奶到底是生了什么病啊？那么严重,哈哈YY✨
735,这背景是在川渝吧，听口音一下就听出来了,徐鹤蝶
736,这转场来的有点突然了吧，和麻将还有关系吗,鲜花盛开的地方
737,这个开场真的是绝绝子啊，这是我羡慕的生活,燕麦片哟
738,莹莹跟夏天真的配一脸呀，好喜欢他们两个,霜喵喵～
739,夏天：这个表演还只是皮毛，更厉害的还在后面,小馋猫♛啦
740,啊哈哈这是问到对处了，那怎么才可以做到这个配合,娜就刚刚皓
741,奶奶有莹莹照顾真是太好了，夏天对莹莹也很好的,檐叶
742,何阳光是搞笑担当吧，看到他太欢乐了，哈哈[应援],匿名用户
743,我还没有出过国呢，不知道国外到底是什么样,峰松✌
744,怎么出来混还改名字呢，是不是想要隐瞒什么,祺二
745,从小一起的友谊...长大就成闺蜜[捂脸笑][捂脸笑][捂脸笑],闪闪看剧🙊
746,原来小姐姐只是来照顾奶奶的，工具人石锤,liuzile20071016
747,在新加坡感觉华人很多啊，也是挺舒服的,我爱你老婆大人，么么哒
748,这就是中国舞狮的魅力！看谁有不喜欢的,吃一口泡芙🎐.
749,老年人总是很难照顾的，要到位不容易,美好的一天a🥰
750,生活不易，就应该积极生活，要不然就没半点希望了,一个团儿圆
751,这是来找上门了啊？还是故意躲着他不敢见面呢,爱喝绿茶de秃发风华
752,一开始的舞狮就吸引我了，好好看呀,月乖乖🤩
753,得赶紧给奶奶治疗啊，先送到医院里面去,黎吧啦哔哩吧
754,还好有莹莹帮忙照顾着奶奶，要不然夏天还怎么办,爱吃披萨的小猴子🍄
755,咋们阳光这么优秀的啊，还努力传扬中国文化,忆~昔
756,无论如何，都要好好生活下去，星星坚持下来就成功,相伴何所求
757,咱莹莹捯饬起来还挺有那么回事呢,无敌可爱小绵羊
758,这一段英语真的是爱了啊，口音也是非常的正,郭大侠112233
759,外国人还在外面看不起，咋们阳光让你们闭嘴,故人归，旧人回
760,星星是要留在外面了吗，锻炼一下也挺好,虚怀若谷的想有钱
761,"奶奶有莹莹照顾真是太好了，可惜奶奶生病了
",柒￥（
762,啊哈哈很生动形象的演绎，这样怎么能不爱,烟红20030914
763,明明叫星星，为什么改名叫夏天呢哈哈哈,开货车的😍
764,星星回家之后，探头探脑的样子也忒可爱了哈哈哈,燕麦片哟
765,就是说这样的男孩子怎么能不爱呢，简直就是要命,莫让秋风凉
766,真的很可惜了，因为奶奶生病不能去当交换生,小颗粒1111
767,阳光的出场真是和他的名字一样阳光帅气啊,柒￥（
768,舞狮子可是老传统了，必须得发扬下去,耀6003
769,他们两个第1次相遇就是在那么好的环境！,虚幻的我dear
770,感觉这学校氛围挺不错，国人还是比较多的,虞美人Esther🌟
771,啊哈哈老奶奶打麻将都可以锻炼脑子呢,张18185577
772,奶奶居然说的是方言，听着很有感觉嘛，可以可以,阳光小院🏠
773,对友谊最好的诠释就是阳光和星星了吧,喜欢吃生蚝的谷利俊美
774,过年就适合看这么积极向上的剧，嘿嘿,兰竹师
775,阳光就特别想找到星星嘞，俩人赶快相遇,哦里看看偏偏
776,感觉姑娘好像有什么事想说，是不是因为奶奶？,zq500
777,做梦都想吃到星星送的外卖，能吃到的不知道多幸运,开心哈哈哈哈哈哈😜
778,星星去送外卖可还行，能把握得住吗？,素来不予人
779,感觉阳光很积极向上啊，又搞笑的很,从头越。
780,心疼夏天，还好有盈盈这样的老板支持他,爱蹦哒的小猴子
781,为什么要改名换姓呢？是不是家里出了什么事,惟愿信仰永存
782,又不是第一次相遇了，小时候就经常在一起玩,未来与你共生
783,阳光和星星完全是两个性格啊，正好互补,soserfuy
784,好看，上头，挺不错的一部剧，何阳光真搞笑,难治愈丫
785,又有新的下饭神剧看了，这根本挡不住,丑人多做怪661
786,莹莹为了不让夏天担心，故意隐瞒了奶奶的病情,灵敏的monster🍦
787,上头，这时候还去找人家呢，人家已经走啦,外公说回家
788,还找呢，人家都已经走了，你来晚了,顺利吧👏
789,这部剧确实是挺不错的，挺喜欢这种题材的,难治愈丫
790,阳光有这样的家境我真的好羡慕，哈哈哈,啦228
791,就真的很好看的，被木子洋这造型帅到了,丑人多做怪661
792,奶奶得病不告诉夏天，也是为了夏天好,本仙女本仙09
793,夏天看上去很努力啊，怎么会混得这么惨,秐野
794,不愧我等了这么久，期待了这么久，没有让人失望，哈哈,美少女万华镜，，，
795,上头啊老铁们，这是什么神仙剧，太下饭了,外公说回家
796,太上头了老铁，木子洋是何阳光本人吧,顺利吧👏
797,看看人家更新速度，一步到位！[666][666][大拇指][大拇指],牛奶泡桃苏
798,其实积极的生活，不管干什么都非常的好,还有谁用这个名字！
799,上头，哎呀，奶奶运气是真的挺好，开心得很,难治愈丫
