,0,1
0,看了陈鑫海的最食人间烟火来的[呲牙][呲牙],我💕檀宝贝
1,我是看陈鑫海的最食人间烟火味来的,王雪然.
2,新时代看剧，先看演员和导演，看剧情类型，看评论以及热度，最后自我评价值不值得看，有一样的嘛，举个小手看看吧！,天若有情天易老TT
3,谁是看了陈鑫海的最食人间烟火来的呀[应援][应援][应援],馨儿🍉Isabel
4,一博的宣传图竟然是种地吧的照片哈哈哈,be/qq1695
5,好像很多都是从人间烟火色过来看陈鑫海的！[色][应援],纪念裁判50
6,女主太美啦这是吧！请问芳名？,一路平安0603
7,不是男主  果断走了,那就夢裡见💤
8,啾咪博这么会接剧本 你不要命啦[捂脸笑],百变小叮当..
9,男一号是关系户吧，颜值被男2秒了[捂脸笑][捂脸笑],ا‎؟اد؛
10,太喜欢这种小甜剧了[爱心]唐苏我来啦,我问了问
11,从人间烟火过来，发现了赵啾咪[爱心][爱心][爱心],P  Boy
12,我才大家都是来看陈鑫海的吧,笨小孩的love.🎀
13,我准备看种地吧的赵一博,钱小乖。
14,就喜欢这种短剧，节奏感很强！[应援][应援],奔跑在孤傲的路上😚😚
15,赵啾咪你真的很会接剧本，刚刚看了妈咪的反攻,187****5176_m2033
16,从最食人间烟火过来[色],Delphineaths
17,从人间烟火来的[呲牙],qwqw✨q
18,女主这台词绝了这剧追了，胖酥嗓音都不一样，划重点啊，唐苏和胖酥[666]的声音不同哦,爱探险的胖苏苏
19,赵啾咪，我来咯[应援][应援][应援][色],韬韬🐣
20,来看看赵一博哈哈哈哈哈,忄翌澜
21,140多能看起来这么胖？,呦西，大宝贝🤔
22,就算我只有七秒钟记忆，就算遗忘了世界🌍，我的海马仍铭记着你的名字-王艺瑾。@王艺瑾[大拇指],198风信子
23,赵一博，我来看看你到底演了什么,刨杨梅冰
24,哈哈，看了最食人间烟火色，而来,1142852284
25,看了最食人间烟火色来的，被陈鑫海圈粉了！太喜欢他了，真帅！,百友走召火页
26,王艺瑾唱的心爱的人太好听啦,我问了问
27,我是从烟火色过来的[呲牙],豆豆1024
28,什么鬼，看这封面我还以为是杨幂和罗云熙演的,小森小森不困不困
29,哈哈哈哈真的很好看诶,一斤快乐⭐
30,无语啊，那么好看的漫画就被改成这个样子，又是一部烂剧[微笑],超爱看电视の宇文昊
31,从最食人间烟火过来的,(♡⌂♡)优雅最美的瞬间(♡⌂♡)
32,来了来了超期待唐苏,浩浩风起波，冥冥日沈夕😁
33,竟然有赵一博[惊讶]来自种地吧，照片够朴实[捂脸笑],橙子🍊皮皮橘子
34,一博一博,凤╮（╯＿╰）
35,唐苏和王艺瑾一样啊 都有绿茶队友哦,小丸子°Q
36,来看一博[应援][应援][应援],开欣噗噗
37,来看公主[色],L'Tracy🧸
38,每集时长太短，还不如正常时长。今日宜加油每集也是这个时长但是人家是40集！,二胖家的King
39,海子和一博双厨狂喜啊啊啊啊啊哈哈哈哈,方华公子
40,为了海子来的,一哪儿
41,开局一座山的漂亮女主[呲牙], 针尖 麦芒
42,来看海儿的,辰亦🌸🙊
43,我靠男主那么帅的不明显 我还是去看其他剧吧 毕竟开会员的钱不能浪费,sunlight and sky
44,也太可以了吧，好喜欢王艺瑾唐苏，演的真不错，绝配酥心唐让更多人看到吧！[应援],之宇文中
45,为陈鑫海而来,是xi茜不是qian啊
46,虽然男主颜值不是我喜欢的类型，但是女主是王艺瑾诶，好喜欢她,北极深海鱼
47,为王艺瑾来看的，结果感觉很好看哎，我平时看剧很挑的,Ayi大怡
48,目测又会火一个男主。陈鑫海,单曲循…
49,人间烟火男主，还有种地的一博，都是最近喜欢的,李桂花冲呀
50,为什么男主角是寸头[捂脸笑],就这样吧拜拜👌
51,为什么赵一博不是男主[捂脸笑][捂脸笑][捂脸笑],用户4f4bc0a1
52,导演是没东西拍了吗,꧁热劣꧂
53,剧荒的有路看啦，胖苏太可爱了就是说唐苏真的很喜欢[大拇指][666],爱探险的胖苏苏
54,今天看了两三部电视剧里都有帅小伙陈鑫海[大拇指][大拇指]支持他拍男主角爱情戏[爱心][666],谦让的馨元
55,一博这么潮你不要命了[偷笑][偷笑],我爱十个勤天！💫
56,我宣布绝配酥心唐成为我的新晋电子榨菜[色],既酷又帅的麦莉布兰卡缇小野菊
57,为了看海子哥[色][色][色][色],森屿111🎊
58,胖大海俺来喽[应援],保持开心^_^👍
59,王艺瑾台词真不错，唐苏演的也好，绝配酥心唐爱上了[爱心],之宇文中
60,来看陈鑫海咯，因为爱上了最食人间烟火色的景琛[呲牙][呲牙][呲牙],w吴小妮
61,这部剧你现在播啊，肯定能有热度,_Nanayya_
62,太喜欢小甜剧了，唐苏冲啊,只愿为你疯狂h
63,陈鑫海有一种眼神魅力[火][火],蚊仔
64,不太吃男主的颜，不过男二还挺好,肖怡琑
65,才找了3000个人刷评论吗？   还有人重复刷评论？[捂脸笑],用户494f89bc
66,只爱王艺谨,不塔 女
67,培养和栽培,段大侠💦
68,[微笑][微笑][微笑]小胖丫台词还挺好,刘诉诉i
69,这个男主真的不咋滴，如果换陈鑫海来演，肯定不一样[呲牙][呲牙][呲牙]景琛[色][色],阿七，柒
70,来看女主的,幸运小和尚ii丷
71,唐苏太可爱啦,一斤八宝粥
72,为小海来的 男主好像是少年歌行里的老七,用户a03517b2
73,其实蛮好看的，只不过有些镜头太清晰了，看了之后就不想看了,我家小妞楠
74,互联网没记忆了？,舞舞☺
75,超喜欢这一对，超好看，不知道还会不会在合作，希望下次的剧本还是一样好,皇冠小笨鸭
76,这个电视剧为啥连评分都没有，没人看吗[捂脸笑][捂脸笑][捂脸笑],小猪13990
77,不够看啊不够看啊，王艺瑾唐苏没有你我怎么活[捂脸笑],.....哦啊
78,71公斤肚子怎么可能这么大，不现实,小妤龙嫲嫲11683
79,唐苏只是变胖了，变胖了之后怎么变傻了。,囿你、比蜜甜
80,小甜剧+轻喜剧，还是个原声台词，太好啦[呲牙],匿名用户
81,王艺瑾演的不错,梅瑰竹菊
82,这不是陈宝嘉吗,舍不得动脑
83,胖苏的声音都不一样耶,RRRRengar
84,好看吗，？？陈鑫海戏份多吗[色][色][色],用户53f29084036b0
85,冲着人间烟火色景琛来的,多包露露啦
86,看到后面回过头来评论，真的不错，希望更多人能看到这部剧,☆ZQZ☆
87,"看了陈鑫海的最食人间烟火色来的   
陈鑫海   陈鑫海",匿名用户
88,男主是胡一天版橘生淮南的渣男戈壁,心若安好都是晴天
89,来看饺子姐[色],HGL.无疏
90,一博呢，去哪里了,紅太阳.
91,我是看完陈鑫海的《最食人间烟火》过来的，继续追陈鑫海的剧，发现他今年才22岁，好小啊，好帅，治愈系男友[爱心],遇見 椛開
92,哈哈，你的美食呢,幻风1986
93,海子我来啦[色],巴克56
94,可以可以,广西老铁杆
95,女主是不是那个参加过创造营的那个？？杨幂公司的艺人 是不是那个？,婷婷轩轩哈哈
96,我之前好像看过类似的漫画,爱懒床de相里宏伟
97,男主像个劳改犯一样[捂脸笑][捂脸笑][捂脸笑][捂脸笑][捂脸笑],鱼88⭐
98,哈哈哈哈,匿名用户
99,陈鑫海是男二啊[捂脸笑],半夏萧萧
100,哈哈哈为海子来[应援][应援][应援],晨晨_46796
101,又是这种泡沫爱情剧吗，[捂脸笑][捂脸笑][捂脸笑]剧荒了,Ann_321
102,为了看鑫海[应援][应援][应援][应援],小沈厉害哇
103,有陈松林的弃剧,嘻嘻哈哈拖拖拉拉
104,好喜欢王艺瑾，来看看她出演的女主剧[应援],水余木子
105,陈鑫海戏份好少,半夏萧萧
106,男主太瘦，形象不好,大笑笑哈
107,唐苏好漂亮啊  胖胖的也好可爱,匿名用户
108,考古陈鑫海,葵夏🍀
109,男主角真的不好看,大庙村李
110,好搞笑的剧，女主台词不错,匿名用户
111,赤王，我太跳戏了[捂脸笑],小杏运sunny
112,这不是赤王嘛,大佛嘎嘎嘎
113,哈哈哈来看珍哥啦啦啦开心开心肯定很好看[应援][应援][应援],百变小惠🍓
114,电子榨菜,大佛嘎嘎嘎
115,又有陈鑫海又有赵一博[应援],小俊枕边人
116,轻松搞怪小甜剧,匿名用户
117,来看陈鑫海来啦[应援][应援],夏沫青城love
118,为了陈鑫海而来[色][色],当个祖宗⚠️
119,好喜欢女主哦,匿名用户
120,我来看陈鑫海[色],郡予yu
121,来看陈鑫海！,夏末未至👑凉栀✨
122,来了来了，来看唐苏,媛媛是我呀
123,为陈鑫海而来，最食人间烟火色演的真好。,意难平666🎁
124,我要看陈鑫海,🍒 小甜甜🍒
125,女主台词用心了，变胖后声音变沉[大拇指],Ninasax
126,啦啦啦为陈鑫海[应援][应援],缊提
127,为陈鑫海来的,玖鱼y.
128,大家去看看种地吧，看看赵一博真实的一面。,蜕月
129,来看景琛,小张过过过
130,过来看陈鑫海,134****1806_m1584
131,从主演到小配角演技都很不错，这碗糖我先干为敬,wwde南桑小哥哥
132,"来看赵一博

",鲈鱼2001
133,喜欢卢洋洋,百折不挠的xx宝贝🍇
134,"绝配酥心唐这部剧简直是好看到停不下来，剧情好上头，喜欢唐苏王艺瑾
剧情很吸引人呢 也很新颖，没看过漫画，看这部剧也是津津有味，很喜欢女主唐苏，王艺瑾未来可期，绝配酥心唐值得让更多人看到
",星宿海哥
135,陈鑫海我来看你了,艺有彤心
136,再来看陈鑫海,清愁2018
137,"可以一口气看全集真是太爽了，王艺瑾唐苏绝配酥心唐我来了
",星宿海哥
138,为陈鑫海加一,M J祺
139,来看海子哥,NANA、L
140,虽然是恋爱但是也好真实，剧中人物以及剧情走向都是很好的,悲伤已不再HHH
141,来看陈鑫海的,天津武清地毯园♈️视觉
142,有点搞笑，王艺瑾唐苏一下子让我想到了在糖时期,19497979
143,小甜剧可以看,好吧682
144,好看的 轻松氛围,橙吖橙子
145,终于见到唐苏了[色][色][色],一个小橙子🍊Q
146,为啥我感觉我看过这个剧呢？是有个网剧还是动漫来着？？？,想变成公主的平民女
147,还挺有意思的，再看看，期待下面的剧情,浪浊天凌宇
148,我是土狗就爱看这种剧,橙子奶泡芙
149,这剧情有点眼熟,米粒公主 🌈
150,现在看剧，先看演员，看剧情，看评论，最后再决定看或不看，有一样的嘛，举个小手看看吧！,翩然入君怀
151,这是招黑吗？明明是蠢到没脑子！小编是没脑吗？,姑苏幕雪
152,3月美好的一天就是看艺瑾的新剧[应援],XXXI_xss
153,一集怎么这么快就没了，这剧太短了不够看！ 舍不得看完王艺瑾唐苏,19497979
154,听说今晚唐苏有了新的故事好期待，王艺瑾唐苏绝配酥心唐[应援],净月，寒酌
155,笑发财了，真的是宝藏小甜剧，我的新晋电子甜品，都看起来！[呲牙],Cynthia_Rx
156,从抖音来的看了下还挺好的女主胖的时候好可爱瘦时候好漂亮,草陶姑娘
157,"王艺瑾唐苏真的太让我惊艳了，好喜欢看这部剧绝配酥心唐
",星宿海哥
158,王艺瑾这个胖装太可爱了！,19497979
159,救命，王艺瑾唐苏真的好美啊[色],19497979
160,又看完了，王艺瑾唐苏真好看啊,19497979
161,王艺瑾唐苏，人尽皆知我喜欢你,19497979
162,这个是不是漫画改到,能轮空
163,是谁还没有看唐苏，今晚绝不能错过王艺瑾唐苏绝配酥心唐[色][色],净月，寒酌
164,"等了好久终于等到绝配酥心唐，果然没让我失望呢！很爱唐苏，王艺瑾多多拍戏，有演技的美女就是要多进组
",希哈哈哈哈哈哈🌼
165,女主哪哪都好[应援],观星者2167
166,女主台词好,观星者2167
167,太好看了[爱心],爱阅读の呼延真洁
168,唐苏唐苏终于来啦[色],既酷又帅的麦莉布兰卡缇小野菊
169,现在国产剧时长越来越短，韩剧一集60分钟！还是🉑以长一点,344493058
170,只看演员阵容，就没有一分钟看下去的理由，,温文尔雅的张哥
171,唐苏:这么快就一集了，不够看，期待后面的剧情,19497979
172,这集又结束啦 表白王艺瑾唐苏 好看死了,19497979
173,又是为王艺瑾唐苏的美貌心动的一天~,19497979
174,才8集我不看，存多了再看，天天等剧太折磨人了。走了～,WAY😘
175,每集时长太短，全集还是40集就好了！这不够看啊！,二胖家的King
176,看在男主颜值上，剧情也可以忍了,三生有辛🎉
177,男主不够帅,迷醉一生
178,20分钟一集？？？？,一言之物
179,进来不是为了看电视剧的。就想吐槽一下男主真欣赏不来。再见,独九，
180,王艺瑾，虽然剧情照进了现实，但我希望你也可以像唐苏一样闪闪发光,匿名用户
181,剧里的年轻演员们都表现的不错，画面极美，赏心悦目,skysky回忆那些往事
182,剧情也特别真实接地气，淡的渐进式的恋爱很让人上头,WW霸气豪门啧WW
183,麻了麻了，好爱王一金，谁会不喜欢姐姐呢，给我一直甜下去！,媳妇快跑打不过hold
184,剧里服化道的整体质感也都非常不错，我万万没想到的，带给了我们很多的惊喜,转角遇到爱lvlvlv
185,演技放心制作放心真心高品质好剧，编剧的恋爱剧情写的太好了吧,彧笙今晚
186,啊 姐姐杀我 王一金也太飒了吧，好久没看到这么甜的cp了,有爱的L酱daz
187,王一金真是因为颜值被低估了电视剧的演员，剧情写的我都感同身受闭眼了,雅奕阁的猫妖小z
188,我万万没想到田曦薇带给了我们很多的惊喜，追剧追剧，提上日程好嘛！,SOBERCCCC
189,人物刻画一点也不娇气，这种双倍甜蜜的感觉谁懂,Forseti吃葡萄
190,女主演技好,观星者2167
191,女主好看,观星者2167
192,真的好好看,观星者2167
193,为什么不一次更完啊[大哭],jgffjdj
194,赵一博不是在种地吗？,蜕月
195,一斤好可爱,Ayi大怡
196,哇塞，好喜欢,蜡笔小新的黑色蜡笔
197,胖苏太好看了,月亮慢慢来
198,太可爱啦胖苏,足智多谋的vvvvv
199,哇男主是赤王哎[色],lavicanon
200,好期待啊[应援],观星者2167
201,没演技 看不下去不值得看 科技脸没特色,匿名用户
202,封面的图真的绝了[流汗]俩人都像斗眼……咋选的界面,砌个龙东墙
203,这种剧就是在改变女性价值观  ,1836907762
204,胖苏苏真的声音和瘦下来都不一样耶,3322☃️
205,女主的演技还不错诶，细品的话是很有意境的,Morphlinging
206,男主的脸和身材真的是我的菜，插曲真好听啊,心内言gegei
207,王一金演技非常棒，一口气干了3集,瑾栀下载中ii
208,好多实力派，情节张紧有度,用户3b0fb48a
209,用轻喜烘托人生，这部剧细节取胜,猫骨在樱子脚下
210,人物都有血有肉，节奏把握的好,喜歡僦媞醜啧啧
211,期待接下来的剧情，讲真，这部可以,劣女纪233Z
212,甜爽剧日常解压看看，主人公表演自然到位,帆布牛仔哒哒哒
213,人物设计合理，已经迫不及待等更新了,彧彬彧彬
214,欢喜冤家小甜剧，恋爱的同时不忘励志,有呆毛的哥斯拉哇哇
215,王一金撩头发真的好漂亮，场景真实高度还原,遗失在wawa的旋律
216,甜爽剧日常解压看看，一些高远景镜头也很大气,艾欧泽亚23号FF光呆
217,觉得全员演技在线，剧本给人的感觉还不错,zz忞悦zz
218,这个剧好多我喜欢的演员，剧情人物有血有肉,用户3b0fb39f
219,人物刻画很棒，小甜剧让人没有抵抗力,weiwengdehua22
220,插曲真好听啊，真的是近些年很棒的电视剧。,WayOutyOut
221,道化服太真实了，糖分超标了啊,uopupupqPU皮
222,一斤真的是又漂亮又可爱[色]挺喜欢看她演戏的,雨琦power~
223,赤王啊赤王，赤王那造型多好看啊，这里平头一般[捂脸笑],卜汝猪猪
224,王艺瑾抢到小熊饼干了吗？,19497979
225,最近有谣言说我喜欢你，我要澄清一下，那不是谣言。,橙子奶泡芙
226,来看一下绝配酥心唐  很好奇王艺瑾演的唐苏和原漫画我被总裁黑上了的人设没有没新的改编,DYAlien
227,我就说为什么感觉剧里名字都特别熟悉原来我看过这个漫话[色][色][色][色],预.言.
228,又看到林妍柔的电视剧作品了，前几天刚看过她的骑着鱼的猫,（张倩）宝铮宝莹妈妈
229,我就想知道，为什么演员表里没有小舞扮演者的名字？,☞小宝贝啊_
230,"哇塞 直接放全集的么？这也太好了 好喜欢王艺瑾唐苏 喜欢绝配酥心唐
",匿名用户
231,"王艺瑾是什么神仙颜值，好爱她演戏的唐苏，我爱绝配酥心唐
王艺瑾真是太让人惊喜了，非常棒的塑造了唐苏这个人物 鲜活可爱，演技在线，很喜欢这部漫改绝配酥心唐
",匿名用户
232,这部剧的评论和弹幕都出问题啦，我回复别人的都看不见[大哭],Mon123aa
233,"好难看，快跑
",白桃桃子.
234,老七可以啊[色],匿名用户
235,"这部剧好有代入感 很真实的剧情，王艺瑾唐苏冲，绝配酥心唐冲冲冲
",希哈哈哈哈哈哈🌼
236,"一口气可以看那么多王艺瑾演的角色唐苏，真是太爱绝配酥心唐这部剧了
终于有新剧看了，不再担心剧荒，绝配酥心唐王艺瑾唐苏 我来了
",希哈哈哈哈哈哈🌼
237,"绝配酥心唐这部剧简直是好看到停不下来，剧情好上头，喜欢唐苏王艺瑾
等了好久终于等到绝配酥心唐，果然没让我失望呢！很爱唐苏，王艺瑾多多拍戏，有演技的美女就是要多进组
",希哈哈哈哈哈哈🌼
238,"也太可以了吧，好喜欢王艺瑾唐苏，演的真不错，绝配酥心唐让更多人看到吧！
[大拇指]",希哈哈哈哈哈哈🌼
239,"[捂脸笑]成为绝配酥心唐剧粉一枚，太喜欢这部剧了，女主唐苏王艺瑾爱了爱了
",希哈哈哈哈哈哈🌼
240,"女主唐苏要不要那么美，胖妆也很可爱漂亮，即使胖也可以是大美女，绝配酥心唐 给我冲
[666][666][666]",希哈哈哈哈哈哈🌼
241,"终于有新剧看了，不再担心剧荒，绝配酥心唐王艺瑾唐苏 我来了
[666][666][666]",希哈哈哈哈哈哈🌼
242,"就爱看这种剧，少女感满满，王艺瑾唐苏真漂亮演技很赞，绝配酥心唐勇敢冲
[666][666][666]",希哈哈哈哈哈哈🌼
243,"胖妆的唐苏也好可爱哦！王艺瑾演技在线，朋友们都给我来看绝配酥心唐！
[666][666]",希哈哈哈哈哈哈🌼
244,"等了好久终于等到绝配酥心唐，果然没让我失望呢！很爱唐苏，王艺瑾多多拍戏，有演技的美女就是要多进组
[应援][应援]",希哈哈哈哈哈哈🌼
245,"[应援]也太可以了吧，好喜欢王艺瑾唐苏，演的真不错，绝配酥心唐让更多人看到吧！
[大拇指]",希哈哈哈哈哈哈🌼
246,"[666][666]王艺瑾台词真不错，唐苏演的也好，绝配酥心唐爱上了
",希哈哈哈哈哈哈🌼
247,"剧情太精彩了，王艺瑾太美了，很喜欢唐苏，绝配酥心唐值得反复观看
[大拇指][大拇指]",希哈哈哈哈哈哈🌼
248,"王艺瑾演的女主唐苏演技自然，底子真好，高颜值，绝配酥心唐值得看
[捂脸笑]",希哈哈哈哈哈哈🌼
249,"可以一口气看全集真是太爽了，王艺瑾唐苏绝配酥心唐我来了
[大拇指][大拇指][大拇指]",希哈哈哈哈哈哈🌼
250,。。。。。设定变胖有必要搞得肚子鼓鼓的吗，脸上也怪怪的，重点是画风也好劣质。。。现代剧不应该时尚一点吗,嘟嘟阳光嘟嘟
251,绝配酥心唐这部剧简直是好看到停不下来，剧情好上头，喜欢唐苏王艺瑾[666],匿名用户
252,这部剧好有代入感 很真实的剧情，王艺瑾唐苏冲，绝配酥心唐冲冲冲[呲牙],匿名用户
253,王艺瑾唐苏真的太让我惊艳了，好喜欢看这部剧绝配酥心唐[色][色],匿名用户
254,终于可以告别剧荒了，喜欢上唐苏王艺瑾了，可爱又漂亮[爱心],匿名用户
255,可以一口气看全集真是太爽了，王艺瑾唐苏绝配酥心唐我来了[呲牙],匿名用户
256,王艺瑾真的太适合唐苏这个角色了，绝配酥心唐疯狂加分[呲牙],匿名用户
257,有剧情的恋爱剧少有啊，太甜了，我的嘴角已经笑到达太阳穴了,给我TinyS一个面子
258,邓凯台词好厉害啊 演的也不错，氛围感也太强了吧继续追剧,钢炮aa暖暖一生推
259,被王一金惊艳到了是真的好帅啊！，演员跟角色也太贴合了,昉华此生WW
260,观剧到目前为止无槽点。，我真的非常喜欢这种甜甜的剧,发帖必沉小先生
261,王一金超美，邓凯本色出演，恋爱的气息会穿过屏幕扑面而来,迟迟不动彘鬣
262,王一金多多营业啊，我万万没想到的，带给了我们很多的惊喜,偲毅在222
263,邓凯从偶像转变成演员了。有些慢镜头的拍摄我很喜欢，表白也太浪漫了吧,偲娉万里物语
264,爱媳妇就是听媳妇的话，迫不及待想要看到下面的剧情,布鲁克林的啾啾君
265,邓凯的表现让人惊喜，十分优秀的塑造出了编剧构建的人物形象，追剧好快乐,播种星球78号机器
266,王一金是什么宝藏女孩啊，这部剧也太好看了吧,wwde南桑小哥哥
267,一直就很喜欢王一金，好期待新的作品，前几集还挺上头的,weiwengdehua22
268,演技也很在线，作为原著粉对于剧情按照走还是很满意的,Spirit量行
269,邓凯这次真的很不错！电视剧和颜值都有get到，给我一直甜下去！,ShendelzareZZ
270,为王艺瑾唐苏而来，绝配酥心唐看起来王艺瑾第一次饰演大明星，好喜欢唐苏，绝配酥心唐看起来绝配酥心唐好看到一点儿都不舍得快进，太喜欢王艺瑾演的唐苏了，都不要错过绝配酥心唐王艺瑾第一次饰演大明星，好喜欢唐苏，绝配酥心唐看起来还有谁还没看绝配酥心唐的么？都来给我看唐苏王艺瑾,最多一斤
271,哈哈果然人类的本质还是喜欢无脑爽剧啊，每个重要的点都演的很细节,NBRylaiCrestfall
272,王一金电视剧很好，期待下一期，剧本给人的感觉还不错,LETSRUNgo狗
273,一定要去看啊姐妹们这剧情好多我们想象不到，重要情节一点都没落下,KisaWalkerPowder
274,国产剧终于找到了对的发展劲头鸭，CP成功的立起来了,Dream做梦deram
275,邓凯性格真招人喜欢，这部剧比的故事情节还要精彩呢,CoPark高工公
276,太甜了我的嘴角已经笑到达太阳穴了，剧情跌宕起伏,AAiushtha
277,邓凯的眼神戏很有层次，不管从演员阵容还是剧情走向都很有看点,元月圆圆圆圆月圆圆
278,王一金这次电视剧又到达了一个新的高度，女主不傻白甜，男主也有勇有谋,琉璃花上琉璃碎
279,有没有姐妹和我一样想要超前点播的，特别贴近生活，接地气,01II19大大封印
280,邓凯的电视剧确实蛮让我惊喜的，一定要去看啊姐妹们，这剧情好多我们想象不到,简单点我们的故事近半
281,一对欢喜冤家 互相照亮彼此之间的路，太精彩了超棒的超期待哦！,傻傻虎大战聪聪能
282,强调两性平等，三观正，恋爱进度条直接拉满的节奏真的有点看爽了,苏德彬03520
283,淡淡的渐进式的恋爱很让人上头，好久没看过搞笑剧情的甜宠剧了,猪兔赛跑能手王小兔
284,挺好看的小甜剧，剧中美术、服化道、摄影、视效方面也挺好,w嘟嘟w不爱喝咖啡
285,王一金姐姐又美又飒太可了，我真的非常喜欢这种甜甜的剧,秦周懿买三送一
286,淡淡的渐进式的恋爱很让人上头，这种双倍甜蜜的感觉谁懂,柠萌ice红tea
287,这部剧太符合王一金的气质了呢，细节上没有瑕疵,杭州落樱子1867259
288,王一金的个人魅力实在是太明显了，剧情和恋爱并行,moi是我心头爱吖
289,王一金的演技精湛，具有非常强的表现力和感染力，剧情一会刺激一会甜,nana不是花非花
290,邓凯从偶像转变成演员了。有些慢镜头的拍摄我很喜欢，值得看起来,LuLu爱小兔兔子
291,人物的台词和剧情也不错，期待后期的成长，恋爱进度条直接拉满的节奏真的有点看爽了,蓝瘦子不爱吃蓝莓
292,拍摄手法很符合年轻人的口味，这个剧好多我喜欢的演员,逛逛小楼看花展呀
293,男主这个颜我真太可以了，现代戏我要看小甜饼啊,加一个七也不能胡牌
294,王艺瑾唐苏绝配酥心唐，苏苏来喽今晚会有怎样的剧情呢，超级期待,19497979
295,每个重要的点都演的很细节，电视剧拍出了上海别致的氛围,用户3b0fb2c3
296,今天也是被王一金圈粉的一天啊，整体剧的质感和演员表现都很好,失败者ofyou
297,王一金真是因为颜值被低估了电视剧的演员，挺有质感的,555宁乡小王子
298,追剧追剧提上日程好嘛！，破镜重圆的梗多久都不会腻,用户3b0fb4b1
299,王一金真的太美啦！，从主演到小配角演技都很不错,路我们一起laugh
300,啊 姐姐杀我 王一金也太飒了吧，男女主角让人特别想磕,king的第1001个梦
301,王一金姐姐又美又飒太可了，双向奔赴的爱情真的太甜啦,忙成DOG的小芋
302,没想到王一金的身材那么好，整部剧制作得也好用心,AresZRES
303,邓凯老师电视剧也到位了，全员原声好评，男女主角快点撒糖起来,LOVE小说里的女人
304,镜头感加剧情都挺好的，男女主角让人特别想磕,调专属me
305,看完对邓凯改观了，演员真的要有作品才行，我发誓没人能躲过这对cp,只若初见只若
