,0,1
776,爱奇艺同志，这样每天只更两集不过瘾啊，完全是大爽剧啊，戏骨飙戏追的欲罢不能。这部戏应该改名叫:狂飙演技。国产剧应该多推一些这样高质量的剧目，而不是只是一味的流量和小鲜肉。我们更喜欢看戏骨飙戏。,summer Apple💞
777,那满意度到底是怎么来的,男神嫁到
778,#一句话告别狂飙#一个人生 总有数不完的遗憾,喜欢吃橘子的公冶玉龙
779,还没捏呢，他自己就爆了[捂脸笑],道格拉斯路易斯
780,我现在才开始看。你们都是弟弟,马木子✌
781,好不好看这个电视剧剧，今天刚开,魁儿
782,今天才有时间看，最晚的了吧？,今天刚有时间看，我是最晚的了吧？
783,有张译，这剧就不会差……应该值得看！,TanYu☾
784,"#狂飙剧评征集#《狂飙》开播前的几个月，我就对这部剧充满了期待。不说别的，单单看该剧这强大的实力派演员阵容，就不能不让你满怀期待。

《狂飙》开播后，热度一路飙升，收视率和口碑都不错。

从《狂飙》开播，一路追剧到现在，露珠感觉，这部剧的优点和缺点都很鲜明。

整体来说是一部好剧，但剧中许多剧情细节有漏洞，瑕疵多，不能深究，否则会觉得令人难以信服。",逸辰丶
785,忍了这么久，总于有个51小长假可以看了。[666][666][应援][应援],火卢老三
786,重来不爱看这种片子，这个例外，高启强爱了，二刷,心动无声🌟
787,我应该是最晚的一批吧，现在才开始看[捂脸笑],湫9420
788,不是有贾冰吗？ 在哪呢,輕歌传媒
789,这剧情勾的我痒痒,双廊恋
790,张颂文老师真的被发现了！！！[爱心][爱心][爱心],Vincentttt1
791,院长，从罚罪直接串台过来了感觉[捂脸笑],风都想要拉住
792,孟钰最后和谁在一起了,超爱吹口琴de谷利洮洮
793,报告：六月23下午1点钟看[呲牙],一个四郎
794,怎么不能全屏,274734560
795,有和我一样看完结局又二刷的吗，2月1号,鱼哥铁粉111
796,看到有张译，这片子肯定好看！[大拇指],苗～～星爷最棒！
797,我说怎么大伙对这剧好评这么好，原来都是老戏骨啊。,陶然66880
798,他的衣服发了毛，而欺负他的那些人或许曾经也是穿这种衣服只不过他们踩着他们往上爬而已,那最美的雨季
799,好真实，一点不加美颜滤镜[应援][应援][应援][应援],斌兰🎉
800,哈哈我又开会员来啦高启强,想成为黑老大
801,有没有跟我一样，现在才来看的,周周🍒🍦1993
802,网上说很好看，我来看看是营销还是真的,-Echo--🌙
803,天网恢恢疏而不漏，正义会迟到，但是不会缺席#说出你对剧情的猜测#,黑白雨翼
804,唐小龙报警，入室抢劫，最先到的应该是派出所，构成入室抢劫了才是刑警队出面,莫欺少年穷莫嫌老来丑💘
805,开始追这部剧，而且还不是会员，日期4.22,喜欢吃香肠de羊舌玉韵
806,真的很好看，这是追剧的第二遍了，太喜欢超级推荐[色][色][色][色],吐个泡泡love💞
807,不会只有我是快三月的时候才开始看的吧[捂脸笑],译路有瑜文
808,我应该是最后一批才看的吧[应援][应援][应援],迷途滴猪猪
809,二刷搞起来家人们 人生若只如初见呜呜呜,茶源1234
810,我才是最晚看的,No.3💤
811,都别说了我才是最晚的一批，现在才开始看,简单着，，，
812,二刷的来咯[应援][应援][应援],う過往旳時光
813,刚看完公诉来看狂飙了,日落橘子海💯
814,千万不要小看小人物，特别是像高启明这样的人,江西好迪
815,第一集就给我正流泪了，真是厉害，剧情也的确抓人。编剧导演演员都厉害。,雨下坐家
816,现在才开始看哈哈哈,戒酒李白～
817,这么多年很少看电视剧了！给那些小鲜肉奶狗弄得一点的意思没有！这部都是实力派演员[应援][应援],好嗨吆...
818,我估计后面还有比我晚的 根据抖音来的 实在没事干了[捂脸笑][捂脸笑][捂脸笑],……我是你哥
819,一样一样,孤独娱乐（重拾快乐版）
820,人心都是肉长的，所以后来高启强从没想过害安心,匿名用户
821,我才是最后一批 我今天看第一集 听朋友说这个电视剧不错  才打算看 就是有广告 有点烦人 更新的太慢了,喜欢弹钢琴de羊角月桂
822,没有这么好的警官的[捂脸笑],风中的茜薇
823,之前断断续续看了很多，但是没有完整看，打算买会员了看完整的,夏至^`未至℡
824,我才是最后一批看的[捂脸笑],温茶可可
825,超级喜欢这个电视剧看不够赶紧更新,郭qiang1
826,前十集都带着智商，后面的反派感觉都是站桩输出，都不会动的，傻乎乎一个个排队送货,爱吃薯条的仲长曲文
827,高考完终于开始看[捂脸笑],我不是修沟
828,黑大伞小，有黑无伞，什么意思，要解决这个问题，不明白！,✨无限漫长✨
829,终于来看大嫂了[色],张两岁🤞
830,今天看的举个爪[捂脸笑],璐星河🎪
831,有张译在，剧本应该不错[色],🐯🐯🐯二二三
832,高考完了 来看,☁️☁️☁️kun
