,0,1
163,#长风渡最打动你的角色#谁懂！！！他真得是我心中的顾九思！！！！而且顾九思其实很善良[色][色],夜雨微澜☔️🎪
164,什么时候更新,✨ 🌺 Wendy ☀
165,哈哈哈哈哈哈 怎么回事！！阴差阳错竟然碰到这么早更新 还想说等时间到看看[呲牙][呲牙],壹箭穿心
166,好喜欢里面的剧情，上年龄了，就喜欢看这种撒糖不虐，干事业的。好喜欢白敬亭宠宋轶的样子。有情有义，不愿意的时候，娶了，也不动她，慢慢的有了感情，也没有，一直到彼此确认余生、补足了仪式，幸福的在一起。好男儿,空空仙草
167,超好看的一部剧，选角很贴原著主角！虽然剧情略有bug，但瑕不掩瑜。,哦好饿好饿好饿好饿好饿好饿好饿
168,断更了让我怎么活啊[大哭],玖柒不加糖
169,身为一个高中生，从赘婿开始认识宋轶老师，很喜欢宋老师[应援],吃货家族⛄
170,小说上顾老华本来没有死，但是电视剧里他死了。可怜的顾九思。,娅娅小公主Oly
171,假期快结束了才发现已经更怎么多集了 我明天早上还得去上学呢[微笑][大哭][大哭],-小狗不悲伤.🥀
172,秦婉之这就没了？原著可是太子妃啊[微笑],等幸运.
173,为什么没有按原著拍啊，男女主第一次见面应该是送胭脂啊[大哭][大哭],初见韵
174,他本不该叫洛子商，他本该叫江知仁，却因为一场大火，他失去了母亲，错把顾九思的父亲当成了自己的父亲，机关算尽，在死前才知道自己的父亲不是顾父，而是江河，最终与父亲一同死去.,考试官A
175,好看，好绝，这么好看的剧，一定要爆火[火],zzyuanRAiN.
176,跟诀子呼应了谁懂[大哭],虞木脑袋💤
177,嘿！！爱奇艺你不讲武德！！居然提前播啦！！哈哈哈哈哈！！！！！抢沙发咯~~~~~~[应援][应援][应援],.鷐
178,好好看，三刷了,用户6aa0ba69
179,这剧情感觉和田曦薇演的那部差不多,187****2412_m1961
180,顾九思顶顶好,这世界这么多人🐣
181,既然最终目的是当了换钱买药，有没有人解释一下为什么一定要狐裘？,纯粹玩农场
182,顾九思至纯至善,帅的没边边边了
183,什么你也喜欢小白？你也爱看长风渡？那可真是....泰裤辣[应援],弗清清清
184,"又是扯淡剧
",135****5922_m1583
185,不知道为啥不喜欢这个女主,平常心。。。有意思。。。
186,真的演技原来越好啦，你的努力有一天终会被人们看见[应援][应援][应援][应援][应援],时宜.⁴⁸¹³
187,这会不会是他俩的定情戏[色],逆光海110
188,顾九思想你了  来看看你,顾九思💥💥💥
189,#邓凯空降翻牌#这部剧真不错,炎枝⭐
190,要是换个男演员就完美了,爱驰柠萌的Naranja
191,刘学义多多演戏[应援],爱吃回锅肘子的苍穹🧀
192,头次白敬亭搭档田曦薇也好看,迷茫追@
193,看了20分钟，先不谈论剧情，雪景是真的好看，但是雪会不会多了点这雪好长时间都在下，还有就是没有好笑的点，小白很帅，宋轶也很漂亮，但是这女主演的为啥我看不下去了呢，女主演的赘婿和伪装者就很好看，不知道为啥这次演的我看不下去,若白i🌟
194,#张维娜空降翻牌#呜呜呜 没有VIP太痛苦了,等雨亭🌸
195,女主角不好看呀,2270509683
196,卖出去的东西还能要回？,"小鸡快跑
廾匸"
197,好爱顾九思啊，纨绔只是他的外表，纯善之心，赤子之心才是他的本体。白敬亭演的太好了，比我看书时想象的顾九思还要好，还要灵！,我天我在
198,就喜欢这摸不准时的,.辞.忧.
199,白敬亭古装还是不好看。。。和宋轶没有cp感,"十十十四,"
200,就喜欢 不准时 哈哈哈,只为见你一面
201,#你最想看的古偶剧情#想看男女主双强，他们在日后的相处中感情升温，相互成长，相互帮助，相互鼓励，然后修成正果的故事，期待顾九思和柳玉茹故事[应援]最后希望长风渡收视长虹，大爆[应援],🍍菠萝味的凤梨.
202,#张维娜空降翻牌#待会儿考完高数就来看维娜姐姐[应援],cecily0618
203,作为看过原著小说和白敬亭的粉丝我是真的很期待[色][色][色][色][色][应援],小彤丹丹.com
204,我就想知道丫鬟是谁演的，好眼熟，想不起来名字了[捂脸笑],眼前人是♥心上人
205,不太喜欢宋轶,喜欢追剧的我I
206,是鲜衣怒马的张扬少年郎，是清风霁月的翩翩君子，是救世济民的稳重官人，是皎皎如明月的顾九思。,财富自由ᴮᴬᴵ🕊️
207,看第一集真的很喜欢老太太啊 嫁给叶世安应该也很幸福,新时+
208,长风渡真的很好看啊，布景不错，主角的服装造型也美，剧情也不拖泥带水，非常看好[色][色][色],喜哥哥哥哥哥哥哥哥
209,女主太想让人弃剧了,照你周全
210,为什么我就不喜欢宋秩，有没有人和我一样，换个女主就好了,crown_qq1494
211,追剧日历呢,七月七七七
212,这个女的不合适女主，感觉像女主丫鬟一样个人觉得不喜勿喷,超爱吃红豆沙的叔仲梦山
213,"从开始看小说就觉得一定会改编成电视剧，作者整篇文的节奏、内容、画面设计都是按照荧幕呈现设计的。小说中人物对话不拖沓、框架大、信息量大，甚至连剧情起伏、悬念设计都明显有电视剧痕迹，我想这也是一些读者诟病作者剧情进展太快、升华密集、剧情尴尬的原因。
不过正是因为这样，更加期待改编成剧版之后的呈现。",天使雪儿er
214,真情侣就是不一样！[应援],你是大便啊 Smile
215,这女主第一集有点怪啊，首先衣服卖给人家了，人家想送人或者烧掉都是他自己的事，男主也是好心给你钱让你自己去买，你不领情就算了，你还出言侮辱人家？,你说我叫啥，我就叫啥
216,#长风渡最打动你的角色#太喜欢了，我最喜欢洛子商，也心疼他，不想他死[捂脸笑],牧野神
217,小说我都看了，好看，没有狗血女二[应援],猫厨🎐
218,又是一部霸榜的剧,⁰零零愛.
219,怎么偷偷上线，明明开了预约怎么没给提示[色][色],iua77
220,花里胡哨的剧,匿名用户
221,是不是喜剧？？？刚看完《花戎》心情很不好，如果这个是喜剧就看，还是虐剧就不要了，受不了。,匿名用户
222,原声台词真是太棒啦[大拇指]！喜欢这部剧所有的原声台词，非常贴合角色。希望下部剧也能听到您们的原声台词！[应援][应援][应援],肉骨茶˙
223,很好看啊，花戎真是看一半就弃剧了[呲牙],用户4a6c7277
224,宋轶这个开头真的好漂亮[应援][应援][应援],财富自由ᴮᴬᴵ🕊️
225,因为女主我不看了,小系阿耐
226,弃剧，弃剧。自从看了宋轶的风起长安，他的一句二爷，二爷，让我瞬间弃剧。从此不看他的剧。,果爱隔
227,#长风渡最打动你的角色#顾九思，他不能选择自己生在什么时代，但是他可以选择即使生在乱世，也要兼济天下。这样的人，不管在什么情况下都能，闯出自己的一番天地。,走进大自然，走进你
228,若有机会，愿你可以成为你想成为的人📣😎👍,赵姐丽颖💛许半夏
229,口型对不上,王欢欢3324
230,丫鬟太漂亮了，有点抢戏，我是女的都忍不住多看几眼,小草Suki
231,有一个像 庆余年里面的范若若 忘记名字了,匿名用户
232,#长风渡最打动你的角色#柳玉茹，超打动人的呀！霸总商人的人设，即使是一个女儿身，但是也不比任何一个男子差。在爱情面前有着属于自己的小女人气质。,夜晗小菇凉
233,宁安如梦，你看看，长风渡都上来了[捂脸笑],醉玲珑05
234,期待一下 真情侣的电视，值得期待[应援],匿名用户
235,起起落落，浮浮沉沉 。赤诚忠义善良是对顾九思最好的形容。期待在长风渡中遇见顾九思 [色][色][色],财富自由ᴮᴬᴵ🕊️
236,看不下去[呲牙],匿名用户
237,#你最想看的古偶剧情#播得好快呀，就是喜欢这么不准时[色][色],এ᭄LvemiOﻬএ᭄
238,虽然小白和宋轶是真CP，但是感觉卿卿题材更新颖，特别是卿卿里的女子群像，第一次女子间没有勾心斗角，大小老婆互相救赎，互相扶持搞事业，新颖！个人观点哈！,上古一一
239,什么？！这是最近才新出的吗[大哭]我以为很早之前就出了[大哭][大哭][大哭],縢褚楚
240,女主什么人设。人家正经花钱买衣服。上门讨要本是无礼  人家给钱还骂人家。你家里不是有需要钱买药的老母吗？,D、123
241,很喜欢开始的一片雪景，入画了一般，再配上童谣。很像玉茹和九思，安静的墨画中不失动态的俏皮。目前来说，整体上就像听一个老者，坐在火炉边，看着雪梅，讲着他那尘封的故事，时而会心一笑，时而唏嘘一声，时而潸然泪下。就安静地看着、听着，岁月静好。,向阳便步步生花
242,小白[应援][应援]    话说这沙溢，总感觉跳戏，希望沙哥少点综艺，多点影视作品[应援],符杦阿九
243,善良的顾九思[应援],去看春天吧
244,就喜欢这样的不准时[呲牙],兜里有梨子
245,顾九思 与君长渡,不加糖的白敬亭✨
246,请问怎么涨的热度[应援][应援][应援],Y墨小烟
247,因为她我都没看王一博那部剧……,＊夏末秋初～
248,听说这剧先婚后爱很好看,YACIV
249,在古代妾室可以这么对嫡女，可以上正堂，可以出席正式的正宴？！,YannisGe
250,#你最想看的古偶剧情#其实挺喜欢像剧里面那种从纨绔子弟慢慢回头的感觉，这种情节就会让人觉得很真实，也不是一开始就是立志向着远大的志向。有些时候真的特别舒服，毕竟也只是个小人物,余音绕梁梁
251,不是 这剧情没问题吗 我买的东西 我给谁不行啊？,baladdbala
252,谁懂啊半夜12点多才知道播了 大半夜在这追 明天7点还要起床,爱吃甜橙的澹台天材
253,说实话，我看不下去,海底fm
254,怎么热度还没干过花戎啊，不对劲,用户4a6c7277
255,好奇葩的开头！既然是卖出去的东西 能凭什么拿回来！难道不要钱？脑袋开洞了吧！,姑苏幕雪
256,[色]这个剧里面我都看到3个少年歌行的人了,小胖子的哈
257,宋轶换个人演就更火了,就没好听的名字☀
258,各位大佬热度怎么提高啊,所以不因为
259,终于有一个跟知否差不多的色调的剧了[捂脸笑][捂脸笑],辰辰辰辰辰辰辰辰辰辰啊
260,画质咋不清晰呢？是我手机的问题吗？看别的咋不这样呢,杨rty
261,是真情侣吗,时隙灵
262,老铁怎么这么好看我已经很久没有看过电视剧了[捂脸笑][捂脸笑][捂脸笑][捂脸笑][捂脸笑][捂脸笑][捂脸笑]任何一个人没有看过我真的会哭😭😭😭😭😭😭😭😭😭,甜甜的轩儿
263,宋轶能够通过表情、动作和语言，将角色的情感状态完美地展现出来，为了看这个充了会员,元素追寻艾礼富
264,看了一集，真的不错，书里精华拍出来了。三人组比小说更搞笑了，看见他们就想笑。没想到叶家老太太这段这么感动，古代女子的一生啊，不能做自己。剧里演员仪态都特别好。柳玉茹顾九思角色选对了[爱心],剧情演技服化道滤镜音乐
265,#邓凯空降翻牌#真搞笑哈哈哈哈[色],炎枝⭐
266,好还原原著，好喜欢，[色][应援],亿万星辰꧂不及你
267,本书粉好满意！！！！,–兮酱–
268,期待好久了，终于播了,爱打篮球の轩辕正德
269,怎么觉得声音有点问题，不知道是收音还是音轨出了问题,Mystery.K
270,怎么增加热度[应援],赤脚追梦！
271,#你最想看的古偶剧情#就喜欢看这种，先婚后爱，在磨合中产生感情，两个人互相扶持，互相成长，互相帮助最后修成正果的感情[应援][应援],宝藏乔治🐷
272,#长风渡最打动你的角色#当然是男主顾九思了，和柳玉茹真的是绝配。,奔跑在孤傲的路上😚😚
273,看过小说如果不大改的话剧情真的很好,一一一...？
274,呜呜呜，为什么又是反派啊，我的宝[大哭][大哭],kiss僅你有
275,#你最想看的古偶剧情#特别喜欢古偶剧里面共同成长的剧情，谁也不是拖后腿的那一方，谁也不是依附在对方身上的鸢尾花。顾九思和玉茹给人的感觉就是这一种,喜欢你🌸我也好🌸甜🌸
276,这部电视剧，不怎么火🔥。不怎么好看。,ℳঞᩚ深爱➹成伤꧔ꦿ᭄🎀
277,心中藏有鸿鹄，热血涌动守护。浮沉的时局中，肩负责任，坚定信仰。且看顾九思长风相伴渡万里，一展宏图！,财富自由ᴮᴬᴵ🕊️
278,"如果可以，谁不想最好人啊，是吧，洛子商
真的意难平",橘然。🍧
279,这是赤王又回归了[应援],一夏吃完
280,作为原著粉真的必须来看，这个剧组很听劝爱死了,久念℡🏝
281,#长风渡最打动你的角色#洛子商吧。看到结局破防两次，好久没为小说哭了，两次都是因为江河和洛子商。他们的事就是一个死局，“君子有九思，君子知仁德”，洛子商到死，终于有自己的名字了，他叫“江知仁”。,左耳右东😃
282,早了二十分钟吗？可以呀，期待了好久的电视剧终于播了，愿我如长风，渡君行万里,一把专注磕糖的小梳子
283,看个电视广告120秒，,东宁_
284,来啦来啦[应援][应援][应援][应援][应援][应援][应援][应援]滤镜有点怪怪的,张小主
285,#长风渡最打动你的角色#顾九思是最能够打动我的，最初的顾九思只不过是一个纨绔子弟，而慢慢的成长起来。其实并不是他成长起来有多厉害，而是他一直都没有改变自己内心深处的那一份正直。不管经历什么事情，那股劲儿从未变过呀,彩虹の晴天💕💕💘
286,可以见得编剧和导演都是很有水平的，导演的画面绝美，不愧是实景，编辑将小说中有点部分情节变得更饱满，第一集直接交待了顾九思和柳玉茹的人设和背景，很多情节删繁就简并且填了原著很多坑使得逻辑自洽。再加上白敬亭和宋轶的演技很容易将人代入。我看小说是就在想这两人应该怎样演绎，白敬亭应该如何演绎顾九思的表面纨绔内心细腻，而宋轶又该如何演绎柳玉茹的表面是大家闺秀的矜持实则内心是小女孩。不过很幸运的是，他们都做到了，有被惊艳到[666][666][666][666][666]总之，期待这部剧很久了，终于看到了，很满意，非常满意。期待接下来顾九思与柳玉茹的故事，长风渡，冲冲冲。,pplpppppps
287,画面真的好美  不是粉丝都喜欢这部剧了,Monody 02
288,感觉挺符合原著的，真的很贴，喜欢喜欢,费费正忙着偷月亮呢
289,要是女主是黄日莹或者鞠婧祎就好了,超爱武术de王叔文成
290,#你最想看的古偶剧情#我喜欢古偶剧里面刚刚出场的剧情，虽然挺庸俗，但是真的很酷啊，他们之间的那种相遇，真的让人感觉到了很美好，还挺甜的,尘缘火火火火火
291,实在是没有好电视剧看了，看看这个如何吧！希望不要让我失望,ζั͡染ั͡子ั͡墨ั͡✾
292,我来磕真情侣啦,哗哗雨雨又一年
293,白敬亭真的演的好棒！！路转粉，好剧才是开会员续费的动力哈,有爱的L酱daz
294,狐裘是人家花钱买的，女主要钱也应该管卖了她狐裘得人要啊为啥管男主要,杀生丸爱麻辣烫
295,好早好早,甜蜜冲刺(手工糖果)王梅
296,原著粉很满意！超级好看，还原度很高，天选顾九思柳玉茹[爱心][爱心],Karoyee🧡
297,宋轶能够深刻地理解和刻画角色的内心世界，演技让每个观众折服,Bragi不搞不搞
298,演技没话说，真的很好。原著好看，广播剧也好听，这部剧也是真的好看。从开机等到现在，真不容易[捂脸笑],嫣嫣子-啊
299,顾九思 他真的是白月光一样的存在啊！始终不改的少年气，永如君子般皎洁不染尘埃！他是所有人的光，止住所有人的恶欲与仇恨！,A.轩丫头
300,有没有一种可能，我是说有没有一种可能。女性意识的崛起比本来就有的“天生”的本性更吸引人呢？我现在没有别的希望了，只求别个叶世安刘玉茹加感情戏。替……别给前期的顾九思洗白好吧？至少也不要在前面洗好吧！我是真的不懂国产剧是不是容不下成长系男女主了！？,未离寒
301,就喜欢爱奇艺这么不守时，我来了期待顾九思和柳玉茹[色],岛屿的鲸落
302,这部剧的妆造不错滴[应援],蓝味milk
303,#张维娜空降翻牌#维娜姐姐[应援],cecily0618
304,居然提前播了！！！！[色][色][色],福子.🎪
305,#邓凯空降翻牌#明朗gege怎么不见你的魏三小姐,^O^虞小萘＆℡
306,真的好好看，今晚可以更新6集吗[色][色][色],小情〆
307,是为白哥而来，等了一年了[捂脸笑],李薇不是李威
308,主要是不喜欢男主…还有古装戏别太白话文对白,风中摇曳的草🎐
309,支持白敬亭 真的很好看[应援][应援][应援][应援][色][色][色][色][色]太帅了家人们,爱吃牛奶布丁的小胖丁
310,不是和原著差的也太多了。。。,闻观
311,来啦来啦！！！刚看一个开头，感觉不错啊！！[应援][应援],ning0109
312,烙铁啊 谁懂 原著粉狂喜,韩秃子公主
313,长风渡可以处 提前播出!,花容柳老板的账本
314,对不起，我好像看到了什么,𝓝​𝓪ᰔᩚ𝓓𝓸𝓷𝓰
315,这剧后面不崩，指定爆了,Big丶李子
316,买了东西，想送给谁就送给谁，就是扔了也没有关系吧[捂脸笑],小珑珑😏
317,为啥第一集看不了,魄罗辣椒
318,这部的确不错  ，追更中～，前面那部花戎更新出来追到7集就追不下去了 ，,丫丫头大呀
319,开通会员还是标清[捂脸笑],喜欢跑步的王叔光誉哈哈(ಡωಡ)hi
320,看剧最讨厌讨论是否和原剧一模一样，个人认为只要剧情更合理，演员演技在线，和原剧是否百分比一样又有多少关系呢！一边看剧，一边和原剧比较，累不累啊。文学作品和演艺作品毕竟是不一样的，观剧最重要的还是演员的演技，剧组的服化道……动不动就什么原著粉，是想显摆你更有文化吗？还是有特别的爱好，就喜欢边看边挑刺儿。,血白哟
321,我不是原著粉，就看了几分钟，被编剧的逻辑震惊了，就感觉女主有病，男主出了钱买了东西，你说要就要，最后还因为给别人了男主想补偿反而被骂，厉害死你了,追剧girl😘
322,长风渡是怎么做到从选角，导演还有OST都让我这么喜欢的啊,不加糖爱举铁💯
323,宋轶的角色让人感到非常自然和真实，节奏好剧情紧凑不拖沓,用户3b0fb2c3
324,很喜欢女性视角 [色] 刘玉茹前期带入真的很能理解 太好哭了,啊彩未来都是彩色的
325,一口气看完了六集，现在我是这个世界上最孤单的人，不过真的好好看,冲鸭68
326,#张维娜空降翻牌#韵儿这把熟人剧[呲牙][呲牙]，好多合作过的演员再次合作，是不是很默契吖,张vina的蜡烛
327,我真的太太太激动了，好怕撤档直到现在播出了才敢欢呼，胚胎式追剧谁懂啊！尹涛导演选角绝了，上次这么期待还是锦衣之下,傲雪红梅_wx1674
328,家人们抢到前排了 好激动啊 期待好久了 一直在爱奇艺蹲着,陪你看日出、💯
329,赤王又出来作妖啦[应援],一夏吃完
330,那么快热度就破万了,玲。Jack
331,破万倒计时,山医迪丽热巴
332,养熟了再看[色][色],温心墨
333,大哥出现了,鞠芷柔🌟
334,以前对两位主演无感的，这下入坑了，太上头了[应援],无语😓。。。。
335,快点把第四的那个给超啦[应援][应援][应援],萝卜炖大萝卜
336,想看白敬亭，但女主太老了...个人观点，不喜勿喷！,于朵🍰
337,和卿卿日常有区别吗,yqsl😘
338,感觉和白敬亭那部什么卿卿有点像,狗不坏
339,请问追剧日历在哪里看,一闪一闪L舟舟
340,#长风渡最打动你的角色#最喜欢柳玉茹，原著中走出来的[色][色],superstargh
341,怎么感觉和卿卿日常有点相似,孤骑绕南疆、
342,所以他只是假纨绔，去花楼就他专心打牌,Wait[让我看看]
343,"卖出去的东西还想要回来吗？
",chi吃我最爱
344,所以一直抬高女性地位就必须踩男性？？,小板栗
345,顾九思真的真的太讨人喜欢了,不加糖的小刘
346,今天再冲一波热度家人们 我开口了 别搞我难看,这个账号叫嘛呢
347,天选顾九思和柳玉茹[应援]生活中也要长长久久喔[色],白不加糖也邢
348,自己拿钱买的，凭什么给你,UI开龙
349,制作用心，演员有演技，长风渡给我大火🔥[应援],Komorebi妮☀
350,顾九思柳玉茹人物设定很贴切,小昕昕9dd
351,周烨用鞭子打顾九思的时侯很能体现他的正气[应援],一夏吃完
352,为啥人都拉的又细又长的，像在看哈哈镜[咒骂],喜欢吃锅巴de宗政寻琴
353,宋轶的角色让人产生强烈的共鸣，内容满满，节奏快,本特利弗兰克克林
354,表白顾九思，二刷长风渡,顾九思的小跟班
355,这种剧还有人看吗？这种剧根本就看不下去吧,林逸京剧
356,这个更新时间真是醉了,姜海冬_qq1141
357,#你最想看的古偶剧情#柳玉茹幡然醒悟，不能将命运系之婚姻、系之他人，决定跟随顾母学习经商之道，真实、独立、精彩地实现自我价值。经过努力，柳玉茹在生意上逐渐得心应手，更在此过程中发现了顾九思至纯至善、炽热真诚的一面，两个人的心也越靠越近，共同谱写了一段盛世佳话。两个人先婚后爱，似乎都不是彼此的良配，但缘分使然，他们就是彼此的命中注定。,左耳右东😃
358,我主要是因为白敬亭才过来看的只不过我最近在看他和李微一演的那个卿卿日常,yuan.xing🧀
359,#长风渡剧评征集#这部剧感情线清晰明了，故事情节感人，人物描写生动形象。一见茹顾夫妇是一对欢喜冤家，二人有家国大义，捐万贯家产，仍能保持初心，从头来过，希望他们有个幸福美满的结局,～w麦基
360,#长风渡剧评征集#高颜值的男主，带人很快进入故事，柳如玉古代事业型女性，顾九思从顽固子弟转变成有上进心，爱国爱家的好男儿。值得观看。,喜欢嗑瓜子の慕容承志
361,可以刷很多遍的剧[爱心][爱心][爱心][爱心],开机键b
362,带着这张图走遍天下,一直发疯的狒狒
363,白敬亭你把顾九思演活了，无论是打戏还是纨绔子弟的演绎都非常棒，我爱看！,泉水丁冬_q
364,导演选角很成功，眼光独到，小白是天选顾九思，宋轶也是天选柳玉茹！！[爱心]爱了爱了[爱心]！！,香草味de小时光🍒
365,宋轶真的是从书中走出的柳玉茹，在《长风渡》中把柳玉茹外柔内刚、带着点不屈倔强的特质演绎得太到位了！,琅酒璃扇*原神魈宝～～
366,#长风渡剧评征集#自6.18开播以来，只要有时间就会刷剧长风渡，这剧越看越好看，传递正确三观，演员们情绪表达准确，是部好剧[应援][应援],good白亭邢
367,白敬亭演技自然 共情力强 演活了顾九思 一时不知道是更爱白敬亭还是顾九思,昔鸟多一点
368,#长风渡最打动你的角色#顾九思柳玉茹都各自最喜欢！先婚后爱，阴差阳错，但又缘分天定，相互扶持，一路成长，各自成为更好的自己的同时也收获属于自己的成功和幸福，美好的生活莫过于此！,倾语话桃
369,洛子商真的好坏，但是我真的很难拒绝杀尽天下人只爱你的cp,A.L.W.A.
370,"这个第一集我就不理解，女主不是要卖了白狐裘给他娘买药吗，那男主买了狐裘然后给女主金子不是很合理吗，而且给的还多，她娘的药钱不就有着落了，
为啥非要把狐裘要回来再卖出去？？？",树影🤗
371,我是原著粉，现在是剧粉，剧版还原度还是挺高的，毕竟影视会有改动也是正常，高光基本都有，演员演技在线，很容易共鸣入戏，宋轶哭戏真嘚太棒了，天选柳玉茹，白敬亭演活了顾九思，总之很棒嘚一部剧,哈哈哈嘚笑
372,真的真的好看啊[爱心],王馨雨――
373,这是又一部卿卿日常吗？,李明亮1986
374,长风渡挺好看,renlin0099
375,一见茹顾！,渡人1号
376,白敬亭虽然是纨绔子弟，但是对柳玉茹特别的关心。,帅气的名💤
377,端午节了，你可以教我包粽子吗？我有点笨，做啥都容易露馅，喜欢你也是~🤞顾九思,白白捡漏ᕕ(ᐛ)ᕗ
378,有沙溢这片错不了[爱心],喜笑颜开的大叔
379,"#长风渡最打动你的角色#顾九思呀！
一个看似是纨绔子弟
但尊重女性，并且眼界开明，并不觉得男女有何不同，而在封建时代中，他就像小太阳☀️，而后面就是太阳的成长之路了，有些期待，但也有些不期待，因为成长的代价太大了(╥ω╥`)  
",夏沐的昕
380,人设和知否太像了。,水蓝&Rain
381,超级无敌爆炸好看,Zy、◎
382,前一秒还在二刷卿卿日常，下一秒就看到小白的新剧了[色][呲牙],江柊～😃
383,卖出去了还能去要回来  乔装好歹穿个男装 才开始5分钟就这么多bug  直接弃剧,黄千万🏝
